"pathway","pval","padj","log2err","ES","NES","size","db","leadingEdge_str","tissue","mission","glds"
"REACTOME_MITOCHONDRIAL_FATTY_ACID_BETA_OXIDATION",8.14361083039131e-07,9.03860172363233e-06,0.659444398037935,-0.609011709377807,-2.46099146556108,38,"reactome","Acsf2; Mcat; Mecr; Acads; Acad10; Acadvl; Echs1; Pcca; Pccb; Acot11; Them5; Mmaa; Eci1; Pctp; Acot13; Acot2; Acot12; Hadh; Acadm; Acot1; Acaa2; Acot7; Acsm3; Hadha; Mmut; Acad11; Decr1; Acadl; Dbi","thymus","RR-6","GLDS-244"
"REACTOME_MITOCHONDRIAL_PROTEIN_DEGRADATION",2.76829794236993e-08,4.7019121112071e-07,0.73376198835648,-0.486928953523126,-2.37368250223563,84,"reactome","Idh2; Mdh2; Hmgcs2; Aldh1b1; Ech1; Aldh2; Spg7; Alas1; Lonp1; Ndufv3; Acad8; Htra2; Prkaca; Cox4i1; Smdt1; Ogdh; Clpp; Ndufv1; Ndufa2; Fech; Hsd17b10; Timm10; Timm17a; Ndufa13; Triap1; Pccb; Timm22; App; Twnk; Cox5b; Uqcrq; Aco2; Ndufs3; Mrpl12; Afg3l2; Oxct1; Eci1; Ldhd; Cs; Iars2; Acot2; Acat1; Hadh; Glud1; Suclg2; Shmt2; Prelid1; Hspa9; Uqcrc2; Dbt; Cox5a; Chchd2; Fh1; Slc25a5; Aldh18a1","thymus","RR-6","GLDS-244"
"REACTOME_MITOCHONDRIAL_PROTEIN_IMPORT",3.17461135593761e-05,0.000206903449418957,0.557332238758646,-0.446625244900266,-2.02711161269429,61,"reactome","Coq2; Mtx1; Cyc1; Samm50; Idh3g; Bcs1l; Tomm6; Timm50; Gfer; Cox19; Timm10; Timm17a; Timm22; Aco2; Chchd10; Grpel1; Timm10b; Slc25a4; Ldhd; Cs; Ndufb8; Cmc2; Tomm40; Timm13; Timm17b; Tomm7; Cox17; Chchd4; Vdac1; Hspa9","thymus","RR-6","GLDS-244"
"REACTOME_MITOCHONDRIAL_TRANSLATION",1.84694946476927e-06,1.86525256757329e-05,0.643551836150722,-0.426117575977172,-2.09585166921028,93,"reactome","Mrps18a; Tufm; Mrpl10; Eral1; Oxa1l; Mrpl17; Mrpl27; Mrps7; Tsfm; Mrpl38; Aurkaip1; Mrpl4; Mrps34; Mrps21; Mrpl23; Mrpl2; Mrpl16; Mrps18b; Mrps28; Mrpl54; Mrpl46; Mrpl55; Mrps24; Mrpl37; Mrpl52; Mrpl28; Gadd45gip1; Mrpl12; Mrps23; Mrpl51; Mrps16; Mrpl43; Mrpl44; Mrpl11; Mrps15; Mrps5; Mrps25; Mrps11; Mrrf; Mrpl14; Mrps35; Mrps26; Mrpl34; Mrps12; Mrps17; Mrpl30; Gfm1; Mrpl49; Mrpl20; Mrpl42; Mtif3; Mrpl22; Mrps31; Mrps14; Mrpl35; Mrpl9; Mrpl48; Mrps27; Mrpl36; Mrpl39; Mrps2; Mrps6; Mrpl40; Mrps36","thymus","RR-6","GLDS-244"
"REACTOME_MITOCHONDRIAL_TRNA_AMINOACYLATION",0.31858407079646,0.403996316021303,0.11146266692298,-0.336615652165755,-1.10369508435512,18,"reactome","Dars2; Ears2; Pars2; Iars2; Tars2; Fars2; Sars2; Lars2","thymus","RR-6","GLDS-244"
"REACTOME_MITOCHONDRIAL_UNFOLDED_PROTEIN_RESPONSE_UPRMT",0.0871459694989107,0.150524856407209,0.224966093540314,-0.434259700537446,-1.41691752018153,17,"reactome","Lonp1; Htra2; Sirt3; Akt1; Atf5; Cat; Hspa1a; Hspa9; Foxo3; Esr1; Hsf1","thymus","RR-6","GLDS-244"
"REACTOME_MITOPHAGY",0.394618834080717,0.475664207531704,0.0988903007520636,-0.252029079725981,-1.02873810769757,39,"reactome","Src; Tomm6; Map1lc3b; Mfn2; Ubc; Map1lc3a; Pink1; Sqstm1; Ubb; Optn; Ube2v1; Prkn; Uba52; Tomm40; Csnk2b; Tomm7; Vdac1; Atg9a","thymus","RR-6","GLDS-244"
"REACTOME_MITOTIC_G1_PHASE_AND_G1_S_TRANSITION",3.81808915928039e-05,0.000237782108197407,0.557332238758646,0.366040480425327,1.83243447227941,138,"reactome","Cdkn1b; Orc4; Rbl2; Lin52; Rb1; Cdk7; Ccnh; Orc3; Rpa3; Lin9; Lin54; Orc5; Psmc6; Rbbp4; Dbf4; Ccne2; Dyrk1a; Orc6; Ppp2ca; Psmd14; Ppp2r2a; Rbl1; Pcna; Dhfr; Prim1; Tfdp2; Gmnn; Orc2; Cdc25a; Pola1; Mcm8; Pole2; Cdc7; Jak2; Skp1; Skp2; Ccna2; Orc1; Cdk2; Max; Prim2; Psmd6; Fbxo5; Mcm4; Psma3; E2f3; Tyms; Psma6; Rrm2; Ccnb1; Ccne1; Cdk1; Rps27a; Pole4; Hdac1; Top2a","thymus","RR-6","GLDS-244"
"REACTOME_MITOTIC_G2_G2_M_PHASES",2.64843202241397e-05,0.000178510098689757,0.575610261071129,0.341189919083786,1.78898626562151,185,"reactome","Cep70; Haus3; Lin52; Cdk7; Ccnh; Mzt1; Cep57; Cep43; Pcm1; Haus6; Cenpj; Akap9; Lin9; Lin54; Tubgcp5; Tubgcp4; Cep192; Ppp1r12a; Psmc6; Rbbp4; Dync1i2; Obi1; Ppp2ca; Clasp1; Ckap5; Psmd14; Cep135; Ppp2r2a; Xpo1; Sfi1; Btrc; Ep300; Ofd1; Cntrl; Haus2; Nedd1; Alms1; Mis18bp1; Tubgcp3; Cdc25a; Cep72; Pafah1b1; Sgo1; Haus1; Cep76; Cep290; Plk4; Ywhae; Mapre1; Sdccag8; Cep41; Bora; Skp1; Rbx1; Ccna2; Cdk2; Ccp110; Psmd6; Psma3; E2f3; Cenpf; Hmmr; Nme7; Dynll1; Psma6; Cdk11b; Hsp90aa1; Ccnb1","thymus","RR-6","GLDS-244"
"REACTOME_MITOTIC_METAPHASE_AND_ANAPHASE",2.11059236322096e-09,4.92911258160562e-08,0.774939030136436,0.395871992318939,2.12240668631087,214,"reactome","Anapc4; Ube2d1; Lemd3; Wapl; Spast; Smc3; Cenpq; Ube2e1; Anapc1; Ahctf1; Stag2; Stag1; Pds5a; Ppp2r5e; Pds5b; Psmc6; Ska2; Ranbp2; Dync1i2; Cenpk; Ppp2r5c; Cdc27; Nup107; Seh1l; Ppp2ca; Clasp1; Nup155; Mad2l1; Itgb3bp; Nup160; Dync1li1; Mis12; Ckap5; Psmd14; Ppp2r2a; Xpo1; Spc25; Cenpc1; Tmpo; Lbr; Cenpp; Sumo1; Cenpu; Nup35; Ist1; Taok1; Nuf2; Nup98; Hdac8; Rad21; Anapc10; Kif18a; Cenpl; Ska1; Bub1; Cenph; Cenpi; Zw10; Nup37; Cdc16; Pafah1b1; Sgo1; Knl1; Nup43; Tnpo1; Mapre1; Vrk1; Ran; Spdl1; Sgo2a; Ercc6l; Cdc26; Psmd6; Fbxo5; Kif2a; Vrk2; Ndc80; Zwilch; Dync1i1; Smc1a; Psma3; Clasp2; Kntc1; Cenpf; Kpnb1; Dynll1; Psma6; Cenpe; Dsn1; Nup54; Ccnb1","thymus","RR-6","GLDS-244"
"REACTOME_MITOTIC_PROMETAPHASE",4.56995762171055e-16,3.41528166262502e-14,1.02766987054358,0.483789902076542,2.55177759471893,195,"reactome","Cep70; Haus3; Wapl; Smc3; Cenpq; Smc4; Mzt1; Cep57; Cep43; Pcm1; Ahctf1; Haus6; Stag2; Cenpj; Akap9; Csnk2a1; Tubgcp5; Stag1; Tubgcp4; Cep192; Pds5a; Ppp2r5e; Pds5b; Ska2; Ranbp2; Dync1i2; Cenpk; Ppp2r5c; Csnk2a2; Nup107; Seh1l; Ppp2ca; Clasp1; Mad2l1; Itgb3bp; Nup160; Dync1li1; Mis12; Ckap5; Cep135; Xpo1; Sfi1; Spc25; Ofd1; Cntrl; Cenpc1; Haus2; Nedd1; Cenpp; Smc2; Alms1; Cenpu; Taok1; Nuf2; Nup98; Hdac8; Rad21; Kif18a; Cenpl; Ska1; Bub1; Cenph; Ncapg; Cenpi; Zw10; Tubgcp3; Nup37; Cep72; Pafah1b1; Sgo1; Haus1; Knl1; Cep76; Cep290; Plk4; Nup43; Ywhae; Mapre1; Sdccag8; Cep41; Spdl1; Sgo2a; Ercc6l; Ccp110; Kif2a; Ndc80; Zwilch; Dync1i1; Smc1a; Clasp2; Kntc1; Cenpf","thymus","RR-6","GLDS-244"
"REACTOME_MITOTIC_PROPHASE",0.000544485674519488,0.00240302535880451,0.477270815362862,0.342862957952194,1.6848346297848,122,"reactome","Lemd3; Rb1; Smc4; Phf8; Mapk1; Nup88; Tpr; Cnep1r1; Ranbp2; H2bc21; H3f3b; Nup107; Nup153; Seh1l; Ppp2ca; Nup155; Nup160; Uso1; Tmpo; Smc2; Nup35; Prkcb; Nup98; Mcph1; Nup37; Nup214; Nup43; Prkca; Ncapg2; Vrk1; Mastl; Vrk2; Ncapd3; Ppp2r2d; Lpin2; Nup54; Ccnb1","thymus","RR-6","GLDS-244"
"REACTOME_MITOTIC_SPINDLE_CHECKPOINT",1.42580972667612e-12,5.32777567867975e-11,0.910119734774459,0.540350158702137,2.6016831520161,109,"reactome","Anapc4; Ube2d1; Cenpq; Ube2e1; Anapc1; Ahctf1; Ppp2r5e; Ska2; Ranbp2; Dync1i2; Cenpk; Ppp2r5c; Cdc27; Nup107; Seh1l; Ppp2ca; Clasp1; Mad2l1; Itgb3bp; Nup160; Dync1li1; Mis12; Ckap5; Xpo1; Spc25; Cenpc1; Cenpp; Cenpu; Taok1; Nuf2; Nup98; Anapc10; Kif18a; Cenpl; Ska1; Bub1; Cenph; Cenpi; Zw10; Nup37; Cdc16; Pafah1b1; Sgo1; Knl1; Nup43; Mapre1; Spdl1; Sgo2a; Ercc6l; Cdc26; Kif2a; Ndc80; Zwilch; Dync1i1; Clasp2; Kntc1; Cenpf","thymus","RR-6","GLDS-244"
"REACTOME_MODULATION_OF_HOST_RESPONSES_BY_IFN_STIMULATED_GENES",0.405454545454545,0.485819050633865,0.0852884689790502,0.321773739706595,1.03459985444004,18,"reactome","Chuk; Arih1; Eif2ak3","thymus","RR-6","GLDS-244"
"REACTOME_MOLECULES_ASSOCIATED_WITH_ELASTIC_FIBRES",7.68204031033699e-09,1.59473466442366e-07,0.747739663149885,-0.669196353497887,-2.67368969072203,36,"reactome","Itgb3; Fn1; Ltbp3; Emilin2; Fbln1; Efemp2; Fbln2; Tgfb3; Ltbp1; Eln; Itgb5; Ltbp2; Mfap4; Bmp4; Ltbp4; Vtn; Fbln5; Mfap2; Fbn1; Tgfb2; Efemp1; Emilin1; Gdf5; Mfap5","thymus","RR-6","GLDS-244"
"REACTOME_MRNA_CAPPING",0.0330763272680659,0.0713049285913498,0.321775918075361,0.419784248495972,1.53105247526347,29,"reactome","Rnmt; Gtf2h2; Rngtt; Cdk7; Ccnh; Gtf2h1; Polr2k; Gtf2f2; Ncbp1; Ncbp2","thymus","RR-6","GLDS-244"
"REACTOME_MRNA_DECAY_BY_5_TO_3_EXORIBONUCLEASE",0.00429445008954534,0.0137153235053571,0.407017918923954,0.626460243072291,1.92836902938484,15,"reactome","Lsm1; Xrn1; Lsm5; Ddx6; Dcp2; Lsm6; Lsm3; Dcp1a; Patl1","thymus","RR-6","GLDS-244"
"REACTOME_MRNA_SPLICING",1.8368475238419e-22,3.43184345704461e-20,1.22950405660873,0.535487320540033,2.86434383109103,211,"reactome","Rnpc3; Sf3b1; Cwf19l2; Srsf11; Zrsr2; Luc7l3; Ppil4; Hnrnpa2b1; Hnrnpm; Srsf10; Ppwd1; Rbm39; Hnrnph1; Rbm25; Ccar1; Dhx15; Tra2b; Srsf1; Prpf4b; Cdc40; Upf3b; Srsf3; Hnrnpu; Snrnp48; Srsf6; Hnrnpc; U2surp; Dhx9; Crnkl1; Ddx42; Nkap; Prpf38a; Srsf7; Srsf12; Mtrex; Hnrnpr; Ddx46; Gcfc2; Prpf40a; Srsf2; Tcerg1; Lsm8; Ddx5; Rbm5; Rbm17; Nsrp1; Rbmx; Bud31; Smndc1; Pnn; Ppig; Hnrnpa3; Snrpa1; Lsm5; Hnrnpk; Snrpd1; Magoh; Cwc22; Sf3b6; Smu1; Prpf18; Srrm1; Snrpe; Hnrnpd; Aqr; Snrnp27; Zcrb1; Rbmx2; Sf3b3; Snu13; Sf1; Rbm22; Fus; Snrpb2; Acin1; Hnrnpa1; Polr2k; Cdc5l; Ppih; Srsf5; Lsm6; Hnrnpl; Cwc27; Gtf2f2; Ncbp1; Pdcd7; Prpf3; Lsm3; Rbm7; Mfap1a; Wdr70; Ncbp2; Ppil2; Wbp4; Wbp11; Ppil3; Sde2","thymus","RR-6","GLDS-244"
"REACTOME_MRNA_SPLICING_MINOR_PATHWAY",0.0012746564073215,0.00494425547615017,0.45505986738723,0.444167397719028,1.84988136100697,50,"reactome","Rnpc3; Sf3b1; Zrsr2; Srsf1; Snrnp48; Srsf6; Ddx42; Srsf7; Srsf2; Snrpd1; Sf3b6; Snrpe; Zcrb1; Sf3b3; Polr2k; Gtf2f2; Ncbp1; Pdcd7; Ncbp2","thymus","RR-6","GLDS-244"
"REACTOME_MTORC1_MEDIATED_SIGNALLING",0.318284424379232,0.403996316021303,0.112843355675562,-0.31086287308773,-1.10648909485744,24,"reactome","Eif4ebp1; Lamtor4; Lamtor2; Akt1s1; Lamtor1; Eef2k; Mtor; Eif4g1; Eif4b","thymus","RR-6","GLDS-244"
"REACTOME_MTOR_SIGNALLING",0.0112152957623288,0.0302219868980062,0.380730400722792,-0.40482748380963,-1.67951858183768,41,"reactome","Prkag3; Akt2; Tsc2; Prkab1; Eif4ebp1; Lamtor4; Lamtor2; Akt1s1; Lamtor1; Stk11; Eef2k; Mtor; Akt1; Ppm1a; Prkag1; Eif4g1; Eif4b","thymus","RR-6","GLDS-244"
"REACTOME_MUSCLE_CONTRACTION",2.86254105323368e-16,2.46839116974997e-14,1.03769615548758,-0.464439801936686,-2.59897029401164,199,"reactome","Vim; Cacna1h; Sorbs3; Anxa6; Kcnq1; Myl6; Cacna2d2; Myl12a; Cacna1c; Scn5a; Atp2b4; Scn10a; Aldh2; Kcnk5; Myl12b; Npr1; Tbx5; Cacna1i; Itgb5; Camk2b; Vcl; Prkaca; Dmpk; Nkx2-5; Mylk; Tnni3; Npr2; Atp2a2; Cacng7; Tnnc1; Nppa; Slc8a1; Kcne3; Anxa2; Gucy1a1; Myl4; Myl9; Gucy1b1; Orai1; Atp1a1; Mybpc3; Dysf; Myl7; Itpr3; Atp1b2; Tnnt2; Slc8a2; Ces1d; Gata4; Myh11; Asph; Atp1a3; Cacna1g; Actn2; Scn7a; Actg2; Wwtr1; Kcnk13; Kcnk3; Myl6b; Kcnj11; Scn3b; Ryr2; Pde5a; Myh6; Anxa1; Casq2; Acta2; Kcnd3; Kcnj14; Kcnd2; Kcna5; Cacnb2; Cald1; Fxyd1; Fgf11; Fgf12; Nos1; Tmod1; Pxn; Sorbs1; Abcc9; Corin; Kcne4; Rangrf; Atp1a2; Tpm4; Kcne2; Des; Fxyd3; Kcnk1; Casq1; Tnni2; Atp2b2; Trim72; Kcnip2; Actc1; Tpm1; Tmod2; Tnnt3; Fxyd6; Dmd; Pln; Itga1; Scn1b; Hipk2; Kcnk12; Kcnip1; Kcnk6; Sln; Lmod1; Tcap; Sri; Atp1b1; Tnni1; Fkbp1b; Camk2a","thymus","RR-6","GLDS-244"
"REACTOME_MYD88_INDEPENDENT_TLR4_CASCADE",0.0219794782956496,0.0515460149987934,0.352487857583619,-0.284120752941115,-1.44255482254414,109,"reactome","Ager; Fos; Mapk3; Jun; Ptpn11; Cd14; Fadd; Irak2; Nod1; Mapkapk2; Map2k3; Ticam1; Rela; Irak1; Nod2; Ppp2r1a; Ubc; Nkiras2; Alpk1; Rps6ka1; Nlrx1; Tnip2; Dusp3; Nfkb2; Mapk14; Mapkapk3; App; Dusp7; Irf7; Ubb; Map2k1; Dusp4; Nfkbib; Optn; Traf3; Lrrc14; Ube2v1; Ikbip; S100b","thymus","RR-6","GLDS-244"
"REACTOME_MYOGENESIS",0.287305122494432,0.376171627733162,0.118815039412263,-0.302573319118103,-1.13893151375101,28,"reactome","Ntn3; Cdon; Mapk12; Boc; Mapk14; Ctnna1; Neo1","thymus","RR-6","GLDS-244"
"REACTOME_M_DECAY_DEGRADATION_OF_MATERNAL_MRNAS_BY_MATERNALLY_STORED_FACTORS",0.00170373170759325,0.00640900417520815,0.45505986738723,0.492913873115788,1.82648056831828,32,"reactome","Cnot7; Cnot4; Cnot6; Cnot2; Paip2; Cnot6l; Cnot1; Dicer1; Eif4a2; Paip1; Cnot11; Eloc; Cnot9; Eif4e","thymus","RR-6","GLDS-244"
"REACTOME_M_PHASE",1.35578647296736e-15,7.99914019050742e-14,1.01754479730988,0.395982953268747,2.25716472303695,374,"reactome","Cep70; Haus3; Anapc4; Ube2d1; Lemd3; Rb1; Wapl; Spast; Nipbl; Smc3; Cenpq; Smc4; Mzt1; Cep57; Ube2e1; Cep43; Pcm1; Anapc1; Ahctf1; Haus6; Stag2; Cenpj; Akap9; Csnk2a1; Tubgcp5; Stag1; Phf8; Mapk1; Tubgcp4; Cep192; Pds5a; Nup88; Ppp2r5e; Pds5b; Psmc6; Ska2; Tpr; Cnep1r1; Ranbp2; H2bc21; Dync1i2; H3f3b; Cenpk; Ppp2r5c; Cdc27; Csnk2a2; Nup107; Nup153; Seh1l; Ppp2ca; Clasp1; Nup155; Mad2l1; Itgb3bp; Nup160; Dync1li1; Mis12; Ckap5; Psmd14; Cep135; Ppp2r2a; Xpo1; Sfi1; Spc25; Ofd1; Cntrl; Uso1; Cenpc1; Tmpo; Lbr; Haus2; Nedd1; Cenpp; Smc2; Sumo1; Alms1; Cenpu; Nup35; Ist1; Taok1; Prkcb; Nuf2; Nup98; Hdac8; Rad21; Anapc10; Kif18a; Cenpl; Ska1; Bub1; Cenph; Ncapg; Cenpi; Zw10; Tubgcp3; Mcph1; Nup37; Cdc16; Cep72; Pafah1b1; Sgo1; Haus1; Knl1; Cep76; Cep290; Nup214; Plk4; Nup43; Ywhae; Tnpo1; Mapre1; Sdccag8; Cep41; Prkca; Ncapg2; Vrk1; Ran; Mastl; Spdl1; Sgo2a; Ercc6l; Cdc26; Ccp110; Psmd6; Fbxo5; Kif2a; Vrk2; Ndc80; Zwilch; Dync1i1; Smc1a; Psma3; Clasp2; Kntc1; Cenpf; Ncapd3; Kpnb1; Nme7; Ppp2r2d; Dynll1; Lpin2; Psma6; Cenpe; Dsn1; Nup54; Hsp90aa1; Ccnb1","thymus","RR-6","GLDS-244"
"REACTOME_NA_CL_DEPENDENT_NEUROTRANSMITTER_TRANSPORTERS",0.675675675675676,0.726902526326711,0.0697792517076235,-0.261708332511671,-0.861298515219258,19,"reactome","Slc6a13; Slc22a1; Slc6a9; Slc6a14; Slc6a6; Slc6a20a; Slc22a2; Slc6a12","thymus","RR-6","GLDS-244"
"REACTOME_NCAM1_INTERACTIONS",2.38359282384352e-07,3.18096137562927e-06,0.690132458796796,-0.599857439959388,-2.50600889456217,42,"reactome","St8sia2; Agrn; Cacna1h; Cacna1d; Cacna1c; Col6a1; Gfra4; Col6a3; Gfra2; Cacna1i; Cntn2; Col4a2; Col6a2; Col4a1; Col5a1; Prnp; Col4a3; Col5a3; Col4a5; Col5a2; Col9a2; Cacna1g; Col4a4; Col3a1; Cacnb2; Col2a1; Col6a6; Cacnb4; Nrtn; Cacnb3; Ncan; Gdnf","thymus","RR-6","GLDS-244"
"REACTOME_NCAM_SIGNALING_FOR_NEURITE_OUT_GROWTH",3.71564756188608e-06,3.30574675942404e-05,0.627256739718528,-0.477064443541768,-2.17605470824346,63,"reactome","St8sia2; Agrn; Mapk3; Cacna1h; Src; Fgfr1; Cacna1d; Cacna1c; Col6a1; Sptbn1; Gfra4; Col6a3; Sptbn5; Gfra2; Cacna1i; Cntn2; Col4a2; Spta1; Col6a2; Col4a1; Col5a1; Prnp; Col4a3; Sptan1; Col5a3; Hras; Col4a5; Col5a2; Col9a2; Cacna1g; Col4a4","thymus","RR-6","GLDS-244"
"REACTOME_NEDDYLATION",0.0924764890282132,0.157434651996835,0.183023938384487,0.223025735152617,1.21360066027492,237,"reactome","Wsb1; Klhl20; Fbxl3; Kbtbd8; Ubxn7; Ube2d1; Dcun1d5; Fbxo11; Dcun1d1; Asb3; Fbxw7; Pum2; Dcaf17; Rbbp5; Fbxw10; Fbxl14; Fbxw2; Fbxl20; Fem1c; Dcaf13; Ufd1; Psmc6; Kbtbd7; Uba3; Cop1; Asb7; Ddb2; Ube2d2a; Fem1b; Asb13; Ube2d3; Ercc8; Dcaf10; Fbxl5; Psmd14; Nae1; Palb2; Btrc; Klhl9; Lrr1; Hif1a; Cul4b; Dtl; Kbtbd6; Dcaf8; Amer1; Cul5; Klhl42; Cul3; Ubd; Klhl11; Eloc; Fbxl12; Skp1; Rbx1; Skp2; Cops3","thymus","RR-6","GLDS-244"
"REACTOME_NEF_MEDIATES_DOWN_MODULATION_OF_CELL_SURFACE_RECEPTORS_BY_RECRUITING_THEM_TO_CLATHRIN_ADAPTERS",0.559633027522936,0.624227486421105,0.080419996876154,-0.274671379556834,-0.930394064496621,21,"reactome","Ap2a1; Ap2m1; Ap1s1; Arf1; Ap2a2; Ap2b1; Ap1m2; Ap2s1; Ap1m1; H2-Q10; B2m","thymus","RR-6","GLDS-244"
"REACTOME_NEGATIVE_EPIGENETIC_REGULATION_OF_RRNA_EXPRESSION",0.00194380947607307,0.00710909119439159,0.45505986738723,0.358400165908816,1.65691044583878,90,"reactome","Arid4b; Tbp; Gtf2h2; Sirt1; Cdk7; Ccnh; Polr1f; Hdac2; Smarca5; Taf1b; H2bc21; Gtf2h1; Rrp8; H3f3b; Taf1d; Ttf1; Polr2k","thymus","RR-6","GLDS-244"
"REACTOME_NEGATIVE_REGULATION_OF_FGFR1_SIGNALING",0.09375,0.158992057488654,0.219250346703755,-0.349094435594079,-1.35845053595638,31,"reactome","Mapk3; Ptpn11; Src; Fgfr1; Spry2; Fgf1; Ppp2r1a; Ubc; Ubb; Fgf10; Uba52; Fgf2","thymus","RR-6","GLDS-244"
"REACTOME_NEGATIVE_REGULATION_OF_FGFR2_SIGNALING",0.149425287356322,0.225911277930322,0.173747838999571,-0.319484153526298,-1.25326048025134,33,"reactome","Mapk3; Ptpn11; Src; Spry2; Fgf1; Ppp2r1a; Ubc; Fgf18; Ubb; Fgf10; Uba52; Fgf2","thymus","RR-6","GLDS-244"
"REACTOME_NEGATIVE_REGULATION_OF_FGFR3_SIGNALING",0.0979955456570156,0.164450608804662,0.213927855492356,-0.364122738142631,-1.37061279081939,28,"reactome","Mapk3; Ptpn11; Src; Spry2; Fgf1; Ppp2r1a; Ubc; Fgfr3; Fgf18; Ubb; Uba52; Fgf2","thymus","RR-6","GLDS-244"
"REACTOME_NEGATIVE_REGULATION_OF_FGFR4_SIGNALING",0.0844748858447489,0.146588772495299,0.234392647294686,-0.358653425576055,-1.37199301301392,30,"reactome","Mapk3; Ptpn11; Src; Spry2; Fgf1; Ppp2r1a; Ubc; Fgf18; Fgfr4; Ubb; Uba52; Fgf2","thymus","RR-6","GLDS-244"
"REACTOME_NEGATIVE_REGULATION_OF_FLT3",0.142548596112311,0.217488150494855,0.172324344900946,-0.421184442041102,-1.32106906434151,15,"reactome","Sh2b3; Ptprj; Flt3l; Ubc; Ubb; Socs2; Uba52; Csk","thymus","RR-6","GLDS-244"
"REACTOME_NEGATIVE_REGULATION_OF_MAPK_PATHWAY",0.154195011337868,0.231705908458111,0.169570644405628,-0.292182432824905,-1.22128786708255,43,"reactome","Mapk3; Dusp1; Ppp2r1a; Ubc; Mapk12; Pebp1; Hras; Dusp8; Ksr1; Dusp7; Ubb; Map2k1; Dusp4; Ppp2r5b; Ppp5c; Uba52; Map2k2; Dusp6; Ptpn3; Dusp9; Paqr3; Ppp2r5d; Ppp2cb; Ywhab","thymus","RR-6","GLDS-244"
"REACTOME_NEGATIVE_REGULATION_OF_MET_ACTIVITY",0.530035335689046,0.598358118134361,0.0697792517076235,0.279489932613159,0.938883745322528,21,"reactome","Stam; Sh3kbp1; Eps15; Cbl; Ptpn2","thymus","RR-6","GLDS-244"
"REACTOME_NEGATIVE_REGULATION_OF_NMDA_RECEPTOR_MEDIATED_NEURONAL_TRANSMISSION",0.720848056537102,0.763050681188,0.0550211117163117,0.243327354072962,0.817403673167894,21,"reactome","Dlg1; Ppm1e; Camk4; Grin2b; Lrrc7; Dlg3","thymus","RR-6","GLDS-244"
"REACTOME_NEGATIVE_REGULATION_OF_NOTCH4_SIGNALING",0.809633027522936,0.840132491173041,0.0618406035753285,-0.197161032635991,-0.826519902227931,44,"reactome","Notch4; Ubc; Adrm1; Ubb; Psmb5; Psmc5; Akt1; Psmb2; Psmb6; Psmb3; Uba52; Psmc2; Psmc4; Psmd7; Psmd3; Psmd2; Psmd8","thymus","RR-6","GLDS-244"
"REACTOME_NEGATIVE_REGULATION_OF_TCF_DEPENDENT_SIGNALING_BY_WNT_LIGAND_ANTAGONISTS",0.950323974082073,0.957154694470803,0.051530912208539,-0.196883062031305,-0.617534971809347,15,"reactome","Wnt9a; Lrp5; Wnt3a; Wnt5a","thymus","RR-6","GLDS-244"
"REACTOME_NEGATIVE_REGULATION_OF_THE_PI3K_AKT_NETWORK",0.000514236112832128,0.00229664813738971,0.477270815362862,-0.331990590085005,-1.69570447719373,119,"reactome","Mapk3; Pip4k2c; Pdgfrb; Ptpn11; Src; Akt2; Fgfr1; Gab2; Myd88; Ier3; Pdgfb; Irak1; Flt3l; Kit; Fgf1; Ppp2r1a; Pdgfa; Pik3r2; Fgfr3; Phlpp2; Erbb2; Ntf3; Fgf18; Irak4; Pdgfra; Fgfr4; Pik3r6; Phlpp1; Trib3; Erbb3; Ntrk2; Il1rl1; Akt1; Fgf10; Ppp2r5b; Pik3cb; Egfr; Tgfa; Cd19; Gab1; Irs1; Esr2; Pip4k2b; Pik3ap1; Fgf2; Areg; Irs2; Nrg4; Il33; Met; Rhog","thymus","RR-6","GLDS-244"
"REACTOME_NEGATIVE_REGULATORS_OF_DDX58_IFIH1_SIGNALING",0.072310405643739,0.131164991467041,0.222056046145248,0.375875005885804,1.41067696093826,33,"reactome","Atg12; Ube2d1; Itch; Tbk1; Cyld; Ube2d2a; Ube2d3; Ube2k; Tax1bp1","thymus","RR-6","GLDS-244"
"REACTOME_NEPHRIN_FAMILY_INTERACTIONS",0.540350877192982,0.606947227788911,0.0684714904492087,0.272377812553998,0.934979547568159,22,"reactome","Nphs2; Wasl; Cd2ap; Nck2; Pik3ca; Nck1; Fyn","thymus","RR-6","GLDS-244"
"REACTOME_NETRIN_1_SIGNALING",0.158256880733945,0.23654128440367,0.16823816568964,-0.291176587200222,-1.22064305084116,44,"reactome","Trpc6; Ptpn11; Unc5b; Src; Slit3; Rgma; Ablim3; Unc5a; Neo1; Trio; Ntn4; Dock1; Ntn1; Ablim2","thymus","RR-6","GLDS-244"
"REACTOME_NEUREXINS_AND_NEUROLIGINS",0.312206572769953,0.39906906279945,0.116739204791222,-0.241323781002713,-1.07061329000612,54,"reactome","Nlgn2; Stxbp1; Syt7; Epb41l1; Dlgap4; Nrxn2; Syt12; Shank2; Grin2d; Apba3; Homer2; Dbnl; Cask; Homer3; Grm1; Shank1; Lin7b; Grin2c; Pdlim5; Epb41l5; Syt10; Nlgn3; Dlgap1","thymus","RR-6","GLDS-244"
"REACTOME_NEURONAL_SYSTEM",3.08856846179854e-06,2.89128416185796e-05,0.627256739718528,-0.269786556302057,-1.63609768100639,397,"reactome","Nrgn; Kcnc3; Tubb1; Slc6a4; Slc6a13; Akap5; Abcc8; Mapk3; Ap2a1; Cacna1a; Adcy4; Prkag3; Nlgn2; Src; Naaa; Camk1; Kcnq1; Plcb3; Cacna2d2; Stxbp1; Syt7; Adcy9; Ap2m1; Lrrc51; Aldh2; Tubb6; Prkab1; Adcy7; Hcn4; Gnb1; Slc1a7; Rab3a; Kcnj5; Tubb4b; Ppm1f; Kcnh4; Comt; Camk2b; Prkaca; Slc17a7; Kcnj8; Slc22a1; Epb41l1; Gng11; Rps6ka1; Grik5; Kcnq4; Rasgrf2; Dlgap4; Hras; Flot2; Gng7; Nrxn2; Adcy8; Prkcg; Syt12; Slc1a3; Unc13b; Kcng2; Flot1; Gjc1; Shank2; Tspan7; Glul; Grin2d; Ppfibp1; Gabrq; Slc1a1; Lrfn3; Hcn2; Rasgrf1; Ap2a2; Actn2; Kcnb1; Adcy5; Ppfibp2; Gnb2; Prkag1; Gnb5; Kcnv2; Kcnk13; Apba3; Kcnk3; Ppfia4; Homer2; Kcnj11; Tuba4a; Adcy3; Slitrk4; Gabra3; Kif17; Slc5a7; Tuba8; Gng2; Kcnd3; Git1; Aldh5a1; Dbnl; Kcnj14; Ap2b1; Gad1; Kcnd2; Kcna5; Arhgef9; Gnai2; Grip1; Cacnb2; Kcns3; Abcc9; Ptprs; Kcnn1; Kcnmb1; Rps6ka2; Bche; Slc18a3; Camkk2; Cask; Plcb1; Lrfn1; Syn3; Nbea; Homer3; Cacna2d3; Gria1; Ap2s1; Grm1; Kcna1; Hspa8; Tuba1c; Kcnk1; Kcnf1; Lrfn4; Tuba1a; Myo6; Kcng4; Shank1; Mapt; Slc22a2; Slc6a12; Tuba1b; Kcnn2; Gabrr2; Grip2; Rac1; Cacnb4; Panx2; Lin7b; Grik4; Cacnb3; Kcnj3; Tubb4a; Prkar2a; Tubb2a; Lrrc4b; Kcnk6; Grin2c; Prkag2; Slitrk2; Gng13; Erbb4; Gnai1; Kcnc1; Gng4; Pdlim5; Adcy2; Camk2a","thymus","RR-6","GLDS-244"
"REACTOME_NEUROTRANSMITTER_RECEPTORS_AND_POSTSYNAPTIC_SIGNAL_TRANSMISSION",0.0711955986383813,0.130821888564719,0.287805130535564,-0.22499877327042,-1.25642069247179,196,"reactome","Nrgn; Tubb1; Akap5; Mapk3; Ap2a1; Adcy4; Prkag3; Src; Camk1; Plcb3; Adcy9; Ap2m1; Tubb6; Prkab1; Adcy7; Gnb1; Kcnj5; Tubb4b; Ppm1f; Camk2b; Prkaca; Epb41l1; Gng11; Rps6ka1; Grik5; Rasgrf2; Hras; Gng7; Adcy8; Prkcg; Tspan7; Grin2d; Gabrq; Rasgrf1; Ap2a2; Actn2; Adcy5; Gnb2; Prkag1; Gnb5; Tuba4a; Adcy3; Gabra3; Kif17; Tuba8; Gng2; Git1; Ap2b1; Arhgef9; Gnai2; Grip1; Rps6ka2; Camkk2; Cask; Plcb1; Nbea; Gria1; Ap2s1; Tuba1c; Tuba1a; Myo6; Mapt; Tuba1b; Gabrr2; Grip2; Rac1; Lin7b; Grik4; Kcnj3; Tubb4a; Prkar2a; Tubb2a; Grin2c; Prkag2; Gng13; Erbb4; Gnai1; Gng4; Adcy2; Camk2a","thymus","RR-6","GLDS-244"
"REACTOME_NEUROTRANSMITTER_RELEASE_CYCLE",0.0606290670294081,0.116578360445912,0.321775918075361,-0.315496234009842,-1.37684751988562,51,"reactome","Slc6a13; Naaa; Stxbp1; Slc1a7; Rab3a; Slc17a7; Slc22a1; Slc1a3; Unc13b; Slc1a1; Ppfia4; Slc5a7; Aldh5a1; Gad1; Slc18a3; Cask; Syn3; Hspa8; Slc22a2; Slc6a12","thymus","RR-6","GLDS-244"
"REACTOME_NEUTROPHIL_DEGRANULATION",4.45361164697802e-23,9.98499731252472e-21,1.24623277191648,-0.398582555364474,-2.45331070448019,476,"reactome","Alox5; Hgsnat; Itgam; Nfam1; Pecam1; Pygb; Fuca1; Ppbp; Anpep; Gusb; Cfp; Fpr1; Plekho2; Qsox1; Pdxk; Tmem63a; Grn; S100a11; Serpina3c; Cd14; Aldh3b1; Adgre5; Gsn; Mlec; Ahsg; Cst3; Ptprj; Plaur; Cnn2; Lcn2; Timp2; Tspan14; Ctsz; Slc11a1; Txndc5; Vamp8; Slc2a3; Clec4d; C5ar1; Tom1; Tnfrsf1b; Fth1; H2-D1; Atad3a; Atp11a; Gns; Lrg1; Folr2; Atg7; Dok3; Rab31; Galns; Adam8; Gpi1; Prtn3; Psap; Ddost; Lgals3; Arsa; Serpina3n; Lpcat1; Crispld2; Dpp7; Hbb-bt; Pnp2; Cyb5r3; Gm2a; Rab3a; Prdx6; Lyz2; Tubb4b; Ceacam1; Stk10; Cfd; Hvcn1; Gaa; Vcl; Ghdc; Sirpa; Slc2a5; Rab3d; Mvp; Npc2; Tyrobp; Ftl1; Hp; Dgat1; Lamp1; Ctsb; Bst2; Ptafr; Ampd3; B4galt1; Alad; Sting1; Pglyrp1; Gstp1; Ptprb; Rab7; Glb1; Pirb; Ctsd; Anxa2; Rab5c; Cd63; Siglece; Vat1; Tnfaip6; Agpat2; Pfkl; Sptan1; Cotl1; Lamtor2; Mapk14; C3; Igf2r; Cd177; Acaa1a; Arsb; Lamtor1; Ptges2; Ctsa; Cxcl1; Ormdl3; Ppie; Retn; Ckap4; Tmbim1; Vps35l; Pkm; Trappc1; Cyfip1; Bri3; Fgr; Mcemp1; Atp6v0c; Plau; Eef2; Cd93; Ostf1; Aoc1; Qpct; Ap2a2; Ltf; Commd9; Stom; Naprt; Aprt; Rhof; Stbd1; Vnn1; Jup; Hpse; Pgm1; Dnase1l1; Cd68; Serpina1b; Cxcl2; Surf4; Hmox2; Mgst1; Actr1b; Prg2; Acly; Eef1a1; Nme2; Pld1; Cpped1; Dbnl; Cd44; Impdh2; Cat; Bst1; Dync1h1; Hsp90ab1; Cant1; Ifi205; Chit1; Serpina3k; Hk3; Syngr1; Tlr2; Ctsh; Csnk2b; Cystm1; 2310033P09Rik; Fcgr2b; Pgam1; Arl8a; Fgl2; Gstp2; Aldoa; Serpina1e; Pigr; Ptpn6; Psmc2; Gla; Ear1; Creg1; Ttr; Ubr4; Mif; Cd59b; Hspa1a; Rhog; C3ar1; Atp6v0a1; Hspa8; Prcp; Neu1; Iqgap1; Apeh; Man2b1; Capn1; Vcp","thymus","RR-6","GLDS-244"
"REACTOME_NFE2L2_REGULATING_ANTI_OXIDANT_DETOXIFICATION_ENZYMES",0.407657657657658,0.487709961829492,0.0972150808846466,-0.311279874542736,-1.02444156511272,19,"reactome","Hmox1; Sod3; Gclm; Txnrd1; Gsr; Gsta3; Srxn1; Mafk; Nfe2l2","thymus","RR-6","GLDS-244"
"REACTOME_NGF_STIMULATED_TRANSCRIPTION",0.386120996441281,0.467936904876407,0.086794975677172,0.265270007912436,1.03458699332307,38,"reactome","Egr2; Creb1; Tcf12; Atf1; Rest; Ep300; Cdk5r1; Atf2; Elk1","thymus","RR-6","GLDS-244"
"REACTOME_NICOTINAMIDE_SALVAGE",0.191208791208791,0.271889400921659,0.148261500475107,-0.396571176827778,-1.26549834868684,16,"reactome","Parp16; Naxe; Nnmt; Naprt; Parp10; Slc5a8; Naxd; Nudt12; Slc22a13; Rnls; Nampt","thymus","RR-6","GLDS-244"
"REACTOME_NICOTINATE_METABOLISM",0.0528872771632088,0.104932102123818,0.321775918075361,-0.380948049441463,-1.45147855844033,29,"reactome","Parp16; Nadk; Naxe; Nnmt; Naprt; Nadsyn1; Bst1; Nt5e; Slc25a51; Parp10; Slc5a8; Naxd; Cd38; Nudt12; Slc22a13; Rnls; Nampt","thymus","RR-6","GLDS-244"
"REACTOME_NITRIC_OXIDE_STIMULATES_GUANYLATE_CYCLASE",0.0240688383476539,0.0551171140812979,0.352487857583619,-0.46439758676572,-1.59701374000047,22,"reactome","Irag1; Pde2a; Pde9a; Nos3; Gucy1a1; Gucy1b1; Pde5a; Pde1a; Prkg1; Nos1; Prkg2; Kcnmb1","thymus","RR-6","GLDS-244"
"REACTOME_NOD1_2_SIGNALING_PATHWAY",0.317689530685921,0.403775469273149,0.0988903007520636,0.286899408154076,1.10226980974139,36,"reactome","Itch; Chuk; Map3k7; Traf6; Cyld; Tab2; Map2k6; Tab3; Casp2; Birc2; Ube2n","thymus","RR-6","GLDS-244"
"REACTOME_NONHOMOLOGOUS_END_JOINING_NHEJ",3.43925623183417e-05,0.000219057172493529,0.557332238758646,0.49752082596825,2.11328471174071,56,"reactome","Tdp2; Abraxas1; Mre11a; Herc2; Xrcc4; Prkdc; Dclre1c; Rif1; Ube2v2; Uimc1; H2bc21; Brcc3; Lig4; Atm; Rnf168; Nsd2; Rad50; Xrcc6","thymus","RR-6","GLDS-244"
"REACTOME_NONSENSE_MEDIATED_DECAY_NMD",0.600496277915633,0.66320820447628,0.0808589150280032,-0.1859904313877,-0.939618953822945,106,"reactome","Ppp2r1a; Rpl4; Rpl21; Rps5; Rps28; Rpl3; Rpl13; Rplp2; Rps29; Rpl29; Eif4g1; Rpl18a; Rpl28; Rpl37a; Rplp1; Uba52; Rps2; Rplp0; Upf1; Rps19; Rpl8; Rpl18; Rps15; Rpl7a; Rpsa; Rps26; Rpl19; Rps4x; Rpl38; Rps18; Rpl26; Rpl10a; Rps9; Rpl10; Gspt2; Rpl24; Fau; Rpl36; Rpl27; Rps14; Rpl35","thymus","RR-6","GLDS-244"
