"pathway","pval","padj","log2err","ES","NES","size","db","leadingEdge_str","tissue","mission","glds"
"REACTOME_ABC_FAMILY_PROTEINS_MEDIATED_TRANSPORT",0.000599043274184279,0.00258279811677145,0.477270815362862,-0.366394021231389,-1.78583039445095,87,"reactome","Abca3; Abca2; Abcc4; Abcb8; Ubc; Rnf185; Pex19; Abcb1a; Abcc1; Adrm1; Abcb6; Derl1; Abca9; Os9; Abcb10; Abcd1; Ubb; Psmb5; Abca4; Psmc5; Kcnj11; Abcd2; Psmb2; Psmb6; Psmb3; Erlin2; Uba52; Abcg4; Abcc9; Derl3; Psmc2; Abca6; Vcp; Psmc4; Psmd7; Apoa1; Abca7; Abcc3; Psmd3; Abca8b; Abcf1; Abcc10; Psmd2; Psmd8","thymus","RR-6","GLDS-244"
"REACTOME_ABC_TRANSPORTERS_IN_LIPID_HOMEOSTASIS",0.00697939078352997,0.0202691633894744,0.407017918923954,-0.553714217223401,-1.8066778349141,17,"reactome","Abca3; Abca2; Pex19; Abca9; Abcd1; Abcd2; Abcg4; Abca6; Apoa1; Abca7","thymus","RR-6","GLDS-244"
"REACTOME_ABC_TRANSPORTER_DISORDERS",0.0137812222709489,0.0351107958312129,0.380730400722792,-0.351669857499973,-1.61717025066846,64,"reactome","Abca3; Abcc8; Ubc; Rnf185; Abca1; Adrm1; Abcb6; Derl1; Os9; Abcd1; Ubb; Psmb5; Psmc5; Kcnj11; Psmb2; Psmb6; Psmb3; Erlin2; Uba52; Abcc9; Derl3; Psmc2; Vcp; Psmc4; Psmd7; Apoa1; Psmd3; Psmd2; Psmd8","thymus","RR-6","GLDS-244"
"REACTOME_ABERRANT_REGULATION_OF_MITOTIC_EXIT_IN_CANCER_DUE_TO_RB1_DEFECTS",0.0153341879634295,0.03804141478139,0.380730400722792,0.521673181363278,1.72729868519362,20,"reactome","Anapc4; Ube2d1; Rb1; Ube2e1; Anapc1; Cdc27; Anapc10; Cdc16; Skp2; Cdc26","thymus","RR-6","GLDS-244"
"REACTOME_ABERRANT_REGULATION_OF_MITOTIC_G1_S_TRANSITION_IN_CANCER_DUE_TO_RB1_DEFECTS",0.246777163904236,0.334911865298606,0.116234148779716,0.372646181760278,1.18679267537568,17,"reactome","Cdkn1b; Rb1; Ccne2; Tfdp2; Cdk2; E2f3; Ccne1","thymus","RR-6","GLDS-244"
"REACTOME_ABORTIVE_ELONGATION_OF_HIV_1_TRANSCRIPT_IN_THE_ABSENCE_OF_TAT",0.346511627906977,0.428268505935745,0.109250039480711,-0.30840284943949,-1.07610556698711,23,"reactome","Polr2l; Nelfe; Polr2f; Gtf2f1; Polr2c; Polr2i; Nelfb; Polr2e; Polr2j","thymus","RR-6","GLDS-244"
"REACTOME_ACETYLCHOLINE_NEUROTRANSMITTER_RELEASE_CYCLE",0.320261437908497,0.405206627421473,0.110122263835536,-0.339945515061339,-1.10918594472713,17,"reactome","Stxbp1; Rab3a; Unc13b; Ppfia4; Slc5a7; Slc18a3","thymus","RR-6","GLDS-244"
"REACTOME_ACTIVATED_NOTCH1_TRANSMITS_SIGNAL_TO_THE_NUCLEUS",0.0019469143592134,0.00710909119439159,0.45505986738723,-0.477570561067737,-1.86382291727773,32,"reactome","Arrb1; Numb; Dll4; Dtx1; Psen2; Aph1c; Aph1a; Psenen; Dll1; Ubc; Jag1; Dtx4; Ubb; Dlk1; Uba52; Jag2; Neurl1b; Aph1b; Arrb2; Mib2; Ncstn; Notch1; Psen1; Neurl1a; Dtx2","thymus","RR-6","GLDS-244"
"REACTOME_ACTIVATED_PKN1_STIMULATES_TRANSCRIPTION_OF_AR_ANDROGEN_RECEPTOR_REGULATED_GENES_KLK2_AND_KLK3",0.465986394557823,0.540197257806949,0.0743625384422526,0.23222799824292,1.00011237355659,60,"reactome","Kdm4c; Kdm1a; H2bc21; H3f3b; Klk1b22; Klk1b1; H3f3a; Klk1b8; Klk1b9; Klk1b4; Klk1b5; H2bc18; H2bc3; Klk1b11; H2aj; Klk1b24; H2az2; H2ac13; Klk1b16; Ncoa2; Pkn1; Klk1b3; H4c16; H2ax; H2ac7; H2ac23; H2ac18; H2ac20; H2ac4; H3c4; H4c14; H4c1; H2bc14; H4c11; H3c8; H3c15; H3c10; H4c2; H2bc8; H4c17; H3c1; H3c11; Klk1; H3c2; H4c6; H4c18; H2bc7; H3c3; H4c8; H2bc6; H4c3; H3c7; H4c12; H2ac19; H4c4; H2ac10","thymus","RR-6","GLDS-244"
"REACTOME_ACTIVATED_TAK1_MEDIATES_P38_MAPK_ACTIVATION",0.0906976744186047,0.155699989315859,0.227987202850442,-0.388937555993049,-1.35711414461688,23,"reactome","Irak2; Nod1; Mapkapk2; Map2k3; Irak1; Nod2; Ubc; Mapk14; Mapkapk3; Ubb; Ube2v1; Uba52","thymus","RR-6","GLDS-244"
"REACTOME_ACTIVATION_OF_AMPK_DOWNSTREAM_OF_NMDARS",0.000407287085078727,0.00188664802633576,0.49849310876659,-0.577710971816351,-2.05631146603309,24,"reactome","Tubb1; Prkag3; Tubb6; Prkab1; Tubb4b; Prkag1; Tuba4a; Tuba8; Camkk2; Tuba1c; Tuba1a; Mapt; Tuba1b; Tubb4a; Tubb2a; Prkag2; Prkaa2","thymus","RR-6","GLDS-244"
"REACTOME_ACTIVATION_OF_ANTERIOR_HOX_GENES_IN_HINDBRAIN_DEVELOPMENT_DURING_EARLY_EMBRYOGENESIS",0.0761421319796954,0.136132902630365,0.211400189384923,0.273010722353462,1.29800848038317,105,"reactome","Egr2; Suz12; Ncor1; Cnot6; Eed; Rbbp5; Kdm6a; Kmt2c; Yy1; Rbbp4; H2bc21; Pias2; Ncoa6; H3f3b; Crebbp; Ep300; Ash2l; Ezh2; Polr2k; Ctcf; Pax6","thymus","RR-6","GLDS-244"
"REACTOME_ACTIVATION_OF_APC_C_AND_APC_C_CDC20_MEDIATED_DEGRADATION_OF_MITOTIC_PROTEINS",0.679930795847751,0.728897096115583,0.0567672387487446,0.206215578200507,0.895106992985198,64,"reactome","Anapc4; Ube2d1; Ube2e1; Anapc1; Psmc6; Cdc27; Mad2l1; Psmd14; Anapc10; Cdc16; Ccna2; Cdc26; Psmd6; Psma3; Psma6; Ccnb1; Cdk1; Rps27a","thymus","RR-6","GLDS-244"
"REACTOME_ACTIVATION_OF_ATR_IN_RESPONSE_TO_REPLICATION_STRESS",3.63694480410314e-07,4.51122646119544e-06,0.674962860011025,0.64006368025204,2.45912975419906,36,"reactome","Orc4; Orc3; Rpa3; Atr; Orc5; Dbf4; Orc6; Chek1; Rad17; Orc2; Cdc25a; Mcm8; Hus1; Cdc7; Rad1; Orc1; Cdk2; Rfc4; Rfc3; Mcm4; Rad9b; Cdc25c; Clspn; Mcm7; Cdc6; Mcm10; Mcm6","thymus","RR-6","GLDS-244"
"REACTOME_ACTIVATION_OF_BAD_AND_TRANSLOCATION_TO_MITOCHONDRIA",0.866090712742981,0.881823514064379,0.055826471778749,-0.230444981822122,-0.722803850594838,15,"reactome","Akt2; Akt1; Ywhag; Bad; Ppp3cc; Ywhab","thymus","RR-6","GLDS-244"
"REACTOME_ACTIVATION_OF_BH3_ONLY_PROTEINS",0.643617021276596,0.699122752762659,0.0605092988656667,0.234753202692864,0.867070589759148,30,"reactome","Mapk8; Bcl2l11; Ppp3r1; Tfdp2; Ywhae; Ywhaz; Dynll1; Bcl2; Trp63; Bmf","thymus","RR-6","GLDS-244"
"REACTOME_ACTIVATION_OF_GENE_EXPRESSION_BY_SREBF_SREBP",0.354723707664884,0.436014557338087,0.0916795246008379,0.267049216855087,1.06278332046302,43,"reactome","Tgs1; Nfyb; Med1; Sp1; Ncoa6; Ggps1; Crebbp; Tbl1xr1; Hmgcr","thymus","RR-6","GLDS-244"
"REACTOME_ACTIVATION_OF_IRF3_IRF7_MEDIATED_BY_TBK1_IKK_IKBKE",0.0475653611006943,0.0948768145798546,0.321775918075361,-0.467878810745176,-1.53408060549451,18,"reactome","Ptpn11; Cd14; Ticam1; Ubc; Irf7; Ubb; Optn; Traf3; Uba52","thymus","RR-6","GLDS-244"
"REACTOME_ACTIVATION_OF_KAINATE_RECEPTORS_UPON_GLUTAMATE_BINDING",0.203196347031963,0.284728881278539,0.14641623786055,-0.316580784254371,-1.21104830757948,30,"reactome","Plcb3; Gnb1; Gng11; Grik5; Gng7; Gnb2; Gnb5; Gng2; Plcb1; Grik4; Gng13; Gng4; Gng8; Grik2; Gng12; Gnb3; Ncald; Calm1; Grik3; Gngt2","thymus","RR-6","GLDS-244"
"REACTOME_ACTIVATION_OF_MATRIX_METALLOPROTEINASES",0.00625538836815336,0.0186002396835541,0.407017918923954,-0.398915022560778,-1.70190147464789,46,"reactome","Furin; Mmp15; Mmp2; Timp2; Cma1; Mmp14; Tpsb2; Timp1; Ctsk; Mmp3; Mmp11; Col18a1","thymus","RR-6","GLDS-244"
"REACTOME_ACTIVATION_OF_NF_KAPPAB_IN_B_CELLS",0.985915492957746,0.985915492957746,0.0536769600638126,-0.14238381923409,-0.631674211801499,54,"reactome","Rela; Ubc; Adrm1; Ubb; Psmb5; Psmc5; Nfkbib; Psmb2; Psmb6; Psmb3; Uba52; Psmc2; Psmc4; Psmd7; Ikbkg; Psmd3; Nfkb1; Psmd2; Psmd8","thymus","RR-6","GLDS-244"
"REACTOME_ACTIVATION_OF_NMDA_RECEPTORS_AND_POSTSYNAPTIC_EVENTS",0.0945626477541371,0.160127988115389,0.224966093540314,-0.258286695097213,-1.26338573627026,88,"reactome","Nrgn; Tubb1; Mapk3; Prkag3; Src; Camk1; Tubb6; Prkab1; Tubb4b; Ppm1f; Camk2b; Prkaca; Rps6ka1; Rasgrf2; Hras; Adcy8; Grin2d; Rasgrf1; Actn2; Prkag1; Tuba4a; Kif17; Tuba8; Git1; Rps6ka2; Camkk2; Cask; Nbea; Gria1; Tuba1c; Tuba1a; Mapt; Tuba1b; Rac1; Lin7b; Tubb4a; Prkar2a; Tubb2a; Grin2c; Prkag2; Erbb4; Camk2a","thymus","RR-6","GLDS-244"
"REACTOME_ACTIVATION_OF_SMO",0.216814159292035,0.300171937538756,0.13880510939114,-0.370793803563292,-1.21575837507587,18,"reactome","Arrb1; Evc2; Evc; Cdon; Boc; Gas8; Gas1; Arrb2; Dhh; Shh","thymus","RR-6","GLDS-244"
"REACTOME_ACTIVATION_OF_THE_MRNA_UPON_BINDING_OF_THE_CAP_BINDING_COMPLEX_AND_EIFS_AND_SUBSEQUENT_BINDING_TO_43S",0.133016627078385,0.206525815726966,0.188204146308491,-0.26669075796137,-1.2018992077145,58,"reactome","Eif3f; Eif3l; Eif3b; Eif4ebp1; Eif3g; Eif3k; Rps5; Rps28; Eif3i; Rps29; Eif4g1; Eif3d; Eif4b; Rps2; Rps19; Rps15; Rpsa; Rps26; Rps4x; Rps18; Eif3c; Rps9; Fau; Rps14; Eif4h","thymus","RR-6","GLDS-244"
"REACTOME_ACTIVATION_OF_THE_PRE_REPLICATIVE_COMPLEX",3.61735623244729e-07,4.51122646119544e-06,0.674962860011025,0.657171478354462,2.43513319615061,32,"reactome","Orc4; Orc3; Rpa3; Orc5; Dbf4; Orc6; Prim1; Gmnn; Orc2; Pola1; Mcm8; Pole2; Cdc7; Orc1; Cdk2; Prim2; Mcm4; Pole4; Mcm7; Cdc6; Mcm10; Mcm6","thymus","RR-6","GLDS-244"
"REACTOME_ACYL_CHAIN_REMODELLING_OF_PC",0.0157105343000366,0.0385372187097177,0.352487857583619,-0.444302962422493,-1.64700422197637,27,"reactome","Plaat3; Pla2g12a; Lpcat1; Pla2g2e; Pla2r1; Pla2g5; Pla2g6; Lpcat3; Lpcat4; Pla2g4a; Plbd1; Pla2g2d","thymus","RR-6","GLDS-244"
"REACTOME_ACYL_CHAIN_REMODELLING_OF_PE",0.00422188522287296,0.0135220952424017,0.407017918923954,-0.486050093414958,-1.80175831280012,27,"reactome","Plaat3; Pla2g12a; Abhd4; Pla2g2e; Pla2r1; Pla2g5; Pla2g6; Mboat1; Plaat5; Lpcat3; Lpcat4; Pla2g4a; Plbd1; Pla2g2d","thymus","RR-6","GLDS-244"
"REACTOME_ACYL_CHAIN_REMODELLING_OF_PG",0.0289615837808918,0.0636586968987837,0.352487857583619,-0.486570233300649,-1.5953660242246,18,"reactome","Pla2g12a; Lpcat1; Pla2g2e; Pla2r1; Pla2g5; Lpcat4; Pla2g4a; Pla2g2d; Lpgat1; Pla2g1b; Pla2g10","thymus","RR-6","GLDS-244"
"REACTOME_ACYL_CHAIN_REMODELLING_OF_PI",0.0488052451991294,0.0971770512757089,0.321775918075361,-0.477083482721916,-1.55664443286194,17,"reactome","Plaat3; Pla2g12a; Pla2g2e; Pla2r1; Mboat7; Pla2g5; Pla2g4a; Plbd1; Pla2g2d","thymus","RR-6","GLDS-244"
"REACTOME_ACYL_CHAIN_REMODELLING_OF_PS",0.0316876355703635,0.0689744455813154,0.321775918075361,-0.44919565854432,-1.54473593120918,22,"reactome","Plaat3; Pla2g12a; Osbpl5; Pla2g2e; Pla1a; Pla2r1; Pla2g5; Mboat1; Lpcat3; Lpcat4; Pla2g4a; Pla2g2d","thymus","RR-6","GLDS-244"
"REACTOME_ADHERENS_JUNCTIONS_INTERACTIONS",0.017727047282692,0.042827629318745,0.352487857583619,-0.338740991207507,-1.52112864253598,57,"reactome","Cdh5; Actg1; Adam33; Angptl4; Nectin2; Ang; Ctnna1; Heyl; Foxf1; Cdh13; Snai1; Zc3h12a; Zeb2; Adam19; Jup; Cdh11; Ctnnd1; Ago4; Cdh12; Ctnnb1; Cdh2; Afdn; Mov10; Nectin3; Cadm3; Nectin1; Cadm2","thymus","RR-6","GLDS-244"
"REACTOME_ADIPOGENESIS",0.0420566224032565,0.0871450530758789,0.321775918075361,0.286723061518741,1.38051696003848,109,"reactome","Egr2; Zfp638; Hnrnpu; Ncor1; Hdac2; Cdk8; Tgs1; Med14; Med1; Med13; Thrap3; Smad4; Med23; Gatad2b; Rbbp4; Med31; Ncoa6; Med30; Crebbp; Ep300; Med6; Tbl1xr1; Ccnc; Fam120b; Med17; Cdk19; Med7","thymus","RR-6","GLDS-244"
"REACTOME_ADORA2B_MEDIATED_ANTI_INFLAMMATORY_CYTOKINES_PRODUCTION",0.0182408636586917,0.0435524995534103,0.352487857583619,-0.385325909267028,-1.60976607374213,42,"reactome","Adcy4; Adcy9; Gnas; Adcy7; Gnb1; Gnaz; Prkaca; Gng11; Adora2b; Gng7; Adcy8; Adcy5; Gnb2; Gnb5; Adcy3; Gng2; Gnai2; Prkar2a; Gng13; Gnai1; Gng4; Adcy2; Adcy6; Gng8; Gng12; Gnb3; Prkar1b","thymus","RR-6","GLDS-244"
"REACTOME_ADP_SIGNALLING_THROUGH_P2Y_PURINOCEPTOR_1",0.00096931448615688,0.00386367547330386,0.477270815362862,-0.541193414802042,-1.95764416734855,25,"reactome","Src; Gna11; Gnb1; Gng11; Mapk14; Gng7; Gnb2; Gnb5; Gng2; Gna15; Pla2g4a; P2ry1; Gnaq; Gng13; Gng4; Gng8; Gna14; Gng12; Gnb3","thymus","RR-6","GLDS-244"
"REACTOME_ADP_SIGNALLING_THROUGH_P2Y_PURINOCEPTOR_12",0.0625,0.118549069373942,0.276500599254472,-0.416385353784283,-1.43190479468173,22,"reactome","Gnb1; Gng11; Gng7; P2ry12; Gnb2; Gnb5; Gng2; Gnai2; Gng13; Gnai1; Gng4; Gng8; Gng12; Gnb3","thymus","RR-6","GLDS-244"
"REACTOME_ADRENALINE_NORADRENALINE_INHIBITS_INSULIN_SECRETION",0.000858453155117787,0.00351646189313761,0.477270815362862,-0.538709595378175,-2.02778399868354,28,"reactome","Cacna1d; Cacna2d2; Cacna1c; Gnb1; Gng11; Gng7; Adcy5; Gnb2; Gnb5; Gng2; Gnai2; Cacnb2; Adra2a; Cacnb3; Gng13; Gnai1; Gng4; Adcy6; Gng8; Gng12; Gnb3","thymus","RR-6","GLDS-244"
"REACTOME_AEROBIC_RESPIRATION_AND_RESPIRATORY_ELECTRON_TRANSPORT",1.01880257164408e-15,6.71810401654716e-14,1.01754479730988,-0.444247398061229,-2.52229703739626,222,"reactome","Idh2; Mdh2; Iscu; Cox4i2; Sco2; Foxred1; Cyc1; Got1; Idh3g; Oxa1l; Ndufa3; Ndufv3; Bcs1l; Trap1; Sdhb; Gid8; Ndufs2; Slc25a11; Ndufb11; Mdh1; Sirt3; Ndufaf3; Gstz1; Ndufa9; Ubc; Ndufb10; Surf1; Cox4i1; Slc25a22; Got2; Ogdh; Uqcrc1; Ndufa8; Gpt; Ndufs8; Ndufv1; Ucp2; Ecsit; Smim20; Ndufa2; Ndufs7; Sdhc; Pnkd; Taco1; Pdk2; Uqcc2; Ndufs5; Higd2a; Ldha; Cox19; Uqcr10; Ndufa12; Etfb; Ndufa7; Cox8a; Ndufb2; Pkm; Me3; Uqcc1; Ndufa13; Ndufs6; Hagh; Coq10a; Cox7a1; Cox5b; Acad9; Uqcrq; Aco2; Pcx; Letm1; Ndufs3; Coa3; Ubb; Ndufa10; Slc25a4; Sdhaf1; Idh3b; Cs; Cox6a2; Ndufb8; Adhfe1; Maea; Cox7a2l; Cox6a1; Tmem177; Uqcr11; Ucp3; Cox6b2; Ndufb7; Ndufa11; Ndufaf8; Uqcrfs1; Sdhd; Pdhx; Uba52; Isca1; Ndufb9; Uqcc3; Cox7a2; Acat1; Etfa; Sdha; Tmem223; Ndufa5; Gid4; Suclg2; Suclg1; Ldhb; Uqcrh; Timmdc1; Ndufb3; Ndufa6; Rmnd5b; Cox17; Ndufa1; Vdac1; Dmac2; D2hgdh; Higd1a; Hspa9; Rab5if; Tmem186; Uqcrc2; Dlat; Cox5a; Dlst; Ndufaf7; L2hgdh; Ucp1; Nfs1; Pdp2; Fh1; Pdpr; Sdhaf4; Pm20d1","thymus","RR-6","GLDS-244"
"REACTOME_AFLATOXIN_ACTIVATION_AND_DETOXIFICATION",0.00579925403582606,0.0175701723625973,0.407017918923954,-0.602287293222747,-1.88910850331197,15,"reactome","Dpep2; Dpep1; Ggt1; Acy1; Akr7a5; Ggt5; Acy3; Mgst3; Mgst1","thymus","RR-6","GLDS-244"
"REACTOME_AGGREPHAGY",0.0139567703138377,0.0353172449702305,0.380730400722792,-0.407435045633271,-1.64642839313938,38,"reactome","Tubb1; Vim; Tubb6; Tubb4b; Ubc; Hdac6; Park7; Dynll2; Ubb; Tuba4a; Ube2v1; Tuba8; Prkn; Dync1h1; Uba52; Tuba1c; Tuba1a; Vcp; Tuba1b; Tubb4a; Tubb2a","thymus","RR-6","GLDS-244"
"REACTOME_AMINE_LIGAND_BINDING_RECEPTORS",0.724604966139955,0.764860797592175,0.066436413766281,-0.213973544729952,-0.857742697123555,37,"reactome","Adra1b; Adrb2; Adrb1; Hrh1; Adrb3; Htr2a; Chrm3; Adra1d; Adra2a; Hrh2; Chrm2","thymus","RR-6","GLDS-244"
"REACTOME_AMINO_ACIDS_REGULATE_MTORC1",0.102803738317757,0.16972458122858,0.213927855492356,-0.282465579290605,-1.26065430422524,55,"reactome","Sh3bp4; Atp6v0d1; Lamtor4; Flcn; Lamtor2; Sesn2; Kics2; Lamtor1; Kptn; Atp6v0c; Mtor; Atp6v0e; Atp6v1f; Atp6v0b; Atp6v0e2; Sec13; Atp6v1b1; Castor1; Atp6v1c2; Wdr24; Mlst8; Tcirg1; Itfg2; Fnip2; Rraga","thymus","RR-6","GLDS-244"
"REACTOME_AMINO_ACID_TRANSPORT_ACROSS_THE_PLASMA_MEMBRANE",0.427586206896552,0.507758620689655,0.0956031492204301,-0.258317712589384,-1.01331905499517,33,"reactome","Slc7a10; Slc1a5; Slc3a2; Slc38a5; Slc1a4; Slc7a7; Slc7a5; Slc6a14; Slc6a6; Slc25a29; Slc38a4; Slc6a20a; Slc6a12; Slc36a2; Slc7a2; Slc38a3","thymus","RR-6","GLDS-244"
"REACTOME_AMYLOID_FIBER_FORMATION",0.000247437651491759,0.00123278936587672,0.49849310876659,-0.370740331838049,-1.83341795315792,95,"reactome","Furin; Tgfbi; Mfge8; Gga2; Gsn; Cst3; Tspan14; Aph1c; Aph1a; Psenen; Apoe; Bace1; Lyz2; Tspan33; Sncaip; Sorl1; Ubc; Nppa; Itm2b; Hspg2; Tspan15; App; Ubb; Ube2l6; Ltf; Snca; H2bc4; Tspan5; Prkn; Uba52; Gga1","thymus","RR-6","GLDS-244"
"REACTOME_ANCHORING_FIBRIL_FORMATION",5.58456376071527e-05,0.00032776418721266,0.557332238758646,-0.730217723739047,-2.29036960717412,15,"reactome","Bmp1; Col4a2; Col4a1; Col1a1; Col4a3; Col4a5; Col1a2; Col4a4; Col4a6; Tll1","thymus","RR-6","GLDS-244"
"REACTOME_ANCHORING_OF_THE_BASAL_BODY_TO_THE_PLASMA_MEMBRANE",4.50930951728615e-05,0.00027031743149079,0.557332238758646,0.402428896258296,1.89558094640408,97,"reactome","Cep70; Haus3; Ttbk2; Cep57; Cep43; Pcm1; Haus6; Sclt1; Cenpj; Cep97; Akap9; Cep192; Iqcb1; Dync1i2; Clasp1; Ahi1; Cep83; Ckap5; Cep135; Sfi1; Ofd1; Cntrl; Haus2; Nedd1; C2cd3; Alms1; Cep162; Cep72; Pafah1b1; Haus1; Cep76; Cep290; Plk4; Ywhae; Mapre1; Sdccag8; Cep41","thymus","RR-6","GLDS-244"
"REACTOME_ANTIGEN_ACTIVATES_B_CELL_RECEPTOR_BCR_LEADING_TO_GENERATION_OF_SECOND_MESSENGERS",0.00235844727593197,0.00818519936941095,0.431707695803346,-0.366770621375855,-1.70746027801891,68,"reactome","Igkv8-21; Igkv17-121; Igkv9-120; Plcg2; Blk; Ighm; Ighv1-62-3; Cd79a; Cd79b; Orai1; Syk; Itpr3; Igkv13-84; Igkv8-28; Lyn; Cd19; Igkv1-99; Igkv2-109; Pik3ap1; Iglc3; Cd22; Igkv14-100; Ptpn6; Iglc1; Blnk; Igkv12-41; Btk; Igkv12-98; Igkv1-135; Igkv1-132; Igkv18-36; Igkv12-38; Ighv8-6; Pik3cd; Trpc1; Ighv8-4; Igkv13-85; Calm1; Iglc2; Igkv8-27; Igkv14-126","thymus","RR-6","GLDS-244"
"REACTOME_ANTIGEN_PRESENTATION_FOLDING_ASSEMBLY_AND_PEPTIDE_LOADING_OF_CLASS_I_MHC",0.45353982300885,0.531262425906918,0.0899860794997137,-0.26321052544636,-1.00287804229829,29,"reactome","H2-D1; Tapbp; H2-T23; H2-M3; Becn1; Sec13; Bcap31; Tap1; Sec24d; Calr; Tap2; H2-Q10; B2m; Pik3r4","thymus","RR-6","GLDS-244"
"REACTOME_ANTIGEN_PROCESSING_CROSS_PRESENTATION",0.0129809574193446,0.0337438423036102,0.380730400722792,-0.296854339907013,-1.4680821050007,97,"reactome","Cd14; Ncf4; Vamp8; Mrc2; Myd88; H2-D1; Tapbp; Ncf2; Itgb5; S100a1; Ubc; Tirap; Ncf1; Adrm1; Ubb; Psmb5; Psmc5; H2-T23; Psmb2; Psmb6; Psmb3; H2-M3; Uba52; Tlr2; Stx4a; Psmc2; Tap1; Psmb10; Psmc4; Fga; Psmd7; Cyba; Cybb; Ikbkg; Psmd3; Calr; Fcgr1; Btk; Psmd2; Psmd8; Cd36; Tap2; H2-Q10; Ctss; Tlr4; B2m; Psmc3; Mrc1; Psme2","thymus","RR-6","GLDS-244"
"REACTOME_ANTIGEN_PROCESSING_UBIQUITINATION_PROTEASOME_DEGRADATION",5.62628796527435e-06,4.70676776796458e-05,0.610526878385931,0.316891321567277,1.75702701141589,295,"reactome","Ube3a; Wsb1; Rnf111; Klhl20; Fbxl3; Kbtbd8; Anapc4; Ube2d1; Ubr1; Siah1a; Itch; Rchy1; Herc2; Hectd1; Tpp2; Rnf6; Dzip3; Trip12; Fbxo11; Rbbp6; Npepps; Ube2j2; Ube2e1; Asb3; Anapc1; Fbxw7; Fbxw10; Fbxl14; Ube2e3; Fbxw2; Fbxl20; Herc1; Glmn; Rnf138; Arih2; Ube2v2; Uba5; Psmc6; Kbtbd7; Uba3; Hectd2; Asb7; Herc6; Mex3c; Lnpep; Ltn1; Herc4; Ube2d2a; Ube3c; Ube4a; Asb13; Ube2d3; Cdc27; Rlim; Ube2k; Ube2g1; Hace1; Herc3; Huwe1; Rnf19a; Fbxl5; Psmd14; Btrc; Klhl9; Trim39; Uba6; Rnf4; Lrr1; Znrf2; Kbtbd6; Anapc10; Cul5; Cdc16; Trim37; Trim69; Klhl42; Ube2a; Cul3; Ube2w; Klhl11; Eloc; Ube2n; Fbxl12; Skp1; Rbx1; Skp2; Dcaf1; Nedd4l; Cdc26; Trim21; Psmd6; Blmh; Trim71; Psma3; Znrf1; Fbxw19","thymus","RR-6","GLDS-244"
"REACTOME_ANTIGEN_PROCESSING_UB_ATP_INDEPENDENT_PROTEASOMAL_DEGRADATION",0.72972972972973,0.766660756351478,0.065981614400873,-0.251092065459377,-0.826359715366927,19,"reactome","Psmb5; Psmb2; Psmb6; Psmb3; Psmb10; Psme2; Psmb8; Psmb7; Psma7; Psmb9; Psme1","thymus","RR-6","GLDS-244"
"REACTOME_ANTIMICROBIAL_PEPTIDES",0.527315914489311,0.595888246111409,0.0855356947987884,-0.213330953040562,-0.961421780793653,58,"reactome","Lcn2; Slc11a1; Prtn3; Clu; Lyz2; Pglyrp1; Atox1; Ltf; Bpifb1; Tlr2; Defb25; Ear1; Bpifb2; Rnase6; Bpifa1; Ccr2; Ccr6; Reg3g; Art1; Tlr1","thymus","RR-6","GLDS-244"
"REACTOME_ANTIVIRAL_MECHANISM_BY_IFN_STIMULATED_GENES",0.0115139321084169,0.030731233079846,0.380730400722792,0.282874779604123,1.41837106809303,141,"reactome","Eif4g2; Dhx9; Chuk; Arih1; Ube2e1; Fancb; Nup88; Tpr; Ranbp2; Fancm; Dnajc3; Nup107; Nup153; Seh1l; Ppp2ca; Fancf; Pde12; Nup155; Map2k6; Nup160; Kpna3; Ilf2; Ptpn2; Npm1; Eif4e3; Sumo1; Nup35; Nup98; Eif4a2; Kpna4; Kpna1; Abce1; Nup37; Nup214; Eif2s1; Nup43; Ube2n; Nck1; Mx2; Fancl; Eif2s2; Eif4e; Fancc","thymus","RR-6","GLDS-244"
"REACTOME_ANTI_INFLAMMATORY_RESPONSE_FAVOURING_LEISHMANIA_PARASITE_INFECTION",8.61839519950993e-07,9.47178531240259e-06,0.659444398037935,-0.416276512800439,-2.12618464490811,115,"reactome","Dpep2; Igkv8-21; Adcy4; Furin; Igkv17-121; Src; Dpep1; Hck; Adcy9; Igkv9-120; Ggt1; Gnas; Adcy7; Gnb1; Plcg2; Rhbdf2; Gnaz; Prkaca; Gng11; Myh9; Ighv1-62-3; Ggt5; Adora2b; Mapk14; Gng7; Adcy8; Syk; Plk2; Itpr3; Fgr; Ighg3; Igkv13-84; Adcy5; Gnb2; Gnb5; Adcy3; Igkv8-28; Lyn; Igkv1-99; Gng2; Igkv2-109; Gnai2; Fcgr2b; Cd163; Iglc3; Igkv14-100; Iglc1; Fcgr4; Igkv12-41; Cysltr1; Prkar2a; Fcgr1; Gng13; Gnai1; Gng4; Igkv12-98; Adcy2; Igkv1-135; Igkv1-132; Igkv18-36; Adcy6; Gng8; Ighg2c; Igkv12-38; Ighv8-6; Gng12; Gnb3; Prkar1b; Ighv8-4; Igkv13-85","thymus","RR-6","GLDS-244"
"REACTOME_APC_CDC20_MEDIATED_DEGRADATION_OF_NEK2A",0.0982142857142857,0.164571321802264,0.190023305279108,0.376393304518517,1.34269059266205,26,"reactome","Anapc4; Ube2d1; Ube2e1; Anapc1; Cdc27; Mad2l1; Anapc10; Cdc16; Cdc26","thymus","RR-6","GLDS-244"
"REACTOME_APC_C_CDC20_MEDIATED_DEGRADATION_OF_CYCLIN_B",0.132379248658318,0.206525815726966,0.161978948883402,0.370444691526031,1.29516232322233,24,"reactome","Anapc4; Ube2d1; Ube2e1; Anapc1; Cdc27; Anapc10; Cdc16; Cdc26; Ccnb1; Cdk1; Rps27a","thymus","RR-6","GLDS-244"
"REACTOME_APC_C_CDH1_MEDIATED_DEGRADATION_OF_CDC20_AND_OTHER_APC_C_CDH1_TARGETED_PROTEINS_IN_LATE_MITOSIS_EARLY_G1",0.476190476190476,0.549186752890456,0.0732558655828455,0.228988077147598,0.990774627283113,61,"reactome","Anapc4; Ube2d1; Rb1; Ube2e1; Anapc1; Psmc6; Cdc27; Psmd14; Anapc10; Cdc16; Skp2; Cdc26; Psmd6; Psma3","thymus","RR-6","GLDS-244"
"REACTOME_APC_C_MEDIATED_DEGRADATION_OF_CELL_CYCLE_PROTEINS",0.135363790186125,0.209589514915257,0.155241966228839,0.27034687574154,1.2136377387872,75,"reactome","Anapc4; Ube2d1; Rb1; Ube2e1; Anapc1; Psmc6; Cdc27; Mad2l1; Psmd14; Btrc; Anapc10; Cdc16; Skp1; Skp2; Ccna2; Cdk2; Cdc26; Psmd6; Fbxo5; Psma3; Psma6; Ccnb1; Cdk1; Cdc14a; Rps27a","thymus","RR-6","GLDS-244"
"REACTOME_APOPTOSIS",0.32133676092545,0.406108803830247,0.120985142145252,-0.194923046059743,-1.06023602669768,164,"reactome","Stat3; Aven; Mapk3; Septin4; Vim; Tjp2; Unc5b; Cd14; Gsn; Fadd; Akt2; Nmt1; Maged1; Ticam1; Ubc; Add1; Plec; Dapk2; Sptan1; Casp9; Unc5a; Dynll2; Adrm1; Tjp1; Trp73; Ubb; Psmb5; Lmna; Psmc5; Akt1; H1f0; Psmb2; Psmb6; Psmb3; Ocln; Dbnl; Uba52; Dapk3; Cdkn2a; Arhgap10; Ywhag; Ctnnb1; Bad; Bak1; Psmc2; Bcap31; Ppp1r13b; Uaca; Bax; Mapt; Psmc4; Dsg2; Psmd7","thymus","RR-6","GLDS-244"
"REACTOME_APOPTOTIC_CLEAVAGE_OF_CELLULAR_PROTEINS",0.715909090909091,0.758538838288366,0.0673623868166279,-0.214645673568673,-0.867374407811943,38,"reactome","Vim; Tjp2; Gsn; Add1; Plec; Sptan1; Tjp1; Lmna; Ocln; Dbnl; Ctnnb1; Bcap31; Mapt; Dsg2","thymus","RR-6","GLDS-244"
"REACTOME_APOPTOTIC_EXECUTION_PHASE",0.248263888888889,0.33611572396672,0.111918316325105,0.273488572830833,1.14414418237839,52,"reactome","Rock1; Stk26; Hmgb1; Apc; Satb1; Prkcq; Acin1; Dnm1l; Kpna1; Casp3; Pak2; Birc2; Dffb; Casp6; Hmgb2; Kpnb1; Stk24","thymus","RR-6","GLDS-244"
"REACTOME_APOPTOTIC_FACTOR_MEDIATED_RESPONSE",0.484234234234234,0.555037399362553,0.0873098257637931,-0.292770593999957,-0.963526363459509,19,"reactome","Aven; Mapk3; Septin4; Casp9; Cdkn2a; Bak1; Uaca; Bax","thymus","RR-6","GLDS-244"
"REACTOME_AQUAPORIN_MEDIATED_TRANSPORT",0.00762488260781266,0.0219166497522,0.407017918923954,-0.397835897588096,-1.71449982477677,49,"reactome","Adcy4; Adcy9; Gnas; Adcy7; Gnb1; Prkaca; Gng11; Aqp1; Gng7; Adcy8; Aqp5; Myo5b; Adcy5; Gnb2; Gnb5; Adcy3; Gng2; Aqp2; Aqp7; Prkar2a; Gng13; Gng4; Adcy2; Avp; Aqp3; Adcy6; Gng8; Aqp4; Gng12; Gnb3; Prkar1b","thymus","RR-6","GLDS-244"
"REACTOME_ARACHIDONATE_METABOLISM",4.21523692956076e-09,9.45056119607522e-08,0.761460801445585,-0.586772227092373,-2.6299694094445,56,"reactome","Alox15; Dpep2; Alox5ap; Alox5; Alox12; Ltc4s; Cyp4f18; Ptgs1; Dpep1; Ptgis; Mapkapk2; Gpx1; Alox8; Ggt1; Ptges; Slc27a1; Tbxas1; Cbr1; Abcc1; Ggt5; Gpx4; Ptges2; Ptgds; Cyp4b1; Cyp2j9; Cyp1a1; Cyp2u1; Cyp4f15; Ephx2; Pon3; Pon1; Pla2g4a; Akr1c18","thymus","RR-6","GLDS-244"
"REACTOME_ASPARAGINE_N_LINKED_GLYCOSYLATION",1.2961564613993e-08,2.46269727665867e-07,0.747739663149885,-0.321253292767695,-1.89697637153165,305,"reactome","Tubb1; St3gal1; St8sia2; Kdelr1; Fuca1; St6galnac4; B4galt5; Mgat4b; F5; Tmed3; Capzb; St3gal4; Nagk; Gmppa; Mlec; Dhdds; St6galnac2; Ctsz; Gorasp1; Cog7; Alg9; Dpagt1; Man1c1; Rab1b; St3gal2; Tubb6; Ddost; Sec16b; Sptbn1; Fuom; Copz1; St3gal3; Sptbn5; Trappc2l; Hk1; Trappc3; Tubb4b; Dolk; Alg3; Arfgap3; B4galt2; Spta1; Ubc; Rnf185; Alg1; Dad1; Gne; B4galt1; Kdelr2; Tbc1d20; Pmm1; Gosr2; Glb1; Arf1; Mcfd2; Bet1l; Lman2; Sptan1; Napa; Gfpt2; Ank1; Rpn1; Cog4; Kdelr3; B4galt4; St3gal5; Dynll2; Copz2; Ctsa; Mpi; Renbp; Trappc10; Derl1; Trappc1; St6galnac6; Gmppb; Os9; Alg12; Trappc9; Stx17; Man2a2; Golgb1; Mgat3; Ubb; Tmem115; Mpdu1; Rpn2; Dctn2; Tuba4a; Uap1; Serpina1b; Dctn3; Trappc6a; Tgfa; Rft1; Nudt14; Tuba8; Trappc4; Syvn1; Sptb; Sec16a; Amdhd2; Dync1h1; Uba52; Dpm2; Tmed10; Areg; Edem2; Cope; Ubxn1; St8sia6; Prkcsh; St6galnac3; Sec13; Folr1; Cog2; Serpina1e; Cd59b; B4galt6; Gria1; St8sia5; Golga2; Dctn1; Neu1; Tuba1c; Dpm3; Tuba1a; Tmed9; Sec24d; Vcp; Srd5a3; Stt3b","thymus","RR-6","GLDS-244"
"REACTOME_ASPIRIN_ADME",0.125560538116592,0.197410046604067,0.188204146308491,-0.32459043467331,-1.28067973705881,34,"reactome","Cyp2d22; Bsg; Slco2b1; Cyp2e1; Acsm5; Ugt1a6b; Ugt1a7c; Ces1d","thymus","RR-6","GLDS-244"
"REACTOME_ASSEMBLY_AND_CELL_SURFACE_PRESENTATION_OF_NMDA_RECEPTORS",0.159192825112108,0.237623378096768,0.165656695205483,-0.303608616420168,-1.23927664964831,39,"reactome","Tubb1; Tubb6; Tubb4b; Camk2b; Grin2d; Actn2; Tuba4a; Kif17; Tuba8; Cask; Nbea; Tuba1c; Tuba1a; Tuba1b; Lin7b; Tubb4a; Tubb2a; Grin2c; Camk2a","thymus","RR-6","GLDS-244"
"REACTOME_ASSEMBLY_OF_ACTIVE_LPL_AND_LIPC_LIPASE_COMPLEXES",0.00980751958464766,0.0270128487822851,0.380730400722792,-0.540796045908484,-1.77979366154362,19,"reactome","Furin; Cidec; Gpihbp1; Angptl4; Lmf1; Pcsk6; Apoa5; Pcsk5; Apoc2; Lipc; Angptl8; Lmf2","thymus","RR-6","GLDS-244"
"REACTOME_ASSEMBLY_OF_COLLAGEN_FIBRILS_AND_OTHER_MULTIMERIC_STRUCTURES",6.15707921364666e-11,1.97202451385655e-09,0.839088935621274,-0.603837008691642,-2.7293637361459,60,"reactome","Loxl2; Bmp1; Pcolce; Cd151; Dst; Loxl1; Col6a1; Col6a3; Col4a2; Col6a2; Pxdn; Col4a1; Col5a1; Ctsb; Plec; Col8a2; Col1a1; Loxl4; Col4a3; Loxl3; Col5a3; Col4a5; Mmp3; Col15a1; Col5a2; Col1a2; Col9a2; Itgb4; Col4a4; Col4a6; Col18a1; Tll1; Col3a1; Col14a1","thymus","RR-6","GLDS-244"
"REACTOME_ASSEMBLY_OF_THE_HIV_VIRION",0.206593406593407,0.289127601487152,0.142056643575821,-0.388185109483177,-1.23873756778123,16,"reactome","Furin; Vps28; Ubc; Vps37d; Ubb; Mvb12a; Vps37c; Uba52","thymus","RR-6","GLDS-244"
"REACTOME_ASSEMBLY_OF_THE_ORC_COMPLEX_AT_THE_ORIGIN_OF_REPLICATION",0.0178850489049351,0.0430239051983525,0.352487857583619,0.373151133585846,1.55234443892796,51,"reactome","Orc4; Orc3; Orc5; H2bc21; H3f3b; Orc6; Orc2; Kpna1; Orc1; Kpnb1","thymus","RR-6","GLDS-244"
