"pathway","pval","padj","log2err","ES","NES","size","db","leadingEdge_str","tissue","mission","glds"
"REACTOME_RHO_GTPASES_ACTIVATE_PKNS",0.853492333901193,0.87296068093361,0.0455878202571231,0.175237078459501,0.808698844194523,87,"reactome","Kdm4c; Pdpk1; Kdm1a; Pkn2; Ppp1r12a; H2bc21; H3f3b","thymus","RR-6","GLDS-244"
"REACTOME_RHO_GTPASES_ACTIVATE_ROCKS",0.00804929717695411,0.0229016805466131,0.380730400722792,-0.547250947185978,-1.80103714597087,19,"reactome","Rhoc; Myl6; Myl12b; Ppp1r12b; Myh9; Myh10; Myl9; Myh14; Myh11; Rhob; Limk1","thymus","RR-6","GLDS-244"
"REACTOME_RHO_GTPASES_ACTIVATE_WASPS_AND_WAVES",0.837053571428571,0.858909410673124,0.0589694466690997,-0.193652276858802,-0.773713265943343,36,"reactome","Mapk3; Wipf3; Wasf1; Actg1; Arpc1a; Cyfip1; Nckipsd; Arpc1b; Wasf3; Baiap2; Rac1; Arpc4; Arpc3; Btk; Brk1; Nckap1","thymus","RR-6","GLDS-244"
"REACTOME_RHO_GTPASE_CYCLE",1.27618224451093e-08,2.46269727665867e-07,0.747739663149885,-0.292354579074663,-1.78398420722304,444,"reactome","Dock6; Arap3; Plxna1; Farp1; Dlg5; Kalrn; Dock5; Vim; Tjp2; Dnmbp; Arhgap31; Capzb; Arhgap44; Plekhg3; Cdc42ep2; Fgd2; Slc1a5; Src; Syde1; Esyt1; Mtx1; Cdc42ep5; Ncf4; Cdc42ep1; Pard6b; Rhoc; Dst; Pld2; Plekhg5; Arhgap23; Nudc; Samm50; Cdc42bpb; Prag1; Ncf2; Arhgef15; Syde2; Arhgef40; Pkp4; Hint2; Mcam; Wipf3; Ptpn13; Arhgef17; Arhgef5; Hgs; Sptbn1; Arhgef25; Stard8; Wasf1; Rhobtb1; Arhgap35; Fgd1; Ddrgk1; Cdc42ep4; Steap3; Efhd2; Vangl1; Dock9; Stard13; Gps1; Rhpn2; Stk10; Mcf2l; Trip10; Arfgap3; Actg1; Arhgap39; Rhod; Arhgef10; Tnfaip1; Fgd5; Arhgef12; Pik3r2; Add3; Plxnb1; Rhoj; Rab7; Pkn3; Baiap2l2; Noxa1; Ckb; Rasgrf2; Arhgap32; Jag1; Sptan1; Sh3pxd2a; Bcr; Arhgef19; Arhgap28; Dbn1; Flot2; Cavin1; Amigo2; Lamtor1; Ncf1; Flot1; Dlc1; Rhou; Ckap4; Tex2; Rnd2; Farp2; Cyfip1; Arhgdia; Epha2; Noxo1; Dock3; Letm1; Ubxn11; Rhob; Itsn1; Ndufs3; Arhgef3; Sema4f; Arhgap22; Trio; Atp6ap1; Stom; Rapgef1; Rhof; Frs3; Stbd1; Dock1; Nipsnap2; Jup; Hmox2; Arhgef10l; Ccdc187; Arap1; Pde5a; Arhgef28; Pcdh7; Rtkn; Rasal2; Ngef; Fermt2; Rhpn1; Git1; Pld1; Cdc37; Chn1; Filip1; Elmo2; Cav1; Akap12; Grb7; Hsp90ab1; Arhgef9; Tiam2; Wasf3; Srgap1; Pard6a; Arhgap6; Arhgap10; Arhgap29; Arhgap21; Baiap2l1; Csk; Ndufa5; Obscn; Cpd; Rac3; Tpm4; Arhgdig; Fam13a; Bcap31; Ophn1; Shmt2; Rhog; Golga2; Uaca; Chn2; Iqgap1; Myo6; Vcp; Wdr81; Dsg2; Baiap2; Tuba1b; Actc1; Muc13; Whamm; Map3k11; Wdr6; Pak4; Plekhg6; Cyba; Cybb","thymus","RR-6","GLDS-244"
"REACTOME_RHO_GTPASE_EFFECTORS",0.00566123775846024,0.0172452378457444,0.407017918923954,0.248197475713271,1.38486681501504,309,"reactome","Cdkn1b; Kdm4c; Kif5b; Rock1; Pdpk1; Kdm1a; Pkn2; Scai; Abi1; Cenpq; Ahctf1; Wasl; Mapk1; Ppp2r5e; Ppp1r12a; Ska2; Ranbp2; H2bc21; Dync1i2; H3f3b; Cenpk; Ppp2r5c; Nup107; Seh1l; Ppp2ca; Clasp1; Ktn1; Fmnl2; Mad2l1; Itgb3bp; Nup160; Dync1li1; Mis12; Ckap5; Xpo1; Spc25; Cenpc1; Cenpp; Cenpu; Taok1; Prkcb; Nuf2; Nup98; Gopc; Nox1; Kif18a; Cenpl; Ska1; Bub1; Actr3; Cenph; Cenpi; Zw10; Pak2; Diaph2; Nup37; Pafah1b1; Sgo1; Knl1; Nup43; Ywhae; Mapre1; Arpc5; Prkca; Nck1; Spdl1; Sgo2a; Pik3c3; Ercc6l; Wasf2; Kif2a; Ndc80; Zwilch; Wipf1; Dync1i1; Clasp2; Ywhaz; Kntc1; Cenpf","thymus","RR-6","GLDS-244"
"REACTOME_RIPK1_MEDIATED_REGULATED_NECROSIS",0.106498194945848,0.175050552103073,0.183023938384487,0.356932210788036,1.31576275333634,31,"reactome","Fas; Itch; Ogt; Peli1; Cflar; Xiap; Pdcd6ip","thymus","RR-6","GLDS-244"
"REACTOME_RIP_MEDIATED_NFKB_ACTIVATION_VIA_ZBP1",0.287581699346405,0.376171627733162,0.117249716749792,-0.348054342802965,-1.13564370740007,17,"reactome","Myd88; Ticam1; Rela; Nkiras2; Nfkb2; Nfkbib","thymus","RR-6","GLDS-244"
"REACTOME_RMTS_METHYLATE_HISTONE_ARGININES",0.666095890410959,0.719357893208752,0.0572461135202884,0.203738489687467,0.898934139511145,68,"reactome","Prmt6; Smarce1; Pbrm1; Arid2; Wdr77; Actl6a","thymus","RR-6","GLDS-244"
"REACTOME_RNA_POLYMERASE_III_CHAIN_ELONGATION",0.601769911504425,0.663792869288396,0.0747385227439092,-0.27673452701336,-0.907356907413165,18,"reactome","Polr3d; Polr2l; Polr3e; Polr2f; Polr2e; Polr1c; Polr3h","thymus","RR-6","GLDS-244"
"REACTOME_RNA_POLYMERASE_III_TRANSCRIPTION",0.142599277978339,0.217488150494855,0.156312403073186,0.318216179921965,1.24977037633586,41,"reactome","Gtf3c3; Tbp; Bdp1; Polr3k; Snapc3; Snapc1; Polr3f; Ssb; Pou2f1; Polr2k; Zfp143; Gtf3c2; Polr3b; Brf1; Polr3a; Polr3g; Gtf3c4","thymus","RR-6","GLDS-244"
"REACTOME_RNA_POLYMERASE_III_TRANSCRIPTION_INITIATION_FROM_TYPE_1_PROMOTER",0.162748643761302,0.24164401278996,0.14551614609036,0.347800572318414,1.26134374613215,28,"reactome","Gtf3c3; Tbp; Bdp1; Polr3k; Polr3f; Polr2k; Gtf3c2; Polr3b; Brf1; Polr3a; Polr3g; Gtf3c4","thymus","RR-6","GLDS-244"
"REACTOME_RNA_POLYMERASE_III_TRANSCRIPTION_INITIATION_FROM_TYPE_3_PROMOTER",0.10126582278481,0.168120960924931,0.188204146308491,0.369180905658199,1.33888228946632,28,"reactome","Tbp; Bdp1; Polr3k; Snapc3; Snapc1; Polr3f; Pou2f1; Polr2k; Zfp143; Polr3b; Polr3a; Polr3g","thymus","RR-6","GLDS-244"
"REACTOME_RNA_POLYMERASE_III_TRANSCRIPTION_TERMINATION",0.302325581395349,0.389548249131248,0.118287526124085,-0.318416131047292,-1.11104476453846,23,"reactome","Polr3d; Nfix; Nfic; Polr2l; Polr3e; Nfia; Polr2f; Polr2e; Polr1c; Polr3h","thymus","RR-6","GLDS-244"
"REACTOME_RNA_POLYMERASE_II_PRE_TRANSCRIPTION_EVENTS",3.3956520630129e-06,3.09473655498981e-05,0.627256739718528,0.472723311311594,2.13375122116184,78,"reactome","Tbp; Ccnt1; Gtf2h2; Gtf2a2; Cdk7; Taf7; Ccnh; Taf2; Ccnt2; Ctr9; Iws1; Taf9; Gtf2e2; Taf15; Mllt3; Eaf1; Taf5; Rtf1; Gtf2h1; Cdc73; Taf1; Polr2k; Supt16; Gtf2f2; Ncbp1; Leo1; Taf3; Ncbp2; Gtf2b; Eloc; Taf13; Ccnk","thymus","RR-6","GLDS-244"
"REACTOME_RNA_POLYMERASE_II_TRANSCRIBES_SNRNA_GENES",1.46372701309848e-06,1.49167089243945e-05,0.643551836150722,0.483655896599529,2.17513106490185,74,"reactome","Nabp1; Rprd1a; Ice2; Tbp; Snapc3; Ccnt1; Snapc1; Gtf2a2; Cdk7; Pcf11; Ccnt2; Ints13; Ints8; Ints6; Taf9; Ints2; Gtf2e2; Taf5; Rprd2; Sp1; Pou2f1; Ints12; Rpap2; Polr2k; Gtf2f2; Ncbp1; Ncbp2; Gtf2b; Taf13; Ccnk; Zfp143; Ice1; Polr2b; Zc3h8; Ints7","thymus","RR-6","GLDS-244"
"REACTOME_RNA_POLYMERASE_II_TRANSCRIPTION_TERMINATION",1.54858063738197e-09,3.77382368370694e-08,0.788186810800237,0.581565902999983,2.54305893898545,66,"reactome","Thoc2; Srsf11; Thoc1; Chtop; Srsf1; Cstf3; Cdc40; Upf3b; Srsf3; Wdr33; Cpsf6; Pcf11; Srsf6; Zc3h11a; Papola; Fip1l1; Srsf7; Sarnp; Srsf2; Cpsf7; Thoc7; Nudt21; Magoh; Srrm1; Snrpe; Slbp; Clp1; Fyttd1; Srsf5; Ncbp1; Ncbp2; Cstf2; Srsf9","thymus","RR-6","GLDS-244"
"REACTOME_RNA_POLYMERASE_I_PROMOTER_ESCAPE",0.00588204773089999,0.0176776823226244,0.407017918923954,0.352593105705967,1.57849966969085,72,"reactome","Tbp; Gtf2h2; Cdk7; Ccnh; Polr1f; Taf1b; Cbx3; H2bc21; Gtf2h1; H3f3b; Taf1d","thymus","RR-6","GLDS-244"
"REACTOME_RNA_POLYMERASE_I_TRANSCRIPTION",0.0113188836864834,0.0303551880682964,0.380730400722792,0.313559808992831,1.45575099465547,92,"reactome","Tbp; Gtf2h2; Cdk7; Ccnh; Polr1f; Hdac2; Gatad2b; Taf1b; Cbx3; Rbbp4; H2bc21; Gtf2h1; H3f3b; Ercc6; Taf1d; Ttf1; Polr2k","thymus","RR-6","GLDS-244"
"REACTOME_RNA_POLYMERASE_I_TRANSCRIPTION_INITIATION",0.013076590891532,0.0337761714041644,0.380730400722792,0.396737883184003,1.596595913855,46,"reactome","Tbp; Gtf2h2; Cdk7; Ccnh; Polr1f; Hdac2; Gatad2b; Taf1b; Rbbp4; Gtf2h1; Ercc6; Taf1d; Ttf1; Polr2k","thymus","RR-6","GLDS-244"
"REACTOME_RNA_POLYMERASE_I_TRANSCRIPTION_TERMINATION",0.0261281895310031,0.0583728390844429,0.352487857583619,0.43603336511035,1.61050713133632,30,"reactome","Tbp; Gtf2h2; Cdk7; Ccnh; Polr1f; Taf1b; Gtf2h1; Taf1d; Ttf1; Polr2k","thymus","RR-6","GLDS-244"
"REACTOME_RND1_GTPASE_CYCLE",0.0715883668903803,0.131128364843327,0.252961123069611,-0.32309191014516,-1.34977270706131,42,"reactome","Plxna1; Dlg5; Dst; Plekhg5; Pkp4; Ptpn13; Arhgap35; Vangl1; Pik3r2; Flot2; Epha2; Ubxn11; Frs3; Rasal2; Cav1; Grb7","thymus","RR-6","GLDS-244"
"REACTOME_RND2_GTPASE_CYCLE",0.0615510383637952,0.117665921937284,0.321775918075361,-0.347014001602485,-1.449711409118,42,"reactome","Dlg5; Dst; Nudc; Prag1; Pkp4; Ptpn13; Arhgap35; Vangl1; Tnfaip1; Pik3r2; Ckap4; Rnd2; Epha2; Ubxn11; Frs3","thymus","RR-6","GLDS-244"
"REACTOME_RND3_GTPASE_CYCLE",0.0353165276446614,0.0751261459478586,0.321775918075361,-0.365314713409049,-1.5261658189644,42,"reactome","Dlg5; Dst; Plekhg5; Pkp4; Ptpn13; Arhgap35; Vangl1; Tnfaip1; Pik3r2; Ckb; Flot2; Ckap4; Epha2; Ubxn11; Sema4f; Rasal2; Cav1; Arhgap21; Cpd; Muc13; Wdr6","thymus","RR-6","GLDS-244"
"REACTOME_ROLE_OF_LAT2_NTAL_LAB_ON_CALCIUM_MOBILIZATION",0.00330900389124376,0.0110071019646417,0.431707695803346,-0.384223357603361,-1.70457561733756,54,"reactome","Igkv8-21; Igkv17-121; Shc1; Gab2; Igkv9-120; Fcer1a; Pik3r2; Ighv1-62-3; Syk; Igkv13-84; Pik3cb; Igkv8-28; Lyn; Igkv1-99; Lat2; Igkv2-109; Iglc3; Igkv14-100; Iglc1; Igkv12-41; Fcer1g; Ms4a2; Igkv12-98; Igkv1-135; Igkv1-132; Igkv18-36; Igkv12-38; Ighv8-6; Ighv8-4; Igkv13-85","thymus","RR-6","GLDS-244"
"REACTOME_ROLE_OF_PHOSPHOLIPIDS_IN_PHAGOCYTOSIS",0.000358490799986414,0.00170283129993547,0.49849310876659,-0.411090293539422,-1.89770735417249,65,"reactome","Igkv8-21; Pld4; Igkv17-121; Pld2; Igkv9-120; Plcg2; Pik3r2; Ighv1-62-3; Syk; Itpr3; Ighg3; Prkce; Igkv13-84; Pik3cb; Igkv8-28; Igkv1-99; Pld1; Igkv2-109; Fcgr2b; Iglc3; Igkv14-100; Pla2g6; Iglc1; Fcgr4; Igkv12-41; Fcgr1; Igkv12-98; Igkv1-135; Igkv1-132; Igkv18-36; Ighg2c; Igkv12-38; Ighv8-6; Ighv8-4; Igkv13-85; Iglc2; Pld3; Igkv8-27; Igkv14-126","thymus","RR-6","GLDS-244"
"REACTOME_RORA_B_C_AND_NR1D1_REV_ERBA_REGULATE_GENE_EXPRESSION",0.176785714285714,0.256705680977054,0.138022242496643,0.348581068806427,1.24347727828259,26,"reactome","Ncor1; Tgs1; Med1; Nrip1; Ncoa6; Crebbp; Ep300; Tbl1xr1","thymus","RR-6","GLDS-244"
"REACTOME_ROS_AND_RNS_PRODUCTION_IN_PHAGOCYTES",0.00183155643405909,0.00679859192907366,0.45505986738723,-0.468496453364926,-1.87181853420782,36,"reactome","Ncf4; Slc11a1; Ncf2; Atp6v0d1; Hvcn1; Nos3; Ncf1; Atp6v0c; Atp6v0e; Atp6v1f; Atp6v0b; Atp6v0e2; Nos1; Atp6v1b1; Atp6v0a1; Atp6v1c2; Cyba; Cybb; Nos2; Tcirg1","thymus","RR-6","GLDS-244"
"REACTOME_RRNA_MODIFICATION_IN_THE_NUCLEUS_AND_CYTOSOL",0.308900523560209,0.395745699326851,0.0985499803531691,0.25594625799371,1.09574832182573,59,"reactome","Ddx47; Utp25; Dcaf13; Utp15; Nop58; Utp3; Wdr43; Ddx52; Snu13; Mphosph10; Dimt1; Nop56; Utp18; Wdr75; Dkc1; Nol11; Bms1; Utp11; Krr1","thymus","RR-6","GLDS-244"
"REACTOME_RRNA_PROCESSING",0.651757188498403,0.705912858267352,0.0550211117163117,0.175340722146261,0.923993597558163,191,"reactome","Wdr12; Tex10; Riok1; Ddx47; Mtrex; Utp25; Riok3; Dcaf13; Xrn2; Ncl; Eri1; Dis3; Exosc3; Rbm28; Isg20l2; Gnl3; Utp15; Nop58; Utp3; Wdr43; Senp3; Trmt10c; Ddx52; Snu13; Mphosph10; Dimt1; Nop56; Utp18; Wdr75; Rpp30; Exosc8; Dkc1; C1d; Exosc9","thymus","RR-6","GLDS-244"
"REACTOME_RSV_HOST_INTERACTIONS",0.277966101694915,0.366588235294118,0.103197466945307,0.239905701286225,1.09679205358134,82,"reactome","Cdk8; Arih1; Med14; Med1; Med13; Med23; Med31; Med30; Crebbp; Ep300; Med6; Ccnc; Ifnar1; Med17; Cdk19; Med7; Cul5; Med19; Gpc5; Eloc; Med21; Rbx1; Med4","thymus","RR-6","GLDS-244"
"REACTOME_RUNX1_INTERACTS_WITH_CO_FACTORS_WHOSE_PRECISE_EFFECT_ON_RUNX1_TARGETS_IS_NOT_KNOWN",0.00211208210979971,0.00754365359841023,0.431707695803346,0.483925530848689,1.85924574138933,36,"reactome","Rnf2; Pcgf5; Smarce1; Pbrm1; Arid2; Csnk2a1; Phc3; Cbfb; Actl6a; Csnk2a2; Ep300; Smarcc1; Runx1","thymus","RR-6","GLDS-244"
"REACTOME_RUNX1_REGULATES_GENES_INVOLVED_IN_MEGAKARYOCYTE_DIFFERENTIATION_AND_PLATELET_FUNCTION",0.120068610634648,0.191802651708312,0.166933848713193,0.272799458519001,1.23134646381661,78,"reactome","Prmt6; Ago3; Rbbp5; Tnrc6a; Kmt2c; Tnrc6b; H2bc21; Kmt2a; Cbfb; H3f3b; Ep300; Ash2l; Prkcq","thymus","RR-6","GLDS-244"
"REACTOME_RUNX1_REGULATES_TRANSCRIPTION_OF_GENES_INVOLVED_IN_DIFFERENTIATION_OF_HSCS",0.736752136752137,0.772590407202194,0.0524827622635459,0.183684202817339,0.865168769827202,99,"reactome","Itch; Cdk7; Ccnh; Tcf12; Psmc6; H2bc21; Kmt2a; Cbfb; H3f3b; Psmd14; Myb; Gata3","thymus","RR-6","GLDS-244"
"REACTOME_RUNX2_REGULATES_BONE_DEVELOPMENT",0.142528735632184,0.217488150494855,0.178219874951973,-0.321338882642567,-1.26053614221246,33,"reactome","Mapk3; Src; Yap1; Smad6; Zfp521; Gli2; Col1a1; Hdac6; Wwtr1; Hes1","thymus","RR-6","GLDS-244"
"REACTOME_RUNX2_REGULATES_OSTEOBLAST_DIFFERENTIATION",0.221719457013575,0.306470420853535,0.13880510939114,-0.327042200842539,-1.19971218299834,26,"reactome","Mapk3; Src; Yap1; Zfp521; Col1a1; Hdac6; Wwtr1; Hes1; Ar; Hey1; Gli3; Ucma; Satb2","thymus","RR-6","GLDS-244"
"REACTOME_SARS_COV_1_ACTIVATES_MODULATES_INNATE_IMMUNE_RESPONSES",0.290249433106576,0.378336761061014,0.119348440591015,-0.267207066487903,-1.09101983430705,40,"reactome","Nlrp3; Irak2; Mavs; Rela; Ubc; Bst2; Sting1; Ppib; Sftpd; Ubb; Traf3; Rcan3; Uba52","thymus","RR-6","GLDS-244"
"REACTOME_SARS_COV_1_HOST_INTERACTIONS",0.894736842105263,0.906052393857272,0.0432768714901103,0.166507945322297,0.777911446286358,94,"reactome","Pdpk1; Itch; Tbk1; Traf6; Smad4; Ppig; Psmc6; Sp1; Ep300; Npm1; Hnrnpa1; Ppih; Tomm70a; Runx1; Ywhae; Ywhaz; Kpnb1; Kpna2; Rps27a; Fkbp1a; Pals1; Sike1; Nmi; Ube2i","thymus","RR-6","GLDS-244"
"REACTOME_SARS_COV_1_INFECTION",0.402010050251256,0.482498143824045,0.104732821580651,-0.192960785950053,-1.01732470122672,138,"reactome","St3gal1; Nlrp3; St6galnac4; St3gal4; Parp16; Irak2; St6galnac2; Mavs; Rela; St3gal2; Chmp2a; St3gal3; Map1lc3b; Chmp4b; Ubc; Bst2; Sting1; Chmp7; Ppib; Serpine1; Rps5; Tmprss2; Sftpd; Ubb; Rps28; Traf3; Eef1a1; Rcan3; Rps29; Chmp6; Cav1; Uba52; Rps2; Rps19; Prkcsh; Ywhag; St6galnac3; Becn1; Rps15; Rpsa","thymus","RR-6","GLDS-244"
"REACTOME_SARS_COV_1_MODULATES_HOST_TRANSLATION_MACHINERY",0.07847533632287,0.138755287094538,0.241339976815091,-0.345777456416768,-1.36427366508931,34,"reactome","Rps5; Rps28; Eef1a1; Rps29; Rps2; Rps19; Rps15; Rpsa; Rps26; Rps4x; Rps18; Rps9; Fau; Rps14; Rps10; Rps17; Rps20; Rps11; Rps16","thymus","RR-6","GLDS-244"
"REACTOME_SARS_COV_1_TARGETS_HOST_INTRACELLULAR_SIGNALLING_AND_REGULATORY_PATHWAYS",0.0548446069469835,0.108240852795015,0.261663521711573,0.478347785428513,1.5027212431714,16,"reactome","Pdpk1; Smad4; Psmc6; Sp1; Ep300; Ywhae; Ywhaz","thymus","RR-6","GLDS-244"
"REACTOME_SARS_COV_2_ACTIVATES_MODULATES_INNATE_AND_ADAPTIVE_IMMUNE_RESPONSES",0.222961730449251,0.307429397089312,0.116234148779716,0.233008636630847,1.1237394061185,110,"reactome","Tbk1; Chuk; Map3k7; Traf6; Tab2; Nup88; Tpr; Ranbp2; Nup107; Nup153; Seh1l; Nup155; Nup160; Crebbp; Tab3; Ifnar1; H2-Q1; Nup35; Nup98; H2-Q2; Tomm70a; Nup37; G3bp2; Nup214; Nup43; Ube2n; Pik3c3; Sec24a; Kpna2; Cnbp; Nup54; Hsp90aa1","thymus","RR-6","GLDS-244"
"REACTOME_SARS_COV_2_HOST_INTERACTIONS",0.369426751592357,0.452104135955275,0.083129129135339,0.198653206843912,1.04083812067379,184,"reactome","Pdpk1; Tbk1; Chuk; Map3k7; Patj; Traf6; Tab2; Nup88; Tpr; Ranbp2; Snrpd1; Nup107; Nup153; Seh1l; Smn1; Uvrag; Snrpe; Nup155; Ddx20; Nup160; Crebbp; Tab3; Ifnar1; H2-Q1; Nup35; Vps45; Nup98; H2-Q2; Gemin2; Tomm70a; Nup37; Gemin6; G3bp2; Nup214; Nup43; Ywhae","thymus","RR-6","GLDS-244"
"REACTOME_SARS_COV_2_INFECTION",0.132564841498559,0.206525815726966,0.208955027549354,-0.197626911068269,-1.15598265710621,281,"reactome","St3gal1; Nlrp3; Agrn; St6galnac4; Mgat4b; Furin; Ptpn11; St3gal4; Parp16; Sdc3; Irak2; Nod1; Akt2; St6galnac2; Ano10; Iscu; Mavs; Tufm; H2-D1; Gpc3; Zdhhc3; St3gal2; Irak1; Ddost; Nod2; Chmp2a; St3gal3; Map1lc3b; Il17rc; Chmp4b; Gpc4; Ubc; Dad1; Sting1; Ano1; Chmp7; Rpn1; Hspg2; Rnf135; Vps33a; Sdc1; Tjp1; Rps5; Tmprss2; Vps11; Gemin4; Sftpd; Irf7; Ubb; Rps28; Akt1; Crb3; Rpn2; H2-T23; Masp1; Vps18; Traf3; Ube2v1; Gpc6; Gpc1; Rps29; Nrp1; H2-M3; Chmp6; Cav1; Hsp90ab1; Uba52; Gemin7; Rps2; Edem2; Rps19; Tlr2; Isg15; Snrpb; Prkcsh; Ywhag; St6galnac3; Prmt1; Becn1; Sec13; Sdc2; Sdc4; Ptpn6; Rps15; Rpsa","thymus","RR-6","GLDS-244"
"REACTOME_SARS_COV_2_MODULATES_HOST_TRANSLATION_MACHINERY",0.970786516853933,0.974262923360124,0.0523759084097997,-0.156357142119262,-0.671886394785584,47,"reactome","Rps5; Gemin4; Rps28; Rps29; Gemin7; Rps2; Rps19; Snrpb; Rps15; Rpsa; Rps26; Rps4x; Rps18; Rps9; Snrpd2; Fau; Rps14","thymus","RR-6","GLDS-244"
"REACTOME_SARS_COV_INFECTIONS",0.0298738116303258,0.065311725869322,0.352487857583619,-0.198285409223077,-1.21026450286441,434,"reactome","St3gal1; Nlrp3; Agrn; Igkv8-21; St6galnac4; Mgat4b; Ap2a1; Furin; Igkv17-121; Ptpn11; St3gal4; Parp16; Sdc3; Irak2; Nod1; Akt2; St6galnac2; Ano10; Iscu; Il6ra; Mavs; Tufm; H2-D1; Gpc3; Ap2m1; Igkv9-120; Rela; Zdhhc3; St3gal2; Irak1; Ddost; Nod2; Chmp2a; St3gal3; Jak3; Plcg2; Tlr9; Map1lc3b; Il17rc; Comt; Sigmar1; Chmp4b; Gpc4; Ubc; Dad1; Bst2; Sting1; Ighm; Ano1; Ifngr2; Sap30l; Vegfa; Ighv1-62-3; Chmp7; Cd79a; Rpn1; Cd79b; Hspg2; Rnf135; Ppib; Atp1a1; Serpine1; Vps33a; Sdc1; Syk; Fkbp4; Atp1b2; Tjp1; Rps5; Tmprss2; Suds3; Vps11; Gemin4; Sftpd; Irf7; Ubb; Rps28; Ap2a2; Atp1a3; Igkv13-84; Akt1; Crb3; Rpn2; Chd3; S1pr1; Gatad2a; H2-T23; Masp1; Vps18; Traf3; Igkv8-28; Ube2v1; Gpc6; Gpc1; Eef1a1; Rcan3; Rps29; Igkv1-99; Nrp1; H2-M3; Ap2b1; Impdh2; Chmp6; Cav1; Hsp90ab1; Igkv2-109; Uba52; Gemin7; Fxyd1; Mbd3; Rps2; Edem2; Hmg20b; Brms1; Rps19; Tlr2; Isg15; Snrpb; Prkcsh; Ywhag; St6galnac3; Prmt1; Becn1; Sec13; Atp1a2; Iglc3; Sdc2; Sdc4; Igkv14-100; Ptpn6; Rps15; Rpsa; Nfe2l2; Ap2s1; Fxyd3; Keap1","thymus","RR-6","GLDS-244"
"REACTOME_SCAVENGING_BY_CLASS_A_RECEPTORS",1.20784023193651e-05,9.02659266667218e-05,0.593325476396405,-0.695681999686847,-2.28953303719637,19,"reactome","Fth1; Apoe; Col4a2; Ftl1; Col4a1; Col1a1; Msr1; Col1a2; Colec11; Colec12; Masp1; Col3a1; Scara5; Marco; Apoa1; Calr; Scgb3a2","thymus","RR-6","GLDS-244"
"REACTOME_SCAVENGING_OF_HEME_FROM_PLASMA",3.58388701004615e-06,3.21967705539494e-05,0.627256739718528,-0.520352035633183,-2.25597895348261,50,"reactome","Igkv8-21; Igkv17-121; Lrp1; Igkv9-120; Hba-a2; Hbb-bt; Hba-a1; Apol9a; Hp; Ighv1-62-3; Igkv13-84; Igkv8-28; Igkv1-99; Igkv2-109; Cd163; Iglc3; Igkv14-100; Hpx; Iglc1; Apoa1; Igha; Igkv12-41; Igkv12-98; Igkv1-135; Igkv1-132; Igkv18-36; Igkv12-38; Ambp; Ighv8-6; Alb; Ighv8-4; Igkv13-85; Iglc2; Igkv8-27; Igkv14-126","thymus","RR-6","GLDS-244"
"REACTOME_SCF_BETA_TRCP_MEDIATED_DEGRADATION_OF_EMI1",0.751677852348993,0.785862151440424,0.0642140881844605,-0.201805056042963,-0.843075757209114,42,"reactome","Ubc; Adrm1; Ubb; Psmb5; Psmc5; Psmb2; Psmb6; Psmb3; Uba52; Psmc2; Fzr1; Psmc4; Psmd7; Psmd3; Psmd2; Psmd8","thymus","RR-6","GLDS-244"
"REACTOME_SCF_SKP2_MEDIATED_DEGRADATION_OF_P27_P21",0.96545768566494,0.970652973659549,0.0405756447890657,0.159619308117175,0.664787160109344,50,"reactome","Cdkn1b; Psmc6; Ccne2; Psmd14; Skp1; Skp2; Ccna2; Cdk2; Psmd6; Psma3; Psma6; Ccne1; Rps27a","thymus","RR-6","GLDS-244"
"REACTOME_SEALING_OF_THE_NUCLEAR_ENVELOPE_NE_BY_ESCRT_III",0.0235242944936346,0.0542607698093918,0.352487857583619,-0.436581359652425,-1.60154247585061,26,"reactome","Tubb1; Tubb6; Chmp2a; Tubb4b; Chmp4b; Chmp7; Vps4a; Tuba4a; Tuba8; Chmp6; Tuba1c; Tuba1a; Tuba1b; Tubb4a; Tubb2a","thymus","RR-6","GLDS-244"
"REACTOME_SELECTIVE_AUTOPHAGY",0.00468521415653243,0.0147118349284954,0.407017918923954,-0.331995352238233,-1.60596226865382,83,"reactome","Tubb1; Vim; Prkag3; Src; Plin3; Epas1; Tubb6; Prkab1; Tomm6; Tubb4b; Map1lc3b; Mfn2; Ubc; Plin2; Map1lc3a; Hdac6; Park7; Pink1; Dynll2; Sqstm1; Ubb; Prkag1; Optn; Tuba4a; Ube2v1; Tuba8; Pex5; Prkn; Dync1h1; Uba52; Tomm40; Csnk2b; Tomm7; Hspa8; Tuba1c; Vdac1; Tuba1a; Vcp; Atg9a; Tuba1b","thymus","RR-6","GLDS-244"
"REACTOME_SELENOAMINO_ACID_METABOLISM",1.23062594016723e-06,1.30144498012026e-05,0.643551836150722,-0.422075588694917,-2.11104915167413,100,"reactome","Inmt; Nnmt; Papss1; Txnrd1; Rpl4; Rpl21; Rps5; Gsr; Sephs2; Scly; Rps28; Mars1; Aimp2; Rpl3; Rpl13; Rplp2; Rps29; Rpl29; Cbs; Rpl18a; Rpl28; Rpl37a; Rplp1; Uba52; Rps2; Rplp0; Rps19; Mat1a; Rpl8; Rpl18; Papss2; Rps15; Rpl7a; Rpsa; Rps26; Rpl19; Rps4x; Rpl38; Rps18; Gnmt; Rpl26; Rpl10a; Rps9; Ahcy; Rpl10; Rpl24; Fau; Rpl36; Rpl27; Rps14; Rpl35; Hnmt; Rpl14; Rps10; Rpl6; Rpl3l","thymus","RR-6","GLDS-244"
"REACTOME_SEMA3A_PAK_DEPENDENT_AXON_REPULSION",0.0813186813186813,0.14288125667436,0.234392647294686,-0.451873591681984,-1.44197389397536,16,"reactome","Plxna1; Fes; Plxna4; Plxna2; Plxna3; Limk1; Nrp1; Hsp90ab1; Rac1; Cfl1; Sema3a","thymus","RR-6","GLDS-244"
"REACTOME_SEMA4D_INDUCED_CELL_MIGRATION_AND_GROWTH_CONE_COLLAPSE",3.39115711560143e-05,0.000217227835805097,0.557332238758646,-0.666210316680149,-2.22535702650104,20,"reactome","Rhoc; Myl6; Myl12b; Arhgef12; Plxnb1; Myh9; Myh10; Myl9; Myh14; Erbb2; Myh11; Rhob; Limk1","thymus","RR-6","GLDS-244"
"REACTOME_SEMA4D_IN_SEMAPHORIN_SIGNALING",2.71563796422594e-05,0.000181204176065314,0.575610261071129,-0.640979540753239,-2.28151038052728,24,"reactome","Rras; Rhoc; Myl6; Myl12b; Arhgap35; Arhgef12; Plxnb1; Myh9; Myh10; Myl9; Myh14; Erbb2; Myh11; Rhob; Limk1","thymus","RR-6","GLDS-244"
"REACTOME_SEMAPHORIN_INTERACTIONS",3.85675182813687e-05,0.000238862917090687,0.557332238758646,-0.448815390228275,-2.06389851629345,64,"reactome","Plxna1; Rras; Fes; Sema4a; Plxna4; Rhoc; Myl6; Dpysl2; Myl12b; Trem2; Arhgap35; Tyrobp; Arhgef12; Plxnb1; Sema5a; Myh9; Myh10; Myl9; Myh14; Erbb2; Plxna2; Dpysl3; Farp2; Myh11; Plxna3; Rhob; Limk1; Cdk5; Sema3e; Plxnb3; Sema6a; Nrp1; Hsp90ab1","thymus","RR-6","GLDS-244"
"REACTOME_SENESCENCE_ASSOCIATED_SECRETORY_PHENOTYPE_SASP",0.857388316151203,0.874551685537305,0.04577044581081,0.173647749038863,0.806187132831132,92,"reactome","Cdkn1b; Anapc4; Ube2d1; Ube2e1; Anapc1; Mapk1; H2bc21; H3f3b; Cdc27; Rps6ka3","thymus","RR-6","GLDS-244"
"REACTOME_SENSORY_PERCEPTION",7.01840658029921e-09,1.48445920311612e-07,0.761460801445585,0.317487436953933,1.8418919209939,450,"reactome","Or4d5; Or4a47; Or51v8; Or51q1; Cnga1; Or9a4; Or2t1; Or2k2; Or5m11b; Or10h5; Metap1; Slc17a8; Scn2b; Or5l13; Or6x1; Or4d11; Grk4; Lrp12; Rdh11; Metap2; Or7e177; Or5v1b; Or4e2; Or2y1g; Or6b2; Tas2r137; Capza1; Or10h28; Or9a2; Gnal; Grk1; Or2a12; Or5b21; Or12d17; Or52h1; Or4x11; Or4a77; Or51s1; Or4k1; Prkcq; Or6a2; Or6c6c; Or52d1; Or4a80; Or4e1; Or6p1; Atp2b1; Or4c35; Or2t47; Gucy2f; Chrna9; Or5k1b; Scn9a; Or10j2; Or5b3; Or10c1; Or4c52; Or2y1; Or4c11; Or7e178; Or2z8; Or9k2; Gucy2e; Myo3a; Or1n2; Or52e8; Or13c25; Or10h1b; Or1e16; Or6c2; Or8i2; Tas2r108; Or2l5; Or2b6; Or10w1; Or52j3; Camkmt; Or1q1; Gpc5; Gnat1; Or1l8; Prkca; Or5au1; Or5h17; Or8b4; Or51d1; Pde6a; Or52b2; Or10a5; Or2y1b; Gngt1; Rlbp1; Mpp1; Or4c12; Or8k3b; Or12d2; Or2ag2b; Or4q3; Or4f6; Or51v14; Or2t6; Or6f1; Or10g6; Or7d9; Nmt2; Or13c3; Or4b1; Or4c10; Rtp1; Or4n4; Or6n2; Or4c15; Or8b3; Or2c1; Or1l4; Or1f19; Or8b8; Sag; Or4f15; Or56a3; Or51b17; Or2y1d; Or2h1; Or56a4; Or4k2; Or10x1; Or52k2; Or4a15; Or51i1; Or56a5; Or10s1; Or5h23; Capza2; Or10g9; Or12d13; Or10j5; Or10ag2; Or51b4; Or3a1c; Or1e33; Or52z1; Or2h2; Or52e5; Rgs9bp; Or8h9; Otogl; Or52l1; Tmie; Or5m9b; Or52e8b; Or2t44; Or5a1; Or10ad1; Or4a39; Or11h23; Vamp2; Or6b3; Pnlip; Or1i2; Or1e34; Or6c65; Or5t16; Or5an1b; Or10a3; Or2d2b; Or1e22; Rtp2; Or4k15; Or10v1; Or4a69; Or8d1b; Or4c3; Or1b1; Rdx; Or1e35; Or10a4; Or8a1b; Or1e17; Or5l14; Or2b2; Scn4b; Or5d18; Or1m1; Or5k1; Cnga2; Or11a4; Pclo; Or14j1; Or2v1; Or13a1; Or1a1; Or2a25; Or5al1; Or6c70; Or2a14; Lrp8; Or1e30; Or4d10; Or13d1; Or2w1; Tmc2; Or52n2; Or56b35; Or4k5; Or51f1; Or2ag1; Or6c3; Myo3b; Or2m13; Rdh1; Or12d12; Rpe65; Or52e4; Or10j3b; Or6n1; Whrn; Plcb2; Or2m12; Or2f2; Or10p1; Or51a7; Or1p1c; Or6k6; Or4c11b; Or14c39; Or7g27; Or7c70; Or5h25; Or5d14; Or2a7; Or5m3; Or1e1c; Or8b12; Actb; Or13g1; Awat2; Or6c68; Hsd17b6; Or52r1; Or51g2; Or4c10b; Or51b6","thymus","RR-6","GLDS-244"
"REACTOME_SENSORY_PERCEPTION_OF_TASTE",0.515981735159817,0.58544081489287,0.0845557442441281,-0.24869214008652,-0.951347050546517,30,"reactome","Gnb1; Trpm4; Scnn1b; Itpr3; Scnn1a; Grm4; Grm1; Scnn1g; Scn1b; Gng13; Tas2r126; Trpm5; Gnb3; Otop1; Scn3a; Kcnj2; Tas1r1","thymus","RR-6","GLDS-244"
"REACTOME_SENSORY_PROCESSING_OF_SOUND",0.00464070438698081,0.0146130045443974,0.407017918923954,-0.350922687530077,-1.65975509407808,75,"reactome","Myo1c; Myo7a; Capzb; Gsn; Cacna1d; Cacna2d2; Espn; Ctbp2; Sptbn1; Rab3a; Actg1; Eps8; Epb41l1; Kcnq4; Myh9; Sptan1; Triobp; Cib2; Strc; Eps8l2; Tprn; Cacnb2; Ush1g; Cdh23; Myo15a; Kcnmb1; Cask","thymus","RR-6","GLDS-244"
"REACTOME_SENSORY_PROCESSING_OF_SOUND_BY_OUTER_HAIR_CELLS_OF_THE_COCHLEA",0.00110575573547205,0.00436462035022594,0.45505986738723,-0.415278087196546,-1.84104813323011,53,"reactome","Myo1c; Myo7a; Gsn; Espn; Sptbn1; Actg1; Eps8; Epb41l1; Kcnq4; Myh9; Sptan1; Triobp; Cib2; Strc; Eps8l2; Tprn; Ush1g; Cdh23; Myo15a; Kcnmb1; Cask; Atp2b2; Kcnn2","thymus","RR-6","GLDS-244"
"REACTOME_SEPARATION_OF_SISTER_CHROMATIDS",1.4583996709981e-08,2.68010824785061e-07,0.747739663149885,0.41345360275581,2.14874466751909,171,"reactome","Anapc4; Ube2d1; Wapl; Smc3; Cenpq; Ube2e1; Anapc1; Ahctf1; Stag2; Stag1; Pds5a; Ppp2r5e; Pds5b; Psmc6; Ska2; Ranbp2; Dync1i2; Cenpk; Ppp2r5c; Cdc27; Nup107; Seh1l; Ppp2ca; Clasp1; Mad2l1; Itgb3bp; Nup160; Dync1li1; Mis12; Ckap5; Psmd14; Xpo1; Spc25; Cenpc1; Cenpp; Cenpu; Taok1; Nuf2; Nup98; Hdac8; Rad21; Anapc10; Kif18a; Cenpl; Ska1; Bub1; Cenph; Cenpi; Zw10; Nup37; Cdc16; Pafah1b1; Sgo1; Knl1; Nup43; Mapre1; Spdl1; Sgo2a; Ercc6l; Cdc26; Psmd6; Kif2a; Ndc80; Zwilch; Dync1i1; Smc1a; Psma3; Clasp2; Kntc1; Cenpf","thymus","RR-6","GLDS-244"
"REACTOME_SEROTONIN_NEUROTRANSMITTER_RELEASE_CYCLE",0.68141592920354,0.728897096115583,0.0684714904492087,-0.259595676950229,-0.851162061913637,18,"reactome","Stxbp1; Rab3a; Unc13b; Ppfia4","thymus","RR-6","GLDS-244"
"REACTOME_SHC1_EVENTS_IN_ERBB2_SIGNALING",0.789351851851852,0.820077317818282,0.0635007968065945,-0.228168773618063,-0.784648062116076,22,"reactome","Shc1; Hras; Erbb2; Erbb3; Prkce; Egfr","thymus","RR-6","GLDS-244"
"REACTOME_SHC_MEDIATED_CASCADE_FGFR1",0.507936507936508,0.578067843042462,0.0850427463764322,-0.283579611147095,-0.947247234752143,20,"reactome","Shc1; Fgfr1; Fgf1; Hras; Fgf10; Fgf2","thymus","RR-6","GLDS-244"
