"pathway","pval","padj","log2err","ES","NES","size","db","leadingEdge_str","tissue","mission","glds"
"HALLMARK_UNFOLDED_PROTEIN_RESPONSE",5.42505070166864e-10,4.52087558472387e-09,0.801215574617779,0.518246956309323,2.33269424427028,113,"hallmark","Cks1b; Wipi1; Calr; Slc1a4; Asns; Tubb2a; Pdia6; H2ax; Atf4; Mthfd2; Exosc1; Ero1a; Exosc4; Gosr2; Nolc1; Nhp2; Aldh18a1; Eif4e; Eif4g1; Xpot; Hspa5; Cnot2; Exosc2; Eif4ebp1; Hyou1; Exosc5; Ddit4; Sec31a; Eif4a1; Nabp1; Npm1; Banf1; Kdelr3; Nop56; Atp6v0d1; Yif1a; Lsm4; Chac1; Slc7a5; Pop4; Zbtb17; Eef2; Shc1; Nop14; Arfgap1; Rps14; Srprb; Spcs1; Sdad1; Tars; Imp3; Iars; Cxxc1; Tatdn2; Hsp90b1; Ywhaz; Khsrp; Dkc1; Exosc10; Ddx10; Edc4; Edem1; Psat1; Eif2s1; Ttc37; Preb; Dcp1a; Stc2; Exosc9; Pdia5; Atf6; Eif4a3; Cebpb; Bag3","skin","RR-6","GLDS-243"
"HALLMARK_UV_RESPONSE_DN",0.000207041243308065,0.000739433011814517,0.518848077743792,-0.316069973496356,-1.67509879330807,144,"hallmark","Irs1; Plcb4; Cdon; Adora2b; Tgfbr3; Nr3c1; Add3; Rgs4; Kcnma1; Schip1; Dlc1; Grk5; Plpp3; Nek7; Ptpn21; Cap2; Synj2; Bdnf; Igfbp5; Sfmbt1; Ltbp1; Mgll; Akt3; Efemp1; Cited2; Vldlr; Arhgef9; Ptgfr; Amph; Celf2; Anxa4; Atp2b4; Syne1; Scn8a; Dmac2l; Inpp4b; Map1b; Atp2b1; Rbpms; Nrp1; Pdlim5; Bckdhb; Dyrk1a; Lpar1; Ptprm; Atxn1; Magi2; Met; Nr1d2; Dab2; Pik3cd; Tfpi; Scaf8; Apbb2","skin","RR-6","GLDS-243"
"HALLMARK_UV_RESPONSE_UP",0.000930178304213107,0.00294186933765556,0.477270815362862,0.344569239312392,1.62226378934647,155,"hallmark","Aqp3; Car2; Grpel1; Sigmar1; Il6; Cdkn2b; Ykt6; Asns; Tst; Junb; Pdap1; Ctsl; H2ax; Tuba4a; Ppif; Hmox1; Btg1; Bak1; Psmc3; Atp6v1f; Ccne1; Polr2h; Stip1; Rhob; Hyal2; Hspa2; Ddx21; Casp3; Cdo1; Rrad; Ago2; Rpn1; Pole3; Msx1; Ap2s1; Fen1; Epcam; Tchh; Cdc34; Tmbim6; Fkbp4; Tyro3; Gal; Ret; Tars; Furin; Rxrb; H2-Q2; Bsg; Btg3; Btg2; Mmp14; Dnaja1; Stard3; Dnajb1; Klhdc3; Eif2s3x; Mapk8ip2; Ggh; Prkaca; Acaa1a; Alas1; Arrb2; Nxf1; Cdk2; Kcnh2; Gch1; Rfc4; Grina; Igfbp2; Col2a1; Ppp1r2; Urod; Tfrc; Atp6v1c1; Cxcl1; Clcn2; Wiz; Stk25","skin","RR-6","GLDS-243"
"HALLMARK_WNT_BETA_CATENIN_SIGNALING",0.0141334841919225,0.0294447587331719,0.380730400722792,0.417570956003936,1.56520671048254,41,"hallmark","Csnk1e; Ctnnb1; Nkd1; Ncstn; Skp2; Numb; Trp53; Notch1; Kat2a; Fzd1; Jag1; Wnt5b; Tcf7; Psen2; Lef1; Ncor2; Jag2; Hdac5; Axin1; Maml1; Hdac2; Myc; Hdac11; Cul1; Fzd8","skin","RR-6","GLDS-243"
"HALLMARK_XENOBIOTIC_METABOLISM",0.00950754635528777,0.0226370151316375,0.380730400722792,0.287717507764308,1.41145910517044,201,"hallmark","Fetub; Cyp2e1; Acp1; Cyp2c55; Rbp4; Gsto1; Arpp19; Arg1; Hgfac; Car2; Smox; Asl; Hes6; Pcx; Gart; Ahcy; Slc35b1; Dhrs1; Epha2; Hmox1; Crot; Pycr1; Fah; Ets2; Sertad1; Pgd; Arg2; Cyp2s1; Casp6; Cda; Dcxr; Cyp4f14; Jup; Ttpa; Kars; Lpin2; Gss; Spint2; Cdo1; Atp2a2; Gnmt; Shmt2; Upp1; Ap4b1; Tmbim6; Abhd6; Ptgds; Tkfc; Gclc; Apoe; Nmt1; Npc1; Reg1; Serpine1; Ddt; Ptges3; Cndp2; Lonp1; Fbp1; Hsd17b2; Igfbp4; Nqo1; Enpep; Gsta3; Alas1; Rap1gap; Blvrb; Por; Mt2; Ninj1; Gch1; Gad1; Pemt; Pmm1; Fbln1","skin","RR-6","GLDS-243"
