"pathway","pval","padj","log2err","ES","NES","size","db","leadingEdge_str","tissue","mission","glds"
"HALLMARK_ADIPOGENESIS",0.340153452685422,0.485933503836317,0.0758886900606117,0.216080348284529,1.06062151185403,200,"hallmark","Col15a1; Mrap; Slc25a10; Cdkn2c; Ak2; Grpel1; Retn; Tkt; Aplp2; Tst; Col4a1; Cox6a1; Stom; Pdcd4; Taldo1; Abcb8; Cox8a; Fah; Ndufb7; Bckdha; Nabp1; Pfkl; Mdh2; Agpat3; Acly; Acads; Slc5a6; Hadh; Gpat4; Uqcr11; Slc25a1; Uqcr10; Scarb1; Rab34; Cyc1; Ccng2; Cd151; Baz2a; Ucp2; Apoe; Nmt1; Uqcrq; Esrra; Mgst3; Lpl; Aifm1; Atp1b3; Atp5o; Lpcat3; Ddt; Sdhb","skin","RR-6","GLDS-243"
"HALLMARK_ALLOGRAFT_REJECTION",0.832599118942731,0.849590937696665,0.0946646223153342,-0.162159049400246,-0.891890695386554,197,"hallmark","Il12a; Gbp2; Cxcl9; Tgfb2; Ube2d1; Irf4; Elf4; Fas; H2-M3; Prkcg; Ifngr1; Cd47; Cd2; Trat1; Il7; Ripk2; Ifng; Ccl11; Cxcl13; Hdac9; B2m; Il2ra; Gzmb; Csf1; Rpl3l; Il16; Gzma; Tlr3; H2-Aa; Nck1; Cd28; Cd40lg; Prkcb; Cd86; Galnt1; Cd4; Il2; St8sia4; Pf4; Cd96; Ctss; Itk; Icam1; Ccl5; Il27ra; Stat1; Glmn; Ptprc; Itgb2; Fcgr2b; Stat4; Cd3g; Gpr65; C2; Jak2; Ccr2; Acvr2a; Ly75; Ache; Ptpn6; Was; Tap2; H2-DMb1; Il13; Cd3d; Il15","skin","RR-6","GLDS-243"
"HALLMARK_ANDROGEN_RESPONSE",0.557422969187675,0.648166243241483,0.0561766586307176,0.215230498739819,0.959628312640724,105,"hallmark","Scd2; Insig1; Dbi; Pa2g4; Krt19; H1f0; Ell2; Spdef; Krt8; Pmepa1; Ccnd1; Ube2i; Map7; Hsd17b14; Aldh1a3; Fads1; Adrm1; Akt1; Myl12a; Cenpn; Scd1; Rrp12; Ptk2b; Actn1; Tmprss2; Sat1; Abhd2; Tpd52; Srf; Xrcc6; Tmem50a; Appbp2; Zmiz1; Klk1b9; Srp19; Sgk1; Adamts1; Klk1; Acsl3","skin","RR-6","GLDS-243"
"HALLMARK_ANGIOGENESIS",0.493788819875776,0.587843833185448,0.0668966276500666,0.270345162581808,0.977383057688818,36,"hallmark","Timp1; Cxcl5; Msx1; Jag1; Lpl; Lrpap1; Thbd; Vcan; App; Jag2; Col5a2; Col3a1; Stc1","skin","RR-6","GLDS-243"
"HALLMARK_APICAL_JUNCTION",0.0139955533081881,0.0294447587331719,0.380730400722792,0.289545152519544,1.41639062424395,198,"hallmark","Lamc2; Insig1; Dsc1; Icam5; Slc30a3; Cldn14; Mpzl1; Hras; Lama3; Pfn1; Cldn4; Gtf2f1; Mmp9; Cdsn; Actg1; Nectin4; Nectin2; Pik3r3; Cdh1; Pard6g; Mpzl2; Fscn1; Tubg1; Jup; Mapk13; Vasp; Crb3; Cdh3; Dmp1; Src; Pcdh1; Nectin1; Hadh; Bmp1; Cap1; Ctnna1; Cldn8; Alox8; Actb; Actn4; Amh; Grb7; Tjp1; Vcl; Myh9; Pbx2; Egfr; Dlg1; Shc1; Col16a1; Myl12b; Ldlrap1; Fbn1; Nf2; Evl; Cdh11; Thy1; Vcan; Dhx16; Mdk; Msn; Actn1; Cntn1; Myh10; Zyx; Actc1; Mvd; Krt31; Nrxn2; Cnn2; Gamt; Arpc2; Cldn7; Kcnh2; Ctnnd1; Itga3; Nrtn; Pik3cb","skin","RR-6","GLDS-243"
"HALLMARK_APICAL_SURFACE",0.30421686746988,0.447377746279235,0.0908241419007155,0.290161380520455,1.10697853303204,44,"hallmark","Lypd3; Crybg1; Rhcg; Mdga1; Sulf2; Pcsk9; Scube1; Thy1; App; Brca1; Hspb1; Ephb4; Pkhd1; Adam10; Efna5; Plaur","skin","RR-6","GLDS-243"
"HALLMARK_APOPTOSIS",0.0159726749245375,0.031945349849075,0.352487857583619,0.293348315506528,1.38600645768183,159,"hallmark","Timp1; Gadd45b; Ebp; Il6; Bnip3l; Pdcd4; Hmgb2; Cdkn1a; H1f0; Cth; Ctnnb1; Hmox1; Sc5d; Pmaip1; Top2a; Ier3; Igf2r; Rhot2; Krt18; Rhob; Casp6; Tspo; Ccnd1; Cd14; Casp3; Fdxr; Dap3; Gucy2e; Aifm3; Smad7; Clu; Bcl2l10; Etf1; Lmna; Lgals3; Gna15; Ppp2r5b; Psen2; Bax; Cd44; Casp2; Erbb3; Bcl2l1; Lef1; Btg3; Btg2; Slc20a1; Gpx1; Sat1; Bik; App; Dnaja1; Brca1; Hspb1; Diablo; Cdk2; Isg20; Nedd9; Gch1; Erbb2; Cdc25b; Tnfrsf12a; Bcl2l2","skin","RR-6","GLDS-243"
"HALLMARK_BILE_ACID_METABOLISM",0.223367697594502,0.360270479991132,0.173747838999571,-0.217785032954841,-1.10184922298751,109,"hallmark","Nr1h4; Ar; Nr3c2; Abca8b; Rxrg; Hsd17b11; Abca5; Bbox1; Nudt12; Abcg8; Cyp39a1; Abcd3; Abca9; Pex11a; Abca6; Ch25h; Gc","skin","RR-6","GLDS-243"
"HALLMARK_CHOLESTEROL_HOMEOSTASIS",0.00268776306281563,0.00707306069162008,0.431707695803346,0.393633830897547,1.65936291356988,75,"hallmark","Scd2; Fasn; Ebp; Fabp5; Gstm7; Ctnnb1; Sc5d; Actg1; Nfil3; Alcam; Fads2; Cd9; Pcyt2; Mal2; Cbs; Mvk; Trib3; Clu; Nsdhl; Ethe1; Cpeb2; Lgals3; Stard4; Jag1; Aldoc; S100a11; Lpl; Scd1; Srebf2; Mvd; Atf5; Ldlr; Fdps; Abca2","skin","RR-6","GLDS-243"
"HALLMARK_COAGULATION",0.417789757412399,0.547559966914806,0.0681513438679483,0.218706570451089,1.01484393696159,138,"hallmark","Klk8; Timp1; Prep; Ctsl; Wdr1; Mmp9; S100a1; C8a; Dusp14; Proc; Cd9; Sh2b2; Ctsb; Bmp1; Dusp6; Fgg; Apoc2; Clu; Pef1; Gnb2; Apoc1; Capn2; Maff; Fbn1; Furin; Lta4h; Serpine1; Mmp14; Thbd; Rabif; Capn5; Crip2; Serpina1e; Serpinc1; Csrp1; Rgn; Fyn; Arf4; C8b; Mmp8; Lgmn; C1rb; F11; Ctse","skin","RR-6","GLDS-243"
"HALLMARK_COMPLEMENT",0.427096774193548,0.547559966914806,0.0649407684612899,0.208211932946167,1.01519279038988,195,"hallmark","Mmp13; Cxcl3; Rbsn; Timp1; Pclo; Car2; Il6; Dusp5; Rhog; Prep; Ctsl; Col4a2; Pfn1; Ppp4c; Atox1; Ctsd; Hspa5; Ctsc; Kcnip2; Cda; Lap3; Casp3; Ctsb; Src; Pim1; Dusp6; Cpm; Clu; Cdk5r1; Gnb2; Xpnpep1; Apoc1; Ltf; Usp8; Ehd1; Lgals3; Sirt6; Ppp2cb; Pcsk9; Maff; Prdm4; Lta4h; Serpine1; Mmp14","skin","RR-6","GLDS-243"
"HALLMARK_DNA_REPAIR",4.09566846478617e-08,2.55979279049136e-07,0.719512826338911,0.443855679859205,2.07720014216969,150,"hallmark","Polr2g; Taf12; Ccno; Ada; Ddb1; Gtf2h5; Ncbp2; Rad51; Mrpl40; Umps; Sec61a1; Polr1d; Sf3a3; Polr1c; Pold4; Gtf2f1; Eloa; Itpa; Nme4; Alyref; Edf1; Polh; Polr2f; Polr2h; Impdh2; Ercc3; Dut; Nt5c; Polr2i; Cda; Rfc2; Gtf2h3; Polr2e; Nelfcd; Bola2; Taf10; Aprt; Lig1; Clp1; Ssrp1; Trp53; Nme1; Taf1c; Taf6; Dad1; Aaas; Rpa2; Sac3d1; Polr2j; Polr3c; Vps37b; Polr2d; Adrm1; Fen1; Supt5; Rfc5; Pold1; Nelfe; Rfc3; Ell; Ercc2; Ercc1; Gtf2b; Gtf3c5; Ercc8; Vps28; Guk1; Cstf3; Srsf6; Tarbp2; Bcam; Pcna; Supt4a; Xpc; Arl6ip1; Brf2; Rfc4; Nudt21; Pom121; Nudt9; Tyms; Hprt; Gpx4; Rae1; Poll; Nelfb; Tsg101; Dctn4","skin","RR-6","GLDS-243"
"HALLMARK_E2F_TARGETS",1.15797871548248e-25,2.89494678870621e-24,1.31101476274061,0.57758925471719,2.83507312641928,200,"hallmark","Cks1b; Cdkn3; Cdkn2c; Ran; Ak2; Naa38; Pa2g4; Anp32e; Cenpm; Ddx39a; Cdc20; Plk1; Ncapd2; H2ax; Cit; Aurka; Birc5; Jpt1; Cks2; Mthfd2; Tacc3; Kif4; Nolc1; Mxd3; Hmgb2; Cdkn1a; Hmmr; Kpna2; Mcm4; Rrm2; Asf1b; Pop7; Kif18b; Kif2c; Tcf19; Mki67; Cenpe; Racgap1; H2az1; Shmt1; Suv39h1; Cdca8; Top2a; Psmc3ip; Cdca3; Tk1; Tubb5; Depdc1a; Ccne1; Mcm5; Lbr; Ranbp1; Cdk4; Bub1b; Mcm3; Dlgap5; Aurkb; E2f8; Ube2s; Cdk1; Dut; Ccnb2; Ung; Tubg1; Kif22; Lyar; Ilf3; Ctps; Rfc2; Nop56; Lmnb1; Melk; Phf5a; Mad2l1; Mcm7; Spc24; Lig1; Gspt1; Spc25; Ubr7; Ssrp1; Trip13; Trp53; Zw10; Dctpp1; Nme1; Mcm2; Gins1; Chek2; Dclre1b; Rpa2; Mms22l; Snrpb; Ctcf; Rnaseh2a; Stmn1; Ccp110; Spag5; Mybl2; Pold1; Ppp1r8; Dck; Pold2; Hmga1; Rfc3; Tbrg4; Smc1a; Plk4; Pan2; Tipin; Dnmt1; Nup107; Pole; Nasp; Bard1; Wdr90; Prim2; Hells; Hmgb3; Brca1; Chek1; Smc4; Xrcc6; Rad50; Pcna; Cnot9; Eif2s1; Espl1; Prdx4; Nup205; Timeless; Diaph3; Pnn; Cdc25b; Rad51ap1; Nudt21; Dscc1; Orc2; Rad51c; Mcm6","skin","RR-6","GLDS-243"
"HALLMARK_EPITHELIAL_MESENCHYMAL_TRANSITION",0.632600258732212,0.718863930377514,0.0466948041282054,0.18918104330771,0.925971371328846,199,"hallmark","Cxcl3; Col5a3; Nid2; Timp1; Lamc2; Gadd45b; Il6; Tnc; Ppib; Cxcl5; Col4a1; Lama3; Col4a2; Areg; Col12a1; Aplp1; Pmepa1; Rhob; Serpinh1; Sdc1; Qsox1; Efemp2; Wnt5a; Pdlim4; Mcm7; Bmp1; Msx1; Lgals1; Matn2; Gja1; Capg; Inhba; Tpm4; Col16a1; Fbn1; Cald1; Anpep; Cd44; Notch2; Serpine1; Mmp14; Cdh11; P3h1; Thy1; Loxl2; Vcan; Gpc1; Sat1; Sntb1; Plod3; Sfrp1; Igfbp4; Pthlh; Lrrc15; Plod2; Col11a1; Col5a2; Adam12; Nnmt; Cxcl12; Fbln1; Tnfrsf12a; Igfbp2; Fbln2; Col3a1; Basp1; Copa; Cdh6; Cxcl1; Fstl3; Plaur; Itga5; Col1a1; Col6a2; Lrp1; Bgn","skin","RR-6","GLDS-243"
"HALLMARK_ESTROGEN_RESPONSE_EARLY",0.00298287190498059,0.00745717976245147,0.431707695803346,0.308828557888409,1.50684525896805,194,"hallmark","Syt12; Aqp3; Fasn; Unc119; Sybu; Slc1a4; Bhlhe40; Slc2a1; Krt19; Slc39a6; Sfn; Fhl2; Areg; P2ry2; Slc9a3r1; Kcnk5; Nav2; Ppif; Zfp185; Lad1; Pmaip1; Rab31; Krt8; Tubb2b; Car12; Farp1; Inhbb; Krt18; Nxt1; Fam102a; Krt13; Myb; Celsr2; Anxa9; Scnn1a; Ccnd1; Tbc1d30; Snx24; Lrig1; Slc7a5; Mlph; Celsr1; Esrp2; Gla; Sec14l2; Scarb1; Gja1; Flnb; Tfap2c; Hr; Fkbp4; Mybbp1a; Tpd52l1; Kazn; Mreg; Ret; Elf3; Cd44; Syngr1; Rrp12; Clic3; Klf10; Tsku; Pgr; Ugcg; Wwc1; Tpbg; Igfbp4; Slc22a5; Abhd2; Il17rb; Ncor2; Hes1; Tgif2; Med24; Blvrb; Kdm4b; Cldn7; Cxcl12; Siah2; Foxc1; Nadsyn1","skin","RR-6","GLDS-243"
"HALLMARK_ESTROGEN_RESPONSE_LATE",0.00103359154655019,0.00303997513691233,0.45505986738723,0.32206335313068,1.58233921934962,203,"hallmark","Serpina3m; Lamc2; Car2; Slc1a4; Cdc20; Tst; Fabp5; Krt19; Sfn; St14; Areg; Pdcd4; Slc9a3r1; Kcnk5; Pkp3; Ass1; Ppif; Cxcl14; Rab31; Kif20a; Nmu; Top2a; Car12; Gale; Farp1; Cdh1; Nxt1; Fam102a; Krt13; Dcxr; Cyp4f14; Myb; Celsr2; Dusp2; Anxa9; Mapk13; Scnn1a; Ccnd1; Cd9; Agr2; Trim29; Nab2; Slc7a5; Gla; Lsr; Chst8; Scarb1; Flnb; Tfap2c; Rnaseh2a; Stil; Plxnb1; Ltf; Hr; Fkbp4; Fgfr3; Tpd52l1; Gal; Cdc6; Ret; Plk4; Ascl1; Cd44; Btg3; Dlg5; Clic3; Ckb; Mdk; Pgr; Tpbg; Gfus; Igfbp4; Slc22a5; Serpina1e; Abhd2; Il17rb; Ncor2; Llgl2; Perp; Blvrb; Klk11; Isg20; Cxcl12; Siah2; Foxc1; Th; Emp2; Sgk1; Tff1; Hprt; Slc2a8; Serpina3n; Klk10; Ptger3; Slc29a1; Cacna2d2; S100a9; Gjb3; Egr3; Gins2; Opn3; Mettl3; Aldh3a2; Dhcr7","skin","RR-6","GLDS-243"
"HALLMARK_FATTY_ACID_METABOLISM",0.463035019455253,0.577498033044847,0.124434168630393,-0.188445800027152,-1.00644546145519,154,"hallmark","Elovl5; Cyp1a1; Decr1; Rdh1; Eci2; Hsd17b11; Acadl; Rdh11; Aqp7; Aadat; Sms; Acadm; Car4; Mgll; Acss1; Hmgcs2; Fabp1; Ppara; Gpd2; Adh7; Suclg2; Hadhb; Fmo1; Bckdhb; Crat; Cd36; Acsl5; Tdo2; Suclg1; Acsl4; Vnn1; Eno3; Eci1; Serinc1; Psme1; Etfdh; Bphl; Aldh3a1; Rap1gds1; Sdhc; Pdha1; Acox1; Ech1; Adipor2; Hpgd; Hibch; Hmgcs1; Hsd17b4; Idi1; Pts; Mlycd; Cidea; Hccs; Aoc3; Adh1; Maoa; Sdha; Nbn; Dhcr24; Retsat","skin","RR-6","GLDS-243"
"HALLMARK_G2M_CHECKPOINT",7.53627272727287e-20,1.25604545454548e-18,1.15122052214226,0.534950418209342,2.61685871855841,198,"hallmark","Traip; Cks1b; Cdkn3; Cdkn2c; Nup50; Ddx39a; Cenpa; Cdc20; Rad23b; Uck2; Cenpf; Plk1; H2ax; Prc1; Hspa8; Aurka; Birc5; Jpt1; Kmt5a; Cks2; Tfdp1; Tacc3; E2f2; Kif20b; Kif4; Troap; Nolc1; Bub3; Hmmr; Kpna2; Chaf1a; Ube2c; Bub1; Kif2c; Mki67; Cenpe; Racgap1; Sap30; H2az1; Kpnb1; Suv39h1; Tpx2; Top2a; Tle3; Pbk; Odc1; Mcm5; Lbr; Hif1a; Cdk4; Mcm3; Aurkb; Dbf4; Ndc80; E2f3; Ube2s; Cdk1; Nek2; Ccnb2; Nusap1; Smc2; Kif22; Ilf3; Incenp; Ccnd1; Lmnb1; Kif11; Polq; Ccna2; Ccnf; Kif23; Kif15; Mad2l1; Slc7a1; Knl1; Gspt1; Ncl; Cul4a; Slc7a5; Mcm2; Cdc45; Rpa2; Tnpo2; Ctcf; Stmn1; Lig3; Rasal2; Ttk; Hmgn2; Mybl2; Stil; Exo1; Ewsr1; Hmga1; Cdc6; Rad54l; Upf1; Smc1a; G3bp1; Prmt5; Snrpd1; Plk4; Katna1; Notch2; Rbm14; Pole; Nasp; Bard1; Nsd2; Mnat1; Smarcc1; Chmp1a; Arid4a; E2f4; Dkc1; Prim2; Hmgb3; Chek1; Hira; Atf5","skin","RR-6","GLDS-243"
"HALLMARK_GLYCOLYSIS",1.91190328244916e-06,8.69046946567798e-06,0.627256739718528,0.38250614776723,1.87113518115834,198,"hallmark","Gys2; Eno1; Pgam1; Txn1; Slc25a10; Arpp19; Fam162a; Bpnt1; Glrx; Tgfa; Cenpa; Psmc4; Pcx; Ppia; Aurka; Hdlbp; Rars; Ero1a; Taldo1; Hmmr; Pgls; Cth; Ecd; Sap30; Pgm2; Hax1; Kif20a; Hspa5; Mif; Gale; Cldn3; Galk1; Depdc1a; Ier3; Ddit4; Sdc1; Qsox1; Casp6; Cdk1; Slc25a13; Alg1; Mdh2; Kdelr3; Copb2; Dsc2; Egln3; B3gat1; Rpe; G6pdx; Spag4; Pmm2; Nsdhl; Got2; Stmn1; Chst2; Gnpda1; Egfr; B4galt7; Fkbp4; Mpi; Ppp2cb; Gclc; Elf3; Pkm; Cd44; B3gat3; Paxip1; Chpf; Chst5; Gpr87; Nasp; Vcan; Capn5; Gpc1; Cog2; Cxcr4; Bik; Aldh7a1; Tpbg; Gfus; Rbck1; Gmppb; B3galt6; Artn; Plod2; Med24; Me2; Chst12; Chpf2; Abcb6; Isg20","skin","RR-6","GLDS-243"
"HALLMARK_HEDGEHOG_SIGNALING",0.778649921507064,0.839401294498382,0.0460457683018055,0.220394846433561,0.793387184208871,35,"hallmark","Slit1; Ets2; Tle3; Adgrg1; Cntfr; Celsr1; Cdk5r1; Myh9; Thy1; Ldb1; Tle1; Nrp2","skin","RR-6","GLDS-243"
"HALLMARK_HEME_METABOLISM",0.00241017416718134,0.0066949282421704,0.431707695803346,0.31334509891006,1.52366822980377,191,"hallmark","Hbb-bt; Aldh1l1; Gypa; Alas2; Aqp3; Prdx2; H4c3; Car2; Hagh; Smox; Osbp2; Slc2a1; Asns; Trim10; Bnip3l; Minpp1; Pcx; Slc66a2; E2f2; H1f0; H4c14; Pgls; Igsf3; Map2k3; Rcl1; Ell2; Mocos; Slc7a11; Trak2; Bmp2k; Slc25a37; Gclm; Ranbp10; Mfhas1; Arl2bp; Lpin2; Selenbp2; Cast; Ctsb; Slc30a1; Foxo3; Alad; Bpgm; Epb41; Lrp10; Acp5; Ucp2; Gclc; Psmd9; Uros; Ppp2r5b; Mgst3; Add2; Bsg; Btg2; Ctns; Htatip2; Tspo2; Bcam; Rnf123; Rad23a; Sidt2; Slc4a1; Pigq; Rap1gap; Blvrb; Mark3; Gapvd1; Abcb6; Fbxo34; Slc30a10; Top1; Hmbs; Dcaf10; Icam4; Urod; Glrx5; Endod1; Tent5c; Rhag; Ctse; Tfrc; Daam1; Xpo7; Rbm38; Snca; Hbq1b; Mkrn1","skin","RR-6","GLDS-243"
"HALLMARK_HYPOXIA",0.0378289657956697,0.0700536403623513,0.321775918075361,0.271145184786028,1.32508042986833,197,"hallmark","Ncan; Eno1; Fam162a; Glrx; Il6; Bhlhe40; Slc2a1; Ampd3; Bnip3l; Hdlbp; Ero1a; Noct; Cdkn1a; Hmox1; Btg1; Sap30; Pgm2; Hspa5; Mif; Car12; Nfil3; Galk1; Ier3; Ddit4; Casp6; Pkp1; Pfkl; Lxn; Kdelr3; Selenbp2; Ppp1r15a; Jmjd6; Pim1; Foxo3; Fosl2; Slc25a1; Prdx5; Scarb1; Efna1; Chst2; Ccng2; Myh9; Xpnpep1; Egfr; Stbd1; Aldoc; Adm; Maff; Inha; Atp7a; Prkca; Serpine1; Gpc1; Cxcr4; Mt1; Tes; Grhpr; Ilvbl; Tpbg; Fbp1; Ndst1; Tpd52; B3galt6","skin","RR-6","GLDS-243"
"HALLMARK_IL2_STAT5_SIGNALING",0.290322580645161,0.447377746279235,0.0847985102819124,0.221581057755323,1.08392535666269,198,"hallmark","Gsto1; Gadd45b; Car2; Gpr83; Bhlhe40; Mxd1; Uck2; Umps; Ckap4; Praf2; Ahcy; Hopx; Rgs16; Pus1; Prkch; Slc39a8; S100a1; Fah; Tnfrsf8; Aplp1; Ptrh2; Nfil3; Odc1; Ccne1; Igf2r; Rhob; Alcam; Phlda1; Lrig1; Eef1akmt1; Dcps; Etv4; Cdcp1; Casp3; Pim1; Nop2; Map6; Rnh1; Ager; Il4ra; Il3ra; Sell; Capg; Cyfip1; Cdc6; Maff; Syngr2; Cd44; Furin; Bcl2l1; Mapkapk2","skin","RR-6","GLDS-243"
"HALLMARK_IL6_JAK_STAT3_SIGNALING",0.79382889200561,0.839401294498382,0.0400031517498194,0.191636553889686,0.830393768688355,87,"hallmark","Csf3r; Cxcl3; Il6; Ptpn11; Hmox1; Bak1; Hax1; Stam2; Cd14; Cd9; Pim1; Cntfr; Ccr1; Il4ra; Il3ra; Dntt; Ptpn1; Ltbr; Cd44; Reg1","skin","RR-6","GLDS-243"
"HALLMARK_INFLAMMATORY_RESPONSE",0.7,0.777777777777778,0.107140237276725,-0.169899216766161,-0.93342418892012,200,"hallmark","Slc4a4; Cxcl9; Ccrl2; Adora2b; Ccl20; Best1; Irf1; Gabbr1; Ahr; Rasgrp1; Cd55; Il18r1; Pvr; Tnfsf10; Calcrl; Nampt; Pde4b; Rgs1; Kcnj2; Ptger2; Ffar2; Osmr; Cxcl10; Ptafr; Kif1b; Ripk2; Il15ra; Ptgir; Slc7a2; Klf6; Npffr2; Atp2b1; Lta; Csf1; Slamf1; Cxcl11; Tlr3; Lpar1","skin","RR-6","GLDS-243"
"HALLMARK_INTERFERON_ALPHA_RESPONSE",5.10913964506347e-07,2.55456982253173e-06,0.659444398037935,-0.432533811368024,-2.12660581366611,98,"hallmark","Gbp2; Ccrl2; Parp12; Irf1; Ifih1; Trim21; Ncoa7; Ifi44l; Irf9; Parp14; Herc6; Trim5; Rnf31; Parp9; Usp18; Cd47; Il7; Cxcl10; Sp110; Ripk2; Psmb9; Ddx60; Txnip; Ifit2; B2m; Gbp3; Cnp; Csf1; Cxcl11; Trim12c; Batf2; Cmpk2; C1s1; Irf2; Nmi; Samd9l; Psme1; Gmpr; Ifi27l2b; Uba7; Epsti1; Trim14; Eif2ak2; Psme2; Stat2; Rtp4; Casp1; Il15; Ifit3","skin","RR-6","GLDS-243"
"HALLMARK_INTERFERON_GAMMA_RESPONSE",7.82209160410428e-09,5.58720828864591e-08,0.747739663149885,-0.370742802823285,-2.04338980697452,201,"hallmark","Gbp10; Gbp4; Cxcl9; Nlrc5; Casp4; Cd274; Parp12; Sspn; Irf1; Ifih1; Trim21; Irf4; Ifi44l; Auts2; Fas; Tnfsf10; Xaf1; Irf9; Itgb7; Parp14; Herc6; St3gal5; Gbp8; H2-M3; Fgl2; Nampt; Gbp9; Rnf31; Pde4b; Usp18; Sectm1a; Il7; Cxcl10; Sp110; Ripk2; Psmb9; Il15ra; Ddx60; H2-M2; Txnip; Apol6; Ifit2; B2m; Gbp3; Vcam1; Cxcl11; Gzma; Eif4e3; Tnfaip3; Batf2; Klrk1; Casp7; H2-Aa; Lysmd2; Cmpk2; C1s1; Ptgs2; Cd86; Il18bp; St8sia4; Irf2; Bank1; Nod1; Nmi; Icam1; Ccl5; Samd9l; Psme1; Stat1; Csf2rb2; Serping1; Gpr18; Slamf7; Ciita; Ifi27l2b; Stat4; Epsti1; Trim14; Rnf213; Arl4a; Eif2ak2; Vamp5; Jak2; Cd38; Xcl1; Cfh; Psme2; Zbp1; Stat2; Marchf1; Ptpn6; Rtp4; Casp1; Samhd1; H2-Eb1; Ifit1bl1; Il15; Ifit3; Mettl7b; Nfkb1","skin","RR-6","GLDS-243"
"HALLMARK_KRAS_SIGNALING_DN",0.473548387096774,0.577498033044847,0.059989249649033,0.205164948541604,0.995616538905965,187,"hallmark","Klk8; Htr1b; Arhgdig; Fgf22; Slc30a3; Kcnq2; Tgm1; Klk7; Lypd3; Krt5; Lgals7; Tex15; Pkp1; Krt13; Dtnb; Celsr2; Pde6b; Krt1; Tfcp2l1; Cntfr; Hc; Efhd1; Cldn8; Snn; Klhdc8a; Entpd7; Edn1; Skil; Chst2; Akr1b8; Lfng; Fgfr3; Scn10a; Slc29a3; Ybx2; Ambn; Slc6a3; Abcb11; Htr1d; Abcg4; Tenm2; Gtf3c5; Slc5a5; Btg2; Nudt10; Bard1; Slc16a7; Sptbn2; Plag1; Sidt1; Nudt11; Ccdc106","skin","RR-6","GLDS-243"
"HALLMARK_KRAS_SIGNALING_UP",0.35,0.486111111111111,0.158514105424824,-0.187305191782034,-1.02905239969591,200,"hallmark","Nr1h4; Peg3; Csf2; Satb1; Gabra3; Ccl20; Gucy1a1; Reln; Nap1l2; Tmem100; Vwa5a; Pigr; Btc; Ush1c; Prrx1; Abcb1a; Cdadc1; Epb41l3; Igfbp3; Adgrl4; Spp1; Cxcl10; Snap91; Pdcd1lg2; Fgf9; Hdac9; Etv1; Mmp10; Birc3; Snap25; F13a1; Nrp1; Tnfaip3; Gypc; Ptbp2; Akap12; Adamdec1; Ptgs2; Zfp639; Igf2; Cab39l; Ccser2; Il7r; Dock2; Ikzf1; Pecam1; Gfpt2; Ctss; Ptprr; Tspan13; Tfpi; Tnfrsf1b; Atg10; Spry2; Wdr33; Ank; Fcer1g; Aldh1a2; Itgb2; Trib2; Serpina3c; Sparcl1; Sema3b; Il1rl2; Lat2; Cfh; Ano1; Itga2; Akt2; Nin; Lcp1; C3ar1","skin","RR-6","GLDS-243"
"HALLMARK_MITOTIC_SPINDLE",1.17848238521996e-05,4.91034327174982e-05,0.593325476396405,0.361189983613958,1.76789163750018,199,"hallmark","Uxt; Anln; Arf6; Cenpf; Plk1; Prc1; Tuba4a; Aurka; Birc5; Kif20b; Kif4; Cep131; Bub1; Kif2c; Als2; Cenpe; Racgap1; Cyth2; Tpx2; Top2a; Farp1; Arfip2; Bcr; Rhot2; Dlgap5; Ndc80; Cdk1; Ezr; Nek2; Ccnb2; Nusap1; Fscn1; Kif22; Katnb1; Capzb; Atg4b; Incenp; Ect2; Lmnb1; Kif11; Tbcd; Sun2; Kif23; Ywhae; Kif15; Septin9; Actn4; Sac3d1; Arhgdia; Flnb; Map3k11; Sass6; Llgl1; Cttn; Rasal2; Ttk; Vcl; Epb41; Myh9; Dlg1; Cdc42ep4; Cdc42ep1; Smc1a; Pif1; Kntc1; Katna1; Klc1; Notch2","skin","RR-6","GLDS-243"
"HALLMARK_MTORC1_SIGNALING",1.98444290093451e-11,2.48055362616814e-10,0.863415391606693,0.450424328370599,2.20466081447073,199,"hallmark","Eno1; Scd2; Insig1; Ebp; Glrx; Calr; Slc1a4; Psmd13; Cct6a; Bhlhe40; Ddx39a; Ykt6; Slc2a1; Plk1; Asns; Pitpnb; Psmc4; Pdap1; Acaca; Tuba4a; Ppia; Aurka; Mthfd2; Ero1a; Nfyc; Slc9a3r1; Cdkn1a; Mcm4; Rrm2; Eprs; Cth; Bub1; Psmc2; Map2k3; Sc5d; Slc7a11; Hspa5; Psmg1; Phgdh; Nfil3; Txnrd1; Eef1e1; Ctsc; Pik3r3; Psmb5; Stip1; Serpinh1; Ddit4; Srd5a1; Pfkl; Ung; Tubg1; Psmd14; Polr3g; Fads2; Hspa4; Cd9; Ppp1r15a; Ccnf; Egln3; Fdxr; Atp2a2; Acly; Rpn1; G6pdx; Tomm40; Slc7a5; Mcm2; Eif2s2; Fads1; Trib3; Gla; Shmt2; Abcf2; Etf1; Hspd1; Hspe1; Sytl2; Cops5; Stard4; Gclc; Ppa1; Nmt1; Scd1; Lta4h; Btg2; Nfkbib; Uchl5; Hsp90b1; Atp6v1d; Cxcr4; Tes; Atp5g1; Plod2; Dhfr; Ldlr; Edem1; Rit1; Psat1; Nupr1; Nup205; Ube2d3; Psmc6; Psmd12; Hmbs; Lgmn; Stc1; Ifi30; Hprt; Prdx1; Tfrc; Psma4; Ufm1; Acsl3; Gpi1; Cacybp; Idh1; Sqle; Pno1; Nufip1; Ak4; Gtf2h1; Psme3; Sec11a; Dhcr7","skin","RR-6","GLDS-243"
"HALLMARK_MYC_TARGETS_V1",1.63301949651015e-30,8.16509748255074e-29,1.43181244608859,0.607673806253313,2.98274191160505,200,"hallmark","Acp1; Hsp90ab1; Snrpa; Cct7; Glo1; Ran; Rps2; Cct2; Mrpl9; Ncbp2; Cct3; Pa2g4; Lsm7; Cdc20; Fam120a; Rad23b; Psmd7; Hnrnpa1; Psmc4; Ruvbl2; Snrpd2; Ppia; Cct5; Snrpd3; Tfdp1; Psmd3; Ddx18; Eif3b; Nolc1; Bub3; Nhp2; Kpna2; Mcm4; Eprs; Ncbp1; Eif3d; Psma7; Psmb2; Fbl; Eif4e; H2az1; Kpnb1; Xpot; Pabpc1; Apex1; Rps6; Odc1; Uba2; Sf3a1; Rps3; Mcm5; Ranbp1; Pcbp1; Tufm; Cdk4; Erh; Serbp1; U2af1; Hnrnpc; Rpl18; Impdh2; Snrpa1; Psmd8; Eif4a1; Npm1; Dut; Lsm2; Rpl14; Rnps1; Psmb3; Rplp0; Ppm1g; Psmd14; Psma2; Cad; Ctps; Nop56; Trim28; Ddx21; Kars; Ccna2; Eef1b2; Psmd1; Exosc7; Ywhae; Mad2l1; Mcm7; Rrm1; Pole3; Gspt1; Rsl1d1; Hddc2; Rps10; Nop16; Srm; Nme1; Mcm2; Eif2s2; Cdc45; Eif4h; Clns1a; Rps5; Got2; Etf1; Hspd1; Cyc1; Hspe1; Tcp1; Snrpg; Rpl22; Mrps18b; Set; Pold2; Cops5; Cstf2; G3bp1; Hnrnpa3; Phb2; Snrpd1; Abce1; Ilf2; Rpl6; Iars; Txnl4a; Srsf3; Phb; Smarcc1; Ptges3; Rack1; Prpf31; Xrcc6; Pcna; C1qbp; Cbx3; Cdk2; Psma6; Eif2s1; Tardbp; Prdx4; Gnl3; Psma1; Rfc4; Psmc6; Sf3b3; Srsf7; Pwp1; Orc2; Mcm6; Tyms","skin","RR-6","GLDS-243"
"HALLMARK_MYC_TARGETS_V2",3.68443752193323e-10,3.68443752193323e-09,0.814035837847908,0.629934556079781,2.50727948816847,58,"hallmark","Pa2g4; Plk1; Mrto4; Ddx18; Nolc1; Pus1; Mcm4; Rcl1; Ppan; Map3k6; Mcm5; Cdk4; Exosc5; Wdr74; Supv3l1; Npm1; Ung; Nip7; Pes1; Dusp2; Nop56; Nop2; Imp4; Nop16; Srm; Dctpp1; Bysl; Grwd1; Noc4l; Ipo4; Farsa; Hspd1; Hspe1; Rabepk; Mybbp1a; Tbrg4; Pprc1; Plk4; Rrp12; Wdr43; Phb; Tcof1; Cbx3; Utp20; Slc19a1; Gnl3","skin","RR-6","GLDS-243"
"HALLMARK_MYOGENESIS",0.000941398188049779,0.00294186933765556,0.477270815362862,-0.270395418840843,-1.49031414367158,201,"hallmark","Fabp3; Myl2; Tnnc1; Tnnt1; Myl3; Pkia; Sgcd; Myh7; Dtna; Mef2c; Pde4dip; Ppp1r3c; Sspn; Schip1; Large1; Reep1; Svil; Sgcg; Ldb3; Agl; Mylk; Mef2a; Ptgis; Dmd; Ppfia4; Casq2; Nos1; Igfbp3; Fst; Ryr1; Myom2; Myom1; Myoz1; Atp2a1; Gpx3; Pygm; Sod3; Ptp4a3; Myh11; Hrc; Ankrd2; Chrnb1; Myf6; Myh4; Hspb2; Prnp; Tnnt3; Actn3; Crat; Cryab; Cd36; Slc6a8; Mapk12; Casq1; Camk2b; Speg; Denn2b; Csrp3; Bin1; Eno3; Pfkm; Tnni2; Fgf2; Eif4a2; Sorbs1; Adcy9; Des; Tnnc2; Cdh13; Sln; Sh3bgr; Ckmt2; Foxo4; Ak1; Pvalb; Ctf1; Gsn; Cav3; Chrna1; Fhl1; Ache; Tead4; Myh2; Akt2","skin","RR-6","GLDS-243"
"HALLMARK_NOTCH_SIGNALING",0.0526315789473684,0.093984962406015,0.241339976815091,0.412845855020875,1.46049383837092,31,"hallmark","Sap30; Wnt5a; Heyl; Ccnd1; Fzd5; Notch1; Aph1a; Lfng; Kat2a; Fzd1; Jag1; Psen2; Prkca; Notch2; Hes1; Psenen; Notch3","skin","RR-6","GLDS-243"
"HALLMARK_OXIDATIVE_PHOSPHORYLATION",0.0277413460871146,0.0533487424752204,0.352487857583619,0.275736587240339,1.34884218758205,198,"hallmark","Cox6b1; Grpel1; Dlst; Mrpl34; Pmpca; Slc25a5; Cox7a2; Cox6a1; Cox8a; Atp6v1f; Atp5h; Atp6v0b; Timm13; Polr2f; Ndufb7; Atp6v1g1; Rhot2; Bckdha; Supv3l1; Atp6ap1; Mrps11; Atp6v1e1; Afg3l2; Mdh2; Atp6v0e; Atp5d; Atp5b; Atp6v0c; Mrps22; Atp5k; Mrps12; Ndufs8; Uqcr11; Atp5j2; Uqcr10; Got2; Cyc1; Mtx2; Ndufs6; Atp5g2; Ndufa8; Uqcrq; Phb2; Ndufa1; Mgst3; Bax; Aifm1; Cox4i1; Mrps15; Atp5o; Timm50; Atp6v1d; Sdhb; Timm10; Ndufa7; Hsd17b10; Cox7a2l; Tcirg1; Cpt1a; Cs; Atp5g1; Acaa1a; Alas1; Ndufa2; Ndufv1; Por; Ndufa9; Cyb5r3; Atp5g3; Ndufb6; Cycs; Mdh1; Cox5b; Echs1; Gpx4; Atp6v1c1; Gpi1; Idh1; Timm17a; Atp5l; Ndufs7; Atp6v1h; Mrpl35; Lrpprc; Atp5e","skin","RR-6","GLDS-243"
"HALLMARK_P53_PATHWAY",9.14277086061986e-08,5.07931714478881e-07,0.704975715167238,0.405778354150209,1.983029705554,197,"hallmark","Klk8; Fam162a; Ada; Aen; Plk3; Tgfa; Mxd1; Cdkn2b; Rpl36; Ier5; Sec61a1; Tax1bp3; Rad9a; Prkab1; Hras; Sfn; St14; Stom; Rgs16; Cdkn1a; Traf4; Epha2; Rnf19b; Rps12; Rap2b; Hmox1; Ctsd; Btg1; Krt17; Bak1; Slc7a11; Tm4sf1; Procr; Polh; Inhbb; Ier3; Eps8l2; Ddit4; Rpl18; Sdc1; Plk2; H1f2; Dcxr; Hint1; Ppp1r15a; Rrad; Fdxr; Mknk2; H2aj; Plxnb2; Trp53; Vamp8; Alox8; Foxo3; Trib3; Notch1; Upp1; Cdk5r1; Prmt2; Tchh; Ccp110; Tcn2; Hbegf; Rhbdf2; Vdr; Tpd52l1; Hdac3; Osgin1; Bax; Gpx2; Phlda3; Btg2; Sat1; Def6; Hexim1; App; Sertad3; Rack1; Pidd1; Cdkn2aip; Wrap73; Jag2; Perp; Mapkapk3; Fbxw7; Pcna; Xpc; Rps27l; Nupr1; Gls2; Ninj1; Pmm1; Rab40c; Rad51c; Pom121; Ptpre; Acvr1b; Lif","skin","RR-6","GLDS-243"
"HALLMARK_PANCREAS_BETA_CELLS",0.934250764525994,0.934250764525994,0.0364548541965309,0.186014593098645,0.648729340207626,29,"hallmark","Mafb; Pax6; Pcsk2; Vdr; Srprb; Spcs1; Pcsk1","skin","RR-6","GLDS-243"
"HALLMARK_PEROXISOME",0.406593406593407,0.547559966914806,0.129442887745046,-0.208909118029145,-1.02636042507666,100,"hallmark","Elovl5; Eci2; Abcb4; Rxrg; Hsd17b11; Rdh11; Abcd3; Pex11a; Abcb1a; Abcc5; Slc25a4; Sema3c; Siah1a; Pex2; Pex13; Cacna1b; Crat; Acsl5; Atxn1; Acsl4; Gnpat","skin","RR-6","GLDS-243"
"HALLMARK_PI3K_AKT_MTOR_SIGNALING",0.0113878017534011,0.0258813676213662,0.380730400722792,0.338648188448753,1.50876193243765,104,"hallmark","Fgf22; Ppp1ca; Ptpn11; Calr; Arf1; Slc2a1; Acaca; Hras; Ralb; Sfn; Ap2m1; Pfn1; Cdkn1a; Arpc3; Map2k3; Cfl1; Eif4e; Map3k7; Pik3r3; Cdk4; Cdk1; Csnk2b; Pak4; Ppp2r1b; Mknk2; Cab39; Trib3; Rps6ka1; Arhgdia; Smad2; Egfr; Akt1; Them4; Ube2n; Mknk1; Nfkbib; Hsp90b1; Cxcr4; Irak4; Pin1; Rit1; Akt1s1; Cdk2","skin","RR-6","GLDS-243"
"HALLMARK_PROTEIN_SECRETION",0.115492957746479,0.192488262910798,0.153158808683073,0.28503139366398,1.25354149389602,95,"hallmark","Anp32e; Ykt6; Arf1; Ap2m1; Gosr2; Ergic3; Atp1a1; Clta; Ctsc; Igf2r; Krt18; Sec31a; Tom1l1; Copb2; Cope; Ap2s1; Zw10; Gla; Scamp3; Egfr; Atp7a; Arfgef2; Napa; Stx16; Vamp3; Cog2; Ap3b1","skin","RR-6","GLDS-243"
"HALLMARK_REACTIVE_OXYGEN_SPECIES_PATHWAY",0.0684931506849315,0.118091639111951,0.211400189384923,0.3594073804573,1.37627574211127,47,"hallmark","Txn1; Prdx2; Srxn1; Glrx; Junb; Cdkn2d; Atox1; Txnrd1; Gclm; Hmox2; G6pdx; Gclc; Ercc2; Mpo; Egln2; Nqo1; Sbno2; Prdx4; Ptpa; Gpx4; Prdx1; Ftl1; Stk25","skin","RR-6","GLDS-243"
"HALLMARK_SPERMATOGENESIS",0.805825242718447,0.839401294498382,0.0387962208304479,0.183887519604921,0.831607418736483,116,"hallmark","Cdkn3; Oaz3; Chfr; Aurka; Taldo1; Ncaph; Bub1; Kif2c; Psmg1; Dbf4; Cdk1; Hspa2; Nek2; Ccnb2; Pcsk4; Stam2; Pebp1; Map7; Braf; Ttk; Mtor; Gmcl1; Ybx2; Cnih2; Nf2; Topbp1; Ide; Gsg1; Agfg1; Acrbp; Tulp2; Akap4; Tsn; Strbp; Gad1; Rfc4; H1f6; Phkg2","skin","RR-6","GLDS-243"
"HALLMARK_TGF_BETA_SIGNALING",0.000114963311199271,0.000442166581535659,0.538434096309916,0.504735899075364,1.9894504820866,53,"hallmark","Ppp1ca; Junb; Hdac1; Ctnnb1; Id1; Rab31; Pmepa1; Map3k7; Cdh1; Smad1; Ppp1r15a; Smad6; Cdk9; Smad7; Skil; Tjp1; Acvr1; Bcar3; Furin; Serpine1; Klf10; Slc20a1; Hipk2; Smurf1; Fkbp1a; Ncor2; Id3","skin","RR-6","GLDS-243"
"HALLMARK_TNFA_SIGNALING_VIA_NFKB",0.299354838709677,0.447377746279235,0.083129129135339,0.22084080289393,1.0803041941735,198,"hallmark","Ccl4; Cxcl3; Gadd45b; Clcf1; Il6; Dusp5; Bhlhe40; Mxd1; Tnc; Ier5; Junb; Tubb2a; Yrdc; Slc16a6; Cxcl5; Areg; Cdkn1a; Rnf19b; Map2k3; Btg1; Ets2; Pmepa1; Nfil3; Ier3; Rhob; Plk2; Phlda2; Dusp2; Ccnd1; Phlda1; Ppp1r15a; Snn; Fosl2; Edn1; Efna1; Hbegf; Inhba; Il23a; G0s2; Ehd1; Jag1; Ier2; Maff; Cd44; Trib1; Dusp4; Btg3; Btg2; Serpine1; Klf10","skin","RR-6","GLDS-243"
