"pathway","pval","padj","log2err","ES","NES","size","db","leadingEdge_str","tissue","mission","glds"
"MITOCARTA_METABOLISM_AMINO_ACID_METABOLISM_BRANCHED_CHAIN_AMINO_ACID_METABOLISM",0.0216021322940086,0.0489648331997528,0.352487857583619,0.488275979086955,1.55734311748171,25,"mitocarta","Hmgcl; Echs1; Etfa; Ppm1k; Etfb; Aldh6a1; Bckdha; Acad8; Acat1","liver","RR-8","GLDS-379"
"MITOCARTA_METABOLISM_AMINO_ACID_METABOLISM_GLYCINE_METABOLISM",0.326754385964912,0.444385964912281,0.109250039480711,0.387028818003247,1.0903244309446,15,"mitocarta","Slc25a38; Sardh; Etfa; Etfb; Gcsh","liver","RR-8","GLDS-379"
"MITOCARTA_METABOLISM_AMINO_ACID_METABOLISM_LYSINE_METABOLISM",0.0142304284020181,0.0403195471390514,0.380730400722792,0.60559116027374,1.7189909582946,16,"mitocarta","Echs1; Acaa2; Hadhb; Hadh; Etfa; Etfb; Slc25a29; Gcdh; Acat1","liver","RR-8","GLDS-379"
"MITOCARTA_METABOLISM_CARBOHYDRATE_METABOLISM_TCA_CYCLE",0.341346153846154,0.44637573964497,0.112378519110475,0.369635338121446,1.09427240127443,20,"mitocarta","Sdhd; Sdhb; Suclg1; Sdhc","liver","RR-8","GLDS-379"
"MITOCARTA_METABOLISM_DETOXIFICATION_ROS_AND_GLUTATHIONE_METABOLISM",0.888077858880779,0.888077858880779,0.0602484086158019,0.228724383248216,0.741921839570075,27,"mitocarta","Txnrd2; Prdx4; Prdx6; Prdx3; Msrb2; Aldh3a2; Hagh; Gpx4","liver","RR-8","GLDS-379"
"MITOCARTA_METABOLISM_DETOXIFICATION_XENOBIOTIC_METABOLISM",0.263657957244656,0.389755241144273,0.129442887745046,0.374640846096239,1.14906997809246,22,"mitocarta","Acsm5; Bphl; Ephx2; Cbr3; Aldh1b1; Tst; Maoa; Mtarc1; Mpst; Gstk1","liver","RR-8","GLDS-379"
"MITOCARTA_METABOLISM_LIPID_METABOLISM",0.520481927710843,0.610220191109265,0.0870515867946735,0.303573894720058,0.954724952972112,24,"mitocarta","Ech1; Acot9; Ehhadh; Mlycd; Ephx2; Them4; Acaa1b; Lypla1; Acot13","liver","RR-8","GLDS-379"
"MITOCARTA_METABOLISM_LIPID_METABOLISM_CARDIOLIPIN_SYNTHESIS",0.023786302223346,0.0505458922246102,0.352487857583619,0.594782391598644,1.67560073692037,15,"mitocarta","Gpat2; Pnpla8; Triap1; Agpat4; Pld6; Agpat5; Plscr3; Tamm41; Gpam; Hadha; Pgs1","liver","RR-8","GLDS-379"
"MITOCARTA_METABOLISM_LIPID_METABOLISM_FATTY_ACID_OXIDATION",0.00390936205890861,0.0189883300004133,0.407017918923954,0.461955057879083,1.67977939270923,44,"mitocarta","Acad10; Echs1; Acaa1a; Acads; Eci1; Acadvl; Acsm5; Acaa2; Hadhb; Hadh; Etfa; Etfb; Decr1; Cpt2; Slc25a20; Cpt1a; Acat1; Crot; Cpt1c","liver","RR-8","GLDS-379"
"MITOCARTA_METABOLISM_LIPID_METABOLISM_PHOSPHOLIPID_METABOLISM",0.132530120481928,0.236658932714617,0.190023305279108,0.402694521012384,1.26645444263318,24,"mitocarta","Gpat2; Prdx6; Stard7; Pnpla8; Triap1; Agpat4; Chpt1; Agpat5; Osbpl1a","liver","RR-8","GLDS-379"
"MITOCARTA_METABOLISM_METALS_AND_COFACTORS_FE_S_CLUSTER_BIOSYNTHESIS",0.00768911770701461,0.0290477780042774,0.407017918923954,0.554346873037056,1.70584059765301,23,"mitocarta","Nubpl; Fdx1; Ndufab1; Hscb; Grpel1; Glrx5; Cisd1; Nfu1; Fdxr; Abcb7; Bola1","liver","RR-8","GLDS-379"
"MITOCARTA_METABOLISM_METALS_AND_COFACTORS_FE_S_CONTAINING_PROTEINS",0.0101255750072161,0.0315737762646744,0.380730400722792,0.500069689531675,1.68829075059093,31,"mitocarta","Nubpl; Fdx1; Uqcrfs1; Ndufv1; Glrx5; Sdhb; Rsad1; Cisd1; Nfu1; Nthl1; Ndufs8; Bola1; Ndufs2","liver","RR-8","GLDS-379"
"MITOCARTA_METABOLISM_METALS_AND_COFACTORS_HEME_SYNTHESIS_AND_PROCESSING",0.0723981900452489,0.136752136752137,0.252961123069611,0.50229047795162,1.42576848322227,16,"mitocarta","Fdx1; Abcb10; Slc25a38; Hccs; Fdxr; Abcb7","liver","RR-8","GLDS-379"
"MITOCARTA_METABOLISM_NUCLEOTIDE_METABOLISM_NUCLEOTIDE_SYNTHESIS_AND_PROCESSING",0.0169172761691235,0.0442451838269385,0.352487857583619,0.51872235167781,1.59621653776858,23,"mitocarta","Dut; Nme6; Hint1; Nme3; Suclg1; Ak4; Dhodh; Guk1; Nudt5; Cmpk2; Nt5dc2; Nudt2; Nme4","liver","RR-8","GLDS-379"
"MITOCARTA_METABOLISM_VITAMIN_METABOLISM_FOLATE_AND_1_C_METABOLISM",0.862306368330465,0.888077858880779,0.0455878202571231,-0.249457762873032,-0.722721376213799,22,"mitocarta","Amt; Mtfmt; Fpgs; Aldh1l2; Mthfd2","liver","RR-8","GLDS-379"
"MITOCARTA_MITOCHONDRIAL_CENTRAL_DOGMA_MTRNA_METABOLISM_MTRNA_GRANULES",0.000422432262045512,0.0023937828182579,0.49849310876659,0.598134943950935,1.94019269666424,27,"mitocarta","Fastkd2; Mrps9; Rpusd4; Mtpap; Mrpl47; Ptcd2; Eral1; Fastkd1; Trub2; Mrm2; Fastkd5; Noa1","liver","RR-8","GLDS-379"
"MITOCARTA_MITOCHONDRIAL_CENTRAL_DOGMA_MTRNA_METABOLISM_MTRNA_STABILITY_AND_DECAY",0.139211136890951,0.236658932714617,0.181383128498408,0.443138531209386,1.26811226393639,17,"mitocarta","Fastkd2; Fastkd3; Endog; Mtpap; Fastkd1; Fastkd5; Slirp","liver","RR-8","GLDS-379"
"MITOCARTA_MITOCHONDRIAL_CENTRAL_DOGMA_MTRNA_METABOLISM_MT_RRNA_MODIFICATIONS",0.000137547799278721,0.00116915629386913,0.518848077743792,0.724026781266583,2.07191922182166,17,"mitocarta","Rcc1l; Myg1; Mettl5; Rpusd4; Mtpap; Ngrn; Trit1; Mettl15; Trub2; Nsun4; Mrm2; Mettl17","liver","RR-8","GLDS-379"
"MITOCARTA_MITOCHONDRIAL_CENTRAL_DOGMA_MTRNA_METABOLISM_MT_TRNA_MODIFICATIONS",0.447115384615385,0.563034188034188,0.0956031492204301,0.338135279357033,1.00101929100743,20,"mitocarta","Cdk5rap1; Rpusd4; Trit1; Trmt1; Trmu; Trnt1; Trmt2b","liver","RR-8","GLDS-379"
"MITOCARTA_MITOCHONDRIAL_CENTRAL_DOGMA_TRANSLATION_MITOCHONDRIAL_RIBOSOME",1.17926178828286e-06,2.00474504008085e-05,0.643551836150722,0.510730354291992,2.10490079210988,83,"mitocarta","Dap3; Mrpl36; Mrps16; Mrpl44; Mrps24; Mrpl53; Mrps6; Mrpl18; Mrps18a; Mrpl17; Mrpl13; Mrps9; Mrpl55; Mrpl28; Mrpl30; Mrpl27; Mrpl52; Mrps14; Mrpl33; Mrpl47; Mrpl1; Mrps17; Mrpl3; Mrps23; Mrps22; Mrps11; Mrpl11; Chchd1; Mrpl2; Mrpl20; Mrpl14; Mrpl48; Mrpl24; Mrps18c; Mrps28; Mrpl19; Mrpl9; Mrpl41; Mrpl58; Mrpl10; Gadd45gip1","liver","RR-8","GLDS-379"
"MITOCARTA_MITOCHONDRIAL_CENTRAL_DOGMA_TRANSLATION_MITOCHONDRIAL_RIBOSOME_ASSEMBLY",0.171084337349398,0.264403066812705,0.165656695205483,0.388941317700343,1.22320129533139,24,"mitocarta","Fastkd2; Ngrn; Gtpbp10; Eral1; Nsun4; Mterf3; Mrm2; Mtg1; Mettl17; Malsu1; Noa1","liver","RR-8","GLDS-379"
"MITOCARTA_MITOCHONDRIAL_CENTRAL_DOGMA_TRANSLATION_MT_TRNA_SYNTHETASES",0.492788461538462,0.598385989010989,0.0899860794997137,0.32737417026147,0.969161988753201,20,"mitocarta","Mars2; Nars2; Hars2; Yars2; Ears2; Qrsl1; Iars2; Aars2; Cars2","liver","RR-8","GLDS-379"
"MITOCARTA_MITOCHONDRIAL_CENTRAL_DOGMA_TRANSLATION_TRANSLATION_FACTORS",0.278388278388278,0.394383394383394,0.107972360317345,-0.444754933130901,-1.16166003313681,15,"mitocarta","Hemk1; Mtrf1l; Gfm1; Gfm2; Taco1; Mrrf; Mtif3","liver","RR-8","GLDS-379"
"MITOCARTA_MITOCHONDRIAL_DYNAMICS_AND_SURVEILLANCE_APOPTOSIS",0.0047629766062536,0.0202426505765778,0.407017918923954,0.504854447570218,1.7500115301759,34,"mitocarta","Bik; Bok; Endog; Chchd2; Bnip3; Ifi27; Styxl1; Aifm1; Bcl2l11; Pmaip1; Bax; Bcl2a1d","liver","RR-8","GLDS-379"
"MITOCARTA_MITOCHONDRIAL_DYNAMICS_AND_SURVEILLANCE_AUTOPHAGY",0.559164733178654,0.633720030935808,0.0810802057550866,0.324211421701532,0.927783189708007,17,"mitocarta","Rab24; Parl; Fundc1; Tomm7","liver","RR-8","GLDS-379"
"MITOCARTA_MITOCHONDRIAL_DYNAMICS_AND_SURVEILLANCE_FISSION",0.836996336996337,0.888077858880779,0.0497903187820785,-0.275070910488205,-0.718460570506261,15,"mitocarta","Mief1; Stx17; Slc25a46; Mul1; Mtfr2; Armc10; Oma1; Mtfp1; Dnm1l","liver","RR-8","GLDS-379"
"MITOCARTA_OXPHOS_COMPLEX_IV_CIV_ASSEMBLY_FACTORS",0.0192984213911003,0.0468675948069578,0.352487857583619,0.483132811517245,1.57211497344585,28,"mitocarta","Coa6; Cox11; Cmc1; Pet100; Higd1a; Cox19; Cox18; Smim20; Cox14; Cox17; Coa3; Tmem177","liver","RR-8","GLDS-379"
"MITOCARTA_OXPHOS_COMPLEX_IV_CIV_SUBUNITS",0.0696055684454756,0.136752136752137,0.261663521711573,0.497446042332944,1.42352195194455,17,"mitocarta","Cox5a; Cox7b; Cox4i1; Ndufa4; Cox7a2; Cox5b; Cox7c","liver","RR-8","GLDS-379"
"MITOCARTA_OXPHOS_COMPLEX_I_CI_ASSEMBLY_FACTORS",0.0102150452621005,0.0315737762646744,0.380730400722792,0.56299240564743,1.69712423878284,21,"mitocarta","Nubpl; Ndufaf8; Tmem70; Aifm1; Tmem186; Ndufaf4; Dmac1; Ndufaf3; Ndufaf5; Tmem126a; Tmem126b","liver","RR-8","GLDS-379"
"MITOCARTA_OXPHOS_COMPLEX_I_CI_SUBUNITS",5.57010551565172e-05,0.000631278625107195,0.557332238758646,0.617880489193169,2.13982932975647,35,"mitocarta","Ndufa7; Ndufb6; Ndufc2; Ndufa2; Ndufab1; Ndufs4; Ndufb2; Ndufa11; Ndufv1; Ndufc1; Ndufs3; Ndufb8; Ndufb7; Ndufb11; Ndufa6; Ndufa9; Ndufb10; Ndufs8; Ndufv3; Ndufs2; Ndufb9; Ndufs5","liver","RR-8","GLDS-379"
"MITOCARTA_OXPHOS_OXPHOS_ASSEMBLY_FACTORS",0.000301632895318523,0.00205110368816595,0.49849310876659,0.460827823748544,1.83286842578024,66,"mitocarta","Nubpl; Fmc1; Ndufaf8; Coa6; Cox11; Cmc1; Uqcc2; Sdhaf4; Pet100; Higd1a; Rab5if; Tmem70; Aifm1; Cox19; Tmem186; Cox18; Sdhaf3; Smim20; Cox14; Cox17; Coa3; Ndufaf4","liver","RR-8","GLDS-379"
"MITOCARTA_OXPHOS_OXPHOS_SUBUNITS",8.02310817731048e-09,2.72785678028556e-07,0.747739663149885,0.595957619237512,2.38890435208281,69,"mitocarta","Sdhd; Ndufa7; Ndufb6; Ndufc2; Ndufa2; Ndufab1; Ndufs4; Ndufb2; Ndufa11; Uqcrfs1; Ndufv1; Ndufc1; Cox5a; Uqcr11; Uqcr10; Cox7b; Ndufs3; Cox4i1; Sdhb; Ndufb8; Uqcrq; Ndufb7; Ndufb11; Ndufa4; Cox7a2; Cox5b; Sdhc; Cox7c; Hccs; Cyc1; Ndufa6; Ndufa9; Uqcrc1; Ndufb10; Atp5pb; Ndufs8; Ndufv3; Dmac2l; Ndufs2; Cox6b2; Ndufb9; Cox6a1; Ndufs5; Uqcrh","liver","RR-8","GLDS-379"
"MITOCARTA_PROTEIN_IMPORT_SORTING_AND_HOMEOSTASIS_PROTEIN_HOMEOSTASIS_PROTEASES",0.152334152334152,0.246636246636247,0.178219874951973,0.380543237344635,1.23828832820166,28,"mitocarta","Immp2l; Parl; Yme1l1; Afg3l1; Immp1l; Nln; Clpp; Metap1d; Atad1; Atp23","liver","RR-8","GLDS-379"
"MITOCARTA_SMALL_MOLECULE_TRANSPORT_SLC25A_FAMILY",0.664102564102564,0.728370554177006,0.077274697304471,0.241495610725321,0.89685474087814,49,"mitocarta","Slc25a47; Slc25a33; Slc25a5; Slc25a31; Slc25a24; Slc25a26; Slc25a38; Slc25a13; Slc25a29; Slc25a11; Ucp2; Slc25a20; Slc25a16; Slc25a40; Ucp1; Slc25a35; Slc25a48; Slc25a36; Slc25a15; Slc25a3; Slc25a2; Slc25a10; Slc25a21","liver","RR-8","GLDS-379"
