"pathway","pval","padj","log2err","ES","NES","size","db","leadingEdge_str","tissue","mission","glds"
"MITOCARTA_METABOLISM_AMINO_ACID_METABOLISM_BRANCHED_CHAIN_AMINO_ACID_METABOLISM",0.634920634920635,0.991189427312775,0.0609039347452418,-0.283558637376849,-0.894379429280302,25,"mitocarta","Acad8; Bckdhb; Etfb; Etfa; Dbt; Echs1; Mccc2; Auh; Hsd17b10; Ivd; Bcat2; Etfdh; Acadsb; Hadha","gastrocnemius","RR-1","GLDS-101"
"MITOCARTA_METABOLISM_AMINO_ACID_METABOLISM_GLYCINE_METABOLISM",0.967272727272727,0.991189427312775,0.042845050912155,-0.205501618122977,-0.564140928409923,15,"mitocarta","Etfb; Etfa; Slc25a38; Etfdh; Gcat; Amt; Aldh7a1; Dld; Shmt2; Glyat; Gcsh; Gldc; Dmgdh; Chdh; Sardh","gastrocnemius","RR-1","GLDS-101"
"MITOCARTA_METABOLISM_AMINO_ACID_METABOLISM_LYSINE_METABOLISM",0.619223659889094,0.991189427312775,0.0643583367917361,-0.316603359294834,-0.882820728207882,16,"mitocarta","Etfb; Etfa; Slc25a29; Echs1; Dlst","gastrocnemius","RR-1","GLDS-101"
"MITOCARTA_METABOLISM_CARBOHYDRATE_METABOLISM_TCA_CYCLE",0.187845303867403,0.516574585635359,0.135740943810425,-0.418271598905954,-1.23194418096672,20,"mitocarta","Suclg1; Mrps36; Cs; Idh3g; Mdh2; Dlst; Sdhb; Sdhc; Aco2; Fh1; Sdhd; Idh3b; Idh3a","gastrocnemius","RR-1","GLDS-101"
"MITOCARTA_METABOLISM_DETOXIFICATION_ROS_AND_GLUTATHIONE_METABOLISM",0.991189427312775,0.991189427312775,0.0504983044100709,0.165958032665202,0.543032298096689,27,"mitocarta","Aldh9a1; Prxl2a; Aifm2; Cat; Mgst1; Aldh3a2; Txnrd1; Gpx4","gastrocnemius","RR-1","GLDS-101"
"MITOCARTA_METABOLISM_DETOXIFICATION_XENOBIOTIC_METABOLISM",0.970749542961609,0.991189427312775,0.0429311093452583,-0.189981249447404,-0.573591635635446,22,"mitocarta","Abhd10; Akr7a5; Gstk1; Cyb5b; Akr1b10","gastrocnemius","RR-1","GLDS-101"
"MITOCARTA_METABOLISM_LIPID_METABOLISM",0.876122082585278,0.991189427312775,0.046788296531803,-0.223508907985541,-0.693862273599723,24,"mitocarta","Acot7; Hao2; Acot10; Them4; Acot9; Hsd17b4; Echdc1; Acot13","gastrocnemius","RR-1","GLDS-101"
"MITOCARTA_METABOLISM_LIPID_METABOLISM_FATTY_ACID_OXIDATION",0.438799076212471,0.851786442059503,0.0943563635421779,0.271110105682998,1.00598999208985,44,"mitocarta","Acss1; Acad10; Cpt1a; Acsf2; Acsm3; Cpt1c; Acad12; Acsm5; Acsl6; Acacb","gastrocnemius","RR-1","GLDS-101"
"MITOCARTA_METABOLISM_LIPID_METABOLISM_PHOSPHOLIPID_METABOLISM",0.114545454545455,0.354545454545455,0.176694268938498,-0.440187136547405,-1.35274005631994,23,"mitocarta","Prelid3b; Sphk2; Agpat5; Serac1; Osbpl1a","gastrocnemius","RR-1","GLDS-101"
"MITOCARTA_METABOLISM_METALS_AND_COFACTORS_FE_S_CLUSTER_BIOSYNTHESIS",0.986725663716814,0.991189427312775,0.0509082865515105,0.17539912206777,0.548307045537831,23,"mitocarta","Fdxr; Bola1; Isca2; Fdx2; Iba57; Nfs1; Iscu","gastrocnemius","RR-1","GLDS-101"
"MITOCARTA_METABOLISM_METALS_AND_COFACTORS_FE_S_CONTAINING_PROTEINS",0.908925318761384,0.991189427312775,0.04577044581081,-0.21088541618215,-0.698464860811039,31,"mitocarta","Ndufs2; Fdx1; Cisd3; Cisd1; Ndufs1; Uqcrfs1; Nthl1; Glrx5; Sdhb; Glrx2; Ndufv2; Ndufs7; Aco2; Ndufs8; Abat; Nfu1; Ndufv1","gastrocnemius","RR-1","GLDS-101"
"MITOCARTA_METABOLISM_METALS_AND_COFACTORS_HEME_SYNTHESIS_AND_PROCESSING",0.10720887245841,0.354545454545455,0.184706471207739,-0.487153516942057,-1.35838490006456,16,"mitocarta","Cox10; Abcb10; Fdx1; Hccs; Abcb6; Alas1; Alas2","gastrocnemius","RR-1","GLDS-101"
"MITOCARTA_METABOLISM_NUCLEOTIDE_METABOLISM_NUCLEOTIDE_SYNTHESIS_AND_PROCESSING",0.0490909090909091,0.2025,0.276500599254472,-0.481981483341683,-1.48117835526659,23,"mitocarta","Paics; Ak3; Suclg1; Cmpk2; Nudt2; Ak4; Dguok; Dut; Nudt9; Nt5dc2; Hint1","gastrocnemius","RR-1","GLDS-101"
"MITOCARTA_METABOLISM_VITAMIN_METABOLISM_FOLATE_AND_1_C_METABOLISM",0.656307129798903,0.991189427312775,0.0610363728309177,-0.28674423165064,-0.865738557462507,22,"mitocarta","Aldh1l2; Slc25a32; Qdpr; Mthfs","gastrocnemius","RR-1","GLDS-101"
"MITOCARTA_MITOCHONDRIAL_CENTRAL_DOGMA_MTRNA_METABOLISM_MTRNA_GRANULES",0.35948905109489,0.790875912408759,0.0922597260527354,-0.335398546581739,-1.07611718157615,27,"mitocarta","Rmnd1; Mrm2; Noa1; Ptcd2; Pus1; Tfb1m; Mrm1; Ddx28; Fastk; Mrps7; Fastkd1; Prorp; Mrpl47; Grsf1; Eral1; Hsd17b10","gastrocnemius","RR-1","GLDS-101"
"MITOCARTA_MITOCHONDRIAL_CENTRAL_DOGMA_MTRNA_METABOLISM_MTRNA_STABILITY_AND_DECAY",0.553308823529412,0.991189427312775,0.0696133438850965,-0.328833392550626,-0.929437783352392,17,"mitocarta","Rnaseh1; Pde12; Fastk; Endog; Lactb2; Fastkd1; Grsf1; Pnpt1; Mtpap; Lrpprc; Tbrg4; Slirp; Supv3l1","gastrocnemius","RR-1","GLDS-101"
"MITOCARTA_MITOCHONDRIAL_CENTRAL_DOGMA_MTRNA_METABOLISM_MT_RRNA_MODIFICATIONS",0.825367647058823,0.991189427312775,0.0506004243853618,-0.264627195195676,-0.747960880157765,17,"mitocarta","Mrm2; Trmt2b; Mrm3; Tfb1m; Mrm1","gastrocnemius","RR-1","GLDS-101"
"MITOCARTA_MITOCHONDRIAL_CENTRAL_DOGMA_MTRNA_METABOLISM_MT_TRNA_MODIFICATIONS",0.692449355432781,0.991189427312775,0.0588438169595807,-0.281728950753693,-0.829782233359115,20,"mitocarta","Nsun2; Trmt2b; Thg1l; Cdk5rap1; Pus1","gastrocnemius","RR-1","GLDS-101"
"MITOCARTA_MITOCHONDRIAL_CENTRAL_DOGMA_TRANSLATION_MITOCHONDRIAL_RIBOSOME",6.972623999496e-05,0.000932523154214089,0.538434096309916,-0.46486737935102,-1.90637646069421,83,"mitocarta","Mrpl45; Mrpl12; Mrpl15; Mrpl10; Mrpl34; Mrps27; Mrps14; Mrps11; Mrps5; Mrpl1; Mrpl46; Mrps36; Mrpl35; Mrps12; Mrpl23; Mrps22; Ptcd3; Mrpl37; Mrpl19; Mrpl48; Mrpl43; Mrps28; Mrpl27; Mrpl50; Mrps35; Mrps34; Dap3; Mrpl33; Mrpl40; Mrpl55; Mrpl54; Mrpl42; Mrpl14; Mrps2; Mrpl4; Mrpl13; Chchd1; Mrpl22; Mrps7; Mrpl58; Mrps6; Mrps30; Mrpl38; Mrps18b; Mrps24; Mrps18c; Mrpl2; Mrpl53; Mrpl20; Mrpl47; Aurkaip1; Mrpl44","gastrocnemius","RR-1","GLDS-101"
"MITOCARTA_MITOCHONDRIAL_CENTRAL_DOGMA_TRANSLATION_MITOCHONDRIAL_RIBOSOME_ASSEMBLY",0.421903052064632,0.851786442059503,0.0824344091527096,-0.328035618862869,-1.01835556523146,24,"mitocarta","Mrm2; Noa1; Gtpbp10; Ptcd3; Mrm3; Tfb1m; Mief1; Rbfa; Ddx28; Mpv17l2; Mtg2; Grsf1; Nsun4; Eral1; Mettl17; Mtg1","gastrocnemius","RR-1","GLDS-101"
"MITOCARTA_MITOCHONDRIAL_CENTRAL_DOGMA_TRANSLATION_MT_TRNA_SYNTHETASES",0.871086556169429,0.991189427312775,0.0482149710025564,-0.23866695583026,-0.7029508295404,20,"mitocarta","Pars2; Qrsl1; Mars2; Dars2; Gatc; Yars2","gastrocnemius","RR-1","GLDS-101"
"MITOCARTA_MITOCHONDRIAL_CENTRAL_DOGMA_TRANSLATION_TRANSLATION_FACTORS",0.118181818181818,0.354545454545455,0.173747838999571,-0.486972878696593,-1.33683293789905,15,"mitocarta","Tsfm; Coa3; Timm21; Taco1; Mtrf1l; Cox14; Gfm1; Mrpl58","gastrocnemius","RR-1","GLDS-101"
"MITOCARTA_MITOCHONDRIAL_DYNAMICS_AND_SURVEILLANCE_APOPTOSIS",0.827272727272727,0.991189427312775,0.0499913914024592,-0.231689270797952,-0.773664511611304,33,"mitocarta","Sphk2; Aifm1; Casp3; Septin4; Bik; Bak1; Bad; Chchd2; Pmaip1; Ifi27; Bcl2l13; Bcl2l10; Endog","gastrocnemius","RR-1","GLDS-101"
"MITOCARTA_MITOCHONDRIAL_DYNAMICS_AND_SURVEILLANCE_AUTOPHAGY",0.990808823529412,0.991189427312775,0.0422468188360053,-0.18859398839082,-0.533055287250256,17,"mitocarta","Marchf5; Fkbp8; Bcl2l13; Parl","gastrocnemius","RR-1","GLDS-101"
"MITOCARTA_MITOCHONDRIAL_DYNAMICS_AND_SURVEILLANCE_FISSION",0.241818181818182,0.613846153846154,0.116739204791222,-0.432637015593631,-1.18767068537355,15,"mitocarta","Slc25a46; Mtfp1; Spire1; Dnm1l; Mff; Mief1; Mtfr1; Oma1; Mtfr2","gastrocnemius","RR-1","GLDS-101"
"MITOCARTA_OXPHOS_COMPLEX_IV_CIV_ASSEMBLY_FACTORS",0.0263932126164962,0.145162669390729,0.352487857583619,-0.481628351828012,-1.56026673461846,28,"mitocarta","Cox10; Cox11; Higd1a; Sco2; Cmc2; Coa3; Coa5; Timm21; Taco1; Tmem177; Coa7; Cox17","gastrocnemius","RR-1","GLDS-101"
"MITOCARTA_OXPHOS_COMPLEX_IV_CIV_SUBUNITS",0.299632352941176,0.706276260504202,0.103576326612592,-0.398010858777298,-1.1249658298471,17,"mitocarta","Cox7a2; Cox5a; Cox4i1; Cox6c; Cox5b; Cox7b; Ndufa4; Cox7c; Cox7a1","gastrocnemius","RR-1","GLDS-101"
"MITOCARTA_OXPHOS_COMPLEX_I_CI_ASSEMBLY_FACTORS",0.0144916190150882,0.0956446854995821,0.380730400722792,-0.545830410798228,-1.62987694471396,21,"mitocarta","Ndufaf4; Ndufaf3; Timmdc1; Aifm1; Ndufaf2; Tmem70; Lyrm2; Acad9; Foxred1; Dmac2; Tmem126b","gastrocnemius","RR-1","GLDS-101"
"MITOCARTA_OXPHOS_COMPLEX_I_CI_SUBUNITS",8.47748322012808e-05,0.000932523154214089,0.538434096309916,-0.590365992660251,-2.02209389424122,35,"mitocarta","Ndufs2; Ndufa3; Ndufs4; Ndufa8; Ndufb6; Ndufb2; Ndufb11; Ndufc2; Ndufa11; Ndufa1; Ndufb5; Ndufa6; Ndufv3; Ndufa2; Ndufb10; Ndufa9; Ndufa12; Ndufb8; Ndufs1; Ndufc1; Ndufs3; Ndufb7; Ndufv2; Ndufs7; Ndufb9; Ndufs8; Ndufab1","gastrocnemius","RR-1","GLDS-101"
"MITOCARTA_OXPHOS_OXPHOS_ASSEMBLY_FACTORS",0.000162903164880844,0.00134395111026696,0.518848077743792,-0.479313775416017,-1.88714738766823,66,"mitocarta","Ndufaf4; Cox10; Ttc19; Rab5if; Cox11; Ndufaf3; Higd1a; Atpsckmt; Sco2; Cmc2; Timmdc1; Aifm1; Ndufaf2; Coa3; Tmem70; Fmc1; Lyrm2; Acad9; Coa5; Atpaf2; Timm21; Taco1; Tmem177; Coa7; Cox17; Foxred1; Dmac2; Coa8","gastrocnemius","RR-1","GLDS-101"
"MITOCARTA_OXPHOS_OXPHOS_SUBUNITS",4.25631265625271e-06,0.00014045831765634,0.610526878385931,-0.525786515807717,-2.07955390058383,69,"mitocarta","Ndufs2; Hccs; Ndufa3; Ndufs4; Ndufa8; Cox7a2; Ndufb6; Cyc1; Ndufb2; Ndufb11; Cox5a; Ndufc2; Ndufa11; Uqcrq; Cox4i1; Ndufa1; Ndufb5; Ndufa6; Ndufv3; Cox6c; Ndufa2; Cox5b; Ndufb10; Uqcrc1; Uqcrh; Cox7b; Ndufa4; Uqcrb; Ndufa9; Uqcr11; Ndufa12; Ndufb8; Cox7c; Cox7a1; Ndufs1; Ndufc1; Atp5pb; Uqcrfs1; Ndufs3; Sdhb; Cycs; Uqcrc2; Sdhc; Ndufb7; Ndufv2; Dmac2l; Ndufs7; Ndufb9; Ndufs8; Sdhd; Ndufab1","gastrocnemius","RR-1","GLDS-101"
"MITOCARTA_PROTEIN_IMPORT_SORTING_AND_HOMEOSTASIS_PROTEIN_HOMEOSTASIS_PROTEASES",0.981718464351006,0.991189427312775,0.0424170054438747,-0.181431036454914,-0.587757779901295,28,"mitocarta","Immp2l; Afg1l; Casp3; Xpnpep3; Clpb; Atad1; Atp23; Parl; Oma1; Htra2","gastrocnemius","RR-1","GLDS-101"
"MITOCARTA_SMALL_MOLECULE_TRANSPORT_SLC25A_FAMILY",0.0352093666778998,0.165987014338671,0.321775918075361,-0.401211397790867,-1.48374913265325,47,"mitocarta","Slc25a36; Slc25a19; Slc25a32; Slc25a37; Slc25a46; Slc25a24; Ucp2; Slc25a12; Mtch1; Slc25a30; Slc25a11; Slc25a48; Slc25a3; Slc25a45; Mtch2; Slc25a29; Slc25a23","gastrocnemius","RR-1","GLDS-101"
