"pathway","pval","padj","log2err","ES","NES","size","db","leadingEdge_str","tissue","mission","glds"
"KEGG_MEDICUS_VARIANT_MUTATION_CAUSED_ABERRANT_SNCA_TO_ELECTRON_TRANSFER_IN_COMPLEX_I",0.108597285067873,0.454605480356553,0.204294756516886,-0.362064644503493,-1.33758974008708,38,"kegg","Ndufa3; Ndufb7; Ndufs5; Ndufs3; Ndufv3; Ndufa13; Ndufa11; Ndufa5; Ndufs2; Ndufb11; Ndufv1; Ndufa10; Ndufs8; Ndufa7","gastrocnemius","RR-9","GLDS-326"
"KEGG_MEDICUS_VARIANT_MUTATION_CAUSED_ABERRANT_SOD1_TO_26S_PROTEASOME_MEDIATED_PROTEIN_DEGRADATION",0.000531673402283308,0.0229682909786389,0.477270815362862,-0.524473555589539,-1.96155579675452,40,"kegg","Ubc; Psmd9; Psmc4; Psmc3; Sem1; Psmd4; Psmb3; Psmb6; Psmd2; Psmd11; Psmc5; Uba52; Psmd1; Psmb5; Psmb4; Psmb1; Adrm1","gastrocnemius","RR-9","GLDS-326"
"KEGG_MEDICUS_VARIANT_MUTATION_CAUSED_ABERRANT_SOD1_TO_RETROGRADE_AXONAL_TRANSPORT",0.625,0.775862068965517,0.0714786287425507,-0.271424695749535,-0.881386882354295,24,"kegg","Dctn5; Actr1a; Dctn6; Dctn2; Actr10; Dnah2; Dnah9; Dnah8; Dctn3; Sod1","gastrocnemius","RR-9","GLDS-326"
"KEGG_MEDICUS_VARIANT_MUTATION_CAUSED_ABERRANT_TDP43_TO_ELECTRON_TRANSFER_IN_COMPLEX_I",0.15158371040724,0.527024029574861,0.170932335370056,-0.338370429936225,-1.25005526582748,38,"kegg","Ndufa3; Ndufb7; Ndufs5; Ndufs3; Ndufv3; Ndufa13; Ndufa11; Ndufa5; Ndufs2; Ndufb11; Ndufv1; Ndufa10; Ndufs8; Ndufa7","gastrocnemius","RR-9","GLDS-326"
"KEGG_MEDICUS_VARIANT_MUTATION_INACTIVATED_ATP1A1_TO_ANGIOTENSIN_ALDOSTERONE_SIGNALING_PATHWAY",0.00674454936800635,0.104058761677812,0.407017918923954,-0.528775150396617,-1.71707102770252,24,"kegg","Calm3; Atf6b; Calm1; Camk2b; Camk2a; Creb3; Camk1; Creb1; Camk4; Cacna1h; Atf4; Atp1a1","gastrocnemius","RR-9","GLDS-326"
"KEGG_MEDICUS_VARIANT_MUTATION_INACTIVATED_ATP2B3_TO_ANGIOTENSIN_ALDOSTERONE_SIGNALING_PATHWAY",0.00262955446262306,0.0567983763926582,0.431707695803346,-0.557855224271648,-1.76894035576727,22,"kegg","Calm3; Atf6b; Calm1; Camk2b; Camk2a; Creb3; Camk1; Creb1; Camk4","gastrocnemius","RR-9","GLDS-326"
"KEGG_MEDICUS_VARIANT_MUTATION_INACTIVATED_PDE11A_PDE8B_TO_ACTH_CORTISOL_SIGNALING_PATHWAY",0.0909090909090909,0.446280991735537,0.219250346703755,-0.462703002379385,-1.39864333829957,18,"kegg","Atf6b; Pbx1; Prkaca; Creb3; Nr4a1; Creb1","gastrocnemius","RR-9","GLDS-326"
"KEGG_MEDICUS_VARIANT_MUTATION_INACTIVATED_PINK1_TO_ELECTRON_TRANSFER_IN_COMPLEX_I",0.115384615384615,0.461538461538462,0.197822021315103,-0.356241737021903,-1.31607794261364,38,"kegg","Ndufa3; Ndufb7; Ndufs5; Ndufs3; Ndufv3; Ndufa13; Ndufa11; Ndufa5; Ndufs2; Ndufb11; Ndufv1; Ndufa10; Ndufs8; Ndufa7","gastrocnemius","RR-9","GLDS-326"
"KEGG_MEDICUS_VARIANT_MUTATION_INACTIVATED_PRKAR1A_TO_ACTH_CORTISOL_SIGNALING_PATHWAY",0.0759219088937093,0.42049057233439,0.241339976815091,-0.493816844317296,-1.45189331412805,16,"kegg","Atf6b; Pbx1; Prkaca; Creb3; Nr4a1; Creb1","gastrocnemius","RR-9","GLDS-326"
"KEGG_MEDICUS_VARIANT_MUTATION_INACTIVATED_PTCH1_TO_HEDGEHOG_SIGNALING_PATHWAY",0.602968460111317,0.773406315242907,0.0658311958368866,0.285239634209028,0.883079355074672,21,"kegg","Ptch1; Wnt10b; Wnt7b; Wnt9a; Gli3; Wnt5a; Wnt2","gastrocnemius","RR-9","GLDS-326"
"KEGG_MEDICUS_VARIANT_MUTATION_INACTIVATED_RASD1_TO_CRHR_PKA_ACTH_SIGNALING_PATHWAY",0.421739130434783,0.684929715593331,0.0931454575337804,-0.309829450607722,-1.02411053704521,26,"kegg","Adcy2; Atf6b; Prkaca; Creb3; Adcy9; Adcy3; Creb1; Adcy8","gastrocnemius","RR-9","GLDS-326"
"KEGG_MEDICUS_VARIANT_MUTATION_INACTIVATED_UBQLN2_TO_26S_PROTEASOME_MEDIATED_PROTEIN_DEGRADATION",0.000363232778118186,0.0229682909786389,0.49849310876659,-0.523401754893949,-1.94428332800097,39,"kegg","Ubc; Psmd9; Psmc4; Psmc3; Sem1; Psmd4; Psmb3; Psmb6; Psmd2; Psmd11; Psmc5; Uba52; Psmd1; Psmb5; Psmb4; Psmb1; Adrm1","gastrocnemius","RR-9","GLDS-326"
"KEGG_MEDICUS_VARIANT_MUTATION_INACTIVATED_VCP_TO_26S_PROTEASOME_MEDIATED_PROTEIN_DEGRADATION",0.000146426653380349,0.0158140785650777,0.518848077743792,-0.542668344244869,-2.0158530316028,39,"kegg","Ubc; Psmd9; Psmc4; Psmc3; Sem1; Psmd4; Psmb3; Psmb6; Psmd2; Psmd11; Psmc5; Uba52; Psmd1; Psmb5; Psmb4; Psmb1; Adrm1","gastrocnemius","RR-9","GLDS-326"
"KEGG_MEDICUS_VARIANT_SCRAPIE_CONFORMATION_PRPSC_TO_26S_PROTEASOME_MEDIATED_PROTEIN_DEGRADATION",0.00089471276878717,0.0271924457544478,0.477270815362862,-0.513511190022377,-1.85058816501691,35,"kegg","Psmd9; Psmc4; Psmc3; Sem1; Psmd4; Psmb3; Psmb6; Psmd2; Psmd11; Psmc5; Psmd1; Psmb5; Psmb4; Psmb1; Adrm1","gastrocnemius","RR-9","GLDS-326"
"KEGG_MEDICUS_VARIANT_SCRAPIE_CONFORMATION_PRPSC_TO_MGLUR5_CA2_APOPTOTIC_PATHWAY",0.159259259259259,0.527024029574861,0.149207542435322,0.433668302976845,1.28500709790523,18,"kegg","Slc25a5; Apaf1; Vdac1; Slc25a4; Cycs; Itpr3; Vdac2","gastrocnemius","RR-9","GLDS-326"
"KEGG_MEDICUS_VARIANT_SCRAPIE_CONFORMATION_PRPSC_TO_TRANSPORT_OF_CALCIUM",0.0109383981490106,0.146514776371336,0.380730400722792,0.592611641200585,1.71444576475205,16,"kegg","Slc25a5; Apaf1; Grin2d; Vdac1; Slc25a4; Cycs","gastrocnemius","RR-9","GLDS-326"
