"pathway","pval","padj","log2err","ES","NES","size","db","leadingEdge_str","tissue","mission","glds"
"KEGG_MEDICUS_ENV_FACTOR_ARSENIC_TO_ELECTRON_TRANSFER_IN_COMPLEX_IV",0.281535648994516,0.608117001828154,0.107140237276725,0.390811501826056,1.14623176351492,17,"kegg","Cox5a; Cox6c; Cox7a2; Gsto1","gastrocnemius","RR-9","GLDS-326"
"KEGG_MEDICUS_ENV_FACTOR_DCE_TO_DNA_ADDUCTS",0.0641025641025641,0.414212586002104,0.261663521711573,-0.519152097368953,-1.49202593057825,15,"kegg","Gstm2; Gstm1; Gstm7; Gstp2","gastrocnemius","RR-9","GLDS-326"
"KEGG_MEDICUS_ENV_FACTOR_E2_TO_RAS_ERK_SIGNALING_PATHWAY",0.353579175704989,0.647229677561675,0.103576326612592,-0.367690300413725,-1.08106293858498,16,"kegg","Fos; Raf1; Braf; Nras; Hras; Map2k2; Mapk3","gastrocnemius","RR-9","GLDS-326"
"KEGG_MEDICUS_ENV_FACTOR_IRON_TO_ANTEROGRADE_AXONAL_TRANSPORT",0.641025641025641,0.777873811581677,0.0697792517076235,-0.30296800055696,-0.870719997583242,15,"kegg","Mapt; Cdk5; Tuba8; Tubb4a","gastrocnemius","RR-9","GLDS-326"
"KEGG_MEDICUS_ENV_FACTOR_METALS_TO_NFKB_SIGNALING_PATHWAY",0.951310861423221,0.977165015079707,0.0449543067640062,0.212413721387376,0.600085415626867,15,"kegg","Ptpn11; Src; Prkd3; Abl1; Nfkb1; Prkd1","gastrocnemius","RR-9","GLDS-326"
"KEGG_MEDICUS_ENV_FACTOR_NNK_NNN_TO_RAS_ERK_SIGNALING_PATHWAY",0.318872017353579,0.624923359901901,0.110122263835536,-0.376883667016384,-1.10809277294226,16,"kegg","Fos; Raf1; Braf; Nras; Hras; Map2k2; Mapk3","gastrocnemius","RR-9","GLDS-326"
"KEGG_MEDICUS_ENV_FACTOR_TCDD_TO_AHR_SIGNALING_PATHWAY",0.109442060085837,0.454605480356553,0.197822021315103,-0.449079927999505,-1.37384562656646,19,"kegg","Gstm2; Gstm1; Gstm7","gastrocnemius","RR-9","GLDS-326"
"KEGG_MEDICUS_ENV_FACTOR_ZN_TO_ANTEROGRADE_AXONAL_TRANSPORT",0.408119658119658,0.679063545150502,0.0940503465727813,-0.357564653816923,-1.02762897050176,15,"kegg","Gsk3b; Mapt","gastrocnemius","RR-9","GLDS-326"
"KEGG_MEDICUS_PATHOGEN_ESCHERICHIA_EAE_TIR_TO_ACTIN_SIGNALING_PATHWAY",0.224862888482633,0.55452865064695,0.122107920287081,0.413608900019459,1.21309546075177,17,"kegg","Wipf1; Nck1; Wasl; Actr2; Actg1; Actr3; Arpc5; Arpc1b","gastrocnemius","RR-9","GLDS-326"
"KEGG_MEDICUS_PATHOGEN_HBV_HBX_TO_RAS_ERK_SIGNALING_PATHWAY",0.288389513108614,0.60941000746826,0.107140237276725,0.401172653484359,1.13334419703172,15,"kegg","Sos2; Mapk1; Grb2; Src; Kras; Map2k1","gastrocnemius","RR-9","GLDS-326"
"KEGG_MEDICUS_PATHOGEN_HCMV_GB_TO_PDGFR_RAS_ERK_SIGNALING_PATHWAY",0.361423220973783,0.656028703616278,0.0934449219410994,0.374059181251137,1.05674651234407,15,"kegg","Sos2; Mapk1; Grb2; Kras; Map2k1; Pdgfra; Sos1","gastrocnemius","RR-9","GLDS-326"
"KEGG_MEDICUS_PATHOGEN_HCMV_UL33_TO_GNAI_AC_PKA_SIGNALING_PATHWAY",0.244060475161987,0.566850135860099,0.128142916898415,-0.353510507341645,-1.1570778452519,25,"kegg","Adcy2; Atf6b; Prkaca; Creb3; Adcy9; Adcy3; Creb1; Adcy8","gastrocnemius","RR-9","GLDS-326"
"KEGG_MEDICUS_PATHOGEN_HCMV_UL33_TO_GNB_G_RHO_SIGNALING_PATHWAY",0.489655172413793,0.729417360285375,0.0878312634480124,-0.282411738978889,-0.969978434746848,31,"kegg","Gng2; Atf6b; Gng7; Creb3; Gnb2; Gng11; Creb1; Gng12; Mapk12; Atf4; Gngt2; Gng10; Gng4","gastrocnemius","RR-9","GLDS-326"
"KEGG_MEDICUS_PATHOGEN_HCMV_US28_TO_GNAQ_PLCB_G_CALCINEURIN_SIGNALING_PATHWAY",0.0360172747779653,0.338249189219152,0.321775918075361,-0.52470402339562,-1.54781835499481,17,"kegg","Calm3; Nfatc2; Calm1; Nfatc1; Plcb3; Nfatc4; Ptgs2; Plcb1","gastrocnemius","RR-9","GLDS-326"
"KEGG_MEDICUS_PATHOGEN_HCMV_US28_TO_GNB_G_PI3K_NFKB_SIGNALING_PATHWAY",0.0989010989010989,0.454605480356553,0.211400189384923,-0.405376134305095,-1.35930574522659,28,"kegg","Gng2; Akt2; Gng7; Pik3ca; Gnb2; Pik3cd; Gng11; Rela; Gng12; Ikbkg; Gngt2; Gng10; Gng4; Nfkbia","gastrocnemius","RR-9","GLDS-326"
"KEGG_MEDICUS_PATHOGEN_HIV_GP120_TO_CXCR4_GNAQ_PLCB_G_CALCINEURIN",0.171366594360087,0.527024029574861,0.156312403073186,-0.438236275903819,-1.28847836260583,16,"kegg","Calm3; Nfatc2; Calm1; Nfatc1; Nfatc4; Nfatc3; Ccr5","gastrocnemius","RR-9","GLDS-326"
"KEGG_MEDICUS_PATHOGEN_HIV_GP120_TO_CXCR4_GNB_G_RAC_SIGNALING_PATHWAY",0.665948275862069,0.788659793814433,0.0683110858318647,-0.262619079801,-0.852792747370902,24,"kegg","Gng2; Gng7; Gnb2; Gng11; Gng12; Cfl1; Ccr5; Gngt2; Rac1; Gng10; Gng4","gastrocnemius","RR-9","GLDS-326"
"KEGG_MEDICUS_PATHOGEN_HIV_GP120_TO_TNF_NFKB_SIGNALING_PATHWAY",0.873931623931624,0.943846153846154,0.0549073703290958,-0.239823322206158,-0.6892442837127,15,"kegg","Map3k7; Traf2; Rela; Tab1; Ikbkg; Tnfrsf1a; Nfkbia","gastrocnemius","RR-9","GLDS-326"
"KEGG_MEDICUS_PATHOGEN_HPV_E5_TO_EGFR_RAS_ERK_SIGNALING_PATHWAY",0.623595505617977,0.775862068965517,0.0646484568421928,0.311190396338455,0.879137266209345,15,"kegg","Sos2; Mapk1; Grb2; Kras; Map2k1","gastrocnemius","RR-9","GLDS-326"
"KEGG_MEDICUS_PATHOGEN_HTLV_1_TAX_TO_SPINDLE_ASSEMBLY_CHECKPOINT_SIGNALING",0.581196581196581,0.760839160839161,0.0747385227439092,-0.316545322852337,-0.909740772102284,15,"kegg","Anapc13; Anapc4; Anapc5; Cdc23; Anapc1; Anapc11; Anapc2","gastrocnemius","RR-9","GLDS-326"
"KEGG_MEDICUS_PATHOGEN_KSHV_VGPCR_TO_GNB_G_ERK_SIGNALING_PATHWAY",0.086283185840708,0.444787644787645,0.227987202850442,-0.401927621836582,-1.36675219611008,29,"kegg","Fos; Gng2; Raf1; Gng7; Angpt2; Gnb2; Pdgfb; Nras; Gng11; Hras; Map2k2; Gng12; Mapk3","gastrocnemius","RR-9","GLDS-326"
"KEGG_MEDICUS_PATHOGEN_KSHV_VGPCR_TO_GNB_G_PI3K_AKT_SIGNALING_PATHWAY",0.324034334763948,0.624923359901901,0.108394255853397,-0.344806875834588,-1.09337113120379,22,"kegg","Gng2; Akt2; Gng7; Gnb2; Gng11; Gng12; Pik3cg; Gngt2; Pik3r5; Gng10; Gng4","gastrocnemius","RR-9","GLDS-326"
"KEGG_MEDICUS_PATHOGEN_KSHV_VGPCR_TO_GNB_G_PI3K_JNK_SIGNALING_PATHWAY",0.178260869565217,0.527024029574861,0.153158808683073,-0.377475548201391,-1.24770800720107,26,"kegg","Gng2; Gng7; Gnb2; Gng11; Mapk10; Rela; Gng12; Mapk9; Pik3cg; Gngt2; Pik3r5; Rac1; Gng10; Gng4; Prex1","gastrocnemius","RR-9","GLDS-326"
"KEGG_MEDICUS_PATHOGEN_SALMONELLA_SIFA_TO_MICROTUBULE_PLUS_END_DIRECTED_TRANSPORT",0.205183585313175,0.553995680345572,0.141225119642531,-0.387181573839683,-1.22212886487546,21,"kegg","Kif5a; Klc1; Plekhm2; Tuba8; Klc2; Tubb4a","gastrocnemius","RR-9","GLDS-326"
"KEGG_MEDICUS_PATHOGEN_SALMONELLA_SOPB_TO_ARNO_ARF_ACTB_G_SIGNALING_PATHWAY",0.311711711711712,0.624923359901901,0.0999276973731092,0.321682814939905,1.08327937407666,30,"kegg","Arf6; Abi1; Nckap1; Actr2; Actg1; Cyth1; Cyth2; Wasf3; Actr3; Arpc5; Wasf1; Arpc1b","gastrocnemius","RR-9","GLDS-326"
"KEGG_MEDICUS_PATHOGEN_SALMONELLA_SOPE_TO_RAC_SIGNALING_PATHWAY",0.228782287822878,0.55452865064695,0.121543282035469,0.389910877441339,1.19165069150944,20,"kegg","Abi1; Nckap1; Actr2; Actg1; Wasf3; Actr3; Arpc5; Wasf1; Arpc1b","gastrocnemius","RR-9","GLDS-326"
"KEGG_MEDICUS_PATHOGEN_SHIGELLA_IPGD_TO_ARNO_ARF_ACTB_G_SIGNALING_PATHWAY",0.218181818181818,0.55452865064695,0.12384217120105,0.354980297528759,1.17856561147377,29,"kegg","Arf6; Abi1; Nckap1; Actr2; Actg1; Cyth1; Cyth2; Wasf3; Actr3; Arpc5; Wasf1; Arpc1b; Nckap1l","gastrocnemius","RR-9","GLDS-326"
"KEGG_MEDICUS_REFERENCE_26S_PROTEASOME_MEDIATED_PROTEIN_DEGRADATION",0.00053149046903962,0.0229682909786389,0.477270815362862,-0.545369114332721,-2.01477869481616,38,"kegg","Ubc; Psmd9; Psmc4; Psmc3; Sem1; Psmd4; Psmb3; Psmb6; Psmd2; Psmd11; Psmc5; Uba52; Psmd1; Psmb5; Psmb4; Psmb1; Adrm1","gastrocnemius","RR-9","GLDS-326"
"KEGG_MEDICUS_REFERENCE_ACH_CHRN_RAS_ERK_SIGNALING_PATHWAY",0.128260869565217,0.48604118993135,0.183023938384487,-0.432110527651774,-1.33328087726728,20,"kegg","Atf6b; Raf1; Creb3; Braf; Nras; Hras; Creb1; Map2k2; Mapk3","gastrocnemius","RR-9","GLDS-326"
"KEGG_MEDICUS_REFERENCE_ACTH_CORTISOL_SIGNALING_PATHWAY",0.0995575221238938,0.454605480356553,0.211400189384923,-0.397243612526979,-1.3508242537078,29,"kegg","Adcy2; Atf6b; Pbx1; Prkaca; Creb3; Adcy9; Adcy3; Nr4a1; Creb1; Adcy8; Mrap","gastrocnemius","RR-9","GLDS-326"
"KEGG_MEDICUS_REFERENCE_ACTIVATION_OF_PRC2.2_BY_UBIQUITINATION_OF_H2AK119",0.0727611940298507,0.414212586002104,0.227987202850442,0.480047414710424,1.44078756844672,19,"kegg","Rbbp7; Jarid2; Skp1; Ezh2; Yaf2; Suz12","gastrocnemius","RR-9","GLDS-326"
"KEGG_MEDICUS_REFERENCE_ACTIVATION_OF_PRC2.2_BY_UBIQUITINATION_OF_H2AK119_IN_GERMLINE_GENES",0.0780669144981413,0.421561338289963,0.219250346703755,0.44747357895438,1.41092904565977,24,"kegg","Rbbp7; Jarid2; Ezh2; Tfdp1; Ehmt1; Yaf2; Suz12; Cbx3; Mga; Ezh1; Hdac1; Eed; E2f6; Rnf2; L3mbtl2","gastrocnemius","RR-9","GLDS-326"
"KEGG_MEDICUS_REFERENCE_ADRB3_UCP1_SIGNALING_PATHWAY",0.261261261261261,0.581777653942602,0.126253987849115,-0.320188643370131,-1.14316460036007,34,"kegg","Adcy2; Dpf3; Smarce1; Smarcd3; Prkaca; Smarcb1; Adcy9; Smarcc2; Adcy3; Arid1a","gastrocnemius","RR-9","GLDS-326"
"KEGG_MEDICUS_REFERENCE_AGE_RAGE_SIGNALING_PATHWAY",0.563991323210412,0.754147812971342,0.0770736734944102,-0.30636435479161,-0.9007557427978,16,"kegg","Raf1; Braf; Nras; Hras; Map2k2; Rela; Mapk3","gastrocnemius","RR-9","GLDS-326"
"KEGG_MEDICUS_REFERENCE_ANGIOTENSIN_ALDOSTERONE_SIGNALING_PATHWAY",0.0112954639404991,0.146514776371336,0.380730400722792,-0.499580761964516,-1.6588605798317,27,"kegg","Calm3; Atf6b; Calm1; Camk2b; Camk2a; Creb3; Camk1; Plcb3; Creb1; Camk4; Plcb1","gastrocnemius","RR-9","GLDS-326"
"KEGG_MEDICUS_REFERENCE_ANTEROGRADE_AXONAL_TRANSPORT",0.38695652173913,0.673078651685393,0.0982123351217438,-0.341252659045088,-1.05293811537979,20,"kegg","Kif5a; Klc1; Tuba8; Klc2; Tubb4a","gastrocnemius","RR-9","GLDS-326"
"KEGG_MEDICUS_REFERENCE_ARL8_REGULATED_MICROTUBULE_PLUS_END_DIRECTED_TRANSPORT",0.225287356321839,0.55452865064695,0.13880510939114,-0.343720160400701,-1.1805498750933,31,"kegg","Kif5a; Bloc1s1; Borcs8; Klc1; Plekhm2; Tuba8; Klc2; Tubb4a","gastrocnemius","RR-9","GLDS-326"
"KEGG_MEDICUS_REFERENCE_ARNO_ARF_ACTB_G_SIGNALING_PATHWAY",0.10760667903525,0.454605480356553,0.184706471207739,0.42694565461771,1.36390335444171,25,"kegg","Arf6; Abi1; Nckap1; Actr2; Actg1; Cyth1; Cyth2; Wasf3; Actr3; Arpc5; Wasf1; Arpc1b","gastrocnemius","RR-9","GLDS-326"
"KEGG_MEDICUS_REFERENCE_ASSEMBLY_AND_TRAFFICKING_OF_TELOMERASE",0.536796536796537,0.750602242835387,0.0795564677235957,-0.30591739985547,-0.924717002434653,18,"kegg","Tert; Nhp2; Ruvbl1","gastrocnemius","RR-9","GLDS-326"
"KEGG_MEDICUS_REFERENCE_AUTOPHAGY_VESICLE_NUCLEATION_ELONGATION_MATURATION_MTORC1_PI3KC3_C1",0.231053604436229,0.55452865064695,0.120985142145252,0.413147185779546,1.19524895164727,16,"kegg","Rb1cc1; Mlst8; Pik3c3; Mtor; Pik3r4","gastrocnemius","RR-9","GLDS-326"
"KEGG_MEDICUS_REFERENCE_BCR_PLCG_CALCINEURIN_SIGNALING_PATHWAY",0.182212581344902,0.527024029574861,0.151148761385484,-0.430343627697125,-1.26527282943309,16,"kegg","Calm3; Nfatc2; Calm1; Nfatc1; Nfatc4","gastrocnemius","RR-9","GLDS-326"
"KEGG_MEDICUS_REFERENCE_BMP_SIGNALING_PATHWAY",0.559259259259259,0.754147812971342,0.0694481442003175,0.3081457045918,0.913069769848074,18,"kegg","Gdf5; Bmp7; Bmpr2; Gdf6","gastrocnemius","RR-9","GLDS-326"
"KEGG_MEDICUS_REFERENCE_BRANCHING_MICROTUBULE_NUCLEATION",0.851919561243144,0.924696609188539,0.0488970772260102,0.223520317396722,0.737936926823435,28,"kegg","Nedd1; Haus5; Tubgcp5; Haus6; Tubgcp3; Tuba1b; Tubb2a; Tubb3; Tuba4a; Tubb2b; Tubgcp2; Tubb1; Tubgcp6; Tuba1a","gastrocnemius","RR-9","GLDS-326"
"KEGG_MEDICUS_REFERENCE_CA2_CAM_CAMK_SIGNALING_PATHWAY",0.51931330472103,0.747811158798283,0.0808589150280032,-0.307522256134064,-0.940785994474688,19,"kegg","Calm3; Phkg1; Calm1; Camk2b; Camk2a","gastrocnemius","RR-9","GLDS-326"
"KEGG_MEDICUS_REFERENCE_CA2_ENTRY_VOLTAGE_GATED_CA2_CHANNEL",0.267818574514039,0.590294000969718,0.121543282035469,-0.364889226365722,-1.15176363276076,21,"kegg","Cacna1g; Cacng1; Cacna1i; Cacna1a; Cacna1s; Cacng6","gastrocnemius","RR-9","GLDS-326"
"KEGG_MEDICUS_REFERENCE_CA2_PYK2_RAS_ERK_SIGNALING_PATHWAY",0.250936329588015,0.576619650968205,0.116234148779716,0.415449779542011,1.17367819743576,15,"kegg","Sos2; Mapk1; Grb2; Src; Kras; Map2k1","gastrocnemius","RR-9","GLDS-326"
"KEGG_MEDICUS_REFERENCE_CARDIAC_TYPE_VGCC_RYR_SIGNALING",0.372294372294372,0.67012987012987,0.10027910675413,-0.358522771107562,-1.08373077948421,18,"kegg","Cacng1; Casq2; Cacng6; Trdn; Asph; Cacnb1; Casq1","gastrocnemius","RR-9","GLDS-326"
"KEGG_MEDICUS_REFERENCE_CCR2_GNB_G_PI3K_NFKB_SIGNALING_PATHWAY",0.170353982300885,0.527024029574861,0.158514105424824,-0.36178383942892,-1.23024353190052,29,"kegg","Gng2; Akt2; Gng7; Pik3ca; Gnb2; Pik3cd; Gng11; Rela; Gng12; Ikbkg; Gngt2; Gng10; Gng4; Nfkbia","gastrocnemius","RR-9","GLDS-326"
"KEGG_MEDICUS_REFERENCE_CCR5_GNB_G_PLCB_G_PKC_SIGNALING_PATHWAY",0.331896551724138,0.634421727189503,0.107140237276725,-0.339925846637516,-1.10382801156736,24,"kegg","Gng2; Gng7; Gnb2; Plcb3; Gng11; Gng12; Plcb1; Ccr5; Prkcb; Gngt2; Gng10; Gng4; Ccl5","gastrocnemius","RR-9","GLDS-326"
"KEGG_MEDICUS_REFERENCE_CCR_CXCR_GNB_G_PI3K_RAC_SIGNALING_PATHWAY",0.15450643776824,0.527024029574861,0.16440575583821,-0.40182460126279,-1.27417244150019,22,"kegg","Gng2; Gng7; Gnb2; Gng11; Gng12; Cxcr2; Pik3cg; Gngt2; Pik3r5; Rac1; Gng10; Gng4; Prex1","gastrocnemius","RR-9","GLDS-326"
"KEGG_MEDICUS_REFERENCE_CD80_CD86_CTLA4_PP2A_SIGNALING_PATHWAY",0.912017167381974,0.970422207657667,0.0531298054705469,-0.214524352343204,-0.680249583841741,22,"kegg","Akt2; Ppp2r1a; Ppp2r2c; Ppp2r2d; Ppp2r5e; Ppp2r3a","gastrocnemius","RR-9","GLDS-326"
"KEGG_MEDICUS_REFERENCE_COHESIN_DISSOCIATION_IN_ANAPHASE",0.561822125813449,0.754147812971342,0.077274697304471,-0.309496969060554,-0.909966084172667,16,"kegg","Anapc13; Anapc4; Anapc5; Cdc23; Anapc1; Anapc11; Anapc2","gastrocnemius","RR-9","GLDS-326"
"KEGG_MEDICUS_REFERENCE_COHESIN_DISSOCIATION_IN_PROPHASE",0.746203904555314,0.857340656297595,0.0630790410571939,-0.267531768020143,-0.786582292149842,16,"kegg","Stag2; Stag1; Ppp2r1a","gastrocnemius","RR-9","GLDS-326"
"KEGG_MEDICUS_REFERENCE_CONDENSIN_LOADING",0.916974169741697,0.970913826785327,0.0459538081039063,0.223153107621692,0.682003427949701,20,"kegg","Ncaph; Ppp2ca","gastrocnemius","RR-9","GLDS-326"
"KEGG_MEDICUS_REFERENCE_COPI_VESICLE_FORMATION",0.381974248927039,0.673078651685393,0.0982123351217438,-0.331562274650472,-1.05137294151001,22,"kegg","Cope; Kdelr2; Tmed1; Copz2; Tmed5; Kdelr1; Copz1; Kdelr3","gastrocnemius","RR-9","GLDS-326"
"KEGG_MEDICUS_REFERENCE_CORE_NER_REACTION",0.164835164835165,0.527024029574861,0.160801401070022,-0.377874296086732,-1.26708668364173,28,"kegg","Gtf2h5; Xrcc1; Pold2; Gtf2h4; Ercc3","gastrocnemius","RR-9","GLDS-326"
"KEGG_MEDICUS_REFERENCE_CRHR_PKA_ACTH_SIGNALING_PATHWAY",0.125,0.482142857142857,0.184706471207739,-0.406628009433539,-1.32042735655594,24,"kegg","Adcy2; Atf6b; Prkaca; Creb3; Adcy9; Adcy3; Creb1; Adcy8","gastrocnemius","RR-9","GLDS-326"
"KEGG_MEDICUS_REFERENCE_CX3CR1_GNAI_AC_PKA_SIGNALING_PATHWAY",0.527114967462039,0.750602242835387,0.0806388495950661,-0.318189459861395,-0.935523270854519,16,"kegg","Adcy2; Prkaca; Adcy9; Adcy3; Cx3cl1; Adcy8","gastrocnemius","RR-9","GLDS-326"
"KEGG_MEDICUS_REFERENCE_CXCL12_CXCR4_PKC_ERK_SIGNALING_PATHAWAY",0.774678111587983,0.875269396551724,0.0607719451853533,-0.253192342839249,-0.774577466508819,19,"kegg","Raf1; Plcb3; Braf; Map2k2; Plcb1; Mapk3","gastrocnemius","RR-9","GLDS-326"
"KEGG_MEDICUS_REFERENCE_CXCR4_GNAQ_PLCB_G_CALCINEURIN_SIGNALING_PATHWAY",0.119565217391304,0.469565217391304,0.190023305279108,-0.441102472449604,-1.36102560293629,20,"kegg","Calm3; Nfatc2; Calm1; Nfatc1; Plcb3; Nfatc4; Plcb1","gastrocnemius","RR-9","GLDS-326"
"KEGG_MEDICUS_REFERENCE_CXCR4_GNB_G_PLCB_PKC_SIGNALING_PATHWAY",0.294247787610619,0.611130020422056,0.116739204791222,-0.330230941050213,-1.12294811150697,29,"kegg","Gng2; Pxn; Gng7; Ptk2; Gnb2; Plcb3; Gng11; Bcar1; Gng12; Plcb1","gastrocnemius","RR-9","GLDS-326"
"KEGG_MEDICUS_REFERENCE_CXCR4_GNB_G_RAC_SIGNALING_PATHWAY",0.765086206896552,0.86978221415608,0.0615706755421678,-0.244267789906874,-0.793201315786913,24,"kegg","Gng2; Gng7; Gnb2; Gng11; Gng12; Cfl1; Gngt2; Rac1; Gng10; Gng4","gastrocnemius","RR-9","GLDS-326"
"KEGG_MEDICUS_REFERENCE_CXCR_GNB_G_ERK_SIGNALING_PATHWAY",0.314655172413793,0.624923359901901,0.110564716336619,-0.342529416949094,-1.11228248441322,24,"kegg","Gng2; Raf1; Gng7; Gnb2; Nras; Gng11; Hras; Map2k2; Gng12; Mapk3; Cxcr2; Gngt2; Gng10; Gng4","gastrocnemius","RR-9","GLDS-326"
"KEGG_MEDICUS_REFERENCE_CXCR_GNB_G_PI3K_AKT_SIGNALING_PATHWAY",0.27991452991453,0.608117001828154,0.11776578836269,-0.356105067312313,-1.15124824645922,23,"kegg","Gng2; Akt2; Gng7; Gnb2; Gng11; Gng12; Cxcr2; Pik3cg; Gngt2; Pik3r5; Gng10; Gng4","gastrocnemius","RR-9","GLDS-326"
"KEGG_MEDICUS_REFERENCE_CYTOKINE_JAK_STAT_SIGNALING_PATHWAY",0.18140589569161,0.527024029574861,0.155241966228839,-0.348618518492496,-1.22706161471807,33,"kegg","Pim1; Stat5b; Il6st; Il4ra; Stat5a","gastrocnemius","RR-9","GLDS-326"
"KEGG_MEDICUS_REFERENCE_DEUBIQUITINATION_OF_H2AK119",0.473098330241187,0.709647495361781,0.0780892306943345,0.306013256923777,0.977577598244185,25,"kegg","Cbx8; Cbx4; Phc3; Cbx2; Hcfc1; Scml2; Ogt; Bmi1; Asxl2; Phc1","gastrocnemius","RR-9","GLDS-326"
"KEGG_MEDICUS_REFERENCE_DISASSEMBLY_OF_MCC",0.616087751371115,0.773713091194147,0.0640703750499722,0.300132425586486,0.880274295563405,17,"kegg","Mad2l1bp; Anapc10; Cdc27; Cdc20; Mad2l1; Bub3","gastrocnemius","RR-9","GLDS-326"
"KEGG_MEDICUS_REFERENCE_DNA_END_RESECTION_AND_RPA_LOADING",0.224862888482633,0.55452865064695,0.122107920287081,0.414429619033207,1.21550259103858,17,"kegg","Rad50; Rpa3; Brcc3; Wrn","gastrocnemius","RR-9","GLDS-326"
"KEGG_MEDICUS_REFERENCE_DNA_REPLICATION_LICENSING",0.018561423233817,0.217108808497455,0.352487857583619,0.5012930520889,1.55655499117206,22,"kegg","Ccne2; Cdt1; Mcm6; Mcm7; Mcm3; Orc3; Cdc7; Orc4","gastrocnemius","RR-9","GLDS-326"
"KEGG_MEDICUS_REFERENCE_DNA_REPLICATION_TERMINATION",0.385608856088561,0.673078651685393,0.0888945288620449,0.342950352171673,1.04812932381007,20,"kegg","Mcm6; Mcm7; Mcm3; Nploc4; Gins1; Cul2; Pif1; Gins3","gastrocnemius","RR-9","GLDS-326"
"KEGG_MEDICUS_REFERENCE_DRD1_GNAS_AC_PKA_SIGNALING_PATHWAY",0.290598290598291,0.60941000746826,0.115240003147781,-0.394305976546764,-1.13322231494645,15,"kegg","Atf6b; Prkaca; Creb3","gastrocnemius","RR-9","GLDS-326"
"KEGG_MEDICUS_REFERENCE_DYNEIN_RECRUITMENT_TO_THE_KINETOCHORE",0.954545454545455,0.977165015079707,0.0434506826723125,0.195951992580679,0.650577740688951,29,"kegg","Pafah1b1; Dynlt3; Ndel1; Cenpf; Dync2h1; Dync1i1; Zw10; Dctn4","gastrocnemius","RR-9","GLDS-326"
"KEGG_MEDICUS_REFERENCE_E2_ER_RAS_ERK_SIGNALING_PATHWAY",0.217948717948718,0.55452865064695,0.135740943810425,-0.368319242863314,-1.19073532338055,23,"kegg","Atf6b; Raf1; Creb3; Braf; Nras; Hras; Creb1; Map2k2; Mapk3","gastrocnemius","RR-9","GLDS-326"
"KEGG_MEDICUS_REFERENCE_EGF_EGFR_ACTIN_SIGNALING_PATHWAY",0.447124304267161,0.709647495361781,0.0810802057550866,0.32547083322852,1.00763196636423,21,"kegg","Wipf1; Nck1; Wasl; Actr2; Src; Actg1; Actr3; Arpc5; Arpc1b","gastrocnemius","RR-9","GLDS-326"
"KEGG_MEDICUS_REFERENCE_EGF_EGFR_PLCG_CALCINEURIN_SIGNALING_PATHWAY",0.0215780511061063,0.221945668519951,0.352487857583619,-0.579157226865122,-1.66447868504023,15,"kegg","Calm3; Egfr; Nfatc2; Calm1; Nfatc1; Egf; Nfatc4","gastrocnemius","RR-9","GLDS-326"
"KEGG_MEDICUS_REFERENCE_EGF_EGFR_PLCG_CAMK_SIGNALING_PATHWAY",0.0115312555477441,0.146514776371336,0.380730400722792,-0.607884224707442,-1.74703912523806,15,"kegg","Calm3; Egfr; Calm1; Camk2b; Camk2a; Camk1; Camk4; Egf","gastrocnemius","RR-9","GLDS-326"
"KEGG_MEDICUS_REFERENCE_EGF_EGFR_PLCG_ERK_SIGNALING_PATHWAY",0.557692307692308,0.754147812971342,0.0768736734126542,-0.32155819155909,-0.924147590710866,15,"kegg","Egfr; Raf1; Braf; Egf; Map2k2; Mapk3","gastrocnemius","RR-9","GLDS-326"
"KEGG_MEDICUS_REFERENCE_EGF_EGFR_RAS_ERK_SIGNALING_PATHWAY",0.456561922365989,0.709647495361781,0.0797705918628453,0.338841472424067,0.980279979216877,16,"kegg","Sos2; Mapk1; Ccnd1; Grb2; Kras; Map2k1","gastrocnemius","RR-9","GLDS-326"
"KEGG_MEDICUS_REFERENCE_EGF_EGFR_RAS_PI3K_SIGNALING_PATHWAY",0.198717948717949,0.553995680345572,0.142901149386948,-0.432434687558781,-1.24280296735596,15,"kegg","Egfr; Akt2; Bad; Pik3ca; Pik3cd; Nras; Hras; Egf","gastrocnemius","RR-9","GLDS-326"
"KEGG_MEDICUS_REFERENCE_EGF_ERBB2_RAS_ERK_SIGNALING_PATHWAY",0.462039045553145,0.709647495361781,0.0878312634480124,-0.336066615670535,-0.988084707941177,16,"kegg","Egfr; Raf1; Erbb2; Braf; Nras; Hras; Egf; Map2k2; Mapk3","gastrocnemius","RR-9","GLDS-326"
"KEGG_MEDICUS_REFERENCE_ELECTRON_TRANSFER_IN_COMPLEX_I",0.10762331838565,0.454605480356553,0.204294756516886,-0.363110626667771,-1.33128210190781,37,"kegg","Ndufa3; Ndufb7; Ndufs5; Ndufs3; Ndufv3; Ndufa13; Ndufa11; Ndufa5; Ndufs2; Ndufb11; Ndufv1; Ndufa10; Ndufs8; Ndufa7","gastrocnemius","RR-9","GLDS-326"
"KEGG_MEDICUS_REFERENCE_ELECTRON_TRANSFER_IN_COMPLEX_IV",0.322097378277154,0.624923359901901,0.10027910675413,0.383967969974424,1.08473961731175,15,"kegg","Cox5a; Cox6c; Cox7a2","gastrocnemius","RR-9","GLDS-326"
"KEGG_MEDICUS_REFERENCE_FANCONI_ANEMIA_PATHWAY",0.53862660944206,0.750602242835387,0.0789209638180035,-0.303198666925874,-0.927559074823209,19,"kegg","Fancm; Fancf; Fance; Faap100; Fancd2","gastrocnemius","RR-9","GLDS-326"
"KEGG_MEDICUS_REFERENCE_FGF_FGFR_PI3K_SIGNALING_PATHWAY",0.205183585313175,0.553995680345572,0.141225119642531,-0.364520290725691,-1.19311404833536,25,"kegg","Fgfr1; Rps6kb2; Akt2; Pik3ca; Fgfr4; Pik3cd","gastrocnemius","RR-9","GLDS-326"
"KEGG_MEDICUS_REFERENCE_FGF_FGFR_RAS_ERK_SIGNALING_PATHWAY",0.763274336283186,0.86978221415608,0.0629394692018967,-0.235329915833866,-0.800237808505507,29,"kegg","Fgfr1; Raf1; Fgfr4; Braf; Nras; Hras; Map2k2; Fgf7; Mapk3","gastrocnemius","RR-9","GLDS-326"
"KEGG_MEDICUS_REFERENCE_FLT3LG_FLT3_RAS_ERK_SIGNALING_PATHWAY",0.310861423220974,0.624923359901901,0.102449405629826,0.38847944829101,1.09748489724479,15,"kegg","Sos2; Flt3; Mapk1; Grb2; Kras; Map2k1","gastrocnemius","RR-9","GLDS-326"
"KEGG_MEDICUS_REFERENCE_FLT3LG_FLT3_RAS_PI3K_SIGNALING_PATHWAY",0.471910112359551,0.709647495361781,0.0787113806986485,0.343708810924083,0.971004336776583,15,"kegg","Sos2; Flt3; Mtor; Grb2; Kras","gastrocnemius","RR-9","GLDS-326"
"KEGG_MEDICUS_REFERENCE_GENE_SILENCING_BY_METHYLATION_OF_H3K27_AND_UBIQUITINATION_OF_H2AK119",0.0191701587156999,0.217108808497455,0.352487857583619,0.430613035264705,1.48402835921933,34,"kegg","Rbbp7; Cbx8; Jarid2; Cbx4; Phc3; Ezh2; Phf19; Ctbp2; Cbx2; H3f3a; Suz12; Scml2","gastrocnemius","RR-9","GLDS-326"
"KEGG_MEDICUS_REFERENCE_GF_RTK_PI3K_SIGNALING_PATHWAY",0.659863945578231,0.787461946104409,0.0713052987340038,-0.214570686401543,-0.901368782432202,74,"kegg","Fgfr1; Erbb3; Egfr; Akt2; Pik3r3; Angpt2; Pik3ca; Flt3l; Pdgfa; Erbb2; Fgfr4; Kdr; Pdgfb; Pik3cd; Egf; Igf2; Fgf7","gastrocnemius","RR-9","GLDS-326"
"KEGG_MEDICUS_REFERENCE_GF_RTK_RAS_ERK_SIGNALING_PATHWAY",0.466552315608919,0.709647495361781,0.0747385227439092,0.238941661800743,0.992805513802892,82,"kegg","Sos2; Met; Kitl; Fgfr3; Flt3; Mapk1; Ntf5; Ret; Kit; Ntrk2; Insr; Grb2; Kras; Efna1; Map2k1; Vegfa; Igf1r; Hgf; Pdgfc; Fgf1; Angpt4; Pdgfra","gastrocnemius","RR-9","GLDS-326"
"KEGG_MEDICUS_REFERENCE_GF_RTK_RAS_PI3K_SIGNALING_PATHWAY",0.671821305841924,0.788659793814433,0.0570059526582387,0.215244381982404,0.891801862115117,80,"kegg","Sos2; Met; Kitl; Fgfr3; Flt3; Ntf5; Pik3r1; Kit; Ntrk2; Insr; Grb2; Kras; Efna1; Vegfa; Igf1r; Hgf; Pdgfc; Fgf1; Pik3r2; Angpt4; Pdgfra","gastrocnemius","RR-9","GLDS-326"
"KEGG_MEDICUS_REFERENCE_GHRHR_PKA_GH_SIGNALING_PATHWAY",0.0944206008583691,0.453218884120172,0.213927855492356,-0.437129996500807,-1.38612467515432,22,"kegg","Adcy2; Atf6b; Prkaca; Creb3; Adcy9; Adcy3; Creb1; Adcy8","gastrocnemius","RR-9","GLDS-326"
"KEGG_MEDICUS_REFERENCE_GLOBAL_GENOME_NER",0.0909090909090909,0.446280991735537,0.219250346703755,-0.463941853826457,-1.40238809749647,18,"kegg","Gtf2h5; Gtf2h4; Ercc3; Rad23a; Gtf2h3; Ccnh; Rbx1","gastrocnemius","RR-9","GLDS-326"
"KEGG_MEDICUS_REFERENCE_GLYCOLYSIS",0.600858369098712,0.773406315242907,0.0732558655828455,-0.289965892096832,-0.887076771578877,19,"kegg","Aldoa; Pfkl; Gapdh; Eno2; Pgam2; Eno1; Gpi1; Ldhal6b","gastrocnemius","RR-9","GLDS-326"
"KEGG_MEDICUS_REFERENCE_GNRH_GNRHR_PLCB_PKC_SIGNALING_PATHWAY",0.718681318681319,0.830134571311042,0.0655321029282414,-0.27355292457099,-0.8069506213682,17,"kegg","Raf1; Gna11; Plcb3; Map2k2; Plcb1; Mapk3","gastrocnemius","RR-9","GLDS-326"
"KEGG_MEDICUS_REFERENCE_GPCR_PI3K_SIGNALING_PATHWAY",0.259340659340659,0.581777653942602,0.125033367555272,-0.341655442720041,-1.14563775929581,28,"kegg","Gng2; Akt2; Gng7; Lpar2; Gnb2; Gng11; Gng12; Lpar6; Pik3cg; Gngt2; Pik3r5; Gng10; Gng4","gastrocnemius","RR-9","GLDS-326"
"KEGG_MEDICUS_REFERENCE_GPCR_PLCB_ITPR_SIGNALING_PATHWAY",0.926701570680628,0.971687083820465,0.0429311093452583,0.192627444600437,0.684960178083231,40,"kegg","Ednrb; Bdkrb1; F2r; Itpr3; Gna14; Ptger1; Bdkrb2; Chrm3; Adra1b; Chrm1; Cxcr4; Htr2b; Agtr1a; Gnaq; Plcb2; Itpr2; Hrh1; Plcb4","gastrocnemius","RR-9","GLDS-326"
"KEGG_MEDICUS_REFERENCE_GPI_ANCHOR_BIOSYNTHESIS",0.83457249070632,0.917627066948433,0.0506004243853618,0.242493636245041,0.76460674072706,24,"kegg","Pgap1; Pigk; Pigs; Pigx; Mppe1; Pigp; Pigt","gastrocnemius","RR-9","GLDS-326"
"KEGG_MEDICUS_REFERENCE_HGF_MET_RAS_ERK_SIGNALING_PATHWAY",0.202247191011236,0.553995680345572,0.131457611642763,0.440890642505084,1.24555062980684,15,"kegg","Sos2; Met; Mapk1; Grb2; Kras; Map2k1; Hgf; Sos1","gastrocnemius","RR-9","GLDS-326"
"KEGG_MEDICUS_REFERENCE_HOMOLOGOUS_RECOMBINATION",0.565610859728507,0.754147812971342,0.0791316651768349,-0.263944987323586,-0.921768118007654,32,"kegg","Pold2; Sem1; Rad54l; Brca1; Rfc1; Xrcc2; Pold4; Rfc4; Xrcc3; Pole2; Rad51; Rfc3; Rpa1","gastrocnemius","RR-9","GLDS-326"
"KEGG_MEDICUS_REFERENCE_HOMOLOGOUS_RECOMBINATION_IN_ICLR",0.461538461538462,0.709647495361781,0.0870515867946735,-0.341673028527404,-0.981956965840385,15,"kegg","Sem1; Brca1; Fancd2; Hrob; Mcm8; Rpa1","gastrocnemius","RR-9","GLDS-326"
