"pathway","pval","padj","log2err","ES","NES","size","db","leadingEdge_str","tissue","mission","glds"
"REACTOME_FATTY_ACID_METABOLISM",0.0586945556217353,0.145451974496092,0.321775918075361,0.262883703913264,1.30087313238672,161,"reactome","Pon1; Ptges; Them4; Scp2; Ptgis; Them5; Acbd5; Alox5ap; Mapkapk2; Echs1; Gpx4; Prxl2b; Nudt19; Mmut; Tecr; Ephx2; Ptgr2; Mcee; H2-Ke6; Acot9; Acaa2; Mcat; Fads2; Ehhadh; Elovl1; Acaa1a; Decr2; Acot13; Acot7; Hacl1; Acbd4; Thrsp; Hsd17b12; Hacd1; Ggt1; Dpep2; Eci1; Hadhb; Mlycd; Slc22a5; Decr1; Pla2g4a; Slc25a20; Cbr1; Faah; Acsl5; Aldh3a2; Ptgs1; Gpx1; Amacr; Ptgr1; Hsd17b4; Elovl7; Acot2; Acot8; Ptges2; Tbxas1; Ptges3; Acoxl","eye","RR-3","GLDS-194"
"REACTOME_FATTY_ACYL_COA_BIOSYNTHESIS",0.248543689320388,0.408641651360098,0.119348440591015,-0.323191763696781,-1.16547141623652,33,"reactome","Acaca; Elovl5; Elovl3; Fasn; Acsl4; Scd1; Acsbg1; Hacd2; Morc2a; Scd2; Ppt2","eye","RR-3","GLDS-194"
"REACTOME_FBXL7_DOWN_REGULATES_AURKA_DURING_MITOTIC_ENTRY_AND_IN_EARLY_MITOSIS",6.87304629778841e-07,1.12328144717587e-05,0.659444398037935,0.613092270616617,2.4051273730101,42,"reactome","Uba52; Psma7; Rps27a; Psmc1; Sem1; Psmd2; Psmc3; Skp1; Psma5; Psmb6; Psmd14; Psmd8; Psmb1; Psma1; Psmb7; Rbx1; Psmc5; Psma2; Psma4; Psmb3; Psma6; Psmb4; Psmd3; Psmd6; Psma3; Cul1; Aurka; Psmd12; Psmd13; Adrm1; Psmd1; Psmc2","eye","RR-3","GLDS-194"
"REACTOME_FCERI_MEDIATED_CA_2_MOBILIZATION",0.102857142857143,0.217850234871511,0.191892240384838,-0.387635436604293,-1.35794226191872,29,"reactome","Ppp3cb; Ahcyl1; Nfatc3; Sos1; Grb2; Nfatc1; Lat; Ppp3r1","eye","RR-3","GLDS-194"
"REACTOME_FCERI_MEDIATED_MAPK_ACTIVATION",0.843629343629344,0.905660913013854,0.0518457624865066,-0.211705821761652,-0.741760174581143,30,"reactome","Kras; Sos1; Grb2; Lat; Mapk3; Map3k1","eye","RR-3","GLDS-194"
"REACTOME_FCERI_MEDIATED_NF_KB_ACTIVATION",1.69922225480015e-05,0.000177204606572016,0.575610261071129,0.481047715017721,2.06424178883312,66,"reactome","Uba52; Psma7; Rps27a; Psmc1; Bcl10; Sem1; Psmd2; Psmc3; Skp1; Psma5; Psmb6; Nfkb1; Psmd14; Cdc34; Psmd8; Psmb1; Psma1; Psmb7; Psmc5; Psma2; Psma4; Psmb3; Psma6; Psmb4; Psmd3; Psmd6; Psma3; Cul1; Card11; Psmd12; Psmd13; Ube2v1; Adrm1; Psmd1; Psmc2","eye","RR-3","GLDS-194"
"REACTOME_FCGAMMA_RECEPTOR_FCGR_DEPENDENT_PHAGOCYTOSIS",0.552581261950287,0.684602790496838,0.0716527366829457,-0.216672979779333,-0.953587992051693,85,"reactome","Wasl; Wasf1; Myo10; Myo5a; Ahcyl1; Wasf2; Myh2; Wipf2; Abl1; Grb2; Prkce; Wipf3; Cyfip2; Pik3cb; Mapk3; Nckap1; Myh9; Actr2; Elmo1; Abi2","eye","RR-3","GLDS-194"
"REACTOME_FCGR3A_MEDIATED_IL10_SYNTHESIS",0.990384615384615,1,0.0443293451680314,-0.15663421422153,-0.577848531542509,35,"reactome","Prkar2a; Ahcyl1","eye","RR-3","GLDS-194"
"REACTOME_FC_EPSILON_RECEPTOR_FCERI_SIGNALING",0.0126073309139207,0.0463255951367221,0.380730400722792,0.31112249471976,1.47833606306525,116,"reactome","Uba52; Psma7; Rps27a; Psmc1; Bcl10; Sem1; Psmd2; Psmc3; Skp1; Psma5; Psmb6; Nfkb1; Psmd14; Cdc34; Psmd8; Grap2; Psmb1; Psma1; Psmb7; Hras; Psmc5; Psma2; Psma4; Vav3; Psmb3; Psma6; Psmb4; Psmd3; Pak1; Psmd6; Psma3; Cul1; Calm1; Card11; Psmd12; Psmd13; Ube2v1; Adrm1; Psmd1; Plcg2; Psmc2","eye","RR-3","GLDS-194"
"REACTOME_FERTILIZATION",0.947791164658635,0.976322977705743,0.0483117581055019,-0.206052003032516,-0.62850979123241,17,"reactome","Catsperg2; Catsper4; Catsperd; Hvcn1; Catsper3; Zp1; Catsperg1; Ovgp1; B4galt1","eye","RR-3","GLDS-194"
"REACTOME_FGFR1_MUTANT_RECEPTOR_ACTIVATION",0.642045454545455,0.75433452009364,0.0637845390312975,-0.255131412838225,-0.887476550133844,28,"reactome","Bcr; Zmym2; Grb2; Fgfr1; Cntrl; Cux1; Myo18a; Stat3","eye","RR-3","GLDS-194"
"REACTOME_FGFR2_ALTERNATIVE_SPLICING",0.294979079497908,0.460116940242463,0.112843355675562,0.315405268580907,1.09316227782136,27,"reactome","Polr2h; Polr2f; Polr2i; Polr2l; Ncbp2; Polr2k; Polr2j; Hnrnpf; Hnrnpa1; Polr2g; Polr2c; Polr2d; Gtf2f1; Esrp2","eye","RR-3","GLDS-194"
"REACTOME_FGFR2_LIGAND_BINDING_AND_ACTIVATION",0.048122739128603,0.129152939573089,0.321775918075361,0.512341568131721,1.52822888315965,16,"reactome","Fgfbp1; Fgf1; Fgf17; Fgf10; Fgf8; Fgf22; Fgf5; Fgfr2; Fgf9","eye","RR-3","GLDS-194"
"REACTOME_FGFR2_MUTANT_RECEPTOR_ACTIVATION",0.0128417647532292,0.0470235601344587,0.380730400722792,0.476486314945459,1.70111815550565,30,"reactome","Polr2h; Polr2f; Polr2i; Polr2l; Ncbp2; Polr2k; Polr2j; Fgf1; Fgf17; Fgf10; Polr2g; Polr2c; Fgf8; Fgf22; Polr2d; Gtf2f1; Fgf5; Fgfr2; Fgf9; Polr2e","eye","RR-3","GLDS-194"
"REACTOME_FLT3_SIGNALING",0.693798449612403,0.793844621029866,0.0611692626746689,-0.22455916743876,-0.844268252320297,38,"reactome","Kras; Cbl; Sos1; Abl2; Grb2; Foxo3; Ubc; Bcl2l11","eye","RR-3","GLDS-194"
"REACTOME_FLT3_SIGNALING_IN_DISEASE",0.0587121212121212,0.145451974496092,0.257206466468838,-0.420533757079821,-1.46282985617562,28,"reactome","Kras; Cbl; Golgb1; Sos1; Zmym2; Grb2; Sptbn1; Ubc; Etv6","eye","RR-3","GLDS-194"
"REACTOME_FORMATION_OF_ATP_BY_CHEMIOSMOTIC_COUPLING",8.19324373958393e-05,0.00065967660991503,0.538434096309916,0.713317072087514,2.16873226701308,17,"reactome","Atp5g2; Atp5b; Atp5k; Atp5a1; Atp5c1; Atp5h; Atp5mpl; Atp5j2; Atp5pb; Atp5g1; Atp5l; Atp5o; Atp5e","eye","RR-3","GLDS-194"
"REACTOME_FORMATION_OF_FIBRIN_CLOT_CLOTTING_CASCADE",0.626923076923077,0.740931701590884,0.0656813601934011,-0.250566743277256,-0.901492256980386,32,"reactome","Vwf; Serpinc1; F2; Pf4; C1qbp; Serpine2; Prcp; Prtn3; Fgg","eye","RR-3","GLDS-194"
"REACTOME_FORMATION_OF_INCISION_COMPLEX_IN_GG_NER",0.0529531568228106,0.138056444573756,0.282013350011725,0.367464376114838,1.43025439703183,43,"reactome","Uba52; Rps27a; Cetn2; Xpa; Rad23b; Rbx1; Cdk7; Gtf2h5; Cul4a; Sumo1; Chd1l; Ube2i; Ercc5; Parp1; Ercc1; Xpc; Gtf2h2; Mnat1; Ubb; Ercc3; Sumo2; Rpa3; Rpa2; Gtf2h1","eye","RR-3","GLDS-194"
"REACTOME_FORMATION_OF_NEURONAL_PROGENITOR_AND_NEURONAL_BAF_NPBAF_AND_NBAF",0.362934362934363,0.525678739964454,0.0949751525905595,-0.315390887790226,-1.06410770031216,25,"reactome","Arid1b; Arid1a; Smarcd1; Smarca4; Bcl11a; Dpf2; Bcl7a; Smarcc1","eye","RR-3","GLDS-194"
"REACTOME_FORMATION_OF_PARAXIAL_MESODERM",0.00856020792964024,0.033717365766029,0.380730400722792,0.387545226533264,1.62043374381496,57,"reactome","Psma7; Nog; Kat2b; Psmc1; Sem1; Psmd2; Psmc3; Psma5; Psmb6; Psmd14; Psmd8; Psmb1; Psma1; Psmb7; Snw1; Psmc5; Psma2; Ctnnb1; Psma4; Psmb3; Psma6; Psmb4; Psmd3; Psmd6; Psma3; Bmp4; Psmd12; Psmd13; Adrm1; Psmd1; Psmc2","eye","RR-3","GLDS-194"
"REACTOME_FORMATION_OF_RNA_POL_II_ELONGATION_COMPLEX",0.342,0.503346774193548,0.100633389423036,0.254708447271406,1.06500644192007,57,"reactome","Polr2h; Nelfb; Polr2f; Polr2i; Polr2l; Ctdp1; Ncbp2; Elob; Wdr61; Leo1; Polr2k; Cdk7; Gtf2h5; Polr2j; Polr2g; Gtf2h2; Polr2c; Paf1; Eaf2; Polr2d; Mnat1; Ercc3; Gtf2f1","eye","RR-3","GLDS-194"
"REACTOME_FORMATION_OF_SENESCENCE_ASSOCIATED_HETEROCHROMATIN_FOCI_SAHF",0.236111111111111,0.395371399506433,0.124434168630393,0.388272244868787,1.18048281582308,17,"reactome","H1f5; H1f3; H1f4; H1f2; H1f1; H1f0","eye","RR-3","GLDS-194"
"REACTOME_FORMATION_OF_TC_NER_PRE_INCISION_COMPLEX",0.0126025437170338,0.0463255951367221,0.380730400722792,0.398986758366289,1.63213710550211,51,"reactome","Uba52; Polr2h; Rps27a; Cops4; Polr2f; Xpa; Cops7b; Zfp830; Polr2i; Polr2l; Rbx1; Polr2k; Cdk7; Gtf2h5; Cul4a; Cops8; Polr2j; Ppie; Ercc8; Polr2g; Gtf2h2; Polr2c; Cops7a; Polr2d; Mnat1; Ubb; Ercc3; Gps1; Cops2; Isy1; Gtf2h1","eye","RR-3","GLDS-194"
"REACTOME_FORMATION_OF_THE_BETA_CATENIN_TCF_TRANSACTIVATING_COMPLEX",0.0347187136870014,0.0967353472958435,0.321775918075361,0.328706238937876,1.43960102928011,73,"reactome","H2ac19; H4c1; H2aj; H3c3; H3c7; H2ac13; H4c4; Kat5; H3c1; H2ac20; H2bc7; H3c11; H4c2; H4c3; H4c12; H2ac4; Leo1; H4c11; H2ac10; H2bc14; Ctnnb1; H4c18; H3f3b; H2bc18; H4c6; H4c8; H3c8; H2bc3; H2ax; H3c4; H2bc21; H3f3a; H4c17; H2ac18; H2az2; Ruvbl1; H2bc8; H2bc4; H3c10; H3f4","eye","RR-3","GLDS-194"
"REACTOME_FORMATION_OF_THE_CANONICAL_BAF_CBAF_COMPLEX",0.463220675944334,0.622363975655271,0.0828962134571565,-0.327587391898093,-1.0074074147423,18,"reactome","Arid1b; Arid1a; Smarcd1; Smarca4; Dpf2; Bcl7a; Smarcc1","eye","RR-3","GLDS-194"
"REACTOME_FORMATION_OF_THE_CORNIFIED_ENVELOPE",0.0635245901639344,0.152877859845073,0.257206466468838,0.324005473065202,1.37215000435279,61,"reactome","Krt23; Krt25; Krt8; Tgm5; Krt18; Krt71; Krt28; Krt10; Ivl; Krt75; Capn1; Krt77; Pkp3; St14; Krt12; Dsc1; Krt24; Perp; Pkp1; Krt17; Krt7; Dsp; Dsg1a; Evpl; Dsc3; Krt16; Kazn; Ppl; Krt26; Dsc2; Dsg3; Krt5; Krt6a; Krt78; Krt14; Klk8; Krt80; Krt6b; Krt15; Krt19; Tchh","eye","RR-3","GLDS-194"
"REACTOME_FORMATION_OF_THE_DYSTROPHIN_GLYCOPROTEIN_COMPLEX_DGC",0.00570600260169543,0.0245022464661039,0.407017918923954,-0.468646892184948,-1.7387664912341,36,"reactome","Sntb2; Acta1; Sgca; Dag1; Sgcb; Dmd; Lamc1; Actc1; Lamc3; Sgcg; Hspg2; Sntg2; Sgcd; Lama4","eye","RR-3","GLDS-194"
"REACTOME_FORMATION_OF_THE_EARLY_ELONGATION_COMPLEX",0.00589369190606272,0.0251112553974268,0.407017918923954,0.481445485840759,1.75996970384341,33,"reactome","Polr2h; Nelfb; Polr2f; Polr2i; Polr2l; Ctdp1; Ncbp2; Polr2k; Cdk7; Gtf2h5; Polr2j; Polr2g; Gtf2h2; Polr2c; Polr2d; Mnat1; Ercc3; Gtf2f1; Supt4a; Gtf2h1","eye","RR-3","GLDS-194"
"REACTOME_FORMATION_OF_THE_EMBRYONIC_STEM_CELL_BAF_ESBAF_COMPLEX",0.35546875,0.517604097406915,0.096887770327544,-0.345725779588323,-1.08359397302056,19,"reactome","Arid1a; Smarcd1; Smarca4; Bcl11a; Dpf2; Bcl7a; Smarcc1","eye","RR-3","GLDS-194"
"REACTOME_FORMATION_OF_THE_NEPHRIC_DUCT",0.781563126252505,0.858386783597285,0.0571258510018113,-0.25517285176357,-0.772836212611372,16,"reactome","Lhx1; Pcdh19","eye","RR-3","GLDS-194"
"REACTOME_FORMATION_OF_THE_NON_CANONICAL_BAF_NCBAF_COMPLEX",0.281124497991968,0.442286386927018,0.11331290842208,-0.374512481540144,-1.14235609517265,17,"reactome","Bicra; Bicral; Smarcd1; Smarca4; Bcl7a; Smarcc1","eye","RR-3","GLDS-194"
"REACTOME_FORMATION_OF_THE_POLYBROMO_BAF_PBAF_COMPLEX",0.467196819085487,0.623594918828585,0.0824344091527096,-0.326594859848371,-1.00435514786333,18,"reactome","Arid2; Smarcd1; Smarca4; Pbrm1; Bcl7a; Smarcc1","eye","RR-3","GLDS-194"
"REACTOME_FORMATION_OF_THE_URETERIC_BUD",0.548707753479125,0.683543788463757,0.0739901439101341,-0.308323903238213,-0.948167707141454,18,"reactome","Itga8; Sall1; Robo2; Gfra1; Pax2; Foxc2; Npnt; Itgb1; Ret","eye","RR-3","GLDS-194"
"REACTOME_FORMATION_OF_TUBULIN_FOLDING_INTERMEDIATES_BY_CCT_TRIC",0.000334581725256219,0.00227557136121466,0.49849310876659,0.645725393800621,2.05983155882619,20,"reactome","Tubb3; Tuba1c; Tcp1; Tubb4b; Cct7; Tuba1b; Cct6a; Cct3; Tubb2a; Cct5; Tuba8; Cct2; Tubb2b; Cct8; Tuba1a; Tuba4a","eye","RR-3","GLDS-194"
"REACTOME_FORMATION_OF_WDR5_CONTAINING_HISTONE_MODIFYING_COMPLEXES",0.00193480951185706,0.0100408360923388,0.45505986738723,-0.467028396903845,-1.77962134157076,41,"reactome","Setd1a; Kmt2a; Setd1b; Kmt2c; Ncoa6; Hcfc1; Kmt2d; Kdm6a; Bod1l; Phf20l1; Kansl1; Ogt; Kat2a; Yeats2; Mbip","eye","RR-3","GLDS-194"
"REACTOME_FOXO_MEDIATED_TRANSCRIPTION",0.137864077669903,0.272493077704953,0.165656695205483,-0.288083255478359,-1.21534999799279,64,"reactome","Plxna4; Foxo1; Nfya; Foxg1; Ep300; Crebbp; Cited2; Fasl; Ywhab; Foxo4; Ppargc1a; Foxo3; Hdac1; Bcl6; Fbxo32; Srebf1","eye","RR-3","GLDS-194"
"REACTOME_FOXO_MEDIATED_TRANSCRIPTION_OF_CELL_CYCLE_GENES",0.114457831325301,0.236028861207542,0.186432558434075,-0.440835208041543,-1.3446568851377,17,"reactome","Foxo1; Foxg1; Foxo4; Foxo3; Smad3; Klf4; Rbl2; Cdkn1a","eye","RR-3","GLDS-194"
"REACTOME_FOXO_MEDIATED_TRANSCRIPTION_OF_CELL_DEATH_GENES",0.00917403420387771,0.0357493503674238,0.380730400722792,-0.590761838998931,-1.78922694578141,16,"reactome","Foxo1; Nfya; Ep300; Crebbp; Cited2; Fasl; Foxo4; Foxo3; Bcl6; Bcl2l11","eye","RR-3","GLDS-194"
"REACTOME_FOXO_MEDIATED_TRANSCRIPTION_OF_OXIDATIVE_STRESS_METABOLIC_AND_NEURONAL_GENES",0.5,0.644876325088339,0.0762797180809272,-0.280479100292331,-0.975648672748571,28,"reactome","Plxna4; Foxo1; Foxo4; Ppargc1a; Foxo3; Hdac1; Fbxo32; Srebf1; Smad3; Trim63; Nr3c1","eye","RR-3","GLDS-194"
"REACTOME_FRS_MEDIATED_FGFR1_SIGNALING",0.624758220502901,0.740379060011555,0.066132620475844,-0.280266082483284,-0.894605600326414,20,"reactome","Kras; Frs2; Sos1; Grb2; Fgfr1","eye","RR-3","GLDS-194"
"REACTOME_FRS_MEDIATED_FGFR2_SIGNALING",0.70281124497992,0.800809899326755,0.062249042949858,-0.263023121024148,-0.858938233739693,22,"reactome","Kras; Frs2; Sos1; Grb2","eye","RR-3","GLDS-194"
"REACTOME_FRS_MEDIATED_FGFR3_SIGNALING",0.47117296222664,0.624201070996718,0.0819778796501272,-0.323957928597317,-0.996245971014106,18,"reactome","Kras; Frs2; Sos1; Grb2","eye","RR-3","GLDS-194"
"REACTOME_FRS_MEDIATED_FGFR4_SIGNALING",0.55078125,0.684602790496838,0.0728938564822936,-0.306023521201639,-0.959156831091649,19,"reactome","Kras; Frs2; Sos1; Grb2","eye","RR-3","GLDS-194"
"REACTOME_G0_AND_EARLY_G1",0.993814432989691,1,0.0473534245254193,0.16103823389029,0.554594107921599,26,"reactome","Lin37; Lin52; Pcna; E2f1; Tfdp1; Cdk1; Cdc25a; Lin9","eye","RR-3","GLDS-194"
"REACTOME_G1_S_DNA_DAMAGE_CHECKPOINTS",0.000110216306497789,0.000855935146206234,0.538434096309916,0.488742120334632,2.02265125025666,55,"reactome","Uba52; Psma7; Cop1; Rps27a; Psmc1; Sem1; Psmd2; Psmc3; Chek1; Psma5; Psmb6; Psmd14; Psmd8; Psmb1; Psma1; Psmb7; Psmc5; Psma2; Psma4; Psmb3; Psma6; Psmb4; Psmd3; Psmd6; Psma3; Psmd12; Psmd13; Adrm1; Psmd1; Psmc2","eye","RR-3","GLDS-194"
"REACTOME_G1_S_SPECIFIC_TRANSCRIPTION",0.221518987341772,0.382158459898914,0.133554954557592,0.33967408507194,1.18049553668926,28,"reactome","Pola1; Lin37; Orc1; Lin52; Pcna; E2f1; Tk1; Tfdp1; Cdk1; Cdc25a; Lin9","eye","RR-3","GLDS-194"
"REACTOME_G2_M_CHECKPOINTS",4.34364999878057e-09,1.32933231054399e-07,0.761460801445585,0.453181607791434,2.2159044947154,142,"reactome","Rhno1; Uba52; Psma7; Rps27a; Abraxas1; Psmc1; H4c1; Sem1; Psmd2; Psmc3; Chek1; H4c4; Rfc4; Kat5; Rad1; Rfc3; Psma5; Psmb6; Psmd14; Orc1; Psmd8; H2bc7; Psmb1; Psma1; H4c2; H4c3; Psmb7; H4c12; H4c11; Rbbp8; H2bc14; Psmc5; Psma2; H4c18; Psma4; Top3a; Mcm4; H2bc18; Psmb3; Rad9a; Uimc1; H4c6; Nsd2; H4c8; Wrn; Psma6; Psmb4; Psmd3; Psmd6; Psma3; Ywhaq; Brip1; Orc6; H2bc3; Babam1; H2ax; Rnf168; Psmd12; Psmd13; Adrm1; H2bc21; H4c17; Psmd1; Orc2; Mcm5; Ywhah; Mcm3; Psmc2; Ccnb2; Pias4; Rnf8; Mcm2; Rfc5; H2bc8; Ubb; H2bc4","eye","RR-3","GLDS-194"
"REACTOME_G2_M_DNA_DAMAGE_CHECKPOINT",0.00145723482288085,0.00805895015684109,0.45505986738723,0.389538599353566,1.74672547557531,82,"reactome","Rhno1; Abraxas1; H4c1; Chek1; H4c4; Rfc4; Kat5; Rad1; Rfc3; H2bc7; H4c2; H4c3; H4c12; H4c11; Rbbp8; H2bc14; H4c18; Top3a; H2bc18; Rad9a; Uimc1; H4c6; Nsd2; H4c8; Wrn; Ywhaq; Brip1; H2bc3; Babam1; H2ax; Rnf168; H2bc21; H4c17; Ywhah; Pias4; Rnf8; Rfc5; H2bc8; H2bc4; H3f4; Rpa3; Rpa2","eye","RR-3","GLDS-194"
"REACTOME_GAB1_SIGNALOSOME",0.248995983935743,0.40877151785553,0.121543282035469,-0.384411012049211,-1.17254907195618,17,"reactome","Gab1; Pag1; Grb2; Tgfa; Csk; Egf; Pxn","eye","RR-3","GLDS-194"
"REACTOME_GABA_B_RECEPTOR_ACTIVATION",0.480651731160896,0.6303157432589,0.0822054920415869,0.252593478345626,0.983150902640133,43,"reactome","Gng4; Kcnj3; Gnb2; Gng10; Gng8; Gngt2; Gngt1; Gnai2; Gnb3; Gnai3; Gng11; Gng2; Kcnj16; Gnai1; Kcnj5; Gnal; Adcy9; Adcy7","eye","RR-3","GLDS-194"
"REACTOME_GABA_RECEPTOR_ACTIVATION",0.991786447638604,1,0.0472587336673259,0.152043404238512,0.642748075091024,60,"reactome","Gng4; Kcnj3; Gnb2; Gng10; Gng8; Gngt2; Gngt1; Gnai2; Gnb3; Gnai3; Gng11; Gng2","eye","RR-3","GLDS-194"
"REACTOME_GABA_SYNTHESIS_RELEASE_REUPTAKE_AND_DEGRADATION",0.579591836734694,0.705954461873737,0.0725351864394589,0.295624001577572,0.926010726486891,19,"reactome","Stx1a; Slc6a12; Slc6a13; Cplx1; Snap25; Hspa8; Abat; Rab3a; Rims1","eye","RR-3","GLDS-194"
"REACTOME_GAMMA_CARBOXYLATION_HYPUSINYLATION_HYDROXYLATION_AND_ARYLSULFATASE_ACTIVATION",0.00098098671017598,0.00580638079806864,0.45505986738723,0.4321496832781,1.80693731007076,57,"reactome","Rpl27a; Rps6; Rpl8; Rwdd1; Eef2; Arsk; Rps23; Dph5; Dph3; Zc3h15; Eif5a2; Fn3krp; Riox1; Dohh; Arsg; Dhps; Tpst1; Etf1; Tpst2; Icmt; Drg1; Gas6; Dph2; Dph1; Bglap3; Asph; Sumf1; U2af2; Dnajc24; Dph7; Eif5a","eye","RR-3","GLDS-194"
"REACTOME_GAP_FILLING_DNA_REPAIR_SYNTHESIS_AND_LIGATION_IN_GG_NER",0.0518756272205457,0.13654762453485,0.321775918075361,0.451585741707599,1.5389587765268,25,"reactome","Uba52; Rps27a; Pold2; Rfc4; Rfc3; Pole3; Pold4; Pcna; Pole4; Rfc5; Ubb; Rpa3; Rpa2; Pold3","eye","RR-3","GLDS-194"
"REACTOME_GAP_JUNCTION_ASSEMBLY",0.278481012658228,0.438757854475913,0.117249716749792,0.320570598839461,1.11410371810861,28,"reactome","Tubb3; Tuba1c; Tubb4b; Tuba1b; Tubb2a; Tuba8; Tubb2b; Tuba1a; Tuba4a","eye","RR-3","GLDS-194"
"REACTOME_GAP_JUNCTION_TRAFFICKING_AND_REGULATION",0.680894308943089,0.785060091172814,0.0643583367917361,0.227850883667576,0.880094158402701,40,"reactome","Tubb3; Clta; Tuba1c; Cltb; Tubb4b; Tuba1b; Tubb2a; Tuba8","eye","RR-3","GLDS-194"
"REACTOME_GASTRIN_CREB_SIGNALLING_PATHWAY_VIA_PKC_AND_MAPK",0.0903614457831325,0.198686311511105,0.211400189384923,-0.454611168460385,-1.38667698627452,17,"reactome","Prkca; Rps6ka3; Kras; Sos1; Grb2","eye","RR-3","GLDS-194"
"REACTOME_GASTRULATION",0.206185567010309,0.363688622754491,0.137250779610133,0.23909286150244,1.12190534187258,105,"reactome","Psma7; Nog; Kat2b; Psmc1; Sem1; Psmd2; Psmc3; Psma5; Psmb6; Psmd14; Smad2; Psmd8; Psmb1; Psma1; Psmb7; Snw1; Pax6; Psmc5; Psma2; Eomes; Ctnnb1; Psma4; Psmb3; Psma6; Psmb4; Psmd3; Psmd6; Psma3","eye","RR-3","GLDS-194"
"REACTOME_GENERATION_OF_SECOND_MESSENGER_MOLECULES",0.982283464566929,0.998018624925698,0.04577044581081,-0.174422755583817,-0.57810639562998,24,"reactome","Enah; Lat; Cd4; Lck; Plcg1; Fyb; Pak2; Cd247; Pak3; Evl","eye","RR-3","GLDS-194"
"REACTOME_GENE_AND_PROTEIN_EXPRESSION_BY_JAK_STAT_SIGNALING_AFTER_INTERLEUKIN_12_STIMULATION",0.0101153165954964,0.0387282226296104,0.380730400722792,0.446433269517114,1.65651945430987,35,"reactome","Snrpa1; Bola2; Psme2; Taldo1; Ppia; Tcp1; Aip; Cfl1; Rplp0; Sod1; Hspa9; Cdc42; Arf1; Capza1; Hnrnpf","eye","RR-3","GLDS-194"
"REACTOME_GENE_SILENCING_BY_RNA",0.00732438686635865,0.0298148833407536,0.407017918923954,0.322584980863216,1.53280144864761,116,"reactome","Polr2h; H2ac19; H4c1; H2aj; H3c3; H3c7; H2ac13; H4c4; Polr2f; Tdrd9; Tdrd1; Polr2i; H3c1; H2ac20; Mael; Tdrd12; H2bc7; Polr2l; H3c11; H4c2; Ran; H4c3; Bcdin3d; H4c12; H2ac4; H4c11; H2ac10; Polr2k; H2bc14; H4c18; H3f3b; Prkra; H2bc18; H4c6; Hsp90aa1; H4c8; Tsn; Rae1; Polr2j; H3c8; H2bc3; H2ax; Nup50; H3c4; H2bc21; H3f3a; Mybl1; H4c17; Nup107; Polr2g; Polr2c; Tarbp2; H2ac18; H2az2; Polr2d; H2bc8; Tsnax; H2bc4; H3c10","eye","RR-3","GLDS-194"
"REACTOME_GLOBAL_GENOME_NUCLEOTIDE_EXCISION_REPAIR_GG_NER",0.00531807997853513,0.0232508882104033,0.407017918923954,0.35963626502784,1.62991691261592,84,"reactome","Ino80b; Uba52; Rps27a; Cetn2; Pold2; Rfc4; Cops4; Rfc3; Xpa; Cops7b; Rad23b; Pole3; Tfpt; Ino80c; Rbx1; Cdk7; Mcrs1; Gtf2h5; Pold4; Cul4a; Cops8; Ino80e; Actl6a; Sumo1; Chd1l; Pcna; Ube2i; Ercc5; Pole4; Parp1; Ercc1; Xpc; Gtf2h2; Cops7a; Actb; Ruvbl1; Rfc5; Mnat1; Ubb; Ercc3; Sumo2; Gps1; Rpa3; Rpa2; Cops2","eye","RR-3","GLDS-194"
"REACTOME_GLUCAGON_LIKE_PEPTIDE_1_GLP1_REGULATES_INSULIN_SECRETION",0.172764227642276,0.322277392279885,0.150169802128406,0.312661909717041,1.20768423570594,40,"reactome","Rapgef4; Gng4; Gnb2; Gng10; Akap5; Gng8; Kcns3; Gngt2; Gngt1; Gnb3; Prkar2b; Gng11; Gng2","eye","RR-3","GLDS-194"
"REACTOME_GLUCAGON_SIGNALING_IN_METABOLIC_REGULATION",0.594202898550725,0.717367336177556,0.072003313661988,0.255995918021206,0.916531864784468,31,"reactome","Gng4; Gnb2; Gng10; Gng8; Gnb3; Prkar2b; Gng11; Gng2","eye","RR-3","GLDS-194"
"REACTOME_GLUCAGON_TYPE_LIGAND_RECEPTORS",0.0538302277432712,0.138691998538546,0.282013350011725,0.393013395359886,1.40709001502373,31,"reactome","Gng4; Sct; Gip; Gnb2; Gng10; Gng8; Gngt2; Gngt1; Vip; Gnb3; Gng11; Gng2","eye","RR-3","GLDS-194"
"REACTOME_GLUCONEOGENESIS",0.531746031746032,0.673914241622575,0.0755015292281669,0.283775964042925,0.939914345631101,22,"reactome","Aldoa; Pgam1; Tpi1; Pgk1; Eno2; Pcx; Aldoc; Gapdh; Pck2","eye","RR-3","GLDS-194"
"REACTOME_GLUCOSE_METABOLISM",0.517374517374517,0.661056121966274,0.0755015292281669,-0.22391074449321,-0.974459930889064,77,"reactome","Nup160; Pom121; Nup98; Nup153; Nup214; Gckr; Eno3; Pfkfb3; Nup155; Pgam2; Tpr; Nup188; Ranbp2; Nup93","eye","RR-3","GLDS-194"
"REACTOME_GLUTAMATE_NEUROTRANSMITTER_RELEASE_CYCLE",0.269685039370079,0.429222555392785,0.114750719227023,-0.344641196969167,-1.14227802157216,24,"reactome","Syt1; Slc1a2; Slc38a2; Stxbp1; Vamp2","eye","RR-3","GLDS-194"
"REACTOME_GLUTATHIONE_CONJUGATION",0.0903490759753593,0.198686311511105,0.213927855492356,0.365705307976683,1.33687049001965,33,"reactome","Chac1; Gclc; Akr1a1; Esd; Ggt6; Ggt1; Gstt2; Gstz1; Cndp2; Ggct; Mgst3; Gss; Chac2; Gsta3; Gstm5; Gstk1; Ggt7; Gsto1","eye","RR-3","GLDS-194"
"REACTOME_GLYCEROPHOSPHOLIPID_BIOSYNTHESIS",0.536203522504892,0.678722124527661,0.0743625384422526,-0.204366107967809,-0.963921066125307,120,"reactome","Csnk2a2; Phospho1; Ptdss2; Pitpnm2; Etnk1; Pnpla2; Mboat2; Miga1; Lpgat1; Pitpnb; Pitpnm3; Ddhd1; Lclat1; Tmem86b; Stard7; Dgat2l6; Pcyt1b; Pla2g4b; Pla2r1; Pla2g15; Slc44a5; Slc44a1; Cpne1; Pla2g2e; Acp6; Chka; Cds2","eye","RR-3","GLDS-194"
"REACTOME_GLYCOGEN_METABOLISM",0.438223938223938,0.596093431497158,0.0843144320642653,-0.298554605737583,-1.00730321397342,25,"reactome","Phkg1; Gys1; Agl; Phka2; Phka1; Ubc; Pygm; Gys2; Gyg","eye","RR-3","GLDS-194"
"REACTOME_GLYCOSAMINOGLYCAN_METABOLISM",0.89662027833002,0.940420694225452,0.0503964322442957,-0.170419058253204,-0.806688398743014,126,"reactome","Cd44; Prelp; Sdc3; Arsb; Gpc6; Ids; Hs6st3; Chst13; Slc9a1; B3gat1; Xylt1; Ext2; St3gal1; Hs2st1; B4galt6","eye","RR-3","GLDS-194"
"REACTOME_GLYCOSPHINGOLIPID_BIOSYNTHESIS",1,1,0.0466015072985992,0.151178637083231,0.473550993179443,19,"reactome","St6galnac6; B3galt4; Fut1; B3galnt1; Gal3st1","eye","RR-3","GLDS-194"
"REACTOME_GLYCOSPHINGOLIPID_CATABOLISM",0.648033126293996,0.75816691321499,0.0676760401641789,0.246673701911773,0.88315591027415,31,"reactome","Arsk; Hexb; M6pr; Smpd1; Glb1l3; Arsg; Gla; Glb1; Psap; Hexa; Smpd2; Sumf1","eye","RR-3","GLDS-194"
"REACTOME_GLYCOSPHINGOLIPID_METABOLISM",0.850505050505051,0.911255411255411,0.0535669384770951,0.196562206953464,0.795637852264612,50,"reactome","Arsk; St6galnac6; Hexb; M6pr; Smpd1; Glb1l3; Arsg; B3galt4; Gla; Glb1; Fut1; Psap; Hexa; Smpd2; Sumf1; B3galnt1","eye","RR-3","GLDS-194"
"REACTOME_GLYOXYLATE_METABOLISM_AND_GLYCINE_DEGRADATION",0.10934393638171,0.228021194055176,0.190023305279108,0.457037610942861,1.36326646358234,16,"reactome","Mrps36; Gcsh; Grhpr; Got2; Gldc","eye","RR-3","GLDS-194"
"REACTOME_GOLGI_ASSOCIATED_VESICLE_BIOGENESIS",0.859154929577465,0.91538484922179,0.0529129848430583,0.19034301577781,0.787731449413466,55,"reactome","Vamp8; Snx2; Clta; Snx5; Rab5c; Bloc1s4; Dtnbp1; Txndc5; Pik3c2a; Bloc1s1; Arf1; Bloc1s3; Yipf6","eye","RR-3","GLDS-194"
"REACTOME_GOLGI_TO_ER_RETROGRADE_TRANSPORT",0.00015094352424112,0.00112437523159202,0.518848077743792,0.372168189360862,1.77719792130687,122,"reactome","Use1; Kif23; Dctn5; Tmed2; Copz2; Tubb3; Rab1b; Arfgap3; Tuba1c; Kdelr1; Tubb4b; Tuba1b; Kif5a; Actr1a; Stx18; Bnip1; Kdelr2; Capza2; Tmed3; Kifc2; Kif18b; Klc1; Arf5; Tubb2a; Copg2; Tuba8; Copz1; Copb2; Klc2; Dctn2; Arf1; Racgap1; Tubb2b; Capza1; Napb; Kif3c; Surf4; Nbas; Dctn3; Pafah1b3; Dync1li1; Kif11; Pla2g4a; Rab6a; Arcn1; Tuba1a; Rint1; Dynll1; Kif5b; Tuba4a; Dync1i1; Rab3gap1; Kif22; Kif27; Kif3a","eye","RR-3","GLDS-194"
"REACTOME_GPCR_LIGAND_BINDING",0.993534482758621,1,0.0493910105981501,0.139501682026962,0.767122524896206,361,"reactome","Adora2b; Adra2c; Npy; Ffar2; Sstr3; P2ry12; Pomc; Cckar; Gng4; Hrh1; Kiss1; Hc; Rgr; Sct; Gip; Cckbr; Oprl1; Adgre4; Htr1d; Npffr2; Rrh; Gnb2; Gal; Gpr31b; Htr4; Ece2; Ptafr; Gng10; Adgre1; Gng8; Gpr68; Ackr4; Crhr1; Cx3cr1; Hcrtr2; Gngt2; Gngt1; Wnt9b; Opn1sw; Plppr3; Kiss1r; Prokr1; Tshr; Chrm5; Ptger3; Htr5a; Vip; Fpr1; Tac1; Mc3r; Tas1r1; Bdkrb2; Gnb3; Adora1; Hcar2; Grm8; Ccl4; Cxcr2; Psap; Gng11; Rxfp1; Ntsr2; Prlhr; F2rl1; Rln1; Wnt2; Avp; Crhbp; Gng2; Mc4r; Pthlh; Galr1; Wnt3; Shh; Galr3; Ramp2; Opn1mw; Ramp3","eye","RR-3","GLDS-194"
"REACTOME_GPER1_SIGNALING",0.475806451612903,0.627600580594737,0.0822054920415869,0.25154408197794,0.986008220186036,44,"reactome","Gng4; Gnaz; Gnb2; Gng10; Gng8; Gngt2; Gngt1; Gnai2; Gnb3; Gnai3; Prkar2b; Gng11; Gng2","eye","RR-3","GLDS-194"
"REACTOME_GPVI_MEDIATED_ACTIVATION_CASCADE",0.98252427184466,0.998018624925698,0.0451344222209097,-0.163399244859624,-0.589238869023879,33,"reactome","Lat; Pik3r5; Pik3cb; Clec1b; Pik3r6; Rac2; Lck; Rhog","eye","RR-3","GLDS-194"
"REACTOME_GRB2_EVENTS_IN_ERBB2_SIGNALING",0.282565130260521,0.44391508986409,0.112843355675562,-0.377885643405736,-1.14449365373905,16,"reactome","Kras; Sos1; Grb2; Nrg4; Nrg3; Egf; Nrg1; Erbb4","eye","RR-3","GLDS-194"
"REACTOME_GROWTH_HORMONE_RECEPTOR_SIGNALING",0.635051546391753,0.749333451830786,0.0684714904492087,0.281287336715284,0.897292469565187,20,"reactome","Ptpn1; Socs1; Jak2; Stat1","eye","RR-3","GLDS-194"
"REACTOME_G_ALPHA_12_13_SIGNALLING_EVENTS",0.0502109896218713,0.133449110766867,0.321775918075361,-0.309505591309663,-1.35257833684319,79,"reactome","Prex1; Arhgef26; Kalrn; Itsn1; Arhgef7; Arhgef39; Tiam2; Sos1; Obscn; Rock1; Arhgef1; Plekhg2; Plxnb1; Rasgrf2; Arhgef19; Arhgef33; Rock2","eye","RR-3","GLDS-194"
"REACTOME_G_ALPHA_I_SIGNALLING_EVENTS",0.813141683778234,0.883560202076901,0.0564118388217596,0.168460997975157,0.89174147894668,257,"reactome","Adra2c; Npy; Sstr3; P2ry12; Ppp3cc; Pomc; Gna15; Gng4; Gnat2; Gna11; Hc; Rgr; Gnaz; Oprl1; Ppp1ca; Htr1d; Rrh; Gnb2; Gal; Gpr31b; Ppp2r1a; Gng10; Rgs1; Ppp2r5d; Gng8; Cx3cr1; Camkk1; Ppp2cb; Gngt2; Rgs10; Gngt1; Opn1sw; Ptger3; Htr5a; Rgs19; Fpr1; Ppp2ca; Tas1r1; Rgs4; Gnai2; Calm1; Bdkrb2; Gnb3; Adora1; Hcar2; Gnai3; Grm8; Pla2g4a; Prkar2b; Ccl4; Cxcr2; Psap; Gng11; Cdk5","eye","RR-3","GLDS-194"
