"pathway","pval","padj","log2err","ES","NES","size","db","leadingEdge_str","tissue","mission","glds"
"REACTOME_ABC_FAMILY_PROTEINS_MEDIATED_TRANSPORT",0.00462942230112757,0.0206065748769703,0.407017918923954,0.361066654632198,1.64210953894302,86,"reactome","Uba52; Psma7; Rps27a; Psmc1; Sem1; Abcb6; Psmd2; Psmc3; Psma5; Psmb6; Psmd14; Psmd8; Psmb1; Psma1; Eif2s1; Psmb7; Os9; Psmc5; Psma2; Psma4; Psmb3; Psma6; Psmb4; Abcb10; Psmd3; Psmd6; Psma3; Psmd12; Psmd13; Adrm1; Rnf185; Psmd1","eye","RR-3","GLDS-194"
"REACTOME_ABC_TRANSPORTERS_IN_LIPID_HOMEOSTASIS",0.0244839405540926,0.0753087497380095,0.352487857583619,-0.54876304272364,-1.67386358949333,17,"reactome","Abcg4; Abcd1; Abca5; Abca3; Abca2; Abca7; Abcg1; Abcd2","eye","RR-3","GLDS-194"
"REACTOME_ABC_TRANSPORTER_DISORDERS",0.000403110339997796,0.00267518680180355,0.49849310876659,0.430034197073513,1.84108750024769,64,"reactome","Uba52; Psma7; Rps27a; Psmc1; Sem1; Abcb6; Psmd2; Psmc3; Psma5; Psmb6; Psmd14; Psmd8; Psmb1; Psma1; Psmb7; Os9; Psmc5; Psma2; Psma4; Psmb3; Psma6; Psmb4; Psmd3; Psmd6; Psma3; Psmd12; Psmd13; Adrm1; Rnf185; Psmd1; Psmc2","eye","RR-3","GLDS-194"
"REACTOME_ABERRANT_REGULATION_OF_MITOTIC_EXIT_IN_CANCER_DUE_TO_RB1_DEFECTS",0.552577319587629,0.684602790496838,0.0755015292281669,0.29684325117938,0.946915055028257,20,"reactome","Anapc15; Cdc26; Anapc11; Cdc16; Ube2s","eye","RR-3","GLDS-194"
"REACTOME_ABERRANT_REGULATION_OF_MITOTIC_G1_S_TRANSITION_IN_CANCER_DUE_TO_RB1_DEFECTS",0.968253968253968,0.990190193724549,0.046788296531803,0.186358226300476,0.566593895500628,17,"reactome","Cdkn1c; Ccnd1; E2f1; Tfdp1; Cdk4","eye","RR-3","GLDS-194"
"REACTOME_ABORTIVE_ELONGATION_OF_HIV_1_TRANSCRIPT_IN_THE_ABSENCE_OF_TAT",0.0136885316119946,0.0485195742965954,0.380730400722792,0.488531324928532,1.6364004602238,23,"reactome","Polr2h; Nelfb; Polr2f; Polr2i; Polr2l; Ctdp1; Ncbp2; Polr2k; Polr2j; Polr2g; Polr2c; Polr2d; Gtf2f1; Supt4a","eye","RR-3","GLDS-194"
"REACTOME_ACETYLCHOLINE_NEUROTRANSMITTER_RELEASE_CYCLE",0.612449799196787,0.731333184428006,0.0689567351672811,-0.294639930543111,-0.898724974807256,17,"reactome","Syt1; Stxbp1; Vamp2; Ppfia1","eye","RR-3","GLDS-194"
"REACTOME_ACTIVATED_NOTCH1_TRANSMITS_SIGNAL_TO_THE_NUCLEUS",0.225,0.384360374414977,0.12563992130984,-0.327464845898933,-1.17815724126051,32,"reactome","Numb; Notch1; Dll4; Adam10; Ncstn; Ubc; Dlk1; Psen1; Psen2; Dner; Mib1","eye","RR-3","GLDS-194"
"REACTOME_ACTIVATED_PKN1_STIMULATES_TRANSCRIPTION_OF_AR_ANDROGEN_RECEPTOR_REGULATED_GENES_KLK2_AND_KLK3",1.87090245134738e-06,2.69557655819129e-05,0.643551836150722,0.575735926147969,2.29050311284871,46,"reactome","H2ac19; H4c1; H2aj; H3c3; H3c7; H2ac13; H4c4; H3c1; H2ac20; H2bc7; H3c11; H4c2; H4c3; H4c12; H2ac4; H4c11; H2ac10; H2bc14; H4c18; H3f3b; H2bc18; H4c6; H4c8; H3c8; H2bc3; H2ax; H3c4; H2bc21; H3f3a; H4c17; H2ac18; H2az2; H2bc8; H2bc4; H3c10","eye","RR-3","GLDS-194"
"REACTOME_ACTIVATED_TAK1_MEDIATES_P38_MAPK_ACTIVATION",0.423459244532803,0.582632175677288,0.0878312634480124,0.300260887720649,1.00576366300596,23,"reactome","Uba52; Rps27a; Ripk2; Mapkapk2","eye","RR-3","GLDS-194"
"REACTOME_ACTIVATION_OF_AMPK_DOWNSTREAM_OF_NMDARS",0.0967741935483871,0.208452312964021,0.204294756516886,0.419449752570456,1.36270583928564,21,"reactome","Tubb3; Tuba1c; Tubb4b; Tuba1b; Tubb2a; Prkag1; Tuba8; Tubb2b; Calm1; Prkab1; Tuba1a; Tuba4a; Camkk2; Prkaa1; Prkag3; Mapt","eye","RR-3","GLDS-194"
"REACTOME_ACTIVATION_OF_ANTERIOR_HOX_GENES_IN_HINDBRAIN_DEVELOPMENT_DURING_EARLY_EMBRYOGENESIS",0.0107777551765595,0.0408355139105585,0.380730400722792,0.341517445317114,1.57093962026598,92,"reactome","Ezh2; Polr2h; H2ac19; H4c1; Hdac3; H2aj; H3c3; H3c7; H2ac13; H4c4; Polr2f; Polr2i; H3c1; H2ac20; H2bc7; Polr2l; H3c11; H4c2; H4c3; H4c12; H2ac4; H4c11; H2ac10; Polr2k; Pax6; H2bc14; H4c18; H3f3b; H2bc18; H4c6; H4c8; Polr2j; H3c8; H2bc3; H2ax; Dpy30; H3c4; H2bc21; H3f3a; H4c17; Rbbp7; Polr2g; Polr2c; H2ac18; H2az2; Meis1; Polr2d; H2bc8; H2bc4; H3c10","eye","RR-3","GLDS-194"
"REACTOME_ACTIVATION_OF_APC_C_AND_APC_C_CDC20_MEDIATED_DEGRADATION_OF_MITOTIC_PROTEINS",4.18062693610942e-07,7.04274845390742e-06,0.674962860011025,0.532326764892047,2.27902841113471,64,"reactome","Uba52; Anapc15; Psma7; Rps27a; Psmc1; Sem1; Psmd2; Psmc3; Cdc26; Psma5; Psmb6; Psmd14; Psmd8; Psmb1; Psma1; Psmb7; Anapc11; Psmc5; Pttg1; Psma2; Psma4; Cdc16; Psmb3; Ube2s; Psma6; Psmb4; Bub3; Psmd3; Psmd6; Psma3; Psmd12; Psmd13; Adrm1; Psmd1; Psmc2; Plk1; Ubb; Bub1b; Psmb2; Cdc23; Cdk1; Psmb5; Anapc16","eye","RR-3","GLDS-194"
"REACTOME_ACTIVATION_OF_ATR_IN_RESPONSE_TO_REPLICATION_STRESS",0.0555555555555556,0.141097857300641,0.276500599254472,0.377144055035002,1.40736109256726,36,"reactome","Chek1; Rfc4; Rad1; Rfc3; Orc1; Mcm4; Rad9a; Orc6; Orc2; Mcm5; Mcm3; Mcm2; Rfc5; Rpa3; Rpa2; Mcm7; Cdc25a","eye","RR-3","GLDS-194"
"REACTOME_ACTIVATION_OF_BAD_AND_TRANSLOCATION_TO_MITOCHONDRIA",0.426070038910506,0.583913257330418,0.0862865626267245,0.348818473191959,1.02869127536768,15,"reactome","Akt3; Ppp3cc; Bad; Ywhaq; Ywhah","eye","RR-3","GLDS-194"
"REACTOME_ACTIVATION_OF_BH3_ONLY_PROTEINS",0.911157024793388,0.949302513937926,0.0514264916187015,0.198059929933113,0.707099725888164,30,"reactome","Akt3; Ppp3cc; Bad; Ywhaq; Trp73; E2f1; Ywhah; Dynll1; Bbc3; Tfdp1; Bid","eye","RR-3","GLDS-194"
"REACTOME_ACTIVATION_OF_GENE_EXPRESSION_BY_SREBF_SREBP",0.0108522460926569,0.0408357713795852,0.380730400722792,-0.425868709593181,-1.65115477562408,43,"reactome","Chd9; Ncoa2; Tgs1; Nfya; Acaca; Crebbp; Ncoa1; Ncoa6; Dhcr7; Sp1; Tbl1x; Acacb; Fasn; Scd1; Carm1; Srebf1","eye","RR-3","GLDS-194"
"REACTOME_ACTIVATION_OF_IRF3_IRF7_MEDIATED_BY_TBK1_IKK_IKBKE",0.49498997995992,0.642447196120867,0.0797705918628453,0.314736346418647,0.978982123174478,18,"reactome","Uba52; Rps27a; Irf7","eye","RR-3","GLDS-194"
"REACTOME_ACTIVATION_OF_KAINATE_RECEPTORS_UPON_GLUTAMATE_BINDING",0.448347107438017,0.606848062601518,0.086794975677172,0.28185180328394,1.00624761863979,30,"reactome","Gng4; Gnb2; Gng10; Gng8; Gngt2; Gngt1; Calm1; Gnb3; Dlg3; Gng11; Gng2; Plcb1; Ncald","eye","RR-3","GLDS-194"
"REACTOME_ACTIVATION_OF_MATRIX_METALLOPROTEINASES",1,1,0.0454059226590179,0.127541192248638,0.427216137519321,23,"reactome","Ctsk; Ctrb1; Mmp3; Mmp24; Col18a1; Mmp11; Timp1","eye","RR-3","GLDS-194"
"REACTOME_ACTIVATION_OF_NF_KAPPAB_IN_B_CELLS",5.64491456223638e-08,1.26146560115282e-06,0.719512826338911,0.584454860266899,2.4047353054748,54,"reactome","Uba52; Psma7; Rps27a; Psmc1; Bcl10; Sem1; Psmd2; Psmc3; Skp1; Psma5; Psmb6; Nfkb1; Psmd14; Psmd8; Psmb1; Psma1; Psmb7; Psmc5; Psma2; Psma4; Psmb3; Psma6; Psmb4; Psmd3; Psmd6; Psma3; Cul1; Nfkbib; Card11; Psmd12; Psmd13; Adrm1; Psmd1; Psmc2","eye","RR-3","GLDS-194"
"REACTOME_ACTIVATION_OF_NMDA_RECEPTORS_AND_POSTSYNAPTIC_EVENTS",0.380497131931166,0.5432129849604,0.0916795246008379,-0.235409945895928,-1.03605026267935,85,"reactome","Rps6ka3; Prkab2; Kras; Prkaa2; Prkar2a; Tubb4a; Arhgef7; Camk2a; Ppm1e; Camk2d; Actn2; Git1; Rasgrf2","eye","RR-3","GLDS-194"
"REACTOME_ACTIVATION_OF_SMO",0.8389662027833,0.902388094759409,0.053457214108991,-0.239506301426935,-0.736537577154548,18,"reactome","Ptch1; Cdon; Iqce; Gas1; Grk2; Evc; Ihh; Evc2; Boc; Efcab7; Dhh; Arrb1; Csnk1a1; Smo; Arrb2; Kif3a; Gas8; Shh","eye","RR-3","GLDS-194"
"REACTOME_ACTIVATION_OF_THE_MRNA_UPON_BINDING_OF_THE_CAP_BINDING_COMPLEX_AND_EIFS_AND_SUBSEQUENT_BINDING_TO_43S",5.43725938331148e-18,3.13357843406635e-16,1.0959292864312,0.7404333247686,3.11549631046894,58,"reactome","Rps6; Rps7; Rps5; Rps3a1; Rps4x; Rps25; Rps9; Rps24; Rps29; Rps11; Rps19; Rps26; Rps10; Rps27a; Rpsa; Rps28; Rps15a; Rps20; Rps3; Eif4h; Eif3k; Rps13; Rps17; Rps16; Eif4e; Eif4a2; Rps14; Rps12; Rps27; Eif3i; Rps21; Rps2; Rps15; Rps23; Eif3g; Fau; Eif3l; Eif4a1; Rps18; Eif2s1","eye","RR-3","GLDS-194"
"REACTOME_ACTIVATION_OF_THE_PRE_REPLICATIVE_COMPLEX",0.0280901511747548,0.0822425549100441,0.352487857583619,0.438523211893301,1.58709004993988,32,"reactome","Pola1; Gmnn; Orc1; Pole3; Mcm4; Pole4; Orc6; Orc2; Mcm5; Mcm3; Mcm2; Rpa3; Rpa2; Mcm7","eye","RR-3","GLDS-194"
"REACTOME_ACYL_CHAIN_REMODELLING_OF_PC",0.775347912524851,0.85499090051834,0.0571258510018113,0.239051047887339,0.800733187041896,23,"reactome","Pla2g5; Plb1; Pnpla8; Pla2g12a; Pla2g4a; Plbd1","eye","RR-3","GLDS-194"
"REACTOME_ACYL_CHAIN_REMODELLING_OF_PE",0.505952380952381,0.649648062802872,0.0780892306943345,0.28881929723149,0.956618724487562,22,"reactome","Plaat1; Pla2g5; Pnpla8; Pla2g12a; Pla2g4a; Plbd1","eye","RR-3","GLDS-194"
"REACTOME_ACYL_CHAIN_REMODELLING_OF_PS",0.957915831663327,0.98305326679601,0.0477342401407188,0.188794967699375,0.587243578398609,18,"reactome","Pla2g5; Pla2g12a; Pla2g4a; Osbpl10; Mboat1; Osbpl5; Pla2g2d; Plaat3","eye","RR-3","GLDS-194"
"REACTOME_ADHERENS_JUNCTIONS_INTERACTIONS",8.06576925650113e-05,0.000654223506360647,0.538434096309916,-0.496840832460184,-2.03307193168511,56,"reactome","Amot; Tnrc6b; Tnrc6a; Snai1; Afdn; Nectin1; Cdh2; Cdh5; Ago2; Sp1; Cadm2; Cdh4; Ago1; Cdh15; Adam19; Sox10; Ctnnd1; Prdm8; Tnrc6c; Ago3; Cdh11; Cadm3; Cdh8; Cdh6; Heyl","eye","RR-3","GLDS-194"
"REACTOME_ADIPOGENESIS",0.00166448342997992,0.00897837121097544,0.45505986738723,-0.351920742284632,-1.62586132359296,107,"reactome","Chd9; Ncoa2; Tgs1; Ncor2; Gatad2b; Ep300; Crebbp; Ncoa1; Ppargc1b; Ncoa6; Med12; Med13; Med15; Med24; Ncoa3; Tbl1x; Med13l; Chd4; Ppargc1a; Nr2f2; Elovl3; Med14; Mbd3; Ebf2; Carm1; Ncor1; Lpl; Hdac1; Slc2a4; Mta1; Srebf1; Zfp423; Srebf2; Cox7a1; Cebpd; Med25; Pparg","eye","RR-3","GLDS-194"
"REACTOME_ADORA2B_MEDIATED_ANTI_INFLAMMATORY_CYTOKINES_PRODUCTION",0.0577689243027888,0.144597405169852,0.266350657088526,0.361951759159331,1.40922299915165,41,"reactome","Adora2b; Gng4; Gnaz; Gnb2; Gng10; Gng8; Gngt2; Gngt1; Gnai2; Gnb3; Gnai3; Prkar2b; Gng11; Gng2","eye","RR-3","GLDS-194"
"REACTOME_ADP_SIGNALLING_THROUGH_P2Y_PURINOCEPTOR_1",0.0211738285589418,0.0673992507908176,0.352487857583619,0.486801225992403,1.65896960416013,25,"reactome","Gna15; Gng4; Gna11; Gnb2; Gng10; Gng8; Gngt2; Gngt1; Gnb3; Pla2g4a; Gng11; Gng2","eye","RR-3","GLDS-194"
"REACTOME_ADP_SIGNALLING_THROUGH_P2Y_PURINOCEPTOR_12",0.0149905740117733,0.0517257159383391,0.380730400722792,0.508505473351892,1.68425677222994,22,"reactome","P2ry12; Gng4; Gnb2; Gng10; Gng8; Gngt2; Gngt1; Gnai2; Gnb3; Gnai3; Gng11; Gng2","eye","RR-3","GLDS-194"
"REACTOME_ADRENALINE_NORADRENALINE_INHIBITS_INSULIN_SECRETION",0.39873417721519,0.555488452990627,0.0946646223153342,0.29625695235614,1.02960462790535,28,"reactome","Adra2c; Gng4; Gnb2; Gng10; Gng8; Gngt2; Gngt1; Gnai2; Gnb3; Gng11; Gng2","eye","RR-3","GLDS-194"
"REACTOME_AEROBIC_RESPIRATION_AND_RESPIRATORY_ELECTRON_TRANSPORT",2.01067348004356e-25,1.69360573895977e-23,1.31101476274061,0.542988532049483,2.85119616113975,236,"reactome","Maea; Cox7a2l; Uba52; Mrps36; Lyrm2; Uqcc3; Rps27a; Idh3b; Smim4; Ndufaf1; Atp5g2; Smim20; Cox7c; Atp5b; Etfb; Coa3; Ndufb10; Ndufa12; Cox14; Ndufa1; Iscu; Ndufa6; Sirt3; Ndufb8; Uqcrfs1; Cox8a; Uqcrb; Ndufb11; Ndufa2; Ecsit; Sfxn4; Sucla2; Cox6b1; Higd1a; Pkm; Atp5k; Uqcr10; Ldhb; Sdhd; Isca2; Tmem186; Cox6c; Ndufb7; Hscb; Atp5a1; Ndufs6; Atp5c1; Surf1; Atp5h; Nfs1; Uqcr11; Ndufb3; Slc25a11; Ndufs8; Ndufa7; Tmem177; Mkln1; Ndufs5; Mdh1; Ndufv3; Sdhc; Sdhb; Atp5mpl; Uqcc2; Ndufb5; Pgam5; Ndufc1; Lyrm4; Fh1; Ndufa4; Uqcrh; Ndufs3; Ndufv1; Coq10b; Sco1; Atp5j2; Ndufa13; Hagh; Ndufb6; Atp5pb; Ndufs7; Tmem126b; Cox4i1; Pdhb; Timmdc1; L2hgdh; Cox7a2; Cox17; Ndufb1; Higd2a; Rab5if; Hspa9; Pyurf; Atp5g1; Atp5l; Ndufa11; Cycs; Atp5o; Got2; Ndufaf5; Ndufc2; Pdhx; Slc25a4; Sdhaf1; Ndufv2; Cox6b2; Ndufa10; Ndufa9; Dlat; Ndufa5; Ndufs2; Sdha; Ndufaf8; Suclg1; Mpc1; Pdp1; Tmem126a; Ndufb2; Ndufa8; Got1; Cox5b; Atp5e; Cox6a1; Ndufs1; Pcx; Gstz1; Tmem223; Ndufa3; Slc25a14; Uqcrc2; Vdac1; Uqcc1; Aco2; Idh3g; Ndufaf4; Sdhaf4; Cox19; Ndufb9; Uqcrc1; Pdha1; Ndufs4; Mpc2","eye","RR-3","GLDS-194"
"REACTOME_AGGREPHAGY",0.00703052719419028,0.0288330609649377,0.407017918923954,0.457595241784589,1.6979366726761,35,"reactome","Uba52; Park7; Rps27a; Tubb3; Tuba1c; Tubb4b; Tuba1b; Tubb2a; Tuba8; Hsp90aa1; Tubb2b; Dync1li1; Ube2v1; Tuba1a; Dynll1; Tuba4a; Dync1i1; Ubb","eye","RR-3","GLDS-194"
"REACTOME_AMINE_LIGAND_BINDING_RECEPTORS",0.74642126789366,0.833161354070905,0.0602484086158019,0.228364100986124,0.840967884190782,34,"reactome","Adra2c; Hrh1; Htr1d; Htr4","eye","RR-3","GLDS-194"
"REACTOME_AMINO_ACIDS_REGULATE_MTORC1",0.390532544378698,0.550107156790961,0.0919686140000427,-0.252683331171305,-1.02612470671218,53,"reactome","Castor2; Slc38a9; Rptor; Sh3bp4; Wdr59; Szt2; Kics2; Rraga; Mtor; Sesn2; Nprl3; Depdc5; Fnip1; Rragc","eye","RR-3","GLDS-194"
"REACTOME_AMINO_ACID_TRANSPORT_ACROSS_THE_PLASMA_MEMBRANE",0.0309964814234087,0.0883884040589389,0.352487857583619,-0.428408919469833,-1.5232326578895,31,"reactome","Slc38a1; Slc7a1; Slc38a2; Slc7a8; Slc7a5; Slc43a2; Slc7a3; Slc7a2; Slc1a4","eye","RR-3","GLDS-194"
"REACTOME_AMYLOID_FIBER_FORMATION",1.5243595875766e-05,0.000162055703727803,0.593325476396405,0.449929341255229,2.04407068772557,85,"reactome","Uba52; Ttr; Cst3; H2ac19; Rps27a; H4c1; H3c3; H3c7; Ltf; H2ac13; H4c4; H3c1; H2ac20; H2bc7; H3c11; H4c2; Ins2; H4c3; H4c12; H2ac4; Snca; Siah2; H4c11; H2ac10; H2bc14; H4c18; H3f3b; Nppa; H2bc18; H4c6; H4c8; Apoe; Aph1a; H3c8; H2bc3; H2ax; H3c4; H2bc21; H3f3a; H4c17; Tgfbi; H2ac18; H2bc8; B2m; Ubb; H2bc4; H3c10; Siah1a; H2ac7; Psenen","eye","RR-3","GLDS-194"
"REACTOME_ANCHORING_FIBRIL_FORMATION",0.489754098360656,0.638429449648712,0.0815265143256594,-0.32829992189534,-0.963120337328376,15,"reactome","Col4a2; Col4a1; Col4a4; Lama3; Col1a1; Lamb3; Bmp1; Col4a5; Col4a3; Col1a2; Lamc2; Tll1; Col4a6; Tll2; Col7a1","eye","RR-3","GLDS-194"
"REACTOME_ANCHORING_OF_THE_BASAL_BODY_TO_THE_PLASMA_MEMBRANE",0.102661596958175,0.217850234871511,0.191892240384838,-0.275353800393747,-1.25278026711305,96,"reactome","Pcm1; Cep162; Cdk5rap2; Clasp1; Rpgrip1l; Akap9; C2cd3; Dctn1; Tubb4a; Cep192; Mark4; Csnk1d; Sfi1; Ttbk2; Cep97; Alms1; Tctn3; Ywhae; Ccp110; Cep89; Cep290; Cep164; Cep250; Mks1; Cep135; Cep63; Cntrl; Mapre1; Nphp4; Cep41","eye","RR-3","GLDS-194"
"REACTOME_ANTIGEN_ACTIVATES_B_CELL_RECEPTOR_BCR_LEADING_TO_GENERATION_OF_SECOND_MESSENGERS",0.410404624277457,0.568132823746922,0.0878312634480124,-0.288957881999389,-1.02740643953153,31,"reactome","Ahcyl1; Ighm; Sos1; Grb2; Cd19; Stim1","eye","RR-3","GLDS-194"
"REACTOME_ANTIGEN_PRESENTATION_FOLDING_ASSEMBLY_AND_PEPTIDE_LOADING_OF_CLASS_I_MHC",0.205450733752621,0.363438697026041,0.13880510939114,0.33895195050686,1.19459651421585,29,"reactome","Erap1; Calr; H2-T23; Tap1; Bcap31; H2-M3; Sec31a; H2-Q1; H2-D1; Pik3c3; Becn1; B2m; H2-Q2; Sec23a; Sec13; Canx; Hspa5","eye","RR-3","GLDS-194"
"REACTOME_ANTIGEN_PROCESSING_CROSS_PRESENTATION",2.13259035436171e-07,3.82817448856733e-06,0.690132458796796,0.485837342271679,2.23032980258116,95,"reactome","Vamp8; Psmb10; Uba52; Ctss; Psma7; Psme2; Rps27a; Psmc1; Sem1; Psmd2; Psmc3; Psme1; Calr; Psma5; Psmb6; Psmd14; Psmb8; Psmd8; Psmb1; Psma1; Psmb7; Sec61b; H2-T23; Psmc5; Psma2; Psma4; Vamp3; Psmb3; Hmgb1; Psma6; Psmb4; Psmd3; Psmd6; Tap1; Psma3; H2-M3; Psmd12; Psmd13; Adrm1; Psmd1; Cd207; Cd14; H2-Q1; H2-D1; Psmc2; Sec61g; Sec61a1; B2m; Ubb; Ncf4; Tlr1; H2-Q2; Itgav; Ncf1; Psmb2","eye","RR-3","GLDS-194"
"REACTOME_ANTIGEN_PROCESSING_UBIQUITINATION_PROTEASOME_DEGRADATION",0.0192793877119422,0.0632063758819663,0.352487857583619,0.243083063270803,1.31003163092037,289,"reactome","Uba52; Psma7; Fbxo9; Fbxw4; Fbxl4; Rps27a; Klhl13; Psmc1; Sem1; Psmd2; Ube2g2; Psmc3; Stub1; Cdc26; Rnf14; Spsb4; Skp1; Ube2m; Psma5; Psmb6; Psmd14; Lrrc41; Socs1; Fbxo15; Fbxo44; Rnf114; Mkrn1; Znrf2; Fbxl15; Klhl25; Fbxw21; Cdc34; Ube2q1; Psmd8; Psmb1; Psma1; Hace1; Psmb7; Fbxo6; Elob; Anapc11; Siah2; Rnf7; Rbx1; Ube2cbp; Psmc5; Psma2; Psma4; Ubac1; Cdc16; Trim37; Psmb3; Fbxl14; Ube2s; Rnf4; Psma6; Asb1; Rnf34; Psmb4; Fbxw2; Ube2l3; Psmd3; Psmd6; Psma3; Thop1; Uba5; Kctd7; Ube2q2; Tpp2; Klhl22; Ube2f; Cul1; Ube2j2; Rnf115; Trim11; Mib2; Rnf19b; Asb6; Psmd12; Psmd13; Hectd3; Rnf220; Ube2v1; Adrm1; Psmd1; Fbxo17; Trim41; Det1; Ube2w; Rnf126; Psmc2; Klhl2; Herc6; Ubox5; Mex3c; Rbck1; Kbtbd8; Anapc13; Fbxo2; Ubb; Keap1; Trim39; Klhl9; Vhl; Rnf25; Fbxw10; Rnf41; Siah1a; Btbd1; Fbxo21; Psmb2; Fbxo4; Klhl21; Cdc23; Klhl11; Blmh; Fbxo31; Pja1; Fbxw8; Psmb5; Cul7","eye","RR-3","GLDS-194"
"REACTOME_ANTIGEN_PROCESSING_UB_ATP_INDEPENDENT_PROTEASOMAL_DEGRADATION",2.36152763247067e-08,5.87698353989861e-07,0.73376198835648,0.796256186031635,2.49418777014746,19,"reactome","Psmb10; Psma7; Psme2; Psme1; Psma5; Psmb6; Psmb8; Psmb1; Psma1; Psmb7; Psma2; Psma4; Psmb3; Psma6; Psmb4; Psma3","eye","RR-3","GLDS-194"
"REACTOME_ANTIMICROBIAL_PEPTIDES",0.763809523809524,0.84652978600347,0.055826471778749,-0.22808451168149,-0.799012599092084,29,"reactome","Bpifb6; Rnase6; Art1; Atp7a; Cd4; Defb12; Ccr2; S100a8","eye","RR-3","GLDS-194"
"REACTOME_ANTIVIRAL_MECHANISM_BY_IFN_STIMULATED_GENES",0.0967741935483871,0.208452312964021,0.204294756516886,0.248176981311785,1.21296332217015,138,"reactome","Uba52; Cenpx; Faap20; Fancl; Rps27a; Ppm1b; Tubb3; Eif4e; Eif4a2; Tuba1c; Eif4e2; Npm1; Nck1; Pin1; Tubb4b; Eif4a1; Tuba1b; Eif4a3; Isg15; Ppp2r1a; Mx2; Eif2s1; Stat1; Snca; Prkra; Tubb2a; Fancc; Ppp2cb; Tuba8; Sumo1; Rnasel; Rae1; Ube2i; Tubb2b; Ppp2ca; Fancb; Usp18; Nup50","eye","RR-3","GLDS-194"
"REACTOME_ANTI_INFLAMMATORY_RESPONSE_FAVOURING_LEISHMANIA_PARASITE_INFECTION",0.266,0.42708211143695,0.116739204791222,0.255144220592703,1.11773684876795,72,"reactome","Adora2b; Gng4; Gnaz; Gnb2; Yes1; Gng10; Plk2; Gng8; Gngt2; Gngt1; Ggt1; Dpep2; Gnai2; Calm1; Gnb3; Gnai3; Prkar2b; Gng11; Plcg2; Gng2; Fyn; Lyn; Fcgr4","eye","RR-3","GLDS-194"
"REACTOME_APC_CDC20_MEDIATED_DEGRADATION_OF_NEK2A",0.0629282582963341,0.152877859845073,0.287805130535564,0.428890188114571,1.47704036195388,26,"reactome","Uba52; Anapc15; Rps27a; Cdc26; Anapc11; Cdc16; Ube2s; Bub3; Ubb; Bub1b; Cdc23; Anapc16; Anapc5","eye","RR-3","GLDS-194"
"REACTOME_APC_C_CDC20_MEDIATED_DEGRADATION_OF_CYCLIN_B",0.0666752453251249,0.159026958337115,0.287805130535564,0.438566927688066,1.48002185860895,24,"reactome","Uba52; Anapc15; Rps27a; Cdc26; Anapc11; Cdc16; Ube2s","eye","RR-3","GLDS-194"
"REACTOME_APC_C_CDH1_MEDIATED_DEGRADATION_OF_CDC20_AND_OTHER_APC_C_CDH1_TARGETED_PROTEINS_IN_LATE_MITOSIS_EARLY_G1",4.26833912243674e-06,5.69979431593687e-05,0.610526878385931,0.512462214017135,2.17025663962394,61,"reactome","Uba52; Anapc15; Psma7; Rps27a; Psmc1; Sem1; Psmd2; Psmc3; Cdc26; Psma5; Psmb6; Psmd14; Psmd8; Psmb1; Psma1; Psmb7; Anapc11; Psmc5; Pttg1; Psma2; Psma4; Cdc16; Psmb3; Ube2s; Psma6; Psmb4; Psmd3; Psmd6; Psma3; Aurka; Psmd12; Psmd13; Adrm1; Psmd1; Psmc2","eye","RR-3","GLDS-194"
"REACTOME_APC_C_MEDIATED_DEGRADATION_OF_CELL_CYCLE_PROTEINS",3.09044869047978e-05,0.000289234300519261,0.557332238758646,0.462403847111837,2.04753179000209,75,"reactome","Uba52; Anapc15; Psma7; Rps27a; Psmc1; Sem1; Psmd2; Psmc3; Cdc26; Skp1; Psma5; Psmb6; Psmd14; Psmd8; Psmb1; Psma1; Psmb7; Anapc11; Psmc5; Pttg1; Psma2; Psma4; Cdc16; Psmb3; Ube2s; Psma6; Psmb4; Bub3; Psmd3; Psmd6; Psma3; Cul1; Aurka; Psmd12; Psmd13; Adrm1; Psmd1","eye","RR-3","GLDS-194"
"REACTOME_APOPTOSIS",0.000960559915475698,0.00571637558394505,0.477270815362862,0.321227917191063,1.5952033063266,163,"reactome","Akt3; Oma1; Uba52; Psma7; Arhgap10; Ppp3cc; H1f5; Rps27a; H1f3; Psmc1; Sem1; Psmd2; Psmc3; H1f4; H1f2; Bad; H1f1; Fnta; Psma5; Psmb6; Psmd14; Psmd8; Psmb1; Psma1; Psmb7; Tradd; Psmc5; Gas2; Psma2; Ctnnb1; Psma4; Psmb3; Casp7; H1f0; Cycs; Hmgb1; Psma6; Psmb4; Psmd3; Psmd6; Psma3; Ywhaq; Dbnl; Trp73; Bcap31; Casp3; E2f1; Psmd12; Psmd13; Adrm1; Psmd1; Cd14; Ywhah; Psmc2; Dynll1; Bbc3; Lmna; Ubb; Prkcd; Tfdp1; Aven; Nmt1; Bax","eye","RR-3","GLDS-194"
"REACTOME_APOPTOTIC_CLEAVAGE_OF_CELLULAR_PROTEINS",0.875968992248062,0.926749803392877,0.0502948063662358,-0.197695153394768,-0.743268438124717,38,"reactome","Apc; Tjp1; Lmnb1; Rock1","eye","RR-3","GLDS-194"
"REACTOME_APOPTOTIC_EXECUTION_PHASE",0.145708582834331,0.282891663481548,0.163180127180689,0.300322490507526,1.2360220375295,52,"reactome","H1f5; H1f3; H1f4; H1f2; H1f1; Fnta; Gas2; Ctnnb1; Casp7; H1f0; Hmgb1; Dbnl; Bcap31; Casp3","eye","RR-3","GLDS-194"
"REACTOME_APOPTOTIC_FACTOR_MEDIATED_RESPONSE",0.393877551020408,0.552730719984241,0.0934449219410994,0.329327336408593,1.03158283634724,19,"reactome","Casp7; Cycs; Casp3; Aven; Bax; Septin4; Gsdmd; Gsdme; Apaf1; Bak1; Apip","eye","RR-3","GLDS-194"
"REACTOME_AQUAPORIN_MEDIATED_TRANSPORT",0.288888888888889,0.452323580034423,0.111918316325105,0.274274681699259,1.09531402345829,48,"reactome","Gng4; Rab11a; Gnb2; Rab11fip2; Gng10; Gng8; Gngt2; Gngt1; Gnb3; Prkar2b; Gng11; Myo5b; Avp; Gng2","eye","RR-3","GLDS-194"
"REACTOME_ARACHIDONATE_METABOLISM",0.0155653603200352,0.0527680171840204,0.380730400722792,0.394303761578568,1.5960494281411,50,"reactome","Pon1; Ptges; Ptgis; Alox5ap; Mapkapk2; Gpx4; Prxl2b; Ephx2; Ptgr2; Ggt1; Dpep2; Pla2g4a; Cbr1; Faah; Ptgs1; Gpx1; Ptgr1; Ptges2; Tbxas1; Ptges3; Alox12; Hpgd; Ptgds; Cyp2u1; Pon3; Cyp4f15; Ptgs2; Alox15; Cyp2j9; Cyp2c65; Akr1c18; Ltc4s","eye","RR-3","GLDS-194"
"REACTOME_ASPARAGINE_N_LINKED_GLYCOSYLATION",0.00391515592025364,0.0180890115302858,0.407017918923954,0.261465845527078,1.409268928135,294,"reactome","Man1a2; Uap1; Gosr2; Uba52; Nagk; Nans; Dctn5; Tmed2; Rps27a; Copz2; Psmc1; Tubb3; Ost4; Mvd; Rpn1; Rab1b; Arfgap3; Tuba1c; Calr; Kdelr1; St6galnac6; Alg1; Tubb4b; Tmem258; Trappc6b; Ykt6; St3gal4; Tuba1b; Fuom; Rad23b; Alg3; Gmppa; Gmds; Actr1a; Trappc3; Ins2; Kdelr2; Os9; Capza2; Tmed3; Dpm2; Cnih3; Arf5; Mgat1; Tubb2a; Cmas; Copg2; Tuba8; Mpdu1; Ddost; Cog4; Copz1; Bet1l; Copb2; Trappc6a; Trappc1; Dctn2; Mcfd2; Sptbn4; Ppp6c; Arf1; Dolk; Glb1; Rpn2; Tubb2b; Trappc5; Capza1; Napb; Dpm3; Dpagt1; B4galt2; Dctn3; Gfpt2; Renbp; Dync1li1; Fpgt; Ostc; Rnf185; Ubxn1; Amfr; Ctsz; Tmem115; Alg14; Sec31a; Cog6; Arcn1; Man1a; Slc35a1; Dolpp1; Tuba1a; Rnf139; Pmm1; Alg12; Alg9; Dynll1; Trappc9; Trappc4; Mgat2; Tuba4a; Trappc2","eye","RR-3","GLDS-194"
"REACTOME_ASPIRIN_ADME",0.994071146245059,1,0.0454059226590179,-0.161307243667215,-0.518087418865665,21,"reactome","Slco2b1; Glyatl3; Ugt1a5; Cyp2d22; Ugt1a10; Bche; Ugt1a2; Ugt1a6b; Ugt1a7c; Ugt1a1","eye","RR-3","GLDS-194"
"REACTOME_ASSEMBLY_AND_CELL_SURFACE_PRESENTATION_OF_NMDA_RECEPTORS",0.518518518518518,0.661745661745662,0.0787113806986485,0.256330690569807,0.956530630465231,36,"reactome","Tubb3; Lin7b; Tuba1c; Nefl; Tubb4b; Tuba1b; Tubb2a; Tuba8; Tubb2b; Dlg3; Tuba1a; Tuba4a; Grin3a; Lrrc7; Camk2b","eye","RR-3","GLDS-194"
"REACTOME_ASSEMBLY_OF_ACTIVE_LPL_AND_LIPC_LIPASE_COMPLEXES",0.469262295081967,0.623594918828585,0.0838361057159929,-0.335120260195955,-0.983128890747636,15,"reactome","Mbtps2; Mbtps1; Lpl; Furin; Pcsk6; Gpihbp1","eye","RR-3","GLDS-194"
"REACTOME_ASSEMBLY_OF_COLLAGEN_FIBRILS_AND_OTHER_MULTIMERIC_STRUCTURES",0.222444889779559,0.382158459898914,0.129442887745046,0.272288661742108,1.14569981207312,58,"reactome","Col9a3; Ctss; Col8a2; Loxl4; Col12a1; Col8a1; Col9a2","eye","RR-3","GLDS-194"
"REACTOME_ASSEMBLY_OF_THE_HIV_VIRION",0.0287019628254939,0.0829251960261632,0.352487857583619,0.543791346808573,1.62203829299966,16,"reactome","Uba52; Nmt2; Rps27a; Ppia; Mvb12a; Vps37d; Vps28","eye","RR-3","GLDS-194"
"REACTOME_ASSEMBLY_OF_THE_ORC_COMPLEX_AT_THE_ORIGIN_OF_REPLICATION",4.59344330424172e-08,1.05592574145415e-06,0.719512826338911,0.599537517943734,2.4267876847849,50,"reactome","H2ac19; H4c1; H2aj; H3c3; H3c7; H2ac13; H4c4; H3c1; Orc1; H2ac20; H2bc7; H3c11; H4c2; H4c3; H4c12; H2ac4; H4c11; H2ac10; H2bc14; H4c18; H3f3b; H2bc18; H4c6; H4c8; H3c8; Orc6; H2bc3; H2ax; H3c4; H2bc21; H3f3a; H4c17; Orc2; H2ac18; H2az2; H2bc8; H2bc4; H3c10","eye","RR-3","GLDS-194"
"REACTOME_ASSOCIATION_OF_TRIC_CCT_WITH_TARGET_PROTEINS_DURING_BIOSYNTHESIS",0.012023123956548,0.0444774349068244,0.380730400722792,0.435384833932991,1.64673420731574,38,"reactome","Fbxw4; Hdac3; Tcp1; Cct7; Ap3m1; Fbxo6; Cct6a; Cct3; Lonp2; Wrap53; Cct5; Cct2; Fbxw2; Usp11; Cct8","eye","RR-3","GLDS-194"
"REACTOME_ASYMMETRIC_LOCALIZATION_OF_PCP_PROTEINS",5.72952205933311e-05,0.000482602050382289,0.557332238758646,0.517369951936166,2.11640782086218,51,"reactome","Uba52; Psma7; Rps27a; Psmc1; Sem1; Psmd2; Psmc3; Psma5; Psmb6; Psmd14; Psmd8; Psmb1; Psma1; Psmb7; Pard6a; Psmc5; Psma2; Psma4; Psmb3; Psma6; Psmb4; Psmd3; Psmd6; Psma3; Psmd12; Psmd13; Adrm1; Psmd1; Psmc2","eye","RR-3","GLDS-194"
"REACTOME_ATF4_ACTIVATES_GENES_IN_RESPONSE_TO_ENDOPLASMIC_RETICULUM_STRESS",0.318181818181818,0.480564263322884,0.107140237276725,0.319658692349501,1.08936466466844,25,"reactome","Exosc4; Cebpb; Ddit3; Nfyb; Exosc2; Exosc7; Exosc3; Exosc9; Atf4","eye","RR-3","GLDS-194"
"REACTOME_ATP_DEPENDENT_CHROMATIN_REMODELERS",0.0252228051425108,0.0767434439700195,0.352487857583619,-0.435984498257096,-1.55016806582978,31,"reactome","Arid2; Arid1b; Arid1a; Bicra; Bicral; Smarcd1; Smarca4; Bcl11a; Pbrm1; Dpf2; Bcl7a; Smarcc1","eye","RR-3","GLDS-194"
"REACTOME_ATTACHMENT_AND_ENTRY",0.47117296222664,0.624201070996718,0.0819778796501272,-0.325175338564046,-0.999989789786123,18,"reactome","Sdc3; Gpc6; Hspg2; Furin; Gpc2; Agrn; Gpc4; Gpc1; Nrp1","eye","RR-3","GLDS-194"
"REACTOME_ATTENUATION_PHASE",0.682474226804124,0.785283993115318,0.0649407684612899,0.246512353740955,0.84895552821175,26,"reactome","Dnajb1; Mrpl18; Hsbp1; Fkbp4; Hsp90aa1; Rln1; Hspa8; Ubb; Tnfrsf21; Dnajb6; Ptges3; Hspb1","eye","RR-3","GLDS-194"
"REACTOME_AUF1_HNRNP_D0_BINDS_AND_DESTABILIZES_MRNA",4.42086535147507e-05,0.000393564842265463,0.557332238758646,0.545338077097313,2.13933138555521,42,"reactome","Uba52; Psma7; Rps27a; Psmc1; Sem1; Psmd2; Psmc3; Psma5; Psmb6; Psmd14; Psmd8; Psmb1; Psma1; Psmb7; Psmc5; Psma2; Psma4; Psmb3; Psma6; Psmb4; Psmd3; Psmd6; Psma3; Psmd12; Psmd13; Adrm1; Psmd1; Psmc2; Hspa8","eye","RR-3","GLDS-194"
