"pathway","pval","padj","log2err","ES","NES","size","db","leadingEdge_str","tissue","mission","glds"
"REACTOME_REGULATION_OF_MRNA_STABILITY_BY_PROTEINS_THAT_BIND_AU_RICH_ELEMENTS",0.00435054320493951,0.019444264528199,0.407017918923954,0.376295173692436,1.64802140997133,73,"reactome","Exosc4; Uba52; Psma7; Rps27a; Psmc1; Sem1; Psmd2; Psmc3; Mapkapk2; Psma5; Psmb6; Psmd14; Set; Psmd8; Psmb1; Psma1; Psmb7; Psmc5; Psma2; Psma4; Psmb3; Exosc2; Psma6; Psmb4; Mapk11; Psmd3; Psmd6; Anp32a; Exosc7; Psma3; Psmd12; Psmd13; Adrm1; Psmd1; Psmc2; Hspa8; Exosc3; Exosc9","eye","RR-3","GLDS-194"
"REACTOME_REGULATION_OF_NF_KAPPA_B_SIGNALING",0.725450901803607,0.816411857630987,0.060640400949416,0.263884729017563,0.82080902071382,18,"reactome","Uba52; Rps27a; Lrrc14; Usp18","eye","RR-3","GLDS-194"
"REACTOME_REGULATION_OF_ORNITHINE_DECARBOXYLASE_ODC",6.68431173679935e-09,1.87674906456289e-07,0.761460801445585,0.680094903193103,2.57228882134542,38,"reactome","Psma7; Odc1; Psmc1; Sem1; Oaz2; Psmd2; Psmc3; Oaz1; Psma5; Psmb6; Psmd14; Psmd8; Psmb1; Psma1; Psmb7; Psmc5; Psma2; Psma4; Nqo1; Psmb3; Psma6; Psmb4; Psmd3; Psmd6; Psma3; Psmd12; Psmd13; Adrm1; Psmd1; Psmc2","eye","RR-3","GLDS-194"
"REACTOME_REGULATION_OF_PLK1_ACTIVITY_AT_G2_M_TRANSITION",0.400386847195358,0.556380373572335,0.0894366833718621,-0.231701116896482,-1.0230823183264,87,"reactome","Pcm1; Cdk5rap2; Clasp1; Akap9; Dctn1; Ppp1r12b; Tubb4a; Bora; Cep192; Btrc; Csnk1d; Sfi1; Alms1; Ywhae; Ubc; Ccp110; Cep290; Cep164; Cep250; Cep135; Cep63; Cntrl; Mapre1; Cep41","eye","RR-3","GLDS-194"
"REACTOME_REGULATION_OF_PTEN_GENE_TRANSCRIPTION",0.00066115016846192,0.00409016629641696,0.477270815362862,-0.438840614615231,-1.84120064648537,61,"reactome","Phc1; Atn1; Phc3; Nr2e1; Gatad2b; Snai1; Slc38a9; Rptor; Rcor1; Scmh1; Hdac7; Chd4; Pten; Suz12; Rraga; Phc2; Mtor; Mbd3; Egr1; Hdac1; Mta1; Rest; Rragc; Mapk3; Pparg; Sall4; Cbx4","eye","RR-3","GLDS-194"
"REACTOME_REGULATION_OF_PTEN_STABILITY_AND_ACTIVITY",2.05679672277888e-05,0.000204744764676625,0.575610261071129,0.517419565124195,2.1496482399308,56,"reactome","Akt3; Uba52; Psma7; Rps27a; Psmc1; Sem1; Psmd2; Psmc3; Stub1; Psma5; Psmb6; Psmd14; Mkrn1; Trim27; Psmd8; Csnk2b; Psmb1; Psma1; Rnf146; Psmb7; Psmc5; Psma2; Psma4; Psmb3; Psma6; Psmb4; Psmd3; Psmd6; Psma3; Otud3; Psmd12; Psmd13; Adrm1; Psmd1; Psmc2","eye","RR-3","GLDS-194"
"REACTOME_REGULATION_OF_PYRUVATE_METABOLISM",0.0975103734439834,0.208542693205394,0.206587922696891,0.366276761914209,1.32561786603825,32,"reactome","Maea; Uba52; Rps27a; Pkm; Mkln1; Pgam5; Pdhb; Pdhx; Dlat; Pdp1; Gstz1; Pdha1; Gid8; Ubb; Ldha; Gid4; Pdk3","eye","RR-3","GLDS-194"
"REACTOME_REGULATION_OF_RAS_BY_GAPS",0.0030958152261161,0.0148031339414722,0.431707695803346,0.428874265582169,1.77488911512014,55,"reactome","Uba52; Psma7; Rps27a; Psmc1; Sem1; Psmd2; Psmc3; Psma5; Psmb6; Psmd14; Psmd8; Psmb1; Psma1; Psmb7; Hras; Rbx1; Psmc5; Psma2; Psma4; Psmb3; Psma6; Psmb4; Psmd3; Psmd6; Psma3; Psmd12; Psmd13; Adrm1; Psmd1; Psmc2","eye","RR-3","GLDS-194"
"REACTOME_REGULATION_OF_RUNX1_EXPRESSION_AND_ACTIVITY",0.0150217147656546,0.0517257159383391,0.380730400722792,-0.567741304249893,-1.73175200122566,17,"reactome","Tnrc6b; Tnrc6a; Ago2; Ago1; Pml; Tnrc6c; Ago3; Cdk6","eye","RR-3","GLDS-194"
"REACTOME_REGULATION_OF_RUNX2_EXPRESSION_AND_ACTIVITY",1.34357097760373e-05,0.000147458787604566,0.593325476396405,0.522629903460644,2.17129487911752,56,"reactome","Uba52; Psma7; Esrra; Rps27a; Psmc1; Sem1; Psmd2; Psmc3; Stub1; Skp1; Psma5; Psmb6; Psmd14; Psmd8; Psmb1; Psma1; Psmb7; Stat1; Rbx1; Psmc5; Psma2; Psma4; Psmb3; Psma6; Psmb4; Psmd3; Psmd6; Psma3; Cul1; Psmd12; Psmd13; Adrm1; Psmd1; Psmc2","eye","RR-3","GLDS-194"
"REACTOME_REGULATION_OF_RUNX3_EXPRESSION_AND_ACTIVITY",1.33284386401009e-05,0.000147458787604566,0.593325476396405,0.553701061471063,2.19070358500104,45,"reactome","Uba52; Psma7; Rps27a; Psmc1; Sem1; Psmd2; Psmc3; Psma5; Psmb6; Psmd14; Psmd8; Psmb1; Psma1; Psmb7; Psmc5; Psma2; Psma4; Psmb3; Psma6; Psmb4; Psmd3; Psmd6; Psma3; Psmd12; Psmd13; Adrm1; Psmd1; Psmc2","eye","RR-3","GLDS-194"
"REACTOME_REGULATION_OF_SIGNALING_BY_CBL",0.736111111111111,0.825862363387978,0.059476028695732,0.247733449290521,0.820535395469977,22,"reactome","Uba52; Rps27a; Yes1; Fyn; Crk; Lyn; Ubb","eye","RR-3","GLDS-194"
"REACTOME_REGULATION_OF_TLR_BY_ENDOGENOUS_LIGAND",0.725450901803607,0.816411857630987,0.060640400949416,0.263861402988892,0.820736465493131,18,"reactome","Hmgb1; Cd14; Lbp; Tlr1; Tlr7; Gsdmd; S100a1; Gsdme","eye","RR-3","GLDS-194"
"REACTOME_REGULATION_OF_TP53_ACTIVITY",0.384765625,0.54504315572445,0.0922597260527354,-0.207749333492494,-1.02038595609768,156,"reactome","Csnk2a2; Jmy; Prdm1; Prkab2; Trp53bp2; Gatad2b; Ep300; Taf15; Prkaa2; Hipk2; Kat6a; Taf3; Mdm4; Rictor; Trp53inp1; Chd4; Kmt5a; Hipk1; Zfp385a; Ccna2; Mtor; Exo1; Mbd3; Pml; Dna2; Atm; Hdac1; Ubc; Usp2; Chek2; Phf20; Atr; Ppp1r13b; Hus1","eye","RR-3","GLDS-194"
"REACTOME_REGULATION_OF_TP53_ACTIVITY_THROUGH_ACETYLATION",0.498069498069498,0.643143986304364,0.0774767547848578,-0.279316708713478,-0.978650510858406,30,"reactome","Gatad2b; Ep300; Kat6a; Chd4; Mbd3; Pml; Hdac1","eye","RR-3","GLDS-194"
"REACTOME_REGULATION_OF_TP53_ACTIVITY_THROUGH_METHYLATION",0.228628230616302,0.388136298488141,0.126875729929857,-0.385786348120331,-1.18638274004049,18,"reactome","Jmy; Ep300; Mdm4; Kmt5a; Atm; Ubc; Chek2","eye","RR-3","GLDS-194"
"REACTOME_REGULATION_OF_TP53_ACTIVITY_THROUGH_PHOSPHORYLATION",0.183884297520661,0.339550262706786,0.14641623786055,0.254944920915718,1.1677939177878,89,"reactome","Rhno1; Uba52; Trp53rka; Rps27a; Chek1; Rfc4; Kat5; Rad1; Rfc3; Pin1; Csnk2b; Taf10; Taf12; Rbbp8; Tpx2; Noc2l; Stk11; Top3a; Prkag1; Rad9a; Wrn; Mapk11; Taf7; Brip1; Aurka; Taf6; Taf11; Cdk5; Prkab1; Taf9; Rfc5; Ubb; Taf5; Rpa3; Rpa2; Prkaa1; Plk3","eye","RR-3","GLDS-194"
"REACTOME_REGULATION_OF_TP53_EXPRESSION_AND_DEGRADATION",0.447105788423154,0.605916879113061,0.0850427463764322,0.262702120611986,0.993410209440432,37,"reactome","Akt3; Uba52; Rps27a; Ppp2r1a; Ccng1; Daxx; Ppp2cb; Rnf34; Ppp2r5c; Sgk1; Ppp2ca","eye","RR-3","GLDS-194"
"REACTOME_REGULATION_OF_T_CELL_ACTIVATION_BY_CD28_FAMILY",0.659751037344398,0.769358238436758,0.0668966276500666,0.212203773834389,0.899787709781065,62,"reactome","Akt3; Them4; Ppp2r5b; Yes1; Ppp2r1a; Grap2; Ppp2r5d; Ppp2cb; Cdc42; Pak1; Ppp2r5c","eye","RR-3","GLDS-194"
"REACTOME_REPLACEMENT_OF_PROTAMINES_BY_NUCLEOSOMES_IN_THE_MALE_PRONUCLEUS",2.77731995167589e-06,3.89892993216038e-05,0.627256739718528,0.677245376047572,2.34726293969385,27,"reactome","H1f8; H4c1; H4c4; H2bc7; H4c2; H4c3; H4c12; H4c11; H2bc14; H4c18; H3f3b; H2bc18; H4c6; H4c8; Mettl23; H2bc3; H2ax; H2bc21; H3f3a; H4c17; H2bc8; H2bc4","eye","RR-3","GLDS-194"
"REACTOME_REPRODUCTION",0.000507343395101483,0.00326788833903602,0.477270815362862,0.346494349106214,1.66869364941916,126,"reactome","Kcnu1; Mnd1; H2ac19; BC055324; H4c1; H2aj; H3c3; H3c7; Psmc3ip; H2ac13; H4c4; Msh5; H3c1; H2ac20; H2bc7; H3c11; H4c2; Adam30; H4c3; H4c12; H2ac4; Pdpn; H4c11; H2ac10; Rbbp8; H2bc14; Eomes; H4c18; H3f3b; Top3a; H2bc18; Spo11; H4c6; H4c8; Ube2i; Terf2ip; H3c8; H2bc3; H2ax; Bmp4; H3c4; Tinf2; H2bc21; H3f3a; H4c17; Catsper2; Syce1; H2ac18; H2az2; Syce2; Lmna; H2bc8; H2bc4; H3c10; H3f4; Mlh1; Rpa3; Tfap2c; Rpa2; H2ac7","eye","RR-3","GLDS-194"
"REACTOME_RESOLUTION_OF_ABASIC_SITES_AP_SITES",0.0275511258907133,0.0810980721783093,0.352487857583619,0.417249369332704,1.57814134969807,38,"reactome","Pold2; Rfc4; Rfc3; Adprs; Apex1; Pole3; Polb; Pold4; Nthl1; Pcna; Pole4; Parp1; Parg; Fen1; Rfc5; Rpa3; Rpa2; Pold3","eye","RR-3","GLDS-194"
"REACTOME_RESOLUTION_OF_AP_SITES_VIA_THE_MULTIPLE_NUCLEOTIDE_PATCH_REPLACEMENT_PATHWAY",0.00199877015687713,0.0103238364234927,0.431707695803346,0.567557278883505,1.93417810805239,25,"reactome","Pold2; Rfc4; Rfc3; Adprs; Apex1; Pole3; Polb; Pold4; Pcna; Pole4; Parp1; Parg; Fen1; Rfc5; Rpa3; Rpa2; Pold3","eye","RR-3","GLDS-194"
"REACTOME_RESOLUTION_OF_D_LOOP_STRUCTURES",0.170781893004115,0.319668671520523,0.152144922367565,0.326115932501331,1.21694315193718,36,"reactome","Spidr; Mus81; BC055324; Sem1; Kat5; Rbbp8; Top3a; Palb2; Wrn; Brip1","eye","RR-3","GLDS-194"
"REACTOME_RESOLUTION_OF_D_LOOP_STRUCTURES_THROUGH_SYNTHESIS_DEPENDENT_STRAND_ANNEALING_SDSA",0.556485355648536,0.688532728175307,0.0758886900606117,0.273316945413277,0.947288470986694,27,"reactome","Sem1; Kat5; Rbbp8; Top3a; Palb2; Wrn; Brip1","eye","RR-3","GLDS-194"
"REACTOME_RESOLUTION_OF_SISTER_CHROMATID_COHESION",0.0655737704918033,0.157463330457291,0.252961123069611,0.266699534166935,1.26602635521042,117,"reactome","BC055324; Tubb3; Ppp2r5b; Tuba1c; Rps27; Tubb4b; Spc24; Nudc; Tuba1b; Zwint; Ppp2r1a; Wapl; Mis12; Pmf1; Ndel1; Ppp2r5d; Cdca8; Cenpc1; Tubb2a; Cenph; Ppp2cb; Tuba8; Knl1; Nsl1; Bub3; Ppp2r5c; Cenpp; Tubb2b; Ppp2ca; Nde1; Dync1li1; Cenpq; Ska2; Nup107; Tuba1a; Ccnb2; Dynll1; Tuba4a; Dync1i1; Plk1; Zwilch; Spdl1; Nup43; Bub1b; Bub1; Mad1l1; Cdk1; Sec13","eye","RR-3","GLDS-194"
"REACTOME_RESPIRATORY_ELECTRON_TRANSPORT",2.40069576167445e-20,1.46042325501862e-18,1.16906996676109,0.594385188259439,2.89951052904877,143,"reactome","Cox7a2l; Lyrm2; Uqcc3; Smim4; Ndufaf1; Smim20; Cox7c; Etfb; Coa3; Ndufb10; Ndufa12; Cox14; Ndufa1; Iscu; Ndufa6; Ndufb8; Uqcrfs1; Cox8a; Uqcrb; Ndufb11; Ndufa2; Ecsit; Sfxn4; Cox6b1; Higd1a; Uqcr10; Sdhd; Tmem186; Cox6c; Ndufb7; Hscb; Ndufs6; Surf1; Nfs1; Uqcr11; Ndufb3; Slc25a11; Ndufs8; Ndufa7; Tmem177; Ndufs5; Mdh1; Ndufv3; Sdhc; Sdhb; Uqcc2; Ndufb5; Ndufc1; Lyrm4; Ndufa4; Uqcrh; Ndufs3; Ndufv1; Coq10b; Sco1; Ndufa13; Ndufb6; Ndufs7; Tmem126b; Cox4i1; Timmdc1; Cox7a2; Cox17; Ndufb1; Higd2a; Rab5if; Hspa9; Pyurf; Ndufa11; Cycs; Got2; Ndufaf5; Ndufc2; Ndufv2; Cox6b2; Ndufa10; Ndufa9; Ndufa5; Ndufs2; Sdha; Ndufaf8; Tmem126a; Ndufb2; Ndufa8; Got1; Cox5b; Cox6a1; Ndufs1; Tmem223; Ndufa3; Uqcrc2; Uqcc1; Ndufaf4; Cox19; Ndufb9; Uqcrc1; Ndufs4","eye","RR-3","GLDS-194"
"REACTOME_RESPIRATORY_SYNCYTIAL_VIRUS_INFECTION_PATHWAY",0.32484076433121,0.484605772401465,0.107554375265169,0.229379189693529,1.06578904888927,102,"reactome","Med10; Uba52; Med11; Rps27a; Gpc5; Med18; Rab5b; Med8; Med28; Ppp1ca; Rab5c; Isg15; Csnk2b; Med22; Elob; Med4; Rbx1; Sec11c; Med27; Cx3cr1; Med30; Stat2; Hsp90aa1; Gpc3; Med19; Sec11a; Bcap31; Spcs1; Med9; Ifih1; Cd14; Sdc4; Hspa8; Ifnar2; Becn1; Med21; Ubb; Med6","eye","RR-3","GLDS-194"
"REACTOME_RESPIRATORY_SYNCYTIAL_VIRUS_RSV_ATTACHMENT_AND_ENTRY",0.224448897795591,0.384088010204082,0.128788713061714,-0.357804657041551,-1.17914788318456,23,"reactome","Ncl; Igf1r; Sdc3; Gpc6","eye","RR-3","GLDS-194"
"REACTOME_RESPIRATORY_SYNCYTIAL_VIRUS_RSV_GENOME_REPLICATION_TRANSCRIPTION_AND_TRANSLATION",0.493041749502982,0.641188498462904,0.0795564677235957,0.328076204323376,0.978596238350641,16,"reactome","Ppp1ca; Csnk2b; Sec11c; Hsp90aa1; Sec11a; Spcs1; Hspa8","eye","RR-3","GLDS-194"
"REACTOME_RESPONSE_OF_EIF2AK1_HRI_TO_HEME_DEFICIENCY",0.116731517509728,0.238888721714011,0.181383128498408,0.457287466621746,1.34857429695219,15,"reactome","Ppp1r15a; Cebpb; Ddit3; Chac1; Eif2s1; Atf5; Atf4; Eif2s3x","eye","RR-3","GLDS-194"
"REACTOME_RESPONSE_OF_EIF2AK4_GCN2_TO_AMINO_ACID_DEFICIENCY",1.30978442115007e-40,4.78071313719774e-38,1.6595653414844,0.818747047162274,3.7661390157352,92,"reactome","Rpl27a; Rpl6; Rpl26; Rps6; Rps7; Rps5; Rpl7; Rpl7a; Rpl30; Rps3a1; Rpl14; Rps4x; Uba52; Rpl39; Rpl8; Rpl18a; Rpl13; Rpl36a; Rplp1; Rps25; Rps9; Rpl3; Rpl23; Rpl32; Rpl29; Rpl17; Rpl36al; Rpl35a; Rps24; Rps29; Rps11; Rplp2; Rps19; Rps26; Rps10; Rps27a; Rpl22l1; Rpl9; Rpsa; Rps28; Rpl5; Rps15a; Rps20; Rpl36; Rps3; Rpl38; Rps13; Rps17; Rpl37a; Rpl21; Rps16; Rpl27; Rpl19; Rpl10; Rpl35; Rps14; Rpl24; Rps12; Rpl4; Rpl22; Rpl18; Cebpb; Rps27; Rps21; Rps2; Rps15; Rps23; Fau; Ddit3; Rpl13a; Rpl31; Rps18; Eif2s1; Impact; Rplp0","eye","RR-3","GLDS-194"
"REACTOME_RESPONSE_OF_MTB_TO_PHAGOCYTOSIS",0.382936507936508,0.543859242789204,0.0934449219410994,0.316074277680566,1.04689186372393,22,"reactome","Uba52; Rps27a; Gsk3a; Trim27; Coro1a; Pgk1; Atp6v1h","eye","RR-3","GLDS-194"
"REACTOME_RESPONSE_TO_ELEVATED_PLATELET_CYTOSOLIC_CA2",0.701402805611222,0.800037575150301,0.062249042949858,0.188206476198984,0.906389822584179,126,"reactome","Vti1b; Trf; Serpine1; Wdr1; Maged2; Ppia; Tmsb4x; Aldoa; Cfl1; Cyrib; Itga2b; Sod1; Qsox1; Tgfb3; Sccpdh; A2m; Cfd; Cap1; Manf; Rarres2; Calu; Thbs1; Selp; Calm1; Gas6; Fermt3; Hgf; Psap; Habp4; Rab27b; Tex264; Apoh; Tuba4a","eye","RR-3","GLDS-194"
"REACTOME_RETROGRADE_TRANSPORT_AT_THE_TRANS_GOLGI_NETWORK",0.450505050505051,0.609016086793865,0.0852884689790502,0.25012818229529,0.998885146936638,48,"reactome","Stx6; Scoc; M6pr; Vps52; Naa38; Vamp3; Tmf1; Sys1; Cog4; Rab9b; Rab9; Napb; Gcc1; Cog6; Rab6a; Rabepk","eye","RR-3","GLDS-194"
"REACTOME_RET_SIGNALING",0.273084479371316,0.433373195524045,0.11378726182188,-0.298453309784183,-1.1255537503267,39,"reactome","Prkca; Gab1; Frs2; Sos1; Grb2; Irs2; Pik3cb","eye","RR-3","GLDS-194"
"REACTOME_RHOA_GTPASE_CYCLE",0.0723809523809524,0.167623074599819,0.231126709673834,-0.255507336391337,-1.24781984984631,148,"reactome","Prex1; Arhgap31; Arhgap11a; Cit; Arhgap21; Kalrn; Arhgap42; Arhgef7; Bcr; Obscn; Farp1; Rock1; Arhgap35; Arhgef1; Dlc1; Arhgap19; Rasgrf2; Arhgef19; Cavin1; Rock2; Plekhg3; Arhgap23; Pkn1; Diaph1; Pkn3; Arhgap29; Arhgap39; Actc1; Arhgap26; Arap3; Snap23; Myo9a; Plekhg4; Daam1; Arhgef12; Arhgap6; Pkn2; Mcam; Akap13; Plekhg5; Ktn1; Faf2; C1qbp; Arhgap20; Arhgef11; Iqgap1","eye","RR-3","GLDS-194"
"REACTOME_RHOBTB1_GTPASE_CYCLE",0.32064128256513,0.481621679573138,0.104732821580651,-0.330051686922555,-1.0876877657046,23,"reactome","Rbbp6; Srrm1; Stk38; Rock1; Rock2","eye","RR-3","GLDS-194"
"REACTOME_RHOBTB2_GTPASE_CYCLE",0.627254509018036,0.740931701590884,0.0676760401641789,-0.272595617833967,-0.898340866751165,23,"reactome","Srrm1; Phip; Stk38; Actn1","eye","RR-3","GLDS-194"
"REACTOME_RHOBTB_GTPASE_CYCLE",0.305769230769231,0.468695047642416,0.105125131597001,-0.30019173068074,-1.10745504497335,35,"reactome","Rbbp6; Srrm1; Phip; Stk38; Rock1; Actn1; Rock2","eye","RR-3","GLDS-194"
"REACTOME_RHOB_GTPASE_CYCLE",0.15748031496063,0.300419764602595,0.155241966228839,-0.27833780999511,-1.19391973237865,70,"reactome","Prex1; Cit; Arhgap21; Bcr; Rock1; Arhgap35; Arhgef1; Dlc1; Cavin1; Rock2; Pkn1; Diaph1; Pkn3; Arhgap39; Actc1; Arhgap26; Snap23; Myo9a; Daam1","eye","RR-3","GLDS-194"
"REACTOME_RHOC_GTPASE_CYCLE",0.275049115913556,0.434601416919688,0.11331290842208,-0.257319601504642,-1.10860605684813,74,"reactome","Prex1; Cit; Arhgap21; Bcr; Rock1; Arhgap35; Arhgef1; Dlc1; Cavin1; Rock2; Pkn1; Fmnl2; Diaph1; Pkn3; Arhgap39; Arhgap26","eye","RR-3","GLDS-194"
"REACTOME_RHOD_GTPASE_CYCLE",0.023459154663045,0.0731845423248838,0.352487857583619,-0.377241597577634,-1.53194483339921,53,"reactome","Steap3; Arhgap21; Plxna1; Tor1aip1; Arhgap17; Pak5; Lmnb1; Arhgap35; Actn1; Diaph2; Plxnb1; Ankfy1; Slc4a7; Diaph1; Arhgap39; Arhgap26; Lemd3; Add3; Filip1; Rab7; Mcam","eye","RR-3","GLDS-194"
"REACTOME_RHOF_GTPASE_CYCLE",0.07,0.163085106382979,0.241339976815091,-0.361739990034235,-1.37841769501022,41,"reactome","Steap3; Srgap2; Arhgap21; Tor1aip1; Lmnb1; Farp1; Actn1; Diaph2; Slc4a7; Diaph1; Arhgap39; Snap23; Add3; Baiap2l1; Rab7; Mcam; Akap12","eye","RR-3","GLDS-194"
"REACTOME_RHOG_GTPASE_CYCLE",0.300589390962672,0.464894608904132,0.107554375265169,-0.25242994814956,-1.0875400389714,74,"reactome","Prex1; Dock4; Arhgef26; Arhgap21; Kalrn; Itsn1; Arhgap35; Cdc42ep1; Plekhg3; Dock3; Arhgap39; Lemd3; Shmt2; Garre1","eye","RR-3","GLDS-194"
"REACTOME_RHOH_GTPASE_CYCLE",0.660678642714571,0.769620333800484,0.0649407684612899,-0.232462336670599,-0.864387837312119,37,"reactome","Ralgapa1; Pak5; Rock1; Mtr; Slc4a7; Rock2","eye","RR-3","GLDS-194"
"REACTOME_RHOJ_GTPASE_CYCLE",0.0268107977549145,0.0793454690314361,0.352487857583619,-0.365247996411068,-1.49076143600875,55,"reactome","Prex1; Wasl; Steap3; Arhgap21; Fnbp1; Arhgef7; Arhgap35; Cdc42ep1; Wipf2; Git1; Slc4a7; Cdc42bpa; Arhgap26; Snap23","eye","RR-3","GLDS-194"
"REACTOME_RHOQ_GTPASE_CYCLE",9.547649472953e-05,0.000752134976466441,0.538434096309916,-0.47916691014406,-1.98339595387977,59,"reactome","Prex1; Wasl; Steap3; Srgap2; Arhgap21; Arhgap33; Itsn1; Fnbp1; Arhgap17; Arhgef7; Obscn; Arhgap35; Cdc42ep1; Dlc1; Git1; Slc4a7; Plekhg3; Gopc; Cdc42bpa; Arhgap26; Snap23","eye","RR-3","GLDS-194"
"REACTOME_RHOU_GTPASE_CYCLE",0.0174542915877218,0.0580925286158644,0.352487857583619,-0.420832064475064,-1.59535317194414,40,"reactome","Arhgap31; Srgap2; Peak1; Dst; Arhgef7; Usp9x; Stam2; Git1; Grb2; Cltc; Dlg5; Hgs; Sptbn1","eye","RR-3","GLDS-194"
"REACTOME_RHOV_GTPASE_CYCLE",0.163672654690619,0.309536367679149,0.153158808683073,-0.335458217752388,-1.24736767041299,37,"reactome","Wasl; Peak1; Dst; Arhgef7; Zfp512b; Usp9x; Git1; Cep97; Cltc; Dlg5; Sptbn1; Ccp110","eye","RR-3","GLDS-194"
"REACTOME_RHO_GTPASES_ACTIVATE_CIT",0.20703125,0.363688622754491,0.132846300606183,-0.380325134762322,-1.19203729703761,19,"reactome","Cit; Ppp1r12b; Myh10; Myh9; Kif14; Dlg4; Rhoa; Myh11; Ppp1r12a","eye","RR-3","GLDS-194"
"REACTOME_RHO_GTPASES_ACTIVATE_FORMINS",0.250493096646943,0.409400891334909,0.119887845115423,0.225498674642184,1.09290705353721,130,"reactome","Tubb3; Ppp2r5b; Tuba1c; Rps27; Dvl1; Tubb4b; Spc24; Nudc; Tuba1b; Zwint; Ppp2r1a; Mis12; Pmf1; Ndel1; Ppp2r5d; Cdca8; Cenpc1; Tubb2a; Cenph; Ppp2cb; Tuba8; Knl1; Rhoc; Nsl1; Cdc42; Bub3; Ppp2r5c; Cenpp; Tubb2b; Ppp2ca; Nde1; Dync1li1; Cenpq; Ska2; Nup107; Tuba1a; Dynll1; Tuba4a; Dync1i1; Diaph3; Actb; Plk1; Zwilch; Spdl1; Nup43; Srf; Bub1b; Bub1; Mad1l1; Sec13","eye","RR-3","GLDS-194"
"REACTOME_RHO_GTPASES_ACTIVATE_IQGAPS",0.0101709564808164,0.0388055656672263,0.380730400722792,0.519383477311136,1.75275163467763,24,"reactome","Iqgap3; Tubb3; Tuba1c; Tubb4b; Tuba1b; Ctnnb1; Tubb2a; Tuba8; Cdc42; Tubb2b; Calm1; Tuba1a; Tuba4a; Actb","eye","RR-3","GLDS-194"
"REACTOME_RHO_GTPASES_ACTIVATE_NADPH_OXIDASES",0.682730923694779,0.785283993115318,0.0636424081651019,-0.266641773999697,-0.870755443509055,22,"reactome","Prkca; Pik3r4; Mapk3; S100a8; Nox1; Rac2","eye","RR-3","GLDS-194"
"REACTOME_RHO_GTPASES_ACTIVATE_PAKS",0.935483870967742,0.967738386644297,0.0490939668192139,0.197091476052548,0.640309604772311,21,"reactome","Myl12b; Cdc42; Myl6; Pak1; Calm1; Cttn; Limk1","eye","RR-3","GLDS-194"
"REACTOME_RHO_GTPASES_ACTIVATE_PKNS",0.000137181650433086,0.00103595798085675,0.518848077743792,0.437093254476666,1.91429253387225,73,"reactome","H2ac19; H4c1; H2aj; H3c3; H3c7; H2ac13; H4c4; H3c1; H2ac20; H2bc7; H3c11; H4c2; H4c3; H4c12; H2ac4; H4c11; H2ac10; H2bc14; H4c18; H3f3b; H2bc18; H4c6; Rhoc; H4c8; Myl12b; Myl6; Pak1; Ywhaq; H3c8; H2bc3; H2ax; H3c4; H2bc21; H3f3a; H4c17; Ywhah; H2ac18; H2az2; H2bc8; H2bc4; H3c10","eye","RR-3","GLDS-194"
"REACTOME_RHO_GTPASES_ACTIVATE_ROCKS",0.67578125,0.78158294163215,0.0628003977812234,-0.274087879952009,-0.859062275158177,19,"reactome","Ppp1r12b; Myh10; Rock1; Rock2","eye","RR-3","GLDS-194"
"REACTOME_RHO_GTPASES_ACTIVATE_WASPS_AND_WAVES",0.37015503875969,0.534018138922082,0.0940503465727813,-0.284803790324848,-1.05667464236139,36,"reactome","Wasl; Wasf1; Wasf2; Wipf2; Abl1; Grb2; Wipf3; Cyfip2; Mapk3; Nckap1; Actr2; Abi2","eye","RR-3","GLDS-194"
"REACTOME_RHO_GTPASE_CYCLE",3.594058461529e-07,6.14920939902227e-06,0.674962860011025,-0.306116008377341,-1.69744808660093,444,"reactome","Rbbp6; Prex1; Wasl; Dock4; Arhgap31; Arhgef26; Wasf1; Steap3; Srgap3; Srgap2; Farp2; Fam13b; Arhgap11a; Srrm1; Cit; Vangl2; Prag1; Phip; Arhgap21; Arhgap33; Kalrn; Plxna1; Itsn1; Rasal2; Tor1aip1; Frs2; Ralgapa1; Arhgap42; Fnbp1; Peak1; Slitrk3; Arhgap17; Picalm; Dst; Arhgef7; Bcr; Arhgef39; Tiam2; Sos1; Obscn; Pak5; Wasf2; Fam135a; Fgd5; Ubxn11; Plekhg1; Stk38; Lmnb1; Farp1; Fermt2; Rock1; Sema4f; Arhgap35; Golga3; Dock6; Cdc42ep1; Wipf2; Zfp512b; Arhgef1; Plekhg2; Dlc1; Als2; Mtr; Usp9x; Abl2; Arhgap19; Stam2; Git1; Actn1; Diaph2; Plxnb1; Rasgrf2; Arhgef19; Ankfy1; Slc4a7; Cavin1; Grb2; Rock2; Cep97; Nisch; Plekhg3; Arhgap23; Cltc; Dlg5; Hgs; Pkn1; Fmnl2; Diaph1; Pkn3; Dock3; Sptbn1; Gopc; Plxnd1; Kctd3; Samm50; Nhs; Ccp110; Wipf3; Cyfip2; Arhgap29; Arhgap39; Cdc42bpa; Actc1; Arhgap26; Arap3; Taok3; Ccdc88a; Snap23; Lemd3; Shmt2; Stam; Garre1; Cpd; Myo9a; Fgd1; Plekhg4; Daam1; Nckap1; Spata13; Dock7; Arhgef16; Add3; Fnbp1l; Baiap2l1; Filip1; Arhgef12; Cpsf7; Nox1; Sh3pxd2a; Rac2; Rab7; Rapgef1; Arhgap6; Wdr81; Pkn2; Ddx4; Lck; Abi2; Sh3bp1; Mcam; Lrrc1; Dock9; Akap13; Plekhg5; Ktn1; Rhog; Faf2; Akap12; Fgd4; C1qbp; Cyfip1; Csk; Git2","eye","RR-3","GLDS-194"
"REACTOME_RHO_GTPASE_EFFECTORS",0.0155526277615302,0.0527680171840204,0.380730400722792,0.248286667971112,1.33796231358405,290,"reactome","Iqgap3; H2ac19; Tubb3; H4c1; H2aj; H3c3; H3c7; Ppp2r5b; Brk1; Lin7b; Tuba1c; H2ac13; H4c4; Rps27; Nck1; Pin1; Dvl1; Tubb4b; Spc24; Nudc; H3c1; H2ac20; Tuba1b; Zwint; Kif5a; Ppp2r1a; H2bc7; Mis12; H3c11; H4c2; Pmf1; H4c3; Ndel1; Arpc3; H4c12; Ppp2r5d; Cfl1; H2ac4; Cdca8; H4c11; H2ac10; H2bc14; Klc1; Arpc4; Ctnnb1; H4c18; Cenpc1; H3f3b; Tubb2a; Cenph; H2bc18; Abi1; Ppp2cb; Tuba8; Knl1; H4c6; Rhoc; Nsl1; H4c8; Myl12b; Cdc42; Myl6; Mapk11; Arpc5; Bub3; Klc2; Pak1; Ppp2r5c; Cenpp; Ywhaq; H3c8; H2bc3; Tubb2b; Ppp2ca; H2ax; Nde1; H3c4; Calm1; Dync1li1; Cenpq; Ska2; H2bc21; H3f3a; H4c17; Actr3; Nup107; Ywhah; Tuba1a; Cttn; Pik3c3; Dynll1; Kif5b; Tuba4a; H2ac18; H2az2; Dync1i1; Diaph3; Actb; Plk1; Zwilch; H2bc8; H2bc4; H3c10; Limk1; Nckap1l; Prkcd; Spdl1; Ncf4; Klc4; Nup43; Limk2; H2ac7; Srf; Ncf1; Bub1b; Bub1; Mad1l1; Prkcz; Sec13; Klc3","eye","RR-3","GLDS-194"
"REACTOME_RIPK1_MEDIATED_REGULATED_NECROSIS",0.242236024844721,0.40291508662241,0.12563992130984,0.321951075357638,1.15266845560583,31,"reactome","Flot2; Uba52; Rps27a; Flot1; Stub1; Tradd; Hsp90aa1; Ube2l3","eye","RR-3","GLDS-194"
"REACTOME_RIP_MEDIATED_NFKB_ACTIVATION_VIA_ZBP1",0.775100401606426,0.85499090051834,0.057609110864425,-0.25646943646276,-0.782295486558632,17,"reactome","Dhx9; Tlr3; Ikbkb; Ticam1","eye","RR-3","GLDS-194"
"REACTOME_RMTS_METHYLATE_HISTONE_ARGININES",0.000267965405434774,0.00189304592871663,0.49849310876659,0.4387481392063,1.88272850166029,66,"reactome","H2ac22; H2ac19; H4c1; H2aj; H3c3; H3c7; H2ac13; H4c4; Rps2; H3c1; H2ac20; Jak2; H3c11; H4c2; H4c3; H4c12; H2ac4; Ccnd1; H4c11; H2ac10; H4c18; Coprs; H4c6; H4c8; Actl6a; H2ac8; Prmt6; H2ac21; Smarce1; H3c8; H2ax; Prmt5; H3c4; H4c17; Smarcb1; Rbbp7; H2ac18; Actl6b; H2az2","eye","RR-3","GLDS-194"
"REACTOME_RNA_POLYMERASE_III_CHAIN_ELONGATION",0.017239437770509,0.0577283925342732,0.352487857583619,0.554478096481098,1.72469481305082,18,"reactome","Polr1d; Polr3g; Polr2h; Polr2f; Crcp; Polr2l; Polr1c; Polr2k; Polr3h; Polr3f; Polr3gl; Polr3d","eye","RR-3","GLDS-194"
"REACTOME_RNA_POLYMERASE_III_TRANSCRIPTION",0.306772908366534,0.468712793822499,0.107140237276725,0.278807541289803,1.08550929669486,41,"reactome","Polr1d; Polr3g; Polr2h; Polr2f; Snapc5; Crcp; Polr2l; Polr1c; Polr2k; Zfp143; Snapc2; Gtf3a","eye","RR-3","GLDS-194"
"REACTOME_RNA_POLYMERASE_III_TRANSCRIPTION_INITIATION_FROM_TYPE_1_PROMOTER",0.0886075949367089,0.197031039136302,0.219250346703755,0.391161651565854,1.3594342462119,28,"reactome","Polr1d; Polr3g; Polr2h; Polr2f; Crcp; Polr2l; Polr1c; Polr2k; Gtf3a; Polr3h; Polr3f; Polr3gl; Polr3d","eye","RR-3","GLDS-194"
"REACTOME_RNA_POLYMERASE_III_TRANSCRIPTION_INITIATION_FROM_TYPE_3_PROMOTER",0.0203580439953965,0.0655765442025145,0.352487857583619,0.456270239181492,1.58571114061827,28,"reactome","Polr1d; Polr3g; Polr2h; Polr2f; Snapc5; Crcp; Polr2l; Polr1c; Polr2k; Zfp143; Snapc2; Polr3h; Polr3f; Polr3gl; Brf2; Polr3d","eye","RR-3","GLDS-194"
"REACTOME_RNA_POLYMERASE_III_TRANSCRIPTION_TERMINATION",0.1610337972167,0.305072678118142,0.154190966581424,0.377525889866482,1.26457303431727,23,"reactome","Polr1d; Polr3g; Polr2h; Polr2f; Crcp; Polr2l; Polr1c; Polr2k","eye","RR-3","GLDS-194"
"REACTOME_RNA_POLYMERASE_II_PRE_TRANSCRIPTION_EVENTS",0.193415637860082,0.348353354372391,0.142056643575821,0.264328249387403,1.17303727013426,78,"reactome","Gtf2e1; Polr2h; Nelfb; Polr2f; Polr2i; Polr2l; Taf10; Taf12; Gtf2b; Ctdp1; Ncbp2; Elob; Wdr61; Leo1; Polr2k; Cdk7; Gtf2h5; Polr2j; Taf7; Taf6; Taf11; Polr2g; Gtf2h2; Polr2c; Paf1; Eaf2; Taf9; Polr2d; Mnat1; Ercc3; Gtf2f1; Taf5","eye","RR-3","GLDS-194"
"REACTOME_RNA_POLYMERASE_II_TRANSCRIBES_SNRNA_GENES",0.117647058823529,0.239448939427072,0.184706471207739,0.279506411347262,1.22699972351275,74,"reactome","Gtf2e1; Polr2h; Pcf11; Ints12; Polr2f; Snapc5; Ints5; Polr2i; Phax; Polr2l; Nabp2; Gtf2b; Ncbp2; Polr2k; Cdk7; Rprd1b; Zfp143; Snapc2; Polr2j; Ell2; Ints14; Taf6; Taf11; Ssu72; Polr2g; Polr2c; Taf9; Polr2d; Gtf2f1; Ints2; Taf5","eye","RR-3","GLDS-194"
"REACTOME_RNA_POLYMERASE_II_TRANSCRIPTION_TERMINATION",0.222453222453222,0.382158459898914,0.132147260608774,0.26546283891322,1.13596252095581,65,"reactome","Rbm8a; Pcf11; Sympk; Snrpf; Eif4a3; Lsm10; Snrpe; U2af1l4; Ncbp2; Cstf2; Rnps1; Slu7; Thoc3; Sarnp; Magoh; Alyref; Chtop; Thoc7; Slbp; Clp1; Ddx39a","eye","RR-3","GLDS-194"
"REACTOME_RNA_POLYMERASE_I_PROMOTER_ESCAPE",8.76486706769327e-13,4.17283888657571e-11,0.921426003494898,0.63290581737184,2.77263640239531,72,"reactome","Polr1d; Polr2h; H2ac19; H4c1; H2aj; H3c3; H3c7; H2ac13; H4c4; Polr2f; H3c1; H2ac20; H2bc7; Polr2l; H3c11; H4c2; H4c3; H4c12; H2ac4; Polr1c; H4c11; H2ac10; Polr2k; Cdk7; H2bc14; H4c18; H3f3b; Polr1e; Gtf2h5; H2bc18; H4c6; H4c8; Cd3eap; H3c8; Polr1f; H2bc3; Taf1a; H2ax; Rrn3; H3c4; H2bc21; H3f3a; H4c17; Taf1d; Gtf2h2; Polr1h; H2ac18; H2az2; Mnat1; H2bc8; H2bc4; H3c10; Ercc3","eye","RR-3","GLDS-194"
