"pathway","pval","padj","log2err","ES","NES","size","db","leadingEdge_str","tissue","mission","glds"
"KEGG_MEDICUS_ENV_FACTOR_ARSENIC_TO_ELECTRON_TRANSFER_IN_COMPLEX_IV",0.0206319516084065,0.131455005962133,0.352487857583619,0.573115057790082,1.6250300087945,17,"kegg","Cox7a2; Cox7a2l; Cox5a; Cox5b; Cox7c; Cox6a1; Cox4i1; Cox6b1; Cox8a; Cox6c; Cox7b; Cox6a2; As3mt","kidney","RR-3","GLDS-163"
"KEGG_MEDICUS_ENV_FACTOR_DCE_TO_DNA_ADDUCTS",0.913857677902622,0.992043316894606,0.080419996876154,-0.192410911765953,-0.659223789851643,16,"kegg","Gstp1; Gstm1","kidney","RR-3","GLDS-163"
"KEGG_MEDICUS_ENV_FACTOR_E2_TO_RAS_ERK_SIGNALING_PATHWAY",0.333333333333333,0.688271604938272,0.14641623786055,-0.323713694309112,-1.10908350483213,16,"kegg","Fos; Mapk3; Map2k2; Src","kidney","RR-3","GLDS-163"
"KEGG_MEDICUS_ENV_FACTOR_IRON_TO_ANTEROGRADE_AXONAL_TRANSPORT",0.0136481196003639,0.101451022362705,0.380730400722792,-0.532123737938982,-1.7770757569221,15,"kegg","Mapt; Tubb2b; Tubb6; Tubb1; Tubb4b; Tubb2a; Tubb4a","kidney","RR-3","GLDS-163"
"KEGG_MEDICUS_ENV_FACTOR_METALS_TO_NFKB_SIGNALING_PATHWAY",0.137037037037037,0.441926589694985,0.234392647294686,-0.404430323937673,-1.35063195417192,15,"kegg","Src; Nfkb1; Abl1; Prkd2; Rela; Abl2","kidney","RR-3","GLDS-163"
"KEGG_MEDICUS_ENV_FACTOR_NNK_NNN_TO_RAS_ERK_SIGNALING_PATHWAY",0.267206477732794,0.608031066677683,0.172324344900946,-0.312326830581488,-1.14808664653616,19,"kegg","Fos; Chrna7; Mapk3; Map2k2","kidney","RR-3","GLDS-163"
"KEGG_MEDICUS_ENV_FACTOR_TCDD_TO_AHR_SIGNALING_PATHWAY",0.418326693227092,0.836571758368603,0.133554954557592,-0.268977694939961,-1.00591749276507,20,"kegg","Arnt; Gstp1; Gstm1","kidney","RR-3","GLDS-163"
"KEGG_MEDICUS_ENV_FACTOR_ZN_TO_ANTEROGRADE_AXONAL_TRANSPORT",0.0290905833562141,0.154457144962756,0.352487857583619,-0.490137194956014,-1.63685786711137,15,"kegg","Mapt; Tubb2b; Tubb6; Tubb1; Tubb4b; Tubb2a; Tubb4a","kidney","RR-3","GLDS-163"
"KEGG_MEDICUS_PATHOGEN_ESCHERICHIA_EAE_TIR_TO_ACTIN_SIGNALING_PATHWAY",0.593984962406015,0.981175160122529,0.105520936843198,-0.252903779704955,-0.889646355415119,17,"kegg","Actb; Nck2; Actg1","kidney","RR-3","GLDS-163"
"KEGG_MEDICUS_PATHOGEN_HBV_HBX_TO_RAS_ERK_SIGNALING_PATHWAY",0.740740740740741,0.992043316894606,0.0913924325943768,-0.239944035159796,-0.801314990291663,15,"kegg","Mapk3; Map2k2; Src","kidney","RR-3","GLDS-163"
"KEGG_MEDICUS_PATHOGEN_HCMV_GB_TO_PDGFR_RAS_ERK_SIGNALING_PATHWAY",0.953551912568306,0.992043316894606,0.0300618095810087,0.206899076711609,0.56616267427251,15,"kegg","Kras; Nras; Raf1; Sos1; Sos2; Map2k1; Araf; Braf; Pdgfra","kidney","RR-3","GLDS-163"
"KEGG_MEDICUS_PATHOGEN_HCMV_UL33_TO_GNAI_AC_PKA_SIGNALING_PATHWAY",0.0180546136255741,0.125133837720605,0.352487857583619,-0.430777864270296,-1.68328000517806,25,"kegg","Atf6b; Creb3l1; Creb3; Gnai2; Prkaca; Adcy5; Creb1; Adcy1; Creb3l2","kidney","RR-3","GLDS-163"
"KEGG_MEDICUS_PATHOGEN_HCMV_UL33_TO_GNB_G_RHO_SIGNALING_PATHWAY",0.227041788579172,0.550329552751688,0.249246554383295,-0.29009835149046,-1.24369131089006,33,"kegg","Atf6b; Creb3l1; Creb3; Gnb2","kidney","RR-3","GLDS-163"
"KEGG_MEDICUS_PATHOGEN_HCMV_US28_TO_GNAQ_PLCB_G_CALCINEURIN_SIGNALING_PATHWAY",0.882195448460509,0.992043316894606,0.0328701032730105,0.235407378027683,0.680452107446797,18,"kegg","Ppp3ca; Ppp3cb; Calm2","kidney","RR-3","GLDS-163"
"KEGG_MEDICUS_PATHOGEN_HCMV_US28_TO_GNB_G_PI3K_NFKB_SIGNALING_PATHWAY",0.885225885225885,0.992043316894606,0.0281514818960232,0.213560482632882,0.694031357449485,30,"kegg","Pik3ca; Gnb3; Gnb4; Chuk; Gng5; Gng2; Gng10","kidney","RR-3","GLDS-163"
"KEGG_MEDICUS_PATHOGEN_HIV_GP120_TO_CXCR4_GNAQ_PLCB_G_CALCINEURIN",0.507518796992481,0.927677801060027,0.115734447701689,-0.269766749196509,-0.948965671904335,17,"kegg","Plcg2; Gnaq; Calm1; Nfatc3; Nfatc2; Ccr5; Plcg1","kidney","RR-3","GLDS-163"
"KEGG_MEDICUS_PATHOGEN_HIV_GP120_TO_CXCR4_GNB_G_RAC_SIGNALING_PATHWAY",0.709844559585492,0.992043316894606,0.114750719227023,-0.210499870381301,-0.828188946136988,26,"kegg","Cfl1; Gnb2; Limk1","kidney","RR-3","GLDS-163"
"KEGG_MEDICUS_PATHOGEN_HIV_GP120_TO_TNF_NFKB_SIGNALING_PATHWAY",0.285185185185185,0.635962962962963,0.158514105424824,-0.345877639898868,-1.15508992533649,15,"kegg","Nfkb1; Tradd; Rela; Tab1; Traf2; Tab3; Ikbkg","kidney","RR-3","GLDS-163"
"KEGG_MEDICUS_PATHOGEN_HPV_E5_TO_EGFR_RAS_ERK_SIGNALING_PATHWAY",0.285185185185185,0.635962962962963,0.158514105424824,-0.346012550886991,-1.15554047288632,15,"kegg","Atp6v0c; Egfr; Mapk3; Map2k2","kidney","RR-3","GLDS-163"
"KEGG_MEDICUS_PATHOGEN_HTLV_1_TAX_TO_SPINDLE_ASSEMBLY_CHECKPOINT_SIGNALING",0.785185185185185,0.992043316894606,0.0880945010398517,-0.233754434541836,-0.780644254485345,15,"kegg","Anapc2; Cdc16; Cdc20; Anapc5; Anapc1; Anapc7; Anapc4; Anapc13; Cdc23; Espl1; Anapc11; Pttg1; Anapc10; Cdc27; Cdc26","kidney","RR-3","GLDS-163"
"KEGG_MEDICUS_PATHOGEN_KSHV_VGPCR_TO_GNB_G_ERK_SIGNALING_PATHWAY",0.558011049723757,0.964623752623239,0.136490437780413,-0.220030134392673,-0.93294779274977,31,"kegg","Fos; Gnb2; Mapk3; Map2k2","kidney","RR-3","GLDS-163"
"KEGG_MEDICUS_PATHOGEN_KSHV_VGPCR_TO_GNB_G_PI3K_AKT_SIGNALING_PATHWAY",0.954602774274905,0.992043316894606,0.0259033757772498,0.191200659808697,0.59231285884171,24,"kegg","Gnb3; Gnb4; Gng5; Gng2; Gng10; Pik3r5","kidney","RR-3","GLDS-163"
"KEGG_MEDICUS_PATHOGEN_KSHV_VGPCR_TO_GNB_G_PI3K_JNK_SIGNALING_PATHWAY",0.992673992673993,0.997145497145497,0.0219398252709772,0.158000939301976,0.506185364696443,28,"kegg","Gnb3; Gnb4; Gng5; Gng2; Gng10; Pik3r5","kidney","RR-3","GLDS-163"
"KEGG_MEDICUS_PATHOGEN_SALMONELLA_SIFA_TO_MICROTUBULE_PLUS_END_DIRECTED_TRANSPORT",0.00171055592276542,0.0444276098622683,0.45505986738723,-0.530035634580763,-1.97076057638188,21,"kegg","Klc1; Tubb2b; Plekhm2; Klc2; Tubb6; Tubb1; Tubb4b; Tubb2a; Tubb4a; Kif5a; Klc4; Tubb5; Kif5c","kidney","RR-3","GLDS-163"
"KEGG_MEDICUS_PATHOGEN_SALMONELLA_SOPB_TO_ARNO_ARF_ACTB_G_SIGNALING_PATHWAY",0.32529394756998,0.677949068300052,0.203508959461977,-0.299925116581965,-1.2514050139455,30,"kegg","Wasf2; Actb; Actg1; Wasf3; Cyfip2; Cyth2; Arf1; Arf6; Pik3c2b","kidney","RR-3","GLDS-163"
"KEGG_MEDICUS_PATHOGEN_SALMONELLA_SOPE_TO_RAC_SIGNALING_PATHWAY",0.0832596308231849,0.320118925406383,0.287805130535564,-0.394724501148364,-1.47618292519286,20,"kegg","Wasf2; Actb; Actg1; Wasf3; Cyfip2","kidney","RR-3","GLDS-163"
"KEGG_MEDICUS_PATHOGEN_SHIGELLA_IPGD_TO_ARNO_ARF_ACTB_G_SIGNALING_PATHWAY",0.207446808510638,0.53442265795207,0.227987202850442,-0.284709768278416,-1.17319138855614,29,"kegg","Wasf2; Actb; Actg1; Wasf3; Cyfip2","kidney","RR-3","GLDS-163"
"KEGG_MEDICUS_REFERENCE_26S_PROTEASOME_MEDIATED_PROTEIN_DEGRADATION",0.960667461263409,0.992043316894606,0.0224414263839237,0.176802299124279,0.603577542843411,39,"kegg","Uba52; Psmc6; Psma5; Psma3; Rps27a; Psmb2; Psmd7; Psma6; Psmb1; Psmc1; Psma7; Psmb7; Psmd12; Psmd6; Psma1; Psma2","kidney","RR-3","GLDS-163"
"KEGG_MEDICUS_REFERENCE_ACH_CHRN_RAS_ERK_SIGNALING_PATHWAY",0.0282289218926287,0.153537794684298,0.352487857583619,-0.428959997703425,-1.59494456063777,21,"kegg","Atf6b; Creb3l1; Creb3; Chrna7; Mapk3; Map2k2; Creb1","kidney","RR-3","GLDS-163"
"KEGG_MEDICUS_REFERENCE_ACTH_CORTISOL_SIGNALING_PATHWAY",0.00270990803916016,0.0503591243943931,0.431707695803346,-0.463010160662423,-1.96320521551756,31,"kegg","Nr4a1; Atf6b; Creb3l1; Creb3; Prkaca; Gnas; Mrap; Adcy5; Creb1; Pbx1; Adcy1; Creb3l2","kidney","RR-3","GLDS-163"
"KEGG_MEDICUS_REFERENCE_ACTIVATION_OF_PRC2.2_BY_UBIQUITINATION_OF_H2AK119",0.689747003994674,0.992043316894606,0.0440640346597561,0.288973278868524,0.854490891457055,20,"kegg","Aebp2; Eed; Rbbp4; Yaf2; Rbbp7; Ezh2; Rnf2; Skp1; Suz12; Pcgf1","kidney","RR-3","GLDS-163"
"KEGG_MEDICUS_REFERENCE_ACTIVATION_OF_PRC2.2_BY_UBIQUITINATION_OF_H2AK119_IN_GERMLINE_GENES",0.604738154613466,0.984349919743178,0.0470699590082662,0.288388161564771,0.898297640277548,25,"kegg","Cbx3; Pcgf6; Aebp2; Eed; Rbbp4; Yaf2; Rbbp7; Ezh2; Rnf2; E2f6; Wdr5","kidney","RR-3","GLDS-163"
"KEGG_MEDICUS_REFERENCE_ADRB3_UCP1_SIGNALING_PATHWAY",8.73538180336765e-05,0.00973995071075492,0.538434096309916,-0.502601950123494,-2.15855338946926,34,"kegg","Smarcb1; Prkaca; Smarca4; Actb; Actg1; Gnas; Arid1b; Smarce1; Adcy5; Kdm3b; Pparg; Smarcd1; Arid1a; Dpf3; Adcy1; Smarcc1; Adrb3; Adcy9; Kdm3a; Smarcc2; Smarcd2; Smarca2","kidney","RR-3","GLDS-163"
"KEGG_MEDICUS_REFERENCE_AGE_RAGE_SIGNALING_PATHWAY",0.295880149812734,0.646875229492546,0.156312403073186,-0.335855487332603,-1.15068280260105,16,"kegg","Ager; Mapk3; Map2k2; Nfkb1; Rela","kidney","RR-3","GLDS-163"
"KEGG_MEDICUS_REFERENCE_ANGIOTENSIN_ALDOSTERONE_SIGNALING_PATHWAY",0.0307100155992464,0.155643942696181,0.352487857583619,-0.388438509787392,-1.56207311935973,28,"kegg","Atf6b; Creb3l1; Creb3; Gnaq; Calm1; Plcb3; Creb1; Camk2d; Creb3l2","kidney","RR-3","GLDS-163"
"KEGG_MEDICUS_REFERENCE_ANTEROGRADE_AXONAL_TRANSPORT",0.00480855010802434,0.063076863181731,0.407017918923954,-0.513118254647672,-1.91894955573318,20,"kegg","Klc1; Tubb2b; Klc2; Tubb6; Tubb1; Tubb4b; Tubb2a; Tubb4a; Kif5a; Klc4; Tubb5; Kif5c","kidney","RR-3","GLDS-163"
"KEGG_MEDICUS_REFERENCE_AREG_EGFR_RAS_ERK_SIGNALING_PATHWAY",0.574074074074074,0.977240599378004,0.106729884364606,-0.269445169153733,-0.899836718011216,15,"kegg","Egfr; Mapk3; Map2k2","kidney","RR-3","GLDS-163"
"KEGG_MEDICUS_REFERENCE_ARL8_REGULATED_MICROTUBULE_PLUS_END_DIRECTED_TRANSPORT",0.00212953296490545,0.0444276098622683,0.431707695803346,-0.469224931256686,-1.98955640838652,31,"kegg","Klc1; Tubb2b; Plekhm2; Klc2; Tubb6; Arl8a; Tubb1; Arl8b; Borcs6; Tubb4b; Tubb2a; Tubb4a; Kif5a; Klc4; Borcs8; Tubb5; Kif5c; Borcs5","kidney","RR-3","GLDS-163"
"KEGG_MEDICUS_REFERENCE_ARNO_ARF_ACTB_G_SIGNALING_PATHWAY",0.136063126000296,0.441926589694985,0.249246554383295,-0.342319814747997,-1.33762699371202,25,"kegg","Wasf2; Actb; Actg1; Wasf3; Cyfip2; Cyth2; Arf1; Arf6","kidney","RR-3","GLDS-163"
"KEGG_MEDICUS_REFERENCE_ASSEMBLY_AND_TRAFFICKING_OF_TELOMERASE",0.84471218206158,0.992043316894606,0.0349401058848478,0.250505564419419,0.72409386937863,18,"kegg","Naf1; Tcp1; Cct4; Nop10; Cct7; Cct6a; Gar1; Cct6b; Cct5; Cct8; Cct3; Nhp2; Cct2","kidney","RR-3","GLDS-163"
"KEGG_MEDICUS_REFERENCE_AUTOPHAGY_VESICLE_NUCLEATION_ELONGATION_MATURATION_MTORC1_PI3KC3_C1",0.00617669821459034,0.0724949316765076,0.407017918923954,-0.541703289195154,-1.85594305437682,16,"kegg","Telo2; Rptor; Mtor; Atg101; Mlst8; Akt1s1; Pik3r4; Becn1","kidney","RR-3","GLDS-163"
"KEGG_MEDICUS_REFERENCE_BCR_PLCG_CALCINEURIN_SIGNALING_PATHWAY",0.898097826086957,0.992043316894606,0.0327241935806629,0.232804813598127,0.6601027195962,17,"kegg","Ppp3ca; Ppp3cb; Calm2","kidney","RR-3","GLDS-163"
"KEGG_MEDICUS_REFERENCE_BILE_ACID_BIOSYNTHESIS",0.628415300546448,0.992043316894606,0.0494904866135495,0.322568634235591,0.882683110518716,15,"kegg","Akr1d1; Cyp7a1; Cyp8b1; Cyp39a1; Akr1c20; Akr1c6; Hsd17b4; Amacr","kidney","RR-3","GLDS-163"
"KEGG_MEDICUS_REFERENCE_BMP_SIGNALING_PATHWAY",0.96953642384106,0.992043316894606,0.0276588991389961,0.192713647061726,0.562409887767561,19,"kegg","Bmpr1a; Acvr2a; Smad4; Bmpr1b; Smad5; Acvr1; Bmpr2; Bmp5; Smad9; Gdf5; Gdf6","kidney","RR-3","GLDS-163"
"KEGG_MEDICUS_REFERENCE_BRANCHING_MICROTUBULE_NUCLEATION",0.112554532822795,0.411469849499724,0.287805130535564,-0.331271773058803,-1.33218184824421,28,"kegg","Tubb2b; Tubgcp4; Tubgcp2; Tubb6; Haus4; Tubb1; Haus8; Tubgcp3; Tubb4b; Tubb2a; Tubb4a","kidney","RR-3","GLDS-163"
"KEGG_MEDICUS_REFERENCE_CA2_CAM_CAMK_SIGNALING_PATHWAY",0.477732793522267,0.902834008097166,0.125033367555272,-0.26396037907172,-0.970295718311008,19,"kegg","Mylk; Camkk2; Calm1","kidney","RR-3","GLDS-163"
"KEGG_MEDICUS_REFERENCE_CA2_ENTRY_VOLTAGE_GATED_CA2_CHANNEL",0.213216957605985,0.53442265795207,0.100633389423036,0.397100798726499,1.23692563700548,25,"kegg","Cacna1e; Cacna2d3; Cacna1f; Cacng2; Cacng3; Cacna1b; Cacna1h; Cacng7; Cacng5; Cacna2d1","kidney","RR-3","GLDS-163"
"KEGG_MEDICUS_REFERENCE_CA2_PYK2_RAS_ERK_SIGNALING_PATHWAY",0.733333333333333,0.992043316894606,0.0919686140000427,-0.24214559126529,-0.808667287706037,15,"kegg","Mapk3; Map2k2; Src","kidney","RR-3","GLDS-163"
"KEGG_MEDICUS_REFERENCE_CARDIAC_TYPE_VGCC_RYR_SIGNALING",0.305483028720627,0.658527801786229,0.0826646449123753,0.37880187016182,1.13597411590949,21,"kegg","Cacna2d3; Trdn; Cacng2; Cacng3; Cacng7; Casq1; Cacng5; Cacna2d1; Asph","kidney","RR-3","GLDS-163"
"KEGG_MEDICUS_REFERENCE_CCR2_GNB_G_PI3K_NFKB_SIGNALING_PATHWAY",0.844092570036541,0.992043316894606,0.0304180507344859,0.220979256212288,0.722431756706532,31,"kegg","Pik3ca; Gnb3; Gnb4; Chuk; Gng5; Gng2; Gng10","kidney","RR-3","GLDS-163"
"KEGG_MEDICUS_REFERENCE_CCR5_GNB_G_PLCB_G_PKC_SIGNALING_PATHWAY",0.967861557478368,0.992043316894606,0.0240742072753014,0.182816010843108,0.576748777185875,26,"kegg","Gnb3; Gnb4; Gng5; Gng2; Gng10; Prkcg","kidney","RR-3","GLDS-163"
"KEGG_MEDICUS_REFERENCE_CCR_CXCR_GNB_G_PI3K_RAC_SIGNALING_PATHWAY",0.732600732600733,0.992043316894606,0.0373029764832679,0.250077719916892,0.812705502825405,30,"kegg","Gnb3; Gnb4; Gng5; Gng2; Ccl3; Gng10; Pik3r5; Ccr4; Cxcr2","kidney","RR-3","GLDS-163"
"KEGG_MEDICUS_REFERENCE_CD80_CD86_CTLA4_PP2A_SIGNALING_PATHWAY",0.754385964912281,0.992043316894606,0.10027910675413,-0.21745205643753,-0.809436154302249,22,"kegg","Ppp2r1a; Akt1; Akt3; Ppp2r5d; Ppp2r5b; Akt2; Ppp2r3d; Ppp2r2b","kidney","RR-3","GLDS-163"
"KEGG_MEDICUS_REFERENCE_COHESIN_DISSOCIATION_IN_ANAPHASE",0.715355805243446,0.992043316894606,0.0940503465727813,-0.23376454808982,-0.800906507382376,16,"kegg","Anapc2; Cdc16; Cdc20; Anapc5; Anapc1; Anapc7; Anapc4; Anapc13; Cdc23; Espl1; Anapc11; Pttg1; Anapc10; Rad21; Cdc27; Cdc26","kidney","RR-3","GLDS-163"
"KEGG_MEDICUS_REFERENCE_COHESIN_DISSOCIATION_IN_PROPHASE",0.533333333333333,0.936482939632546,0.0568864160475701,0.342488522343954,0.952983363662586,16,"kegg","Ppp2cb; Ppp2r1b; Stag2","kidney","RR-3","GLDS-163"
"KEGG_MEDICUS_REFERENCE_CONDENSIN_LOADING",0.753661784287617,0.992043316894606,0.0400031517498194,0.266962871312817,0.789406351989425,20,"kegg","Ppp2cb; Ppp2r1b","kidney","RR-3","GLDS-163"
"KEGG_MEDICUS_REFERENCE_COPI_VESICLE_FORMATION",0.320754716981132,0.674795300818797,0.169570644405628,-0.289200688134688,-1.09383820667454,23,"kegg","Tmed9; Gbf1; Copg1; Copz1; Tmed10; Arf1; Copz2; Cope; Tmed5; Arcn1","kidney","RR-3","GLDS-163"
"KEGG_MEDICUS_REFERENCE_CORE_NER_REACTION",0.224043715846995,0.54903020476791,0.222056046145248,-0.290860134107362,-1.16966980753571,28,"kegg","Ercc2; Ercc5; Lig3; Ercc1; Gtf2h3; Gtf2h4","kidney","RR-3","GLDS-163"
"KEGG_MEDICUS_REFERENCE_CRHR_PKA_ACTH_SIGNALING_PATHWAY",0.00727365454597882,0.0734414856478037,0.407017918923954,-0.464153295529993,-1.79161412137647,24,"kegg","Atf6b; Creb3l1; Creb3; Prkaca; Gnas; Adcy5; Creb1; Crhr2; Adcy1; Creb3l2","kidney","RR-3","GLDS-163"
"KEGG_MEDICUS_REFERENCE_CX3CR1_GNAI_AC_PKA_SIGNALING_PATHWAY",0.179775280898876,0.500561167227834,0.204294756516886,-0.384341235620871,-1.31680102555955,16,"kegg","Gnai2; Prkaca; Cx3cl1; Adcy5","kidney","RR-3","GLDS-163"
"KEGG_MEDICUS_REFERENCE_CXCL12_CXCR4_PKC_ERK_SIGNALING_PATHAWAY",0.129554655870445,0.437737700895596,0.252961123069611,-0.363303985063854,-1.33547429501532,19,"kegg","Plcg2; Mapk3; Map2k2; Gnaq; Plcb3","kidney","RR-3","GLDS-163"
"KEGG_MEDICUS_REFERENCE_CXCR4_GNAQ_PLCB_G_CALCINEURIN_SIGNALING_PATHWAY",0.555084745762712,0.964623752623239,0.11776578836269,-0.245936307426964,-0.914432063348645,21,"kegg","Plcg2; Gnaq; Calm1; Plcb3; Nfatc3; Nfatc2; Plcg1; Plcb1; Nfatc4","kidney","RR-3","GLDS-163"
"KEGG_MEDICUS_REFERENCE_CXCR4_GNB_G_PLCB_PKC_SIGNALING_PATHWAY",0.895027624309392,0.992043316894606,0.103958471559957,-0.177766240496631,-0.753745036581132,31,"kegg","Gnb2; Pxn; Bcar1; Plcb3; Ptk2; Gnb1; Plcb1; Gngt2; Prkca; Gnb5; Ptk2b","kidney","RR-3","GLDS-163"
"KEGG_MEDICUS_REFERENCE_CXCR4_GNB_G_RAC_SIGNALING_PATHWAY",0.889987639060569,0.992043316894606,0.0285038599247822,0.215772627115587,0.680720459139098,26,"kegg","Gnb3; Gnb4; Gng5; Gng2; Cxcl12; Gng10; Cfl2","kidney","RR-3","GLDS-163"
"KEGG_MEDICUS_REFERENCE_CXCR_GNB_G_ERK_SIGNALING_PATHWAY",0.590852904820766,0.981175160122529,0.0477342401407188,0.286187335289969,0.902865098704215,26,"kegg","Kras; Gnb3; Gnb4; Gng5; Gng2; Nras; Raf1; Gng10; Cxcr2","kidney","RR-3","GLDS-163"
"KEGG_MEDICUS_REFERENCE_CXCR_GNB_G_PI3K_AKT_SIGNALING_PATHWAY",0.946384039900249,0.992043316894606,0.0257629629837414,0.194993103438062,0.607382230041598,25,"kegg","Gnb3; Gnb4; Gng5; Gng2; Gng10; Pik3r5; Cxcr2","kidney","RR-3","GLDS-163"
"KEGG_MEDICUS_REFERENCE_CYTOKINE_JAK_STAT_SIGNALING_PATHWAY",0.91866028708134,0.992043316894606,0.0251307059474849,0.197984092371245,0.682337588678382,42,"kegg","Il2rb; Ifng; Il2ra; Il12rb2; Stat1; Il23a; Ifnar1; Il13ra1; Il6st; Ifngr2; Jak2; Jak1; Il4; Csf2rb2; Il6; Il15; Il3ra; Il12b","kidney","RR-3","GLDS-163"
"KEGG_MEDICUS_REFERENCE_DEUBIQUITINATION_OF_H2AK119",0.000443208055825995,0.0247088491122992,0.49849310876659,-0.550732668792052,-2.15200772014212,25,"kegg","Ogt; Phc2; Cbx4; Cbx8; Mbd6; Foxk2; Cbx6; Pcgf2; Cbx2; Foxk1; Cbx7; Asxl1; Asxl3; Asxl2","kidney","RR-3","GLDS-163"
"KEGG_MEDICUS_REFERENCE_DISASSEMBLY_OF_MCC",0.710526315789474,0.992043316894606,0.0946646223153342,-0.23377466251298,-0.822355350859936,17,"kegg","Anapc2; Bub3; Cdc16; Cdc20; Anapc5; Mad2l1; Anapc1; Mad2l1bp; Bub1b; Anapc7; Trip13; Anapc4; Cdc23; Anapc11; Anapc10; Cdc27; Cdc26","kidney","RR-3","GLDS-163"
"KEGG_MEDICUS_REFERENCE_DNA_END_RESECTION_AND_RPA_LOADING",0.440217391304348,0.853638941398866,0.065981614400873,0.366974766133266,1.04053278539984,17,"kegg","Brcc3; Rpa3; Rpa2","kidney","RR-3","GLDS-163"
"KEGG_MEDICUS_REFERENCE_DNA_REPLICATION_LICENSING",0.721311475409836,0.992043316894606,0.0395172228473919,0.264539617199762,0.819506674805705,24,"kegg","Ticrr; Orc4; Cdk2; Ccne2; Orc2; Dbf4; Cdc6; Cdt1; Mtbp; Orc5","kidney","RR-3","GLDS-163"
"KEGG_MEDICUS_REFERENCE_DNA_REPLICATION_TERMINATION",0.156779661016949,0.455997127872128,0.234392647294686,-0.346200450060585,-1.2872308086318,21,"kegg","Elob; Nploc4; Ufd1; Mcm2; Cdc45; Mcm3; Mcm5; Ubb; Mcm6; Gins4; Lrr1; Vcp; Mcm7; Gins3; Mcm4; Gins2; Pif1; Eloc; Gins1; Cul2; Rbx1","kidney","RR-3","GLDS-163"
"KEGG_MEDICUS_REFERENCE_DRD1_GNAS_AC_PKA_SIGNALING_PATHWAY",0.00474315302746374,0.063076863181731,0.407017918923954,-0.580958947475778,-1.94016539334423,15,"kegg","Atf6b; Creb3l1; Creb3; Prkaca; Gnas; Adcy5; Creb1","kidney","RR-3","GLDS-163"
"KEGG_MEDICUS_REFERENCE_DYNEIN_RECRUITMENT_TO_THE_KINETOCHORE",0.502732240437158,0.92652305468997,0.143758989039275,-0.229243609092616,-0.956494091267823,30,"kegg","Dync1h1; Dctn1; Dync1li2; Dctn2","kidney","RR-3","GLDS-163"
"KEGG_MEDICUS_REFERENCE_E2_ER_RAS_ERK_SIGNALING_PATHWAY",0.0957395837475646,0.357901234567901,0.287805130535564,-0.384421912022436,-1.45399161241685,23,"kegg","Atf6b; Creb3l1; Creb3; Mapk3; Map2k2; Src; Creb1","kidney","RR-3","GLDS-163"
"KEGG_MEDICUS_REFERENCE_EGF_EGFR_ACTIN_SIGNALING_PATHWAY",0.038986856817549,0.184124251151157,0.321775918075361,-0.413823361056036,-1.53866403001403,21,"kegg","Cttn; Actb; Egfr; Nck2; Actg1; Src","kidney","RR-3","GLDS-163"
"KEGG_MEDICUS_REFERENCE_EGF_EGFR_PLCG_CALCINEURIN_SIGNALING_PATHWAY",0.636704119850187,0.992043316894606,0.100990587455923,-0.247598143799868,-0.848302132233145,16,"kegg","Plcg2; Egfr; Calm1; Nfatc3; Nfatc2; Plcg1","kidney","RR-3","GLDS-163"
"KEGG_MEDICUS_REFERENCE_EGF_EGFR_PLCG_CAMK_SIGNALING_PATHWAY",0.266666666666667,0.608031066677683,0.16440575583821,-0.351790980722986,-1.1748380663641,15,"kegg","Plcg2; Egfr; Calm1; Camk2d; Camk2a; Plcg1","kidney","RR-3","GLDS-163"
"KEGG_MEDICUS_REFERENCE_EGF_EGFR_PLCG_ERK_SIGNALING_PATHWAY",0.0962962962962963,0.357901234567901,0.282013350011725,-0.422317138094512,-1.4103666014737,15,"kegg","Plcg2; Egfr; Mapk3; Map2k2","kidney","RR-3","GLDS-163"
"KEGG_MEDICUS_REFERENCE_EGF_EGFR_RAS_ERK_SIGNALING_PATHWAY",0.614232209737828,0.984349919743178,0.103197466945307,-0.251483567712441,-0.861614079322415,16,"kegg","Egfr; Mapk3; Map2k2","kidney","RR-3","GLDS-163"
"KEGG_MEDICUS_REFERENCE_EGF_EGFR_RAS_PI3K_SIGNALING_PATHWAY",0.825925925925926,0.992043316894606,0.0852884689790502,-0.224175428764988,-0.748654291009209,15,"kegg","Egfr; Akt1; Akt3; Grb2; Bad; Akt2","kidney","RR-3","GLDS-163"
"KEGG_MEDICUS_REFERENCE_EGF_ERBB2_RAS_ERK_SIGNALING_PATHWAY",0.617977528089888,0.984349919743178,0.102821842840815,-0.250590512043658,-0.858554359179101,16,"kegg","Egfr; Mapk3; Map2k2","kidney","RR-3","GLDS-163"
"KEGG_MEDICUS_REFERENCE_ELECTRON_TRANSFER_IN_COMPLEX_I",0.157451923076923,0.455997127872128,0.11776578836269,0.380338991005315,1.28676480636319,37,"kegg","Ndufb5; Ndufs1; Ndufa9; Ndufb6; Ndufa7; Ndufb9; Ndufa1; Ndufv2; Ndufs6; Ndufv1; Ndufc2; Ndufb8; Ndufa6; Ndufa4; Ndufb1; Ndufa2; Ndufab1; Ndufs5; Ndufs2; Ndufb3; Ndufb2; Ndufa12; Ndufs4","kidney","RR-3","GLDS-163"
"KEGG_MEDICUS_REFERENCE_ELECTRON_TRANSFER_IN_COMPLEX_IV",0.00849100292426628,0.0734414856478037,0.380730400722792,0.599345400910229,1.64006046032406,15,"kegg","Cox7a2; Cox7a2l; Cox5a; Cox5b; Cox7c; Cox6a1; Cox4i1; Cox6b1; Cox8a; Cox6c; Cox7b; Cox6a2","kidney","RR-3","GLDS-163"
"KEGG_MEDICUS_REFERENCE_EREG_EGFR_RAS_ERK_SIGNALING_PATHWAY",0.648148148148148,0.992043316894606,0.0992333343771191,-0.254367708634438,-0.849484163418243,15,"kegg","Egfr; Mapk3; Map2k2","kidney","RR-3","GLDS-163"
"KEGG_MEDICUS_REFERENCE_FANCONI_ANEMIA_PATHWAY",0.917880794701987,0.992043316894606,0.0304180507344859,0.222277729345064,0.648688843370521,19,"kegg","Atr; Fancb; Fancd2; Fancc; Cenps; Ube2t; Fancl; Fancm; Fance; Topbp1","kidney","RR-3","GLDS-163"
"KEGG_MEDICUS_REFERENCE_FGF_FGFR_PI3K_SIGNALING_PATHWAY",0.954822954822955,0.992043316894606,0.0241447930798382,0.187264963607751,0.599938103643098,28,"kegg","Pik3ca; Fgf16; Fgf4; Fgf15; Fgf5; Fgf2; Fgf9; Fgf3; Fgf6; Rps6kb2; Pik3cd","kidney","RR-3","GLDS-163"
"KEGG_MEDICUS_REFERENCE_FGF_FGFR_RAS_ERK_SIGNALING_PATHWAY",0.754556500607533,0.992043316894606,0.0356933083353341,0.243778273213019,0.797463998699165,32,"kegg","Kras; Fgf16; Fgf4; Fgf15; Nras; Raf1; Fgf5; Fgf2; Sos1; Fgf9; Sos2; Fgf3; Fgf6; Map2k1","kidney","RR-3","GLDS-163"
"KEGG_MEDICUS_REFERENCE_FLT3LG_FLT3_RAS_ERK_SIGNALING_PATHWAY",0.800546448087432,0.992043316894606,0.0383995813369433,0.278492798847786,0.762073133758224,15,"kegg","Kras; Nras; Raf1; Sos1; Flt3l; Sos2; Map2k1; Araf; Braf","kidney","RR-3","GLDS-163"
"KEGG_MEDICUS_REFERENCE_FLT3LG_FLT3_RAS_PI3K_SIGNALING_PATHWAY",0.769125683060109,0.992043316894606,0.0402477565068868,0.286375823135229,0.783644395374603,15,"kegg","Kras; Pik3ca; Nras; Sos1; Flt3l; Sos2","kidney","RR-3","GLDS-163"
"KEGG_MEDICUS_REFERENCE_GENE_SILENCING_BY_METHYLATION_OF_H3K27_AND_UBIQUITINATION_OF_H2AK119",0.0575737810254372,0.242244399408915,0.321775918075361,-0.331286348857623,-1.44398134458964,36,"kegg","Phc2; Cbx4; Cbx8; Elob; Cbx6; Phf1; Pcgf2; Cbx2; Ctbp1; Cbx7; Ezh1; Epop","kidney","RR-3","GLDS-163"
"KEGG_MEDICUS_REFERENCE_GF_RTK_PI3K_SIGNALING_PATHWAY",0.232954453201217,0.558589710364208,0.249246554383295,-0.224982401884629,-1.14144407536003,79,"kegg","Fgfr3; Egfr; Pik3r2; Fgf20; Akt1; Epha2; Flt1; Pik3r3; Angpt4; Akt3; Ntrk1; Pdgfb; Efna2; Vegfb; Pik3r1; Pdgfa; Vegfa; Igf2; Flt4; Tgfa; Vegfd; Csf1; Akt2; Efna5; Tek; Pdgfrb; Vegfc; Fgfr1","kidney","RR-3","GLDS-163"
"KEGG_MEDICUS_REFERENCE_GF_RTK_RAS_ERK_SIGNALING_PATHWAY",0.878048780487805,0.992043316894606,0.16440575583821,-0.157218859259842,-0.808760709523387,87,"kegg","Fgfr3; Egfr; Mapk3; Map2k2; Fgf20; Epha2; Flt1; Angpt4; Ntrk1; Pdgfb; Efna2; Vegfb; Grb2; Pdgfa; Nrtn; Vegfa; Igf2; Flt4; Tgfa; Vegfd; Csf1; Efna5; Tek; Pdgfrb; Vegfc; Fgfr1","kidney","RR-3","GLDS-163"
"KEGG_MEDICUS_REFERENCE_GF_RTK_RAS_PI3K_SIGNALING_PATHWAY",0.423913043478261,0.836571758368603,0.227987202850442,-0.198001930942552,-1.02740214547729,85,"kegg","Fgfr3; Egfr; Pik3r2; Fgf20; Akt1; Epha2; Flt1; Pik3r3; Angpt4; Akt3; Ntrk1; Pdgfb; Efna2; Vegfb; Pik3r1; Grb2; Pdgfa; Vegfa; Igf2; Flt4; Tgfa; Vegfd; Csf1; Akt2; Efna5; Tek; Pdgfrb; Vegfc; Fgfr1","kidney","RR-3","GLDS-163"
"KEGG_MEDICUS_REFERENCE_GHRHR_PKA_GH_SIGNALING_PATHWAY",0.0201228194578271,0.131455005962133,0.352487857583619,-0.418478753025227,-1.61531211915647,24,"kegg","Atf6b; Creb3l1; Creb3; Prkaca; Gnas; Adcy5; Creb1; Adcy1; Creb3l2","kidney","RR-3","GLDS-163"
"KEGG_MEDICUS_REFERENCE_GLOBAL_GENOME_NER",0.262745098039216,0.608031066677683,0.170932335370056,-0.329145076911391,-1.1836578596467,18,"kegg","Ercc2; Rad23a; Gtf2h3; Gtf2h4; Rad23b","kidney","RR-3","GLDS-163"
"KEGG_MEDICUS_REFERENCE_GLYCOLYSIS",0.00796059626297709,0.0734414856478037,0.380730400722792,-0.471540788947857,-1.75524742812562,22,"kegg","Gpi1; Gapdh; Pfkl; Pfkp; Pkm; Pgam2; Pfkm; Ldhal6b; Aldoa; Ldha; Aldob","kidney","RR-3","GLDS-163"
"KEGG_MEDICUS_REFERENCE_GNRH_GNRHR_PLCB_PKC_SIGNALING_PATHWAY",0.215686274509804,0.53442265795207,0.190023305279108,-0.340669917038019,-1.22510301120437,18,"kegg","Mapk3; Map2k2; Gnaq; Gna11; Plcb3","kidney","RR-3","GLDS-163"
"KEGG_MEDICUS_REFERENCE_GPCR_PI3K_SIGNALING_PATHWAY",0.522478736330498,0.928006658343737,0.0525898950623616,0.292436594549271,0.956638395134768,32,"kegg","Lpar4; Gnb3; Gnb4; Chrm2; Gng5; Gng2; Chrm1; Gng10; Pik3r5; Lpar6; Lpar1","kidney","RR-3","GLDS-163"
"KEGG_MEDICUS_REFERENCE_GPCR_PLCB_ITPR_SIGNALING_PATHWAY",0.481955762514552,0.903160798661723,0.0543434390269162,0.278083777833159,0.991703737499727,49,"kegg","Grm5; Tacr1; Grpr; Grm1; Tacr3; Avpr1b; Trhr; Ptgfr; Chrm2; Htr2c; Chrm1; Tacr2","kidney","RR-3","GLDS-163"
"KEGG_MEDICUS_REFERENCE_GPI_ANCHOR_BIOSYNTHESIS",0.949558638083228,0.992043316894606,0.0261841515946199,0.196621996349634,0.609107399972049,24,"kegg","Pigc; Pigx; Pigg; Pigp; Mppe1; Pigw; Pigf; Pign; Pgap1; Pigk","kidney","RR-3","GLDS-163"
"KEGG_MEDICUS_REFERENCE_HGF_MET_RAS_ERK_SIGNALING_PATHWAY",0.610655737704918,0.984349919743178,0.0508054139066364,0.326999830678306,0.894808723006254,15,"kegg","Kras; Hgf; Met; Nras; Raf1; Sos1; Sos2; Map2k1; Araf; Braf","kidney","RR-3","GLDS-163"
