"pathway","pval","padj","log2err","ES","NES","size","db","leadingEdge_str","tissue","mission","glds"
"KEGG_MEDICUS_VARIANT_MUTATION_INACTIVATED_ATP2B3_TO_ANGIOTENSIN_ALDOSTERONE_SIGNALING_PATHWAY",0.904332129963899,0.93017019082001,0.0455878202571231,0.22732951333688,0.664122260821022,20,"kegg","Camk2b; Calm2; Camk2d; Camk2a; Creb3l4; Camk2g; Calm3","liver","RR-9","GLDS-242"
"KEGG_MEDICUS_VARIANT_MUTATION_INACTIVATED_PDE11A_PDE8B_TO_ACTH_CORTISOL_SIGNALING_PATHWAY",0.366515837104072,0.654276205078344,0.103958471559957,-0.366233277437201,-1.061794509911,18,"kegg","Pbx1; Prkar1a; Atf6b; Creb3l2; Creb3","liver","RR-9","GLDS-242"
"KEGG_MEDICUS_VARIANT_MUTATION_INACTIVATED_PINK1_TO_ELECTRON_TRANSFER_IN_COMPLEX_I",0.282296650717703,0.59293407652655,0.125033367555272,-0.314407193150479,-1.12809174552541,39,"kegg","Ndufs2; Pink1; Ndufb7; Ndufa2; Ndufs1; Ndufa9; Ndufa10; Ndufb10; Ndufv1; Ndufs3","liver","RR-9","GLDS-242"
"KEGG_MEDICUS_VARIANT_MUTATION_INACTIVATED_PRKAR1A_TO_ACTH_CORTISOL_SIGNALING_PATHWAY",0.268131868131868,0.59293407652655,0.122679189568808,-0.400230167347486,-1.1456926456713,16,"kegg","Pbx1; Prkar1a; Atf6b; Creb3l2; Creb3","liver","RR-9","GLDS-242"
"KEGG_MEDICUS_VARIANT_MUTATION_INACTIVATED_PTCH1_TO_HEDGEHOG_SIGNALING_PATHWAY",0.492779783393502,0.721911196911197,0.0745500777420554,0.33241966059681,0.97113345863612,20,"kegg","Bmp4; Wnt2b; Smo; Wnt7b; Wnt5a; Kif7","liver","RR-9","GLDS-242"
"KEGG_MEDICUS_VARIANT_MUTATION_INACTIVATED_RASD1_TO_CRHR_PKA_ACTH_SIGNALING_PATHWAY",0.544642857142857,0.730700976042591,0.0689567351672811,0.303834501167399,0.943960154130687,26,"kegg","Adcy7; Adcy4; Gnai1; Creb3l4","liver","RR-9","GLDS-242"
"KEGG_MEDICUS_VARIANT_MUTATION_INACTIVATED_UBQLN2_TO_26S_PROTEASOME_MEDIATED_PROTEIN_DEGRADATION",1.91954947511601e-20,1.38207562208352e-18,1.16906996676109,-0.859352886219195,-3.08858177644038,40,"kegg","Psmd11; Psmd1; Psmc4; Psmc2; Psmd2; Adrm1; Psma1; Psmc5; Psmc1; Psmd3; Psma4; Psmb7; Ubqln2; Psmd7; Psmb3; Psmd12; Psmb6; Psmd13; Psmb5; Psmb4; Psmc3; Psmd6; Ubb; Psmd14; Psmd9; Psmd4; Psmd8; Psma7; Psmb2; Psma2; Psmb1","liver","RR-9","GLDS-242"
"KEGG_MEDICUS_VARIANT_MUTATION_INACTIVATED_VCP_TO_26S_PROTEASOME_MEDIATED_PROTEIN_DEGRADATION",1.91954947511601e-20,1.38207562208352e-18,1.16906996676109,-0.859349720507742,-3.08857039862475,40,"kegg","Psmd11; Psmd1; Psmc4; Psmc2; Psmd2; Adrm1; Psma1; Psmc5; Psmc1; Psmd3; Psma4; Psmb7; Vcp; Psmd7; Psmb3; Psmd12; Psmb6; Psmd13; Psmb5; Psmb4; Psmc3; Psmd6; Ubb; Psmd14; Psmd9; Psmd4; Psmd8; Psma7; Psmb2; Psma2; Psmb1","liver","RR-9","GLDS-242"
"KEGG_MEDICUS_VARIANT_SCRAPIE_CONFORMATION_PRPSC_TO_26S_PROTEASOME_MEDIATED_PROTEIN_DEGRADATION",3.92424911779312e-20,1.41272968240552e-18,1.16017957183021,-0.878119594476622,-3.07957437430509,36,"kegg","Psmd11; Psmd1; Psmc4; Psmc2; Psmd2; Adrm1; Psma1; Psmc5; Psmc1; Psmd3; Psma4; Psmb7; Psmd7; Psmb3; Psmd12; Psmb6; Psmd13; Psmb5; Psmb4; Psmc3; Psmd6; Psmd14; Psmd9; Psmd4; Psmd8; Psma7; Psmb2; Psma2; Psmb1","liver","RR-9","GLDS-242"
"KEGG_MEDICUS_VARIANT_SCRAPIE_CONFORMATION_PRPSC_TO_MGLUR5_CA2_APOPTOTIC_PATHWAY",0.239285714285714,0.576659038901602,0.116234148779716,0.419431250261554,1.19870207611612,18,"kegg","Ryr1; Slc25a31; Slc25a4; Ryr2; Ryr3; Cycs; Apaf1; Prnp","liver","RR-9","GLDS-242"
"KEGG_MEDICUS_VARIANT_SCRAPIE_CONFORMATION_PRPSC_TO_TRANSPORT_OF_CALCIUM",0.319926873857404,0.622560403181975,0.0992333343771191,0.402444643477435,1.11310905055595,16,"kegg","Slc25a31; Grin2b; Slc25a4; Cycs; Apaf1; Prnp","liver","RR-9","GLDS-242"
