"pathway","pval","padj","log2err","ES","NES","size","db","leadingEdge_str","tissue","mission","glds"
"KEGG_MEDICUS_ENV_FACTOR_ARSENIC_TO_ELECTRON_TRANSFER_IN_COMPLEX_IV",0.29372197309417,0.59293407652655,0.11776578836269,-0.391806654131211,-1.13050982179256,17,"kegg","Cox6b2; Gsto1; Cox8a; Cox6a1; As3mt","liver","RR-9","GLDS-242"
"KEGG_MEDICUS_ENV_FACTOR_DCE_TO_DNA_ADDUCTS",0.108510638297872,0.418673705047839,0.197822021315103,-0.489222336146715,-1.39136269317433,15,"kegg","Gstt2; Gstm4; Mgst3; Gsta3; Gsto1","liver","RR-9","GLDS-242"
"KEGG_MEDICUS_ENV_FACTOR_E2_TO_RAS_ERK_SIGNALING_PATHWAY",0.659574468085106,0.804904435629282,0.0681513438679483,-0.304742268308688,-0.866695961794505,15,"kegg","Map2k2; Mapk3; Map2k1; Esr2; Mapk1; Hras; Nras; Jun","liver","RR-9","GLDS-242"
"KEGG_MEDICUS_ENV_FACTOR_IRON_TO_ANTEROGRADE_AXONAL_TRANSPORT",0.0553191489361702,0.271566731141199,0.282013350011725,-0.527527500254306,-1.50030370497482,15,"kegg","Tubb4b; Tuba4a; Tuba1c; Tuba8; Tubb5","liver","RR-9","GLDS-242"
"KEGG_MEDICUS_ENV_FACTOR_METALS_TO_NFKB_SIGNALING_PATHWAY",0.14468085106383,0.488297872340425,0.169570644405628,-0.462549734234661,-1.31550502992326,15,"kegg","Ikbkg; Acp1; Prkd3; Chuk","liver","RR-9","GLDS-242"
"KEGG_MEDICUS_ENV_FACTOR_NNK_NNN_TO_RAS_ERK_SIGNALING_PATHWAY",0.928251121076233,0.941325080528011,0.0543434390269162,-0.218536168924142,-0.630559187243728,17,"kegg","Map2k2; Mapk3; Map2k1; Chrnb2; Mapk1; Hras; Nras; Jun","liver","RR-9","GLDS-242"
"KEGG_MEDICUS_ENV_FACTOR_TCDD_TO_AHR_SIGNALING_PATHWAY",0.0983981693363844,0.403940557689097,0.216542836735348,-0.4612739350948,-1.35842378529674,19,"kegg","Gstt2; Gstm4; Mgst3; Gsta3; Gsto1","liver","RR-9","GLDS-242"
"KEGG_MEDICUS_ENV_FACTOR_ZN_TO_ANTEROGRADE_AXONAL_TRANSPORT",0.0702127659574468,0.322679945676777,0.248911114434702,-0.515136976228711,-1.46506469071828,15,"kegg","Tubb4b; Tuba4a; Tuba1c; Tuba8; Tubb5","liver","RR-9","GLDS-242"
"KEGG_MEDICUS_PATHOGEN_ESCHERICHIA_EAE_TIR_TO_ACTIN_SIGNALING_PATHWAY",0.820627802690583,0.91842282580915,0.0601186142531851,-0.262700384294631,-0.757989588748291,17,"kegg","Wasl; Arpc4; Wipf3; Arpc5l; Actr2; Nck1; Actg1; Nck2; Actb","liver","RR-9","GLDS-242"
"KEGG_MEDICUS_PATHOGEN_HBV_HBX_TO_RAS_ERK_SIGNALING_PATHWAY",0.674468085106383,0.80936170212766,0.0670512579829467,-0.299997077378153,-0.85320049941489,15,"kegg","Map2k2; Grb2; Mapk3; Map2k1; Mapk1","liver","RR-9","GLDS-242"
"KEGG_MEDICUS_PATHOGEN_HCMV_GB_TO_PDGFR_RAS_ERK_SIGNALING_PATHWAY",0.421276595744681,0.697079094191008,0.0919686140000427,-0.361865729749891,-1.02915676393261,15,"kegg","Map2k2; Grb2; Mapk3; Map2k1; Mapk1","liver","RR-9","GLDS-242"
"KEGG_MEDICUS_PATHOGEN_HCMV_UL33_TO_GNAI_AC_PKA_SIGNALING_PATHWAY",0.485915492957746,0.721911196911197,0.0739901439101341,0.318670444021675,0.985708140878682,25,"kegg","Adcy7; Adcy4; Gnai1; Creb3l4","liver","RR-9","GLDS-242"
"KEGG_MEDICUS_PATHOGEN_HCMV_UL33_TO_GNB_G_RHO_SIGNALING_PATHWAY",0.142355008787346,0.48807431584233,0.154190966581424,0.404375627057734,1.29763056577983,30,"kegg","Gngt2; Gng2; Mapk11; Gngt1; Gnb4; Gng10; Gng11; Mapk12","liver","RR-9","GLDS-242"
"KEGG_MEDICUS_PATHOGEN_HCMV_US28_TO_GNAQ_PLCB_G_CALCINEURIN_SIGNALING_PATHWAY",0.467625899280576,0.717029449423816,0.0770736734944102,0.354008032044923,0.988043415283792,17,"kegg","Plcb2; Gnaq; Plcb3; Plcb1; Calm2; Ppp3cc","liver","RR-9","GLDS-242"
"KEGG_MEDICUS_PATHOGEN_HCMV_US28_TO_GNB_G_PI3K_NFKB_SIGNALING_PATHWAY",0.0588235294117647,0.276214833759591,0.248911114434702,0.464633449162029,1.44902646492586,27,"kegg","Il6; Gngt2; Gng2; Gngt1; Gnb4; Gng10; Pik3cd; Gng11; Nfkb1","liver","RR-9","GLDS-242"
"KEGG_MEDICUS_PATHOGEN_HIV_GP120_TO_CXCR4_GNAQ_PLCB_G_CALCINEURIN",0.228519195612431,0.569245647969052,0.120985142145252,0.44233751302259,1.22344749054528,16,"kegg","Plcg2; Gnaq; Ccr5; Calm2; Ppp3cc","liver","RR-9","GLDS-242"
"KEGG_MEDICUS_PATHOGEN_HIV_GP120_TO_CXCR4_GNB_G_RAC_SIGNALING_PATHWAY",0.0271647878064172,0.183362317693316,0.352487857583619,0.530624782242414,1.61237461198911,23,"kegg","Gngt2; Gng2; Rac2; Gngt1; Gnb4; Gng10; Gng11; Ccr5; Limk1","liver","RR-9","GLDS-242"
"KEGG_MEDICUS_PATHOGEN_HIV_GP120_TO_TNF_NFKB_SIGNALING_PATHWAY",0.508510638297872,0.722620380739082,0.0815265143256594,-0.333004128870273,-0.947073523323689,15,"kegg","Ikbkg; Map3k7; Chuk; Tradd; Tnfrsf1a; Ripk1","liver","RR-9","GLDS-242"
"KEGG_MEDICUS_PATHOGEN_HPV_E5_TO_EGFR_RAS_ERK_SIGNALING_PATHWAY",0.291489361702128,0.59293407652655,0.114750719227023,-0.395038151319059,-1.12350010519769,15,"kegg","Map2k2; Atp6v0c; Grb2; Mapk3; Map2k1; Mapk1","liver","RR-9","GLDS-242"
"KEGG_MEDICUS_PATHOGEN_HTLV_1_TAX_TO_SPINDLE_ASSEMBLY_CHECKPOINT_SIGNALING",0.780075187969925,0.886822318955283,0.0542315935495841,0.28700470059615,0.772690642714173,15,"kegg","Cdc20; Anapc1; Anapc10; Cdc27; Anapc13; Cdc23","liver","RR-9","GLDS-242"
"KEGG_MEDICUS_PATHOGEN_KSHV_VGPCR_TO_GNB_G_ERK_SIGNALING_PATHWAY",0.191150442477876,0.543269678621332,0.131457611642763,0.388523693850041,1.22775840623938,28,"kegg","Gngt2; Gng2; Gngt1; Gnb4; Gng10; Hif1a; Gng11","liver","RR-9","GLDS-242"
"KEGG_MEDICUS_PATHOGEN_KSHV_VGPCR_TO_GNB_G_PI3K_AKT_SIGNALING_PATHWAY",0.0247541746227794,0.178230057284012,0.352487857583619,0.550099169654318,1.624737533743,21,"kegg","Pik3r5; Gngt2; Gng2; Gngt1; Gnb4; Gng10; Gng11","liver","RR-9","GLDS-242"
"KEGG_MEDICUS_PATHOGEN_KSHV_VGPCR_TO_GNB_G_PI3K_JNK_SIGNALING_PATHWAY",0.00212490506534174,0.0382482911761513,0.431707695803346,0.595558724964603,1.84217612452634,25,"kegg","Il6; Pik3r5; Gngt2; Gng2; Prex1; Gngt1; Gnb4; Gng10; Gng11; Nfkb1","liver","RR-9","GLDS-242"
"KEGG_MEDICUS_PATHOGEN_SALMONELLA_SIFA_TO_MICROTUBULE_PLUS_END_DIRECTED_TRANSPORT",0.020158782697527,0.155510609380922,0.352487857583619,-0.51126433128981,-1.57736076320709,21,"kegg","Tubb4b; Tuba4a; Tuba1c; Klc4; Tuba8; Kif5c; Tubb5","liver","RR-9","GLDS-242"
"KEGG_MEDICUS_PATHOGEN_SALMONELLA_SOPB_TO_ARNO_ARF_ACTB_G_SIGNALING_PATHWAY",0.884007029876977,0.922193595877806,0.0454059226590179,0.216297599480272,0.694093208417657,30,"kegg","Cyfip2; Cyth4; Pik3cd; Cyth3; Wasf3","liver","RR-9","GLDS-242"
"KEGG_MEDICUS_PATHOGEN_SALMONELLA_SOPE_TO_RAC_SIGNALING_PATHWAY",0.834821428571429,0.921574239713775,0.0590954798717342,-0.248980864635114,-0.752959840717398,20,"kegg","Nckap1; Wasf1; Arpc4","liver","RR-9","GLDS-242"
"KEGG_MEDICUS_PATHOGEN_SHIGELLA_IPGD_TO_ARNO_ARF_ACTB_G_SIGNALING_PATHWAY",0.460456942003515,0.717029449423816,0.0766746872490091,0.315304865958607,1.00112259256553,29,"kegg","Nckap1l; Cyfip2; Cyth4; Pik3cd; Cyth3; Wasf3","liver","RR-9","GLDS-242"
"KEGG_MEDICUS_REFERENCE_26S_PROTEASOME_MEDIATED_PROTEIN_DEGRADATION",3.83036755995118e-20,1.41272968240552e-18,1.16017957183021,-0.856530367980951,-3.07322751820343,39,"kegg","Psmd11; Psmd1; Psmc4; Psmc2; Psmd2; Adrm1; Psma1; Psmc5; Psmc1; Psmd3; Psma4; Psmb7; Psmd7; Psmb3; Psmd12; Psmb6; Psmd13; Psmb5; Psmb4; Psmc3; Psmd6; Ubb; Psmd14; Psmd9; Psmd4; Psmd8; Psma7; Psmb2; Psma2; Psmb1","liver","RR-9","GLDS-242"
"KEGG_MEDICUS_REFERENCE_ACH_CHRN_RAS_ERK_SIGNALING_PATHWAY",0.271714922048998,0.59293407652655,0.122679189568808,-0.373633453425966,-1.15273981223933,21,"kegg","Map2k2; Atf6b; Creb3l2; Creb3; Mapk3; Map2k1; Mapk1; Hras; Nras; Atf2","liver","RR-9","GLDS-242"
"KEGG_MEDICUS_REFERENCE_ACTH_CORTISOL_SIGNALING_PATHWAY",0.530973451327434,0.728290996371117,0.0697792517076235,0.300635301361854,0.950025762397365,28,"kegg","Adcy7; Adcy4; Nr4a1","liver","RR-9","GLDS-242"
"KEGG_MEDICUS_REFERENCE_ACTIVATION_OF_PRC2.2_BY_UBIQUITINATION_OF_H2AK119",0.178173719376392,0.527198950483571,0.155241966228839,-0.40512051627343,-1.24988419420497,21,"kegg","Ubb; Bcor; Rbbp7; Rbbp4; Pcgf1; Skp1","liver","RR-9","GLDS-242"
"KEGG_MEDICUS_REFERENCE_ACTIVATION_OF_PRC2.2_BY_UBIQUITINATION_OF_H2AK119_IN_GERMLINE_GENES",0.169683257918552,0.515837104072398,0.160801401070022,-0.376008608804675,-1.23560131319873,26,"kegg","E2f6; Ubb; Cbx3; Rbbp7; Wdr5; Rbbp4","liver","RR-9","GLDS-242"
"KEGG_MEDICUS_REFERENCE_ADRB3_UCP1_SIGNALING_PATHWAY",0.215384615384615,0.569245647969052,0.120433371642259,0.36795568025678,1.19781472414624,32,"kegg","Adcy7; Adcy4; Kdm3a; Dpf1; Adrb3","liver","RR-9","GLDS-242"
"KEGG_MEDICUS_REFERENCE_AGE_RAGE_SIGNALING_PATHWAY",0.873857404021938,0.922193595877806,0.0477342401407188,0.245851097196105,0.679991859286456,16,"kegg","Il6; Nfkb1; Braf; Ager; Kras","liver","RR-9","GLDS-242"
"KEGG_MEDICUS_REFERENCE_ANGIOTENSIN_ALDOSTERONE_SIGNALING_PATHWAY",0.598214285714286,0.760084033613445,0.0643583367917361,0.292822118000669,0.909746623832214,26,"kegg","Plcb2; Gnaq; Camk2b; Plcb3; Plcb1; Calm2; Camk2d; Camk2a; Creb3l4; Camk2g; Calm3","liver","RR-9","GLDS-242"
"KEGG_MEDICUS_REFERENCE_ANTEROGRADE_AXONAL_TRANSPORT",0.018868024359542,0.150944194876336,0.352487857583619,-0.51904919428756,-1.56969170794717,20,"kegg","Tubb4b; Tuba4a; Tuba1c; Klc4; Tuba8; Kif5c; Tubb5","liver","RR-9","GLDS-242"
"KEGG_MEDICUS_REFERENCE_ARL8_REGULATED_MICROTUBULE_PLUS_END_DIRECTED_TRANSPORT",0.08584686774942,0.363586733997543,0.234392647294686,-0.401114985895866,-1.36972173767542,31,"kegg","Tubb4b; Tuba4a; Tuba1c; Klc4; Tuba8; Kif5c; Borcs8; Tubb5; Arl8b; Borcs6; Kxd1; Klc2","liver","RR-9","GLDS-242"
"KEGG_MEDICUS_REFERENCE_ARNO_ARF_ACTB_G_SIGNALING_PATHWAY",0.875576036866359,0.922193595877806,0.0583452776743612,-0.221902760093024,-0.715286456200837,25,"kegg","Nckap1; Wasf1; Arf1; Arpc4","liver","RR-9","GLDS-242"
"KEGG_MEDICUS_REFERENCE_ASSEMBLY_AND_TRAFFICKING_OF_TELOMERASE",0.00506932020195768,0.0644101860954623,0.407017918923954,-0.576303242942859,-1.67083565885287,18,"kegg","Ruvbl1; Cct3; Cct5; Wrap53; Cct8; Tcp1; Dkc1; Cct7; Cct2; Ruvbl2","liver","RR-9","GLDS-242"
"KEGG_MEDICUS_REFERENCE_AUTOPHAGY_VESICLE_NUCLEATION_ELONGATION_MATURATION_MTORC1_PI3KC3_C1",0.0317298622004911,0.201577948097238,0.321775918075361,-0.533933748348442,-1.52843043494873,16,"kegg","Atg13; Rb1cc1; Pik3c3; Becn1; Atg14; Rptor; Akt1s1; Deptor; Atg101","liver","RR-9","GLDS-242"
"KEGG_MEDICUS_REFERENCE_BCR_PLCG_CALCINEURIN_SIGNALING_PATHWAY",0.056672760511883,0.272029250457038,0.257206466468838,0.538226644881493,1.48866424085366,16,"kegg","Syk; Plcg2; Btk; Blnk; Calm2; Ppp3cc; Calm3; Lyn","liver","RR-9","GLDS-242"
"KEGG_MEDICUS_REFERENCE_BILE_ACID_BIOSYNTHESIS",0.231914893617021,0.569245647969052,0.130777137971974,-0.41767210106557,-1.18787172306886,15,"kegg","Cyp39a1; Akr1d1","liver","RR-9","GLDS-242"
"KEGG_MEDICUS_REFERENCE_BMP_SIGNALING_PATHWAY",0.438756855575868,0.703565365025467,0.0813027345384498,0.36572642713777,1.01155128456163,16,"kegg","Smad1; Bmp4; Bmp7; Bmp5; Bmpr1b","liver","RR-9","GLDS-242"
"KEGG_MEDICUS_REFERENCE_BRANCHING_MICROTUBULE_NUCLEATION",0.267734553775744,0.59293407652655,0.12563992130984,-0.341055707569367,-1.13395147330722,28,"kegg","Tubb4b; Haus7; Tuba4a; Tuba1c; Tubgcp2; Tuba8; Tubb5; Haus6","liver","RR-9","GLDS-242"
"KEGG_MEDICUS_REFERENCE_CA2_CAM_CAMK_SIGNALING_PATHWAY",0.135714285714286,0.486645124951828,0.159646701919906,0.463598536828476,1.32492876540351,18,"kegg","Camk2b; Calm2; Camk2d; Mylk4; Camk2a; Camkk1; Mylk2; Camkk2; Camk2g; Calm3; Camk4; Phkg1; Mylk","liver","RR-9","GLDS-242"
"KEGG_MEDICUS_REFERENCE_CA2_ENTRY_VOLTAGE_GATED_CA2_CHANNEL",0.0517857142857143,0.266802964477383,0.266350657088526,0.529626222034856,1.51363078340688,18,"kegg","Cacna1s; Cacna1h; Cacng7; Cacna1e; Cacng1; Cacnb3; Cacna1a","liver","RR-9","GLDS-242"
"KEGG_MEDICUS_REFERENCE_CA2_PYK2_RAS_ERK_SIGNALING_PATHWAY",0.508510638297872,0.722620380739082,0.0815265143256594,-0.332547654720788,-0.945775297435242,15,"kegg","Map2k2; Grb2; Mapk3; Map2k1; Mapk1","liver","RR-9","GLDS-242"
"KEGG_MEDICUS_REFERENCE_CARDIAC_TYPE_VGCC_RYR_SIGNALING",0.0426734883094359,0.256040929856616,0.321775918075361,0.583611873814271,1.57123361720725,15,"kegg","Trdn; Casq1; Ryr2; Cacng7; Cacng1; Cacnb3; Casq2","liver","RR-9","GLDS-242"
"KEGG_MEDICUS_REFERENCE_CCR2_GNB_G_PI3K_NFKB_SIGNALING_PATHWAY",0.0455029752001555,0.259927797833935,0.321775918075361,0.474158622513204,1.49836996789741,28,"kegg","Ccr2; Gngt2; Gng2; Gngt1; Gnb4; Gng10; Pik3cd; Gng11; Nfkb1","liver","RR-9","GLDS-242"
"KEGG_MEDICUS_REFERENCE_CCR5_GNB_G_PLCB_G_PKC_SIGNALING_PATHWAY",0.00278541419908303,0.046280728230918,0.431707695803346,0.598090964584093,1.81737966116122,23,"kegg","Prkcb; Gngt2; Gng2; Plcb2; Gngt1; Gnb4; Ccl5; Gng10; Gng11; Ccr5; Plcb3; Plcb1","liver","RR-9","GLDS-242"
"KEGG_MEDICUS_REFERENCE_CCR_CXCR_GNB_G_PI3K_RAC_SIGNALING_PATHWAY",0.00414039287331054,0.0582555391202784,0.407017918923954,0.57662785890882,1.78361936428974,25,"kegg","Pik3r5; Gngt2; Gng2; Prex1; Gngt1; Gnb4; Gng10; Gng11","liver","RR-9","GLDS-242"
"KEGG_MEDICUS_REFERENCE_CD80_CD86_CTLA4_PP2A_SIGNALING_PATHWAY",0.55902004454343,0.73469387755102,0.0789209638180035,-0.303477229335114,-0.936292725276511,21,"kegg","Ppp2r5e; Ppp2r5a; Ppp2r2d; Ppp2r5c; Akt2; Ppp2ca; Ppp2r2a; Ppp2r5d; Ppp2r2b; Ppp2cb","liver","RR-9","GLDS-242"
"KEGG_MEDICUS_REFERENCE_COHESIN_DISSOCIATION_IN_ANAPHASE",0.837294332723949,0.921574239713775,0.0496901392724606,0.260984499218588,0.721848862553719,16,"kegg","Cdc20; Anapc1; Anapc10; Cdc27; Anapc13; Cdc23","liver","RR-9","GLDS-242"
"KEGG_MEDICUS_REFERENCE_COHESIN_DISSOCIATION_IN_PROPHASE",0.548446069469835,0.73126142595978,0.0697792517076235,0.332344859407951,0.919222250583834,16,"kegg","Cdk1; Aurkb; Sgo1; Plk1","liver","RR-9","GLDS-242"
"KEGG_MEDICUS_REFERENCE_CONDENSIN_LOADING",0.00839761356247348,0.0911791863854601,0.380730400722792,0.57810234738289,1.68887282735224,20,"kegg","Top2a; Ncapg2; Ncapg; Smc2; Ncapd3; Ncapd2; Kif4","liver","RR-9","GLDS-242"
"KEGG_MEDICUS_REFERENCE_COPI_VESICLE_FORMATION",0.000530290716287837,0.0104129813380157,0.477270815362862,-0.615656954185016,-1.93929949541805,23,"kegg","Tmed10; Copz1; Copg2; Arcn1; Kdelr2; Tmed9; Copz2; Tmed3; Arf1; Kdelr1; Tmed7; Tmed1; Copb2; Tmed4; Copa; Copg1; Cope","liver","RR-9","GLDS-242"
"KEGG_MEDICUS_REFERENCE_CORE_NER_REACTION",0.240274599542334,0.576659038901602,0.133554954557592,-0.350442371707092,-1.16516051450542,28,"kegg","Pold2; Pole3; Ercc1; Ercc5; Pole4; Gtf2h4; Gtf2h2; Pcna; Rpa2; Rpa1; Gtf2h3; Ercc4; Gtf2h5","liver","RR-9","GLDS-242"
"KEGG_MEDICUS_REFERENCE_CRHR_PKA_ACTH_SIGNALING_PATHWAY",0.361061946902655,0.649911504424779,0.0902635484340068,0.345819887431869,1.05939323997746,24,"kegg","Adcy7; Adcy4","liver","RR-9","GLDS-242"
"KEGG_MEDICUS_REFERENCE_CX3CR1_GNAI_AC_PKA_SIGNALING_PATHWAY",0.230347349177331,0.569245647969052,0.120433371642259,0.44098464478893,1.21970563461676,16,"kegg","Adcy7; Adcy4; Gnai1; Cx3cl1","liver","RR-9","GLDS-242"
"KEGG_MEDICUS_REFERENCE_CXCL12_CXCR4_PKC_ERK_SIGNALING_PATHAWAY",0.329203539823009,0.629274023024513,0.0956031492204301,0.386767745288161,1.11953216233003,19,"kegg","Plcg2; Prkcb; Plcb2; Gnaq; Plcb3; Plcb1; Braf","liver","RR-9","GLDS-242"
"KEGG_MEDICUS_REFERENCE_CXCR4_GNAQ_PLCB_G_CALCINEURIN_SIGNALING_PATHWAY",0.249097472924188,0.591264331336533,0.114266502484433,0.403345886498806,1.17833790299585,20,"kegg","Plcg2; Plcb2; Gnaq; Plcb3; Plcb1; Calm2; Ppp3cc","liver","RR-9","GLDS-242"
"KEGG_MEDICUS_REFERENCE_CXCR4_GNB_G_PLCB_PKC_SIGNALING_PATHWAY",0.053485869098079,0.268673202911281,0.321775918075361,0.4656145068011,1.47137004471264,28,"kegg","Prkcb; Gngt2; Gng2; Plcb2; Gngt1; Gnb4; Gng10; Gng11; Plcb3; Plcb1","liver","RR-9","GLDS-242"
"KEGG_MEDICUS_REFERENCE_CXCR4_GNB_G_RAC_SIGNALING_PATHWAY",0.0518783542039356,0.266802964477383,0.266350657088526,0.495332450413304,1.50513412540898,23,"kegg","Gngt2; Gng2; Rac2; Gngt1; Gnb4; Gng10; Gng11; Limk1","liver","RR-9","GLDS-242"
"KEGG_MEDICUS_REFERENCE_CXCR_GNB_G_ERK_SIGNALING_PATHWAY",0.198568872987478,0.551764025448236,0.129442887745046,0.404567033025667,1.2293312237353,23,"kegg","Gngt2; Gng2; Gngt1; Gnb4; Gng10; Gng11","liver","RR-9","GLDS-242"
"KEGG_MEDICUS_REFERENCE_CXCR_GNB_G_PI3K_AKT_SIGNALING_PATHWAY",0.0132548233367259,0.130927448104086,0.380730400722792,0.549343445260684,1.66603512071906,22,"kegg","Pik3r5; Gngt2; Gng2; Gngt1; Gnb4; Gng10; Gng11","liver","RR-9","GLDS-242"
"KEGG_MEDICUS_REFERENCE_CYTOKINE_JAK_STAT_SIGNALING_PATHWAY",0.0153933561754925,0.130927448104086,0.380730400722792,0.47946119361698,1.61677256703108,38,"kegg","Il6; Il2rg; Csf2rb2; Il2rb; Il12b; Stat2; Ifng; Epor; Il13ra1; Stat5a; Stat1; Jak2; Il5ra; Pim1; Il15; Stat4; Il2ra; Ifngr1","liver","RR-9","GLDS-242"
"KEGG_MEDICUS_REFERENCE_DEUBIQUITINATION_OF_H2AK119",0.967741935483871,0.967741935483871,0.0536769600638126,-0.183093850473769,-0.590188925106862,25,"kegg","Hcfc1; Pcgf2; Bap1; Phc1; Foxk1; Asxl1","liver","RR-9","GLDS-242"
"KEGG_MEDICUS_REFERENCE_DISASSEMBLY_OF_MCC",0.643884892086331,0.799305383279583,0.0611692626746689,0.310135683552673,0.865594823396186,17,"kegg","Cdc20; Trip13; Mad2l1; Anapc1; Anapc10; Cdc27; Bub1b; Cdc23","liver","RR-9","GLDS-242"
"KEGG_MEDICUS_REFERENCE_DNA_END_RESECTION_AND_RPA_LOADING",0.62410071942446,0.783754391835369,0.0626618230932491,0.315490321722873,0.880539724376914,17,"kegg","Mre11a; Dna2; Rbbp8; Rpa3; Blm; Bard1","liver","RR-9","GLDS-242"
"KEGG_MEDICUS_REFERENCE_DNA_REPLICATION_LICENSING",5.37704930226736e-05,0.00116144264928975,0.557332238758646,0.686979441359571,2.08747922689483,23,"kegg","Ccna2; Mcm5; Cdc6; Mcm6; Ccne1; Ticrr; Dbf4; Mcm4; Orc2; Cdk2; Mtbp; Orc5; Mcm2; Orc3; Mcm3; Orc1; Orc4","liver","RR-9","GLDS-242"
"KEGG_MEDICUS_REFERENCE_DNA_REPLICATION_TERMINATION",0.763110307414105,0.87212606561612,0.053457214108991,0.26716462933172,0.789080269356798,21,"kegg","Mcm5; Mcm6; Mcm4; Pif1; Gins2; Mcm2; Lrr1; Mcm3","liver","RR-9","GLDS-242"
"KEGG_MEDICUS_REFERENCE_DYNEIN_RECRUITMENT_TO_THE_KINETOCHORE",0.35676625659051,0.64757572624832,0.0905428948469474,0.335046503752606,1.07515526440216,30,"kegg","Cenpf; Kntc1; Bub1; Zwilch; Spdl1; Dynlrb1; Nde1; Dynlt1b; Dynlrb2","liver","RR-9","GLDS-242"
"KEGG_MEDICUS_REFERENCE_E2_ER_RAS_ERK_SIGNALING_PATHWAY",0.318284424379232,0.622560403181975,0.112843355675562,-0.350053049831133,-1.10265578629858,23,"kegg","Map2k2; Atf6b; Creb3l2; Creb3; Mapk3; Map2k1; Esr2; Mapk1","liver","RR-9","GLDS-242"
"KEGG_MEDICUS_REFERENCE_EGF_EGFR_ACTIN_SIGNALING_PATHWAY",0.964365256124722,0.967741935483871,0.0522693317499306,-0.18305135880588,-0.564752933778333,21,"kegg","Wasl; Arpc4; Wipf3; Arpc5l; Cttn; Actr2; Nck1; Egf; Actg1; Nck2","liver","RR-9","GLDS-242"
"KEGG_MEDICUS_REFERENCE_EGF_EGFR_PLCG_CALCINEURIN_SIGNALING_PATHWAY",0.421052631578947,0.697079094191008,0.0850427463764322,0.378502099669887,1.01902522869868,15,"kegg","Plcg2; Egfr; Calm2; Ppp3cc","liver","RR-9","GLDS-242"
"KEGG_MEDICUS_REFERENCE_EGF_EGFR_PLCG_ERK_SIGNALING_PATHWAY",0.199248120300752,0.551764025448236,0.132846300606183,0.46296285316208,1.24641535075748,15,"kegg","Ccnd1; Plcg2; Prkcb; Egfr","liver","RR-9","GLDS-242"
"KEGG_MEDICUS_REFERENCE_EGF_EGFR_RAS_ERK_SIGNALING_PATHWAY",0.872029250457038,0.922193595877806,0.0478299633114229,0.247522153139524,0.684613780648194,16,"kegg","Ccnd1; Egfr; Sos2; Braf","liver","RR-9","GLDS-242"
"KEGG_MEDICUS_REFERENCE_EGF_EGFR_RAS_PI3K_SIGNALING_PATHWAY",0.889097744360902,0.922193595877806,0.0482149710025564,0.25063228140838,0.674766713590746,15,"kegg","Pik3cd; Egfr; Sos2; Kras; Akt1","liver","RR-9","GLDS-242"
"KEGG_MEDICUS_REFERENCE_EGF_ERBB2_RAS_ERK_SIGNALING_PATHWAY",0.668131868131868,0.808703322552191,0.069119845655101,-0.300809748783705,-0.861093303415343,16,"kegg","Map2k2; Grb2; Mapk3; Map2k1; Mapk1","liver","RR-9","GLDS-242"
"KEGG_MEDICUS_REFERENCE_ELECTRON_TRANSFER_IN_COMPLEX_I",0.507246376811594,0.722620380739082,0.0886261133285098,-0.272115533106905,-0.967489130156815,38,"kegg","Ndufs2; Ndufb7; Ndufa2; Ndufs1; Ndufa9; Ndufa10; Ndufb10; Ndufv1; Ndufs3","liver","RR-9","GLDS-242"
"KEGG_MEDICUS_REFERENCE_ELECTRON_TRANSFER_IN_COMPLEX_IV",0.680851063829787,0.812507346890796,0.0665892104103933,-0.299049874528992,-0.850506626691148,15,"kegg","Cox6b2; Cox8a; Cox6a1","liver","RR-9","GLDS-242"
"KEGG_MEDICUS_REFERENCE_EREG_EGFR_RAS_ERK_SIGNALING_PATHWAY",0.517021276595745,0.724443926866193,0.0806388495950661,-0.329561243549236,-0.9372818563481,15,"kegg","Map2k2; Grb2; Mapk3; Map2k1; Mapk1","liver","RR-9","GLDS-242"
"KEGG_MEDICUS_REFERENCE_FANCONI_ANEMIA_PATHWAY",0.311504424778761,0.617599868350681,0.0988903007520636,0.39236423032657,1.13573166467434,19,"kegg","Topbp1; Fanca; Fanci; Fance; Fancd2; Ube2t; Fancl","liver","RR-9","GLDS-242"
"KEGG_MEDICUS_REFERENCE_FGF_FGFR_PI3K_SIGNALING_PATHWAY",0.851327433628319,0.921574239713775,0.0474483193656297,0.246993435241434,0.714943523615567,19,"kegg","Fgf2; Pik3cd; Fgf9; Fgfr3; Akt1; Fgf1; Fgfr1; Mtor; Fgf18","liver","RR-9","GLDS-242"
"KEGG_MEDICUS_REFERENCE_FGF_FGFR_RAS_ERK_SIGNALING_PATHWAY",0.81489841986456,0.91676072234763,0.0607719451853533,-0.242145389479126,-0.762750145909269,23,"kegg","Map2k2; Fgfr4; Grb2; Mapk3; Map2k1; Mapk1","liver","RR-9","GLDS-242"
"KEGG_MEDICUS_REFERENCE_FLT3LG_FLT3_RAS_ERK_SIGNALING_PATHWAY",0.740425531914894,0.859849004804393,0.0625237414724762,-0.284732575032961,-0.809787806404479,15,"kegg","Map2k2; Grb2; Mapk3; Map2k1; Mapk1","liver","RR-9","GLDS-242"
"KEGG_MEDICUS_REFERENCE_FLT3LG_FLT3_RAS_PI3K_SIGNALING_PATHWAY",0.584586466165414,0.747163767406682,0.0679922591544058,0.333186404816617,0.897023695941619,15,"kegg","Flt3l; Pik3cd; Flt3; Sos2; Kras; Akt1; Mtor","liver","RR-9","GLDS-242"
"KEGG_MEDICUS_REFERENCE_GENE_SILENCING_BY_METHYLATION_OF_H3K27_AND_UBIQUITINATION_OF_H2AK119",0.424019607843137,0.697079094191008,0.0999276973731092,-0.288944325726517,-1.01333069744173,36,"kegg","Ubb; Epop; Rbbp7; Pcgf2; Ctbp2; Rbbp4; Phc1","liver","RR-9","GLDS-242"
"KEGG_MEDICUS_REFERENCE_GF_RTK_PI3K_SIGNALING_PATHWAY",0.153973509933775,0.496392211129782,0.142901149386948,0.323941980211111,1.23103803671875,68,"kegg","Ntrk2; Csf1r; Efna5; Fgf2; Pdgfc; Pik3r3; Flt3l; Pik3cd; Ngfr; Egfr; Flt3; Erbb4; Kit; Vegfa; Fgf9; Csf1; Fgfr3; Ntf5; Hgf; Pdgfrb; Tek; Efna1; Pik3r1; Akt1; Kdr; Fgf1; Fgfr1; Erbb2; Ngf; Fgf18","liver","RR-9","GLDS-242"
"KEGG_MEDICUS_REFERENCE_GF_RTK_RAS_ERK_SIGNALING_PATHWAY",0.439542483660131,0.703565365025467,0.0753093764172773,0.259829809109458,1.00344585645493,74,"kegg","Ntrk2; Csf1r; Efna5; Fgf2; Pdgfc; Flt3l; Ngfr; Egfr; Flt3; Sos2; Erbb4; Kit; Braf; Vegfa; Fgf9; Csf1; Fgfr3; Ntf5; Hgf; Pdgfrb; Tek; Kras; Efna1; Kdr; Fgf1; Fgfr1; Erbb2; Ngf; Fgf18","liver","RR-9","GLDS-242"
"KEGG_MEDICUS_REFERENCE_GF_RTK_RAS_PI3K_SIGNALING_PATHWAY",0.183006535947712,0.534181240063593,0.128788713061714,0.309877153389304,1.19672545134171,74,"kegg","Ntrk2; Csf1r; Efna5; Fgf2; Pdgfc; Pik3r3; Flt3l; Pik3cd; Ngfr; Egfr; Flt3; Sos2; Erbb4; Kit; Vegfa; Fgf9; Csf1; Fgfr3; Ntf5; Hgf; Pdgfrb; Tek; Kras; Efna1; Pik3r1; Akt1; Kdr; Fgf1; Fgfr1; Erbb2; Ngf; Fgf18","liver","RR-9","GLDS-242"
"KEGG_MEDICUS_REFERENCE_GHRHR_PKA_GH_SIGNALING_PATHWAY",0.325581395348837,0.627906976744186,0.096887770327544,0.36031122438696,1.09485400994866,23,"kegg","Adcy7; Adcy4","liver","RR-9","GLDS-242"
"KEGG_MEDICUS_REFERENCE_GLOBAL_GENOME_NER",0.00431522512002062,0.0582555391202784,0.407017918923954,-0.582615750484104,-1.68913707017728,18,"kegg","Cetn2; Rad23a; Cul4a; Rad23b; Mnat1; Gtf2h4; Gtf2h2; Ddb1; Ccnh; Gtf2h3; Rbx1; Gtf2h5","liver","RR-9","GLDS-242"
"KEGG_MEDICUS_REFERENCE_GLYCOLYSIS",0.415162454873646,0.697079094191008,0.0835990603684159,0.356054149239806,1.04017944303356,20,"kegg","Eno3; Pklr; Pkm; Pfkp; Ldhb; Pgam2","liver","RR-9","GLDS-242"
"KEGG_MEDICUS_REFERENCE_GNRH_GNRHR_PLCB_PKC_SIGNALING_PATHWAY",0.480357142857143,0.721911196911197,0.0753093764172773,0.342329724049619,0.978351876925352,18,"kegg","Prkcb; Plcb2; Gnaq; Elk1; Plcb3; Plcb1","liver","RR-9","GLDS-242"
"KEGG_MEDICUS_REFERENCE_GPCR_PI3K_SIGNALING_PATHWAY",0.0154904142433163,0.130927448104086,0.380730400722792,0.516035944559618,1.63070484215896,28,"kegg","Lpar6; Pik3r5; Gngt2; Gng2; Gngt1; Gnb4; Gng10; Gng11; F2r; Lpar5","liver","RR-9","GLDS-242"
"KEGG_MEDICUS_REFERENCE_GPCR_PLCB_ITPR_SIGNALING_PATHWAY",0.219015280135823,0.569245647969052,0.118815039412263,0.359162338165819,1.19249689811092,35,"kegg","Plcb2; Gnaq; Gna14; Ptafr; Chrm3; Ptger3; F2r; Plcb3; Cysltr1; Adra1b; Plcb1; Gna15; Cysltr2; Ltb4r2; Adra1a; Ptger1","liver","RR-9","GLDS-242"
"KEGG_MEDICUS_REFERENCE_GPI_ANCHOR_BIOSYNTHESIS",0.281464530892448,0.59293407652655,0.122107920287081,-0.354480970758293,-1.13734178900166,24,"kegg","Pigg; Pgap1; Pigyl; Pigo; Pigk; Pigc; Pigl; Pigs; Pigb","liver","RR-9","GLDS-242"
"KEGG_MEDICUS_REFERENCE_HGF_MET_RAS_ERK_SIGNALING_PATHWAY",0.393617021276596,0.680170212765957,0.0959206777921745,-0.371248788283738,-1.05584245799697,15,"kegg","Map2k2; Grb2; Mapk3; Map2k1; Mapk1","liver","RR-9","GLDS-242"
"KEGG_MEDICUS_REFERENCE_HOMOLOGOUS_RECOMBINATION",0.570743405275779,0.73469387755102,0.0817515582532145,-0.270771777736329,-0.927232844380789,32,"kegg","Pold2; Pole3; Rfc2; Rad51c; Brca1; Pole4; Rfc1; Rfc5","liver","RR-9","GLDS-242"
"KEGG_MEDICUS_REFERENCE_HOMOLOGOUS_RECOMBINATION_IN_ICLR",0.81063829787234,0.916742787122647,0.0582216241124161,-0.264862549116112,-0.753276869085338,15,"kegg","Ubb; Mcm8; Brca1","liver","RR-9","GLDS-242"
"KEGG_MEDICUS_REFERENCE_IFN_RIPK1_3_SIGNALING_PATHWAY",0.219642857142857,0.569245647969052,0.122107920287081,0.428585688385786,1.22486475230763,18,"kegg","Stat2; Ifng; Stat5a; Stat1; Jak2; Irf9; Stat4; Ifngr1; Ripk3","liver","RR-9","GLDS-242"
"KEGG_MEDICUS_REFERENCE_IGF_IGF1R_RAS_ERK_SIGNALING_PATHWAY",0.140659340659341,0.48807431584233,0.175204047558551,-0.457354486098008,-1.30921583113032,16,"kegg","Map2k2; Grb2; Igf1r; Igf2; Mapk3; Map2k1; Mapk1","liver","RR-9","GLDS-242"
"KEGG_MEDICUS_REFERENCE_IL1_IL1R_JNK_SIGNALING_PATHWAY",0.601769911504425,0.760130414531905,0.0636424081651019,0.307926655162796,0.891319915616581,19,"kegg","Il1b; Il1r1; Map2k4; Il1a; Tab3; Tab1; Fos","liver","RR-9","GLDS-242"
"KEGG_MEDICUS_REFERENCE_IL1_IL1R_P38_SIGNALING_PATHWAY",0.881294964028777,0.922193595877806,0.0466015072985992,0.247229832741667,0.69002335029257,17,"kegg","Il1b; Il1r1; Il1a; Tab3; Tab1","liver","RR-9","GLDS-242"
