"pathway","pval","padj","log2err","ES","NES","size","db","leadingEdge_str","tissue","mission","glds"
"KEGG_MEDICUS_REFERENCE_IL2_FAMILY_TO_JAK_STAT_SIGNALING_PATHWAY",0.0469314079422383,0.259927797833935,0.282013350011725,0.529959356777975,1.54822750904797,20,"kegg","Il2rg; Il2rb; Il21r; Stat5a; Stat1; Il15; Il2ra; Il7r","liver","RR-9","GLDS-242"
"KEGG_MEDICUS_REFERENCE_IL6_FAMILY_TO_JAK_STAT_SIGNALING_PATHWAY",0.255813953488372,0.59293407652655,0.111918316325105,0.381442359394189,1.15906379951821,23,"kegg","Il6; Lifr; Il13ra1; Il13ra2; Stat1; Jak2","liver","RR-9","GLDS-242"
"KEGG_MEDICUS_REFERENCE_ITGA_B_FAK_CDC42_SIGNALING_PATHWAY",0.335714285714286,0.631687018744653,0.0949751525905595,0.354652144212816,1.10184159938262,26,"kegg","Itga4; Itgb7; Itga10; Itga2b; Itga8","liver","RR-9","GLDS-242"
"KEGG_MEDICUS_REFERENCE_ITGA_B_FAK_RAC_SIGNALING_PATHWAY",0.149384885764499,0.496392211129782,0.150169802128406,0.402365082515817,1.29117878214876,30,"kegg","Itga4; Itgb7; Rac2; Elmo1; Itga10; Itga2b; Itga8","liver","RR-9","GLDS-242"
"KEGG_MEDICUS_REFERENCE_ITGA_B_RHOGAP_RHOA_SIGNALING_PATHWAY",0.273703041144902,0.59293407652655,0.107554375265169,0.37343147980414,1.13472166680418,23,"kegg","Itga4; Itgb7; Itga10; Itga2b; Itga8","liver","RR-9","GLDS-242"
"KEGG_MEDICUS_REFERENCE_ITGA_B_RHOGEF_RHOA_SIGNALING_PATHWAY",0.262969588550984,0.59293407652655,0.110122263835536,0.37909390512381,1.15192770604935,23,"kegg","Itga4; Itgb7; Itga10; Itga2b; Itga8","liver","RR-9","GLDS-242"
"KEGG_MEDICUS_REFERENCE_ITGA_B_RHOG_RAC_SIGNALING_PATHWAY",0.0991150442477876,0.403940557689097,0.188204146308491,0.430580025260358,1.36065896093383,28,"kegg","Itga4; Itgb7; Rac2; Elmo1; Itga10; Itga2b; Itga8; Rhog","liver","RR-9","GLDS-242"
"KEGG_MEDICUS_REFERENCE_ITGA_B_TALIN_VINCULIN_SIGNALING_PATHWAY",0.539543057996485,0.728383128295255,0.0686325631836726,0.299268663161435,0.960345131391665,30,"kegg","Itga4; Itgb7; Itga10; Itga2b; Itga8","liver","RR-9","GLDS-242"
"KEGG_MEDICUS_REFERENCE_KEAP1_NRF2_SIGNALING_PATHWAY",0.00380459281526285,0.0582555391202784,0.431707695803346,-0.584550991829542,-1.76778011572981,20,"kegg","Nqo1; Gstt2; Gstm4; Mgst3; Txnrd1; Gsta3; Keap1; Gsto1","liver","RR-9","GLDS-242"
"KEGG_MEDICUS_REFERENCE_KINETOCHORE_FIBER_ORGANIZATION",0.160183066361556,0.496991150442478,0.166933848713193,-0.434206434832481,-1.27871163733567,19,"kegg","Tubb4b; Tuba4a; Tuba1c; Cltb; Tuba8; Tubb5","liver","RR-9","GLDS-242"
"KEGG_MEDICUS_REFERENCE_KINETOCHORE_MICROTUBULE_ATTACHMENT",0.226691042047532,0.569245647969052,0.121543282035469,0.444191043396465,1.22857411222625,16,"kegg","Cenpf; Cenpe; Tubb2b; Bub1b; Tuba1b; Tuba1a","liver","RR-9","GLDS-242"
"KEGG_MEDICUS_REFERENCE_KITLG_KIT_RAS_ERK_SIGNALING_PATHWAY",0.485106382978723,0.721911196911197,0.0840745577910723,-0.340293838044353,-0.967805670324157,15,"kegg","Map2k2; Grb2; Mapk3; Map2k1; Mapk1","liver","RR-9","GLDS-242"
"KEGG_MEDICUS_REFERENCE_LONG_PATCH_BER",0.29372197309417,0.59293407652655,0.11776578836269,-0.391983591717177,-1.13102035339449,17,"kegg","Pold2; Pole3; Rfc2; Pole4; Rfc1; Rfc5","liver","RR-9","GLDS-242"
"KEGG_MEDICUS_REFERENCE_LPAR_GNB_G_RHO_SIGNALING_PATHWAY",0.0831858407079646,0.359362831858407,0.206587922696891,0.493097276112449,1.42731204059926,19,"kegg","Gngt2; Gng2; Gngt1; Gnb4; Gng10; Gng11; Lpar5","liver","RR-9","GLDS-242"
"KEGG_MEDICUS_REFERENCE_MACHR_CA2_APOPTOTIC_PATHWAY",0.185714285714286,0.534857142857143,0.134273452883202,0.442380345507362,1.26428881553762,18,"kegg","Slc25a31; Slc25a4; Plcb2; Gnaq; Chrm3; Plcb3; Plcb1; Cycs","liver","RR-9","GLDS-242"
"KEGG_MEDICUS_REFERENCE_MGLUR5_CA2_APOPTOTIC_PATHWAY",0.415162454873646,0.697079094191008,0.0835990603684159,0.35462431864915,1.03600232449528,20,"kegg","Slc25a31; Slc25a4; Plcb2; Gnaq; Plcb3; Plcb1; Cycs","liver","RR-9","GLDS-242"
"KEGG_MEDICUS_REFERENCE_MICROTUBULE_DEPOLYMERIZATION",0.558352402745995,0.73469387755102,0.080419996876154,-0.315504681253227,-0.929142166462899,19,"kegg","Tubb4b; Mapre1; Tuba4a; Tuba1c; Tuba8; Tubb5","liver","RR-9","GLDS-242"
"KEGG_MEDICUS_REFERENCE_MICROTUBULE_DEPOLYMERIZATION_AT_THE_MINUS_ENDS",0.389010989010989,0.677632045373981,0.0985499803531691,-0.365518516163008,-1.04632761343315,16,"kegg","Tubb4b; Tuba4a; Tuba1c; Tuba8; Tubb5","liver","RR-9","GLDS-242"
"KEGG_MEDICUS_REFERENCE_MICROTUBULE_NUCLEATION",0.532731376975169,0.728290996371117,0.0822054920415869,-0.301616372271003,-0.950081818419936,23,"kegg","Tubb4b; Tuba4a; Tuba1c; Tubgcp2; Tuba8; Tubb5","liver","RR-9","GLDS-242"
"KEGG_MEDICUS_REFERENCE_MICROTUBULE_RHOA_SIGNALING_PATHWAY",0.0367440807712426,0.226763469902526,0.321775918075361,-0.518802876315152,-1.49694177233676,17,"kegg","Tubb4b; Tuba4a; Rhoa; Tuba1c; Tuba8; Tubb5","liver","RR-9","GLDS-242"
"KEGG_MEDICUS_REFERENCE_MISMATCH_REPAIR",0.569642857142857,0.73469387755102,0.0667426134241917,0.297890025209451,0.925491716807305,26,"kegg","Exo1; Pole2; Pole; Rfc3; Rpa3; Lig1; Pms2; Mlh3; Mlh1","liver","RR-9","GLDS-242"
"KEGG_MEDICUS_REFERENCE_MITOCHONDRIAL_COMPLEX_UCP1_IN_THERMOGENESIS",0.00844251725791298,0.0911791863854601,0.380730400722792,-0.396151099049655,-1.54278009950399,60,"kegg","Ndufs2; Atp5d; Ndufb7; Sdhc; Cox8a; Sdhd; Ndufaf3; Uqcrfs1; Cox20; Ndufa2; Uqcrq; Ndufaf1; Ndufs1; Ndufa9; Ndufa10; Ndufaf6; Cyc1; Cox11; Ndufb10; Ndufv1; Ndufs3","liver","RR-9","GLDS-242"
"KEGG_MEDICUS_REFERENCE_NUCLEAR_EXPORT_OF_MRNA",0.842956120092379,0.921574239713775,0.0602484086158019,-0.225162839109238,-0.760786765504889,30,"kegg","Alyref; Seh1l","liver","RR-9","GLDS-242"
"KEGG_MEDICUS_REFERENCE_N_GLYCAN_BIOSYNTHESIS",0.640425531914894,0.799305383279583,0.0696133438850965,-0.309401714150107,-0.879947562622214,15,"kegg","St6gal1; Man1a; Man1b1; Mogs; B4galt3; Man2a1","liver","RR-9","GLDS-242"
"KEGG_MEDICUS_REFERENCE_ORGANIZATION_OF_THE_INNER_KINETOCHORE",0.0283929637718771,0.185844853779559,0.352487857583619,0.561043209816375,1.56588268900749,17,"kegg","Cenpi; Cenpa; Cenpc1; Cenph; Cenpu; Cenpn; Cenpk","liver","RR-9","GLDS-242"
"KEGG_MEDICUS_REFERENCE_ORGANIZATION_OF_THE_OUTER_KINETOCHORE",0.0144312673547526,0.130927448104086,0.380730400722792,0.575479409268719,1.66577413779685,19,"kegg","Nuf2; Birc5; Ndc80; Spc25; Cenpc1; Cdca8; Aurkb; Incenp","liver","RR-9","GLDS-242"
"KEGG_MEDICUS_REFERENCE_ORIGIN_UNWINDING_AND_ELONGATION",0.471001757469244,0.717029449423816,0.0755015292281669,0.312764670498375,1.00365345777084,30,"kegg","Mcm5; Mcm6; Pole2; Pole; Mcm4; Rfc3; Gins2; Rpa3; Mcm2; Mcm3; Pola2; Mcm10; Pola1","liver","RR-9","GLDS-242"
"KEGG_MEDICUS_REFERENCE_P300_P21_CELL_CYCLE_G1_S",0.135338345864662,0.486645124951828,0.16440575583821,0.494583439827033,1.33154612172531,15,"kegg","Ccnd1; E2f3; Rb1; Cdkn1a; E2f1; Cdk6; Cdk4; Ccnd2; E2f2; Trp53; Ep300","liver","RR-9","GLDS-242"
"KEGG_MEDICUS_REFERENCE_P4_PR_RAS_ERK_SIGNALING_PATHWAY",0.892307692307692,0.922193595877806,0.0552495663125249,-0.238051275419021,-0.681441874678712,16,"kegg","Map2k2; Grb2; Mapk3; Map2k1; Mapk1","liver","RR-9","GLDS-242"
"KEGG_MEDICUS_REFERENCE_PDGF_PDGFR_PLCG_CAMK_SIGNALING_PATHWAY",0.219378427787934,0.569245647969052,0.12384217120105,0.447326554577324,1.23724652451972,16,"kegg","Plcg2; Camk2b; Calm2; Camk2d; Camk2a; Pdgfrb; Camk2g; Calm3","liver","RR-9","GLDS-242"
"KEGG_MEDICUS_REFERENCE_PDGF_PDGFR_RAS_ERK_SIGNALING_PATHWAY",0.311659192825112,0.617599868350681,0.11378726182188,-0.387680873489514,-1.11860539013266,17,"kegg","Map2k2; Grb2; Pdgfa; Mapk3; Map2k1; Mapk1","liver","RR-9","GLDS-242"
"KEGG_MEDICUS_REFERENCE_PP2A_AKT_SIGNALING_PATHWAY",0.0221704023334589,0.165131272552659,0.352487857583619,-0.516897912114074,-1.49860594074849,18,"kegg","Ppp2r5e; Ppp2r5a; Ppp2r2d; Ppp2r5c; Akt2; Ppp2ca; Ppp2r2a; Ppp2r5d; Ppp2r2b; Ppp2cb","liver","RR-9","GLDS-242"
"KEGG_MEDICUS_REFERENCE_PRE_IC_FORMATION",0.00564439507260015,0.0677327408712018,0.407017918923954,0.547900933037127,1.708708130162,27,"kegg","Mcm5; Cdc6; Mcm6; Topbp1; Ticrr; Pole2; Pole; Mcm4; Orc2; Gins2; Mtbp; Orc5; Mcm2; Orc3; Mcm3; Orc1; Orc4","liver","RR-9","GLDS-242"
"KEGG_MEDICUS_REFERENCE_PRNP_PI3K_NOX2_SIGNALING_PATHWAY",0.0509666080843585,0.266802964477383,0.266350657088526,0.465133335329599,1.47684206882792,29,"kegg","Ncf2; Prkcd; Cybb; Ncf1; Rac2; Cyba; Fyn; Pik3cd; Cav1; Ncf4; Cav3; Creb3l4; Cav2; Egr1; Prnp","liver","RR-9","GLDS-242"
"KEGG_MEDICUS_REFERENCE_PROMOTION_OF_MICROTUBULE_GROWTH",0.171945701357466,0.515837104072398,0.159646701919906,-0.424575882570379,-1.23094314178248,18,"kegg","Tubb4b; Mapre1; Tuba4a; Tuba1c; Tuba8; Tubb5","liver","RR-9","GLDS-242"
"KEGG_MEDICUS_REFERENCE_RAB7_REGULATED_MICROTUBULE_MINUS_END_DIRECTED_TRANSPORT",0.0157597854199362,0.130927448104086,0.352487857583619,-0.418073473076258,-1.50004594129862,39,"kegg","Tubb4b; Osbpl1a; Tuba4a; Actr10; Dctn2; Rab7; Tuba1c; Dctn3; Dynll2; Tuba8; Actr1b; Tubb5","liver","RR-9","GLDS-242"
"KEGG_MEDICUS_REFERENCE_REGULATION_OF_GF_RTK_RAS_ERK_SIGNALING_PTP",0.886725663716814,0.922193595877806,0.0455878202571231,0.234253119347724,0.67806559474219,19,"kegg","Dusp1; Dusp7; Ptpn7; Dusp6","liver","RR-9","GLDS-242"
"KEGG_MEDICUS_REFERENCE_REGULATION_OF_GF_RTK_RAS_ERK_SIGNALING_UBIQUITINATION_OF_RTK_BY_CBL",0.279929577464789,0.59293407652655,0.105125131597001,0.369011840806938,1.14142363180467,25,"kegg","Ntrk2; Csf1r; Cbl; Ngfr; Egfr; Flt3; Erbb4; Kit; Fgfr3; Pdgfrb; Tek; Kdr; Fgfr1; Erbb2","liver","RR-9","GLDS-242"
"KEGG_MEDICUS_REFERENCE_RELN_VLDLR_PI3K_SIGNALING_PATHWAY",0.25531914893617,0.59293407652655,0.12384217120105,-0.406442061232301,-1.15593315994041,15,"kegg","Rheb; Dab1; Rps6kb2; Pik3ca; Vldlr; Akt2","liver","RR-9","GLDS-242"
"KEGG_MEDICUS_REFERENCE_RETROGRADE_AXONAL_TRANSPORT",0.152173913043478,0.496392211129782,0.176694268938498,-0.353824116704959,-1.25799870000401,38,"kegg","Tubb4b; Tuba4a; Actr10; Dctn2; Tuba1c; Dctn3; Tuba8; Dnali1; Actr1b; Tubb5; Dnah7b; Dnah11","liver","RR-9","GLDS-242"
"KEGG_MEDICUS_REFERENCE_RTK_PLCG_ITPR_SIGNALING_PATHWAY",0.34192439862543,0.636686811233559,0.0916795246008379,0.314202503085202,1.07414548860279,42,"kegg","Plcg2; Ntrk2; Fgf2; Pdgfc; Egfr; Erbb4; Ntrk3; Vegfa; Fgf9; Fgfr3; Hgf; Pdgfrb; Kdr; Fgf1; Fgfr1; Erbb2; Ngf; Fgf18","liver","RR-9","GLDS-242"
"KEGG_MEDICUS_REFERENCE_SKELETAL_TYPE_VGCC_RYR_SIGNALING",0.0147640178687553,0.130927448104086,0.380730400722792,0.635224564674442,1.71018828655627,15,"kegg","Trdn; Ryr1; Cacna1s; Casq1; Cacng7; Cacng1; Cacnb3","liver","RR-9","GLDS-242"
"KEGG_MEDICUS_REFERENCE_SPINDLE_ASSEMBLY_CHECKPOINT_SIGNALING",0.51985559566787,0.724443926866193,0.0718276293603809,0.325900567121298,0.952088526748881,20,"kegg","Cdc20; Mad2l1; Mad1l1; Anapc1; Anapc10; Cdc27; Bub1b; Anapc13; Cdc23","liver","RR-9","GLDS-242"
"KEGG_MEDICUS_REFERENCE_TCR_PLCG_ITPR_SIGNALING_PATHWAY",0.0268763121836942,0.183362317693316,0.352487857583619,0.54987176713887,1.59165063780219,19,"kegg","Plcg2; Lcp2; Cd4; Grap2; Cd247; Fyn; Cd3d; Vav1; Vav3; Zap70; Cd3g; Lck; Cd3e; Lat; Itpr1","liver","RR-9","GLDS-242"
"KEGG_MEDICUS_REFERENCE_TELOMERE_ELONGATION",0.942857142857143,0.951668891855808,0.0431901998334182,0.211469359869983,0.6043630763159,18,"kegg","Ten1; Ctc1; Tert; Rtel1; Stn1; Terf2; Nop10","liver","RR-9","GLDS-242"
"KEGG_MEDICUS_REFERENCE_TGFA_EGFR_RAS_ERK_SIGNALING_PATHWAY",0.506382978723404,0.722620380739082,0.0817515582532145,-0.334769632978865,-0.952094668863954,15,"kegg","Map2k2; Grb2; Mapk3; Map2k1; Mapk1","liver","RR-9","GLDS-242"
"KEGG_MEDICUS_REFERENCE_TIGHT_JUNCTION_ACTIN_SIGNALING_PATHWAY",0.528868360277136,0.728290996371117,0.0838361057159929,-0.279478342941125,-0.944309573444713,30,"kegg","Cldn3; Ocln; Tjp1; Cldn8; Arpc4","liver","RR-9","GLDS-242"
"KEGG_MEDICUS_REFERENCE_TLR1_2_4_NFKB_SIGNALING_PATHWAY",0.101083032490975,0.404332129963899,0.188204146308491,0.472217899306245,1.37954115277007,20,"kegg","Tlr1; Il6; Il12b; Tlr4; Nfkb1; Tlr2","liver","RR-9","GLDS-242"
"KEGG_MEDICUS_REFERENCE_TLR2_4_MAPK_SIGNALING_PATHWAY",0.719457013574661,0.84457997245721,0.0668966276500666,-0.253446913936919,-0.832851515506916,26,"kegg","Map2k2; Map2k3; Map3k7; Mapk9; Mapk3; Mapk14; Map2k1; Mapk1","liver","RR-9","GLDS-242"
"KEGG_MEDICUS_REFERENCE_TLR5_NFKB_SIGNALING_PATHWAY",0.384892086330935,0.675908054044569,0.0875697115548511,0.376857501929524,1.05181673740813,17,"kegg","Il6; Il12b; Tlr5; Nfkb1","liver","RR-9","GLDS-242"
"KEGG_MEDICUS_REFERENCE_TNF_JNK_SIGNALING_PATHWAY",0.731868131868132,0.854505494505495,0.0646484568421928,-0.284128190818592,-0.813340935307679,16,"kegg","Map3k7; Mapk9; Tradd; Tnfrsf1a; Ripk1; Mapk8; Jun; Map2k7","liver","RR-9","GLDS-242"
"KEGG_MEDICUS_REFERENCE_TNF_NFKB_SIGNALING_PATHWAY",0.538461538461538,0.728383128295255,0.0802023444698144,-0.327117648332068,-0.936401887062038,16,"kegg","Ikbkg; Map3k7; Chuk; Tradd; Tnfrsf1a; Ripk1","liver","RR-9","GLDS-242"
"KEGG_MEDICUS_REFERENCE_TNF_P38_SIGNALING_PATHWAY",0.0464457477219307,0.259927797833935,0.321775918075361,-0.469430343463099,-1.50615347702269,24,"kegg","Rps6ka4; Map2k3; Atf6b; Map3k7; Creb3l2; Creb3; Mapk14; Tradd; Tnfrsf1a; Ripk1; Map2k6","liver","RR-9","GLDS-242"
"KEGG_MEDICUS_REFERENCE_TRAIP_DEPENDENT_REPLISOME_DISASSEMBLY",0.648994515539305,0.801044659179942,0.0615706755421678,0.306885516503896,0.848805050437151,16,"kegg","Mcm5; Mcm6; Traip; Mcm4; Gins2; Mcm2","liver","RR-9","GLDS-242"
"KEGG_MEDICUS_REFERENCE_TRANSCRIPTION_COUPLED_NER",0.108545034642032,0.418673705047839,0.206587922696891,-0.402216461155765,-1.34986480795513,29,"kegg","Polr2c; Cul4a; Polr2e; Mnat1; Gtf2h4; Polr2a; Gtf2h2; Ddb1; Ccnh; Gtf2h3; Polr2b; Rbx1; Gtf2h5; Polr2g; Gtf2h1","liver","RR-9","GLDS-242"
"KEGG_MEDICUS_REFERENCE_TRANSLATION_INITIATION",1.06805028594059e-09,2.56332068625742e-08,0.788186810800237,0.603096151442849,2.33963425539061,78,"kegg","Rpsa; Rpl30; Rps6; Rpl17; Rps10; Rpl10; Rps24; Rpl38; Rpl35; Rps4x; Rps15; Rpl7a; Rpl35a; Rpl15; Rpl31; Rpl12; Rpl26; Rpl32; Rps29; Rps23; Rps7; Rpl6; Rps21; Rps3; Rps12; Rps15a; Rpl27a; Rps27; Rpl34; Rps3a1; Rps16; Rps8; Rps17; Rps14; Rps25; Rpl10a; Rpl23a; Uba52; Rpl37a; Rpl9; Rps13; Rplp1; Rpl5; Rps11; Rps27a; Rpl39; Rps26; Rps28; Rpl22; Rps2; Rps19; Rplp0; Rpl29; Rpl3; Rpl36a; Rpl13; Rpl14; Rpl13a","liver","RR-9","GLDS-242"
"KEGG_MEDICUS_REFERENCE_TSH_TG_SIGNALING_PATHWAY",0.494642857142857,0.721911196911197,0.0738052724171275,0.312952024641535,0.972286689895609,26,"kegg","Adcy7; Adcy4; Creb3l4; Ttf1; Ttf2","liver","RR-9","GLDS-242"
"KEGG_MEDICUS_REFERENCE_VGCC_CA2_APOPTOTIC_PATHWAY",0.137432188065099,0.486645124951828,0.159646701919906,0.442818639998524,1.30788065995217,21,"kegg","Cacna1s; Slc25a31; Slc25a4; Cacna1h; Cacna1e; Cycs; Apaf1; Cacna1a","liver","RR-9","GLDS-242"
"KEGG_MEDICUS_REFERENCE_WNT5A_ROR_SIGNALING_PATHWAY",0.915413533834586,0.937105797669529,0.0468819856878333,0.238402877416398,0.64184200535096,15,"kegg","Fzd3; Ror1; Fzd7; Wnt5a; Dvl1; Fzd2; Fzd6","liver","RR-9","GLDS-242"
"KEGG_MEDICUS_REFERENCE_WNT_SIGNALING_MODULATION_LGR_RSPO",0.850549450549451,0.921574239713775,0.0574877409561325,-0.260827046440512,-0.746639442197804,16,"kegg","Znrf3; Fzd1; Fzd4; Lgr4; Fzd9","liver","RR-9","GLDS-242"
"KEGG_MEDICUS_REFERENCE_WNT_SIGNALING_MODULATION_WNT_INHIBITOR",0.699640287769784,0.830342319550953,0.0572461135202884,0.297479449686239,0.830271024493127,17,"kegg","Wnt2b; Sfrp1; Wnt7b; Wif1; Wnt5a","liver","RR-9","GLDS-242"
"KEGG_MEDICUS_REFERENCE_WNT_SIGNALING_PATHWAY",0.471380471380471,0.717029449423816,0.0732558655828455,0.300060739778782,1.0017114153448,36,"kegg","Ccnd1; Wnt2b; Fzd3; Tcf7; Axin2; Peg12; Wnt7b; Fzd7; Lef1; Wnt5a; Dvl1","liver","RR-9","GLDS-242"
"KEGG_MEDICUS_VARIANT_AMPLIFIED_FGFR_TO_RAS_ERK_SIGNALING_PATHWAY",0.285106382978723,0.59293407652655,0.116234148779716,-0.396626957568788,-1.12801871683748,15,"kegg","Map2k2; Grb2; Mapk3; Map2k1; Mapk1; Fgfr2; Hras; Nras","liver","RR-9","GLDS-242"
"KEGG_MEDICUS_VARIANT_AMPLIFIED_MYC_TO_P27_CELL_CYCLE_G1_S",0.133458646616541,0.486645124951828,0.165656695205483,0.496314241240952,1.33620588532553,15,"kegg","E2f3; Ccne1; Cdk2; Rb1; Cks1b; Skp2; E2f1","liver","RR-9","GLDS-242"
"KEGG_MEDICUS_VARIANT_CYP11B1_CYP11B2_FUSION_TO_ACTH_CORTISOL_SIGNALING_PATHWAY",0.468805704099822,0.717029449423816,0.0764767053228531,0.317634203298846,0.990588102461743,27,"kegg","Adcy7; Adcy4; Nr4a1","liver","RR-9","GLDS-242"
"KEGG_MEDICUS_VARIANT_EGF_OVEREXPRESSION_TO_RAS_ERK_SIGNALING_PATHWAY",0.561702127659575,0.73469387755102,0.0762797180809272,-0.323668296050812,-0.920522140578126,15,"kegg","Map2k2; Grb2; Mapk3; Map2k1; Mapk1","liver","RR-9","GLDS-242"
"KEGG_MEDICUS_VARIANT_FZD7_OVEREXPRESSION_TO_WNT_SIGNALING_PATHWAY",0.161061946902655,0.496991150442478,0.144630528034484,0.401364774414121,1.26833699863233,28,"kegg","Ccnd1; Wnt2b; Tcf7; Axin2; Peg12; Wnt7b; Fzd7; Lef1; Wnt5a; Dvl1","liver","RR-9","GLDS-242"
"KEGG_MEDICUS_VARIANT_IGF2_OVEREXPRESSION_TO_RAS_ERK_SIGNALING_PATHWAY",0.125531914893617,0.475699888017917,0.183023938384487,-0.476000078269016,-1.35375820341317,15,"kegg","Map2k2; Grb2; Igf1r; Igf2; Mapk3; Map2k1; Mapk1","liver","RR-9","GLDS-242"
"KEGG_MEDICUS_VARIANT_LRP6_OVEREXPRESSION_TO_WNT_SIGNALING_PATHWAY",0.439728353140917,0.703565365025467,0.077274697304471,0.30872329952372,1.02502834494477,35,"kegg","Ccnd1; Wnt2b; Fzd3; Tcf7; Axin2; Peg12; Wnt7b; Fzd7; Lef1; Wnt5a; Dvl1","liver","RR-9","GLDS-242"
"KEGG_MEDICUS_VARIANT_MLL_AF4_FUSION_TO_TRANSCRIPTIONAL_ACTIVATION",0.346902654867257,0.637778970779968,0.0925528864684773,0.349421981918915,1.0704279857744,24,"kegg","Lmo2; Smad1; Cdk14; Flt3; Mef2c; Jmjd1c; Bmp2k; Ccnt2; Dot1l","liver","RR-9","GLDS-242"
"KEGG_MEDICUS_VARIANT_MUTATION_ACTIVATED_CACNA1D_H_TO_ANGIOTENSIN_ALDOSTERONE_SIGNALING_PATHWAY",0.670175438596491,0.808703322552191,0.0580983576873206,0.27980365473719,0.848581556254844,22,"kegg","Cacna1h; Camk2b; Calm2; Camk2d; Camk2a; Creb3l4; Camk2g; Calm3","liver","RR-9","GLDS-242"
"KEGG_MEDICUS_VARIANT_MUTATION_ACTIVATED_EGFR_TO_RAS_ERK_SIGNALING_PATHWAY",0.868421052631579,0.922193595877806,0.0492917662312669,0.259214365642214,0.697871896776578,15,"kegg","Ccnd1; Egfr; Sos2; Braf","liver","RR-9","GLDS-242"
"KEGG_MEDICUS_VARIANT_MUTATION_ACTIVATED_FGFR3_TO_RAS_ERK_SIGNALING_PATHWAY",0.417582417582418,0.697079094191008,0.0943563635421779,-0.357456800147461,-1.02325027068381,16,"kegg","Map2k2; Grb2; Mapk3; Map2k1; Mapk1","liver","RR-9","GLDS-242"
"KEGG_MEDICUS_VARIANT_MUTATION_ACTIVATED_GNAS_TO_ACTH_CORTISOL_SIGNALING_PATHWAY",0.464285714285714,0.717029449423816,0.0770736734944102,0.320898670603791,0.99697551594575,26,"kegg","Adcy7; Adcy4; Nr4a1","liver","RR-9","GLDS-242"
"KEGG_MEDICUS_VARIANT_MUTATION_ACTIVATED_GNAS_TO_CRHR_PKA_ACTH_SIGNALING_PATHWAY",0.336314847942755,0.631687018744653,0.0949751525905595,0.357059363480814,1.08497279417764,23,"kegg","Adcy7; Adcy4","liver","RR-9","GLDS-242"
"KEGG_MEDICUS_VARIANT_MUTATION_ACTIVATED_KCNJ5_TO_ANGIOTENSIN_ALDOSTERONE_SIGNALING_PATHWAY",0.715563506261181,0.84457997245721,0.0559428593065705,0.270656833057694,0.822427110055768,23,"kegg","Cacna1h; Camk2b; Calm2; Camk2d; Camk2a; Creb3l4; Camk2g; Calm3","liver","RR-9","GLDS-242"
"KEGG_MEDICUS_VARIANT_MUTATION_ACTIVATED_MET_TO_RAS_ERK_SIGNALING_PATHWAY",0.74468085106383,0.86016611673683,0.062249042949858,-0.283932474888704,-0.807512298094106,15,"kegg","Map2k2; Grb2; Mapk3; Map2k1; Mapk1","liver","RR-9","GLDS-242"
"KEGG_MEDICUS_VARIANT_MUTATION_ACTIVATED_PRKACA_TO_ACTH_CORTISOL_SIGNALING_PATHWAY",0.519148936170213,0.724443926866193,0.080419996876154,-0.329093103235025,-0.935950451544521,15,"kegg","Pbx1; Atf6b; Creb3l2; Creb3","liver","RR-9","GLDS-242"
"KEGG_MEDICUS_VARIANT_MUTATION_ACTIVATED_SMO_TO_HEDGEHOG_SIGNALING_PATHWAY",0.492779783393502,0.721911196911197,0.0745500777420554,0.33241966059681,0.97113345863612,20,"kegg","Bmp4; Wnt2b; Smo; Wnt7b; Wnt5a; Kif7","liver","RR-9","GLDS-242"
"KEGG_MEDICUS_VARIANT_MUTATION_CAUSED_ABBERANT_ATXN2_3_TO_MGLUR5_CA2_APOPTOTIC_PATHWAY",0.230347349177331,0.569245647969052,0.120433371642259,0.440165050348291,1.21743874399106,16,"kegg","Slc25a31; Slc25a4; Plcb2; Gnaq; Plcb3; Plcb1; Cycs","liver","RR-9","GLDS-242"
"KEGG_MEDICUS_VARIANT_MUTATION_CAUSED_ABERRANT_ABETA_TO_26S_PROTEASOME_MEDIATED_PROTEIN_DEGRADATION",3.49615477612835e-20,1.41272968240552e-18,1.16017957183021,-0.878666004006783,-3.08149063810053,36,"kegg","Psmd11; Psmd1; Psmc4; Psmc2; Psmd2; Adrm1; Psma1; Psmc5; Psmc1; Psmd3; Psma4; Psmb7; Psmd7; Psmb3; Psmd12; Psmb6; Psmd13; Psmb5; Psmb4; Psmc3; Psmd6; Psmd14; Psmd9; Psmd4; Psmd8; Psma7; Psmb2; Psma2; Psmb1","liver","RR-9","GLDS-242"
"KEGG_MEDICUS_VARIANT_MUTATION_CAUSED_ABERRANT_ABETA_TO_AGE_RAGE_SIGNALING_PATHWAY",0.928057553956835,0.941325080528011,0.0442407423477375,0.223927629853246,0.624986441405176,17,"kegg","Il6; Nfkb1; Braf; Ager; Kras","liver","RR-9","GLDS-242"
"KEGG_MEDICUS_VARIANT_MUTATION_CAUSED_ABERRANT_ABETA_TO_ANTEROGRADE_AXONAL_TRANSPORT",0.292410714285714,0.59293407652655,0.11776578836269,-0.374864505732195,-1.13365305779773,20,"kegg","Tubb4b; Tuba4a; Tuba1c; Tuba8; Tubb5","liver","RR-9","GLDS-242"
"KEGG_MEDICUS_VARIANT_MUTATION_CAUSED_ABERRANT_ABETA_TO_ELECTRON_TRANSFER_IN_COMPLEX_I",0.832917705735661,0.921574239713775,0.0645031249656493,-0.21357292898457,-0.784381993182585,45,"kegg","Ndufs2; Ndufb7; Ndufa2; Ndufs1; Ndufa9; Ndufa10; Ndufb10; Ndufv1; Ndufs3","liver","RR-9","GLDS-242"
"KEGG_MEDICUS_VARIANT_MUTATION_CAUSED_ABERRANT_ABETA_TO_ELECTRON_TRANSFER_IN_COMPLEX_IV",0.749450549450549,0.861070844049568,0.0635007968065945,-0.281057148531242,-0.804549817470457,16,"kegg","Cox6b2; Cox8a; Cox6a1","liver","RR-9","GLDS-242"
"KEGG_MEDICUS_VARIANT_MUTATION_CAUSED_ABERRANT_ABETA_TO_MACHR_CA2_APOPTOTIC_PATHWAY",0.223008849557522,0.569245647969052,0.120433371642259,0.423908135403249,1.22703818309282,19,"kegg","Slc25a31; Slc25a4; Plcb2; Gnaq; Chrm3; Plcb3; Plcb1; Cycs","liver","RR-9","GLDS-242"
"KEGG_MEDICUS_VARIANT_MUTATION_CAUSED_ABERRANT_ABETA_TO_MGLUR5_CA2_APOPTOTIC_PATHWAY",0.425992779783394,0.697079094191008,0.0822054920415869,0.352260613060978,1.02909697606036,20,"kegg","Slc25a31; Slc25a4; Plcb2; Gnaq; Plcb3; Plcb1; Cycs","liver","RR-9","GLDS-242"
"KEGG_MEDICUS_VARIANT_MUTATION_CAUSED_ABERRANT_HTT_TO_26S_PROTEASOME_MEDIATED_PROTEIN_DEGRADATION",4.38562385033759e-19,1.18411843959115e-17,1.12391496374483,-0.867675701772972,-3.04294753606978,36,"kegg","Psmd11; Psmd1; Psmc4; Psmc2; Psmd2; Adrm1; Psma1; Psmc5; Psmc1; Psmd3; Psma4; Psmb7; Psmd7; Psmb3; Psmd12; Psmb6; Psmd13; Psmb5; Psmb4; Psmc3; Psmd6; Psmd14; Psmd9; Psmd4; Psmd8; Psma7; Psmb2; Psma2; Psmb1","liver","RR-9","GLDS-242"
"KEGG_MEDICUS_VARIANT_MUTATION_CAUSED_ABERRANT_HTT_TO_ANTEROGRADE_AXONAL_TRANSPORT",0.0787037037037037,0.346938775510204,0.245041785430996,-0.446692300180083,-1.38011895091617,22,"kegg","Tubb4b; Tuba4a; Tuba1c; Klc4; Tuba8; Kif5c; Tubb5","liver","RR-9","GLDS-242"
"KEGG_MEDICUS_VARIANT_MUTATION_CAUSED_ABERRANT_HTT_TO_MGLUR5_CA2_APOPTOTIC_PATHWAY",0.291139240506329,0.59293407652655,0.104343952581949,0.388789767229004,1.14830445562955,21,"kegg","Slc25a31; Slc25a4; Plcb2; Gnaq; Htt; Plcb3; Plcb1; Cycs","liver","RR-9","GLDS-242"
"KEGG_MEDICUS_VARIANT_MUTATION_CAUSED_ABERRANT_HTT_TO_RETROGRADE_AXONAL_TRANSPORT",0.373493975903614,0.661268022911317,0.106729884364606,-0.293828730102274,-1.05604353664441,40,"kegg","Tubb4b; Tuba4a; Actr10; Dctn2; Tuba1c; Dctn3; Tuba8; Dnali1; Actr1b; Tubb5; Dnah7b; Dnah11","liver","RR-9","GLDS-242"
"KEGG_MEDICUS_VARIANT_MUTATION_CAUSED_ABERRANT_HTT_TO_TRANSPORT_OF_CALCIUM",0.158273381294964,0.496991150442478,0.147331213699377,0.465519525969434,1.29927419912824,17,"kegg","Slc25a31; Grin2b; Slc25a4; Htt; Cycs; Dlg4; Apaf1","liver","RR-9","GLDS-242"
"KEGG_MEDICUS_VARIANT_MUTATION_CAUSED_ABERRANT_PSEN_TO_MGLUR5_CA2_APOPTOTIC_PATHWAY",0.571428571428571,0.73469387755102,0.069119845655101,0.335420735183507,0.903039089291074,15,"kegg","Slc25a31; Slc25a4; Ryr3; Cycs; Apaf1","liver","RR-9","GLDS-242"
"KEGG_MEDICUS_VARIANT_MUTATION_CAUSED_ABERRANT_SNCA_TO_26S_PROTEASOME_MEDIATED_PROTEIN_DEGRADATION",2.60684784196733e-19,8.04398762664206e-18,1.13308993200902,-0.870444558185361,-3.05265794374928,36,"kegg","Psmd11; Psmd1; Psmc4; Psmc2; Psmd2; Adrm1; Psma1; Psmc5; Psmc1; Psmd3; Psma4; Psmb7; Psmd7; Psmb3; Psmd12; Psmb6; Psmd13; Psmb5; Psmb4; Psmc3; Psmd6; Psmd14; Psmd9; Psmd4; Psmd8; Psma7; Psmb2; Psma2; Psmb1","liver","RR-9","GLDS-242"
"KEGG_MEDICUS_VARIANT_MUTATION_CAUSED_ABERRANT_SNCA_TO_ANTEROGRADE_AXONAL_TRANSPORT",0.0779510022271715,0.346938775510204,0.241339976815091,-0.459130414951715,-1.41651638382985,21,"kegg","Tubb4b; Tuba4a; Tuba1c; Klc4; Tuba8; Kif5c; Tubb5","liver","RR-9","GLDS-242"
"KEGG_MEDICUS_VARIANT_MUTATION_CAUSED_ABERRANT_SNCA_TO_ELECTRON_TRANSFER_IN_COMPLEX_I",0.657894736842105,0.804904435629282,0.0741758965588009,-0.245893928083253,-0.882266425796353,39,"kegg","Ndufs2; Ndufb7; Ndufa2; Ndufs1; Ndufa9; Ndufa10; Ndufb10; Ndufv1; Ndufs3","liver","RR-9","GLDS-242"
"KEGG_MEDICUS_VARIANT_MUTATION_CAUSED_ABERRANT_SOD1_TO_26S_PROTEASOME_MEDIATED_PROTEIN_DEGRADATION",6.4783076355193e-21,1.38207562208352e-18,1.18665095279281,-0.85753249032253,-3.11116912493089,41,"kegg","Psmd11; Psmd1; Psmc4; Psmc2; Psmd2; Adrm1; Psma1; Psmc5; Psmc1; Psmd3; Psma4; Psmb7; Psmd7; Psmb3; Psmd12; Psmb6; Psmd13; Psmb5; Psmb4; Psmc3; Psmd6; Ubb; Psmd14; Psmd9; Psmd4; Psmd8; Psma7; Psmb2; Sod1; Psma2; Psmb1; Derl1","liver","RR-9","GLDS-242"
"KEGG_MEDICUS_VARIANT_MUTATION_CAUSED_ABERRANT_SOD1_TO_RETROGRADE_AXONAL_TRANSPORT",0.34841628959276,0.637778970779968,0.107140237276725,-0.325896452874024,-1.07092783438671,26,"kegg","Sod1; Actr10; Dctn2; Dctn3; Dnali1; Actr1b; Dnah7b; Dnah11; Dnal4; Dctn5; Actr1a","liver","RR-9","GLDS-242"
"KEGG_MEDICUS_VARIANT_MUTATION_CAUSED_ABERRANT_TDP43_TO_ELECTRON_TRANSFER_IN_COMPLEX_I",0.471291866028708,0.717029449423816,0.0922597260527354,-0.270356789380798,-0.970039073823794,39,"kegg","Ndufs2; Ndufb7; Ndufa2; Ndufs1; Ndufa9; Ndufa10; Ndufb10; Ndufv1; Ndufs3; Tardbp","liver","RR-9","GLDS-242"
"KEGG_MEDICUS_VARIANT_MUTATION_INACTIVATED_ATP1A1_TO_ANGIOTENSIN_ALDOSTERONE_SIGNALING_PATHWAY",0.853309481216458,0.921574239713775,0.0478299633114229,0.239216914710453,0.726892698843623,23,"kegg","Cacna1h; Camk2b; Calm2; Camk2d; Camk2a; Creb3l4; Camk2g; Calm3","liver","RR-9","GLDS-242"
